rank,uri,artist_names,track_name,source,peak_rank,previous_rank,weeks_on_chart,streams,End Date
1,spotify:track:4n7jnSxVLd8QioibtTDBDq,"Alan Walker, Sabrina Carpenter, Farruko",On My Way,Kreatell Music,1,143,2,434869,2019-03-28
2,spotify:track:4y3OI86AEP6PQoDE6olYhO,Jonas Brothers,Sucker,Jonas Brothers Recording,1,1,4,343698,2019-03-28
3,spotify:track:3KkXRkHbMCARz0aVfEt68P,"Post Malone, Swae Lee",Sunflower - Spider-Man: Into the Spider-Verse,Universal Records,3,3,5,245189,2019-03-28
4,spotify:track:6ocbgoVGwYJhOv1GgI9NsF,Ariana Grande,7 rings,Republic Records,1,4,5,226696,2019-03-28
5,spotify:track:1WSGTYKLEpKfNQYYW5Oymt,"benny blanco, Selena Gomez, J Balvin, Tainy","I Can’t Get Enough (benny blanco, Selena Gomez, J Balvin, Tainy)",NEON16/Friends Keep Secrets/Interscope Records,2,2,5,208181,2019-03-28
6,spotify:track:5icOoE6VgqFKohjWWNp0Ac,"Marshmello, CHVRCHES",Here With Me,Marshmello/Republic,6,6,3,206927,2019-03-28
7,spotify:track:7COXchtUOMd6uIT6HvmRaI,"Lauv, Troye Sivan",i'm so tired...,Lauv,7,7,5,188909,2019-03-28
8,spotify:track:6MWtB6iiXyIwun0YzU6DFP,Post Malone,Wow.,Republic Records,6,9,5,182896,2019-03-28
9,spotify:track:2tjWCe2W7sgvS3C8NHcdtI,"Akhil, Dhvani Bhanushali, Kunaal Vermaa, Abhijit Vaghani","Duniyaa (From ""Luka Chuppi"")",T-Series,5,5,5,178621,2019-03-28
10,spotify:track:5WHTFyqSii0lmT9R21abT8,Mabel,Don't Call Me Up,Polydor Records,10,12,5,172645,2019-03-28
11,spotify:track:5w9c2J52mkdntKOmRLeM2m,"Daddy Yankee, Snow",Con Calma,El Cartel Records (EC3),5,10,5,157169,2019-03-28
12,spotify:track:4kV4N9D1iKVxx1KLvtTpjS,Ariana Grande,"break up with your girlfriend, i'm bored",Republic Records,4,8,5,147010,2019-03-28
13,spotify:track:5p7ujcrUXASCNwRaWNHR1C,Halsey,Without Me,Capitol Records,11,11,5,143876,2019-03-28
14,spotify:track:6Qs4SXO9dwPj5GKvVOv8Ki,"Sam Smith, Normani",Dancing With A Stranger (with Normani),PLG - Capitol,10,13,5,136764,2019-03-28
16,spotify:track:790uNrqzKWCvj8rR1QXNpU,"Neha Kakkar, Mika Singh, Kumar Sanu","Aankh Marey (From ""Simmba"")",T-Series,16,19,5,122163,2019-03-28
17,spotify:track:45P9g6kUb7itdonjjGjDdS,"The Doorbeen, Ragini",Lamberghini,Times Music,16,18,5,122120,2019-03-28
18,spotify:track:5wdlz4N7s1Xyr4y4RXhZJM,"Karan Sehmbi, Tanishk Bagchi, Goldboy","Photo (From ""Luka Chuppi"")",T-Series,17,17,5,119479,2019-03-28
19,spotify:track:39vrbjCMTRXEdiIr2IsBgd,Badshah,She Move It Like,Sony Music Entertainment India Pvt. Ltd.,14,14,5,118917,2019-03-28
20,spotify:track:2dpaYNEQHiRxtZbfNsse99,"Marshmello, Bastille",Happier,Joytime Collective,17,20,5,116161,2019-03-28
21,spotify:track:39ujbBjTwwqUFySaCYDMMT,"Badshah, Diljit Dosanjh, Aastha Gill",Proper Patola,Sony Music Entertainment India Pvt. Ltd.,21,22,5,115582,2019-03-28
22,spotify:track:4bKkdGBttnK4SYjT4zPC1U,"Tony Kakkar, Neha Kakkar, Young Desi","Coca Cola (From ""Luka Chuppi"")",T-Series,16,16,5,114639,2019-03-28
23,spotify:track:11cDEev79fPKi6uJCjUhu8,"The Chainsmokers, 5 Seconds of Summer",Who Do You Love,Disruptor Records/Columbia,17,24,5,114282,2019-03-28
24,spotify:track:2VxeLyX666F8uXCJ0dZF8B,"Lady Gaga, Bradley Cooper",Shallow,A Star is Born OST,2,21,5,105556,2019-03-28
25,spotify:track:3sqRODOZ1Z6hR4F2tnFAlg,Maninder Buttar,Sakhiyaan,Ishtar Punjabi,23,23,5,105180,2019-03-28
26,spotify:track:1DUSuNhF8P5vUGNPpQiZa5,Khalid,My Bad,"Right Hand Music Group, LLC/RCA Records",26,28,3,103201,2019-03-28
27,spotify:track:7FGq80cy8juXBCD2nrqdWU,"benny blanco, Halsey, Khalid",Eastside (with Halsey & Khalid),Friends Keep Secrets/Interscope Records,25,25,5,100288,2019-03-28
28,spotify:track:6cARnc9YVlBNigjNSX63pp,"Neha Kakkar, Dhvani Bhanushali, Ikka","Dilbar (From ""Satyameva Jayate"")",T-Series,28,30,5,95710,2019-03-28
29,spotify:track:4w8niZpiMy6qz1mntFA5uM,"DJ Snake, Selena Gomez, Ozuna, Cardi B","Taki Taki (with Selena Gomez, Ozuna & Cardi B)","DJ Snake Music Productions Limited, under exclusive license to Geffen Records",29,35,5,94041,2019-03-28
30,spotify:track:2P91MQbaiQOfbiz9VqhqKQ,Lauv,I Like Me Better,Lauv,30,31,5,93687,2019-03-28
31,spotify:track:0rTV5WefWd1J3OwIheTzxM,"Khalid, Disclosure",Talk,"Right Hand Music Group, LLC/RCA Records",7,26,5,92217,2019-03-28
32,spotify:track:4f5kLqyOJ5ZPnalEVMQrB2,"Rahat Fateh Ali Khan, Asees Kaur, Tanishk Bagchi","Tere Bin (From ""Simmba"")",T-Series,32,33,5,91658,2019-03-28
33,spotify:track:5x3K3Ld54TtkYKdQvrFOV3,"Guru Randhawa, Neha Kakkar","Morni Banke (From ""Badhaai Ho"")",T-Series,27,27,5,91292,2019-03-28
34,spotify:track:5SHhPFh68OhUmuRPymKX9d,FLETCHER,Undrunk,Capitol Records,34,47,3,90565,2019-03-28
36,spotify:track:4NzMOnvSJVNKF7nw5NkXIP,Billie Eilish,bury a friend,Darkroom/Interscope Records,13,34,5,81424,2019-03-28
37,spotify:track:7dt6x5M1jzdTEt8oCbisTK,Post Malone,Better Now,Republic Records,34,40,5,80987,2019-03-28
38,spotify:track:2JvzF1RMd7lE3KmFlsyZD8,J. Cole,MIDDLE CHILD,"Dreamville, Inc., Under exclusive license to Roc Nation Records",21,37,5,79662,2019-03-28
39,spotify:track:6bdpj89aYEBjhpsenXAsmO,"A.R. Rahman, Arijit Singh",Enna Sona,Sony Music Entertainment India Pvt. Ltd.,34,39,5,79312,2019-03-28
40,spotify:track:0GVBPuCT3pBrXCdY3Uiy5B,"Marshmello, Pritam",BIBA,Joytime Collective,15,29,5,78779,2019-03-28
41,spotify:track:7bFx4We3iNjxmIxXBxou1G,"Pritam, Arijit Singh, Neeti Mohan",First Class (Kalank),Zee Music Company,41,-1,1,78608,2019-03-28
43,spotify:track:3e9HZxeyfWwjeyPAMmWSSQ,Ariana Grande,"thank u, next",Republic Records,24,36,5,77688,2019-03-28
44,spotify:track:0Iz4CkptElGHo16r797Jsb,"Atif Aslam, Nusrat Fateh Ali Khan, Rochak Kohli","Dekhte Dekhte (From ""Batti Gul Meter Chalu"")",T-Series,41,41,5,77639,2019-03-28
45,spotify:track:7heMX7gyHP0mhTlNgd7Lxd,"A.R. Rahman, Badshah, Tanishk Bagchi, Shashaa Tirupati, Jubin Nautiyal",The Humma Song,Sony Music Entertainment India Pvt. Ltd.,29,38,5,77522,2019-03-28
46,spotify:track:1ZaeaGLhFSckG8sv1y7AWk,"Harrdy Sandhu, Jaani",Kya Baat Ay,Sony Music Entertainment India Pvt. Ltd.,42,42,5,75206,2019-03-28
47,spotify:track:698ItKASDavgwZ3WjaWjtz,Alan Walker,Faded,Kreatell Music,47,65,5,74496,2019-03-28
48,spotify:track:4txc3txsIt81diMzGhrVPS,Billie Eilish,wish you were gay,Darkroom/Interscope Records,30,44,4,74159,2019-03-28
49,spotify:track:0e7ipj03S05BNilyu5bRzt,"Post Malone, 21 Savage",rockstar (feat. 21 Savage),Republic Records,43,43,5,74086,2019-03-28
50,spotify:track:53CJANUxooaqGOtdsBTh7O,Lil Nas X,Old Town Road,Columbia,49,49,4,73286,2019-03-28
51,spotify:track:5SVpD60u9vjoQ2OeoKsTkb,"Badshah, Asees Kaur, Jubin Nautiyal",Akh Lad Jaave,T-Series,46,46,5,71734,2019-03-28
52,spotify:track:4lSSJcfptqRAv9cTzpherg,Jugraj Sandhu,Mere Wala Sardar,Grand Studio,45,45,5,71368,2019-03-28
53,spotify:track:3Y7a0typ6ik1KscmebXd6D,"Sia, Diplo, Labrinth, LSD","No New Friends (feat. Sia, Diplo, and Labrinth)",Records/Columbia,53,97,2,71217,2019-03-28
54,spotify:track:60AUuYrFbCBnPvDfofMfVF,"DJ Snake, Eptic",SouthSide (feat. Eptic),DJ Snake Music Productions Limited,54,-1,1,67534,2019-03-28
55,spotify:track:7fa9MBXhVfQ8P8Df9OEbD8,"Maroon 5, Cardi B",Girls Like You (feat. Cardi B) - Cardi B Version,Interscope Records*,39,48,5,67261,2019-03-28
56,spotify:track:1ahVFh0ViDZr8LvkEVlq3B,"Martin Garrix, Bonn",No Sleep (feat. Bonn),Epic Amsterdam,16,50,5,67218,2019-03-28
57,spotify:track:6yIdwnpDHufLWgQcveTPMk,"ZAYN, Taylor Swift",I Don’t Wanna Live Forever (Fifty Shades Darker),"Big Machine Records, LLC",44,53,5,65675,2019-03-28
58,spotify:track:4NBTZtAt1F13VvlSKe6KTl,"The Chainsmokers, Kelsea Ballerini",This Feeling,Disruptor Records/Columbia,58,72,5,64188,2019-03-28
59,spotify:track:7BKLCZ1jbUBVqRi2FVlTVw,"The Chainsmokers, Halsey",Closer,Disruptor Records/Columbia,59,60,5,63760,2019-03-28
60,spotify:track:6SRWhUJcD2YKahCwHavz3X,"Alan Walker, Au/Ra, Tomine Harket",Darkside,Kreatell Music,60,130,5,62658,2019-03-28
62,spotify:track:0tBbt8CrmxbjRP0pueQkyU,"Selena Gomez, Marshmello",Wolves,Selena Gomez PS,57,57,5,62403,2019-03-28
63,spotify:track:6fScgF2Y63ScU73nYju0ny,"Atif Aslam, Arko",O Saathi,T-Series,62,62,5,62221,2019-03-28
64,spotify:track:2mwBSO58y92EYmEFpDfmS7,"Guru Randhawa, Arjun",Suit Suit,T-Series,50,54,5,61452,2019-03-28
66,spotify:track:116H0KvKr2Zl4RPuVBruDO,"Bad Bunny, Drake",MIA,Rimas Entertainment LLC,55,56,5,60743,2019-03-28
67,spotify:track:4u7EnebtmKWzUH433cf5Qv,Queen,Bohemian Rhapsody - Remastered 2011,EMI,30,51,5,60628,2019-03-28
68,spotify:track:68iBMrMRc1rg4eAxJbvxch,"Tanishk Bagchi, Dhvani Bhanushali, Rashmi Virag",Leja Re,T-Series,68,79,5,60610,2019-03-28
69,spotify:track:4ymPEyiXabTe1NO8q8EFxG,"Darshan Raval, Asees Kaur, Lijo George-Dj Chetas","Chogada (From ""Loveyatri"")",T-Series,55,55,5,60439,2019-03-28
70,spotify:track:0H2iJVgorRR0ZFgRqGUjUM,"Pritam, Arijit Singh",Channa Mereya,Sony Music Entertainment India Pvt. Ltd.,58,64,5,60253,2019-03-28
71,spotify:track:3QGsuHI8jO1Rx4JWLUh9jd,Shawn Mendes,Treat You Better,Island Records,49,61,5,59986,2019-03-28
73,spotify:track:0l6g8Z8mqGbGXFOjigYetD,"Pritam, Arijit Singh",Hawayein,Sony Music Entertainment India Pvt. Ltd.,51,66,5,59198,2019-03-28
74,spotify:track:0pqnGHJpmpxLKifKRmU6WP,Imagine Dragons,Believer,Kid Ina Korner / Interscope,69,69,5,59159,2019-03-28
75,spotify:track:0Tm5ER6IrGfmW0yZ5lkQli,"Dhanush, Dhee, Yuvan Shankar Raja",Rowdy Baby,Divo Tv Private Limited,66,74,5,59082,2019-03-28
77,spotify:track:5G7pZ8G8NFvS1MQ9H4L7dC,"Javed-Mohsin, Arijit Singh, Shreya Ghoshal, Kunaal Vermaa, Prashant Ingole",Pal,Sony Music Entertainment India Pvt. Ltd.,59,59,5,58425,2019-03-28
78,spotify:track:5JEx7HbmvHQQswJCsoo9rA,"Ellie Goulding, Diplo, Swae Lee",Close To Me (with Diplo) (feat. Swae Lee),Polydor Records,72,73,5,57633,2019-03-28
79,spotify:track:3jtKSUiVDowKNBqVQbWaig,"Amit Trivedi, Kavita Seth, Amitabh Bhattacharya",Iktara,Sony Music Entertainment India Pvt. Ltd.,79,82,5,57593,2019-03-28
80,spotify:track:4hQ6UGyWQIGJmHSo0J88JW,Selena Gomez,Back To You - From 13 Reasons Why – Season 2 Soundtrack,UMGRI Interscope,66,70,5,56693,2019-03-28
81,spotify:track:1mjWhM7GQTTxJxg2F0iCRS,"Armaan Malik, Rochak Kohli, Bappi Lahiri","Dil Mein Ho Tum (From ""Cheat India"")",T-Series,76,76,5,56429,2019-03-28
82,spotify:track:1gl8BBFdMRrgb3P7Jz5JQT,Guri,Nira Ishq,GEET MP3,63,63,4,55838,2019-03-28
83,spotify:track:1zB4vmk8tFRmM9UULNzbLB,Imagine Dragons,Thunder,Kid Ina Korner / Interscope,78,78,5,55610,2019-03-28
84,spotify:track:2si0ZNx4yRbggTvrIom8A2,"Rochak Kohli, Atif Aslam, Tulsi Kumar",Paniyon Sa,T-Series,80,80,4,55246,2019-03-28
85,spotify:track:3npzogdOEiVsieXmmhBepL,Maren Morris,The Bones,Columbia Nashville,85,88,2,54923,2019-03-28
86,spotify:track:6fxVffaTuwjgEk5h9QyRjy,Ed Sheeran,Photograph,Atlantic Records UK,75,77,5,54873,2019-03-28
87,spotify:track:5aA9HqRPZHROKWrO5RczTm,Darshan Raval,Kaash Aisa Hota,Indie Music Label,87,-1,1,54844,2019-03-28
88,spotify:track:0f0QUUOAVMWG1WlCd8n908,"Pritam, Shreya Ghoshal",Ghar More Pardesiya (Kalank),Zee Music Company,88,-1,1,54819,2019-03-28
89,spotify:track:4ut5G4rgB1ClpMTMfjoIuy,"Martin Garrix, Bonn",High On Life (feat. Bonn),Epic Amsterdam,60,94,5,54362,2019-03-28
90,spotify:track:3XYvdqcZrTmRntFDDbJkJd,"Aastha Gill, Badshah",Buzz (feat. Badshah),Sony Music Entertainment India Pvt. Ltd.,75,75,5,53839,2019-03-28
91,spotify:track:6wZJsut8fjiWiMPaccRAOX,Ritviz,Udd Gaye,Ritviz,81,81,5,52836,2019-03-28
92,spotify:track:79esEXlqqmq0GPz0xQSZTV,Shawn Mendes,Lost In Japan,Island Records,67,83,5,52795,2019-03-28
93,spotify:track:6RUKPb4LETWmmr3iAEQktW,"The Chainsmokers, Coldplay",Something Just Like This,Disruptor Records/Columbia,93,95,5,52258,2019-03-28
94,spotify:track:59oPs52NiTDVVi9oTIBzuf,Harrdy Sandhu,Yaarr Superstaar,Sony Music Entertainment India Pvt. Ltd.,94,-1,1,52063,2019-03-28
95,spotify:track:1j4kHkkpqZRBwE0A4CN4Yv,"ZAYN, Sia",Dusk Till Dawn (feat. Sia) - Radio Edit,RCA Records Label,63,86,5,51987,2019-03-28
97,spotify:track:1rfofaqEpACxVEHIZBJe6W,"Camila Cabello, Young Thug",Havana (feat. Young Thug),Syco Music/Epic,86,92,5,50793,2019-03-28
98,spotify:track:5itOtNx0WxtJmi1TQ3RuRd,"Calvin Harris, Rag'n'Bone Man",Giant (with Rag'n'Bone Man),Columbia,32,115,5,50729,2019-03-28
99,spotify:track:0rk2X5TAhraBC5aCIXK2Rq,"Jawad Ahmad, Shaarib Toshi, Arijit Singh, Shreya Ghoshal",Samjhawan,Sony Music Entertainment India Pvt. Ltd.,70,90,5,50631,2019-03-28
100,spotify:track:14sOS5L36385FJ3OL8hew4,"Kygo, Sandro Cavazza",Happy Now,Kygo,98,110,5,50517,2019-03-28
101,spotify:track:2xLMifQCjDGFmkHkpNLD9h,Travis Scott,SICKO MODE,Cactus Jack / Epic,61,85,5,50438,2019-03-28
102,spotify:track:4wANB882g1ZhF2V8ugksY1,"Rahat Fateh Ali Khan, Tanishk Bagchi","Sanu Ek Pal Chain (From ""Raid"")",T-Series,96,98,5,50372,2019-03-28
103,spotify:track:04VUjNx30IrigVZU3CQmrQ,Badshah,Mercy,Sony Music Entertainment India Pvt. Ltd.,72,91,5,50362,2019-03-28
104,spotify:track:2XWjPtKdi5sucFYtVav07d,"Zedd, Katy Perry",365,Interscope Records,42,67,5,50247,2019-03-28
105,spotify:track:4RbbzNY4MEcgzewYWkIsGu,"NAV, The Weeknd",Price On My Head (feat. The Weeknd),"XO Records, LLC and Republic Records",105,-1,1,50170,2019-03-28
106,spotify:track:7Dhy1R9NmD96wfr7VJEN37,"Zack Knight, Jasmin Walia",Bom Diggy,AO,87,87,5,49796,2019-03-28
107,spotify:track:1HvCFAUIWQsWV9zud3UhDl,"Alan Walker, Noah Cyrus, Digital Farm Animals, Juliander",All Falls Down (feat. Juliander),Kreatell Music,107,172,5,49609,2019-03-28
108,spotify:track:23L5CiUhw2jV1OIMwthR3S,"Martin Garrix, Bebe Rexha",In the Name of Love,Epic Amsterdam,79,102,5,49522,2019-03-28
109,spotify:track:0lYBSQXN6rCTvUZvg9S0lU,"DJ Snake, Justin Bieber",Let Me Love You,DJ Snake Def Jam,109,118,5,49481,2019-03-28
110,spotify:track:4CO4cxcQfhpitILnQ5gKnL,"Yo Yo Honey Singh, Simar Kaur, Ishers","Dil Chori (From ""Sonu Ke Titu Ki Sweety"")",T-Series,86,89,5,49378,2019-03-28
111,spotify:track:7MXVkk9YMctZqd1Srtv4MB,"The Weeknd, Daft Punk",Starboy,Universal Republic Records,84,100,5,48760,2019-03-28
112,spotify:track:3eR23VReFzcdmS7TYCrhCe,"Kygo, Selena Gomez",It Ain't Me (with Selena Gomez),Kygo,99,109,5,48477,2019-03-28
113,spotify:track:03x2rVJRFUrvwlfxoHd9Mo,Tom Walker,Just You and I,Relentless Records,113,134,5,48261,2019-03-28
114,spotify:track:3swc6WTsr7rl9DqQKQA55C,"Post Malone, Ty Dolla $ign",Psycho (feat. Ty Dolla $ign),Republic Records,106,106,5,48222,2019-03-28
115,spotify:track:6XqvFyJGdUD5IWee02ARKU,"Jonas Blue, Liam Payne, Lennon Stella",Polaroid,Positiva,115,144,5,47931,2019-03-28
116,spotify:track:1u8c2t2Cy7UBoG4ArRcF5g,Taylor Swift,Blank Space,"Big Machine Records, LLC",69,99,5,47518,2019-03-28
117,spotify:track:7n8xH63Whw5spavIWScPIh,Emiway Bantai,Samajh mein aaya kya?,Bantai Studio,52,108,5,46924,2019-03-28
118,spotify:track:5cjVsWqIkBQC7acTRhL0RO,"Aastha Gill, Sachin Sanghvi, Jigar Saraiya, Divya Kumar",Kamariya,T-Series,85,104,5,46704,2019-03-28
119,spotify:track:5uCax9HTNlzGybIStD3vDh,James Arthur,Say You Won't Let Go,Columbia,107,117,5,46618,2019-03-28
120,spotify:track:6Kynli1iHBqJRWUCohcV9h,DIVINE,Kaam 25 - Sacred Games,Netflix India Originals LLC,94,154,3,45922,2019-03-28
121,spotify:track:0cWLJcdvM6QlOQ7UJdB4jb,"Ash King, Sachin-Jigar","Nazar Na Lag Jaaye (From ""Stree"")",T-Series,113,113,4,45898,2019-03-28
123,spotify:track:1UWacd8x8tPPwmrPB1MoBI,"Pritam, Arijit Singh",Ae Dil Hai Mushkil Title Track,Sony Music Entertainment India Pvt. Ltd.,105,105,5,45210,2019-03-28
124,spotify:track:3T0oPETOdddxJ2xTt2qJe4,"Arjun Kanungo, Momina Mustehsan, Kunaal Vermaa",Aaya Na Tu,Universal Music India Pvt Ltd.,103,103,5,45026,2019-03-28
125,spotify:track:1Apk7v87QHLNYqrsT0zhE8,Arijit Singh,"Tera Yaar Hoon Main (From ""Sonu Ke Titu Ki Sweety"")",T-Series,119,119,4,44708,2019-03-28
126,spotify:track:3LlmKSHR3Rs0Y3KHQLAYDk,Alan Walker,Alone,Kreatell Music,126,-1,1,44562,2019-03-28
127,spotify:track:0lks2Kt9veMOFEAPN0fsqN,"Alan Walker, K-391, Emelie Hollow",Lily,Kreatell Music,127,-1,1,44005,2019-03-28
128,spotify:track:0a6zRnrjmaOcqsEIFkXIhw,Akhil,Khaab,Crown Records,128,128,3,43873,2019-03-28
129,spotify:track:3GrCQPpKqKzOcKfMAoqn82,"Tanishk Bagchi, Arijit Singh, Asees Kaur","Bolna (From ""Kapoor & Sons (Since 1921)"")",Sony Music Entertainment India Pvt. Ltd.,101,116,5,43538,2019-03-28
130,spotify:track:4BiiOzZCrXEzHRLYcYFiD5,"The Chainsmokers, Winona Oak",Hope,Disruptor Records/Columbia,124,124,5,43514,2019-03-28
131,spotify:track:1NJcg626wLln4pGHpiV7mf,"Billie Eilish, Khalid",lovely (with Khalid),Darkroom,115,136,5,43454,2019-03-28
132,spotify:track:342pJxy678kgQrZXCL9RG7,Yo Yo Honey Singh,Urvashi,T-Series,129,129,3,43421,2019-03-28
133,spotify:track:2iUXsYOEPhVqEBwsqP70rE,5 Seconds of Summer,Youngblood,Capitol,120,125,5,43157,2019-03-28
136,spotify:track:0lG6QM1jjbbX5UUn3DPmrZ,"Alan Walker, Sorana",Lost Control,Kreatell Music,136,-1,1,42641,2019-03-28
137,spotify:track:09Z6o1yu596HJAwWZxTz4m,"Dhibu Ninan Thomas, Anirudh Ravichander",Othaiyadi Pathayila,Sony Music Entertainment India Pvt. Ltd.,137,140,2,42638,2019-03-28
138,spotify:track:5kfNriitmkNE8mUbZ7gbq8,Khalid,Saturday Nights,"Right Hand Music Group, LLC/RCA Records",108,114,5,42470,2019-03-28
139,spotify:track:5tAa8Uaqr4VvA3693mbIhU,Zara Larsson,Ruin My Life,Epic/Record Company TEN,123,123,4,42033,2019-03-28
140,spotify:track:2xJCMIJfcNYDc5iR0sAm2O,Dua Lipa,New Rules,Warner Records,107,121,5,41958,2019-03-28
141,spotify:track:224EVTFiLsdQignUFLvDeH,"Dalex, Rafa Pabön, KHEA, Sech, Feid, Cazzu, Lenny Tavárez",Pa Mí - Remix,Rich Music/Ingrooves Records,141,-1,1,41897,2019-03-28
142,spotify:track:1ozrNv9W4KlprAmvgH0Yrq,Guru Randhawa,"High Rated Gabru (From ""Nawabzaade"")",T-Series,107,107,5,41829,2019-03-28
143,spotify:track:4NEdR5Yo8D2KwL7Y9KW7EH,"DIVINE, Naezy",Mere Gully Mein (feat. Naezy),Sony Music Entertainment India Pvt. Ltd.,57,142,5,41787,2019-03-28
144,spotify:track:2FCXQHugkoHE1K3tiDu8pu,"Alka Yagnik, Arijit Singh","Agar Tum Saath Ho (From ""Tamasha"")",T-Series,144,150,2,41665,2019-03-28
145,spotify:track:3ebXMykcMXOcLeJ9xZ17XH,"Martin Garrix, Dua Lipa",Scared to Be Lonely,Epic Amsterdam,89,160,5,41518,2019-03-28
146,spotify:track:7vGuf3Y35N4wmASOKLUVVU,"Marshmello, Khalid",Silence,Joytime Collective/RCA Records,127,131,5,41361,2019-03-28
147,spotify:track:1cmZbGkCEVVAck2MsWpPYQ,"Ami Mishra, Shreya Ghoshal, Kunaal Vermaa",Hasi - Female Version,Sony Music Entertainment India Pvt. Ltd.,141,141,4,41065,2019-03-28
148,spotify:track:6zeeWid2sgw4lap2jV61PZ,Khalid,Better,"Right Hand Music Group, LLC/RCA Records",120,120,5,40221,2019-03-28
149,spotify:track:3fPgIknlkDWXs1l2noKZbp,"Badshah, Amaal Mallik, Fazilpuria, Sukriti Kakar, Neha Kakkar",Kar Gayi Chull,Sony Music Entertainment India Pvt. Ltd.,122,122,4,40159,2019-03-28
151,spotify:track:7JJmb5XwzOO8jgpou264Ml,Shawn Mendes,There's Nothing Holdin' Me Back,Island Records,141,151,5,39863,2019-03-28
152,spotify:track:2DGa7iaidT5s0qnINlwMjJ,Alan Walker,The Spectre,Kreatell Music,152,-1,1,39837,2019-03-28
153,spotify:track:7uH27oIt4a6cIFCA8ZPcyG,Ozuna,Baila Baila Baila,Aura Music Corp.,85,193,5,39762,2019-03-28
154,spotify:track:2GlZQur8CHidODl6OgMO3z,Mohit Chauhan,"Kyun Dil Mera - From ""Paharganj""",Sony Music Entertainment India Pvt. Ltd.,154,189,2,39604,2019-03-28
155,spotify:track:5iwz1NiezX7WWjnCgY5TH4,"Pedro Capó, Farruko",Calma - Remix,Sony Music Latin,71,127,5,39581,2019-03-28
156,spotify:track:6DCZcSspjsKoFjzjrWoCdn,Drake,God's Plan,Cash Money/Drake LP6,131,145,5,39388,2019-03-28
157,spotify:track:4NSW0Km5ZG60L8FthUebPJ,"Jonas Blue, Theresa Rex",What I Like About You (feat. Theresa Rex),Positiva,157,-1,1,39267,2019-03-28
158,spotify:track:6875MeXyCW0wLyT72Eetmo,"Hailee Steinfeld, Grey, Zedd",Starving,UME - Global Clearing House,128,153,5,39256,2019-03-28
159,spotify:track:3KLygy1YWhmrQx0GRs7IOx,"Jonas Blue, Jack & Jack",Rise,Positiva,159,-1,1,39233,2019-03-28
160,spotify:track:0PDUDa38GO8lMxLCRc4lL1,ZAYN,PILLOWTALK,RCA Records Label,111,156,5,39227,2019-03-28
161,spotify:track:5Gu0PDLN4YJeW75PpBSg9p,"Hailee Steinfeld, Alesso, Florida Georgia Line, WATT","Let Me Go (with Alesso, Florida Georgia Line & watt)",Universal Records,152,152,5,39065,2019-03-28
162,spotify:track:2m8P30Ly9Az1uGvFmhLTBI,Neha Kakkar,"Gali Gali (From ""Kgf Chapter 1"")",T-Series,162,186,2,38857,2019-03-28
163,spotify:track:3ExeNEpJJQXfmq1cwj0LVo,"Amit Trivedi, Shellee, Ammy Virk, Shahid Mallya",Daryaa,Eros Now Music,158,158,5,38835,2019-03-28
164,spotify:track:09IStsImFySgyp0pIQdqAc,"Zedd, Maren Morris, Grey",The Middle,UMGRI Interscope,164,167,5,38806,2019-03-28
165,spotify:track:6MjNilJCVKJq0LfFvo5jWJ,Juice WRLD,Fast,Grade A Productions/Interscope Records,54,96,3,38488,2019-03-28
166,spotify:track:3ee8Jmje8o58CHK66QrVC2,XXXTENTACION,SAD!,"Bad Vibes Forever, LLC",147,159,5,38364,2019-03-28
167,spotify:track:5H3z9m3njodfExlWBeaFg7,"Abhay Jodhpurkar, Ajay-Atul","Mere Naam Tu (From ""Zero"")",T-Series,135,135,3,38321,2019-03-28
168,spotify:track:72jbDTw1piOOj770jWNeaG,The Chainsmokers,Paris,Disruptor Records/Columbia,164,171,4,38177,2019-03-28
169,spotify:track:3s7m0jmCXGcM8tmlvjCvAa,"Guru Randhawa, Neeti Mohan","Kaun Nachdi (From ""Sonu Ke Titu Ki Sweety"")",T-Series,132,132,4,38110,2019-03-28
170,spotify:track:2NbC6ugzdo8LzQ6wJUGpeI,Parmish Verma,Ja Ve Ja,Times Music,170,-1,1,37745,2019-03-28
171,spotify:track:63cd4JkwGgYJrbOizbfmsp,"Mustard, Migos",Pure Water (with Migos),10 Summers Records/Interscope Records,45,139,5,37622,2019-03-28
172,spotify:track:3U4isOIWM3VvDubwSI3y7a,John Legend,All of Me,G.O.O.D. Music/Columbia,164,164,4,37323,2019-03-28
173,spotify:track:0UMLejbZXf7YVgnfxURvVr,"Alan Walker, Julie Bergan, K-391, SEUNGRI",Ignite,Kreatell Music,173,-1,1,37149,2019-03-28
174,spotify:track:50kpGaPAhYJ3sGmk6vplg0,Justin Bieber,Love Yourself,RBMG/Def Jam,132,165,5,37121,2019-03-28
175,spotify:track:0nrWZWkJM62ftQJSI8fDc0,"Alan Walker, Sophia Somajo",Diamond Heart,Kreatell Music,175,-1,1,37071,2019-03-28
176,spotify:track:15tihU7QrnhaBvE7hXGDwa,Sid Sriram,Maate Vinadhuga,Aditya Music,157,157,5,36974,2019-03-28
177,spotify:track:5sOch9Cf4uxcMtwFzMtNqQ,Taylor Swift,Delicate,"Big Machine Records, LLC",74,147,5,36912,2019-03-28
178,spotify:track:7DHApOHsIFo7EyfieArYGE,P!nk,Walk Me Home,RCA Records Label,118,161,5,36888,2019-03-28
179,spotify:track:01X09TTUbyJWQPlv28gUss,Jass Manak,Prada,GEET MP3,135,155,4,36865,2019-03-28
180,spotify:track:5b4bjAPxGu2yS2b8IQpY39,"Arjun Kanungo, Kunaal Vermaa",Tu Na Mera,Universal Music India Pvt Ltd.,178,178,4,36776,2019-03-28
181,spotify:track:2TIlqbIneP0ZY1O0EzYLlc,Lewis Capaldi,Someone You Loved,Vertigo Berlin,178,-1,2,36686,2019-03-28
182,spotify:track:0I20rLT2MJDhcF96AjbNYo,"Zedd, Alessia Cara",Stay,UMGRI Interscope,148,177,5,36681,2019-03-28
183,spotify:track:3GCdLUSnKSMJhs4Tj6CV3s,"Kendrick Lamar, SZA",All The Stars (with SZA),Black Panther (TDE/DMG) PS,135,169,5,36599,2019-03-28
184,spotify:track:5MnAi6ZF7cE8pAz7wYr9Ta,"Vishal-Shekhar, Atif Aslam, Irshad Kamil",Dil Diyan Gallan,YRF Music,168,168,2,36530,2019-03-28
185,spotify:track:3a1lNhkSLSkpJE4MSHpDu9,"Post Malone, Quavo",Congratulations,Universal Records,176,176,3,36238,2019-03-28
186,spotify:track:0lpDlWrV0Cw3eGGvPU6d3R,"Jubin Nautiyal, Prakriti Kakar, Tanishk Bagchi, Anand-Milind","Gazab Ka Hai Din (From ""Dil Juunglee"")",T-Series,186,190,2,36228,2019-03-28
187,spotify:track:3SJVCbBFTxR6UvvTWRNbMp,Diljit Dosanjh,Jind Mahi,Diljit Dosanjh,187,-1,1,36227,2019-03-28
188,spotify:track:5ZhKD46Q7mhsl0awl7ZMJc,"Sachin-Jigar, Atif Aslam",Jeena Jeena,Eros Now Music,173,195,4,36134,2019-03-28
189,spotify:track:2TzyJEUfWHGRsk3r6Emvbk,"Param Singh, Kamal Kahlon, Pratik Studio",Daru Badnaam,VIP Records / Param Singh & Kamal Kahlon,149,149,3,36057,2019-03-28
190,spotify:track:50sbcAcWHgDPRDkYBEUpkA,"Nusrat Fateh Ali Khan, Rahat Fateh Ali Khan, Manoj Muntashir","Mere Rashke Qamar (From ""Baadshaho"")",T-Series,169,170,5,36000,2019-03-28
191,spotify:track:2hnxrRNzF74mdDzpQZQukQ,"Lauv, Julia Michaels",There's No Way (feat. Julia Michaels),Lauv,170,173,5,35913,2019-03-28
192,spotify:track:4Ro98RCK90oHqqSZUnTFq5,"Liam Payne, Quavo",Strip That Down,Capitol Records UK / EMI,108,175,5,35780,2019-03-28
193,spotify:track:2H4gf1wLxvYreMj1jcaN0k,Dean Lewis,Be Alright,Universal Music Australia Pty. Ltd.,172,-1,2,35459,2019-03-28
194,spotify:track:6GzApXoBQiiAjak3tOQfV3,"5 Seconds of Summer, Julia Michaels",Lie To Me (feat. Julia Michaels),Capitol,181,181,3,35372,2019-03-28
195,spotify:track:3nc420PXjTdBV5TN0gCFkS,"Martin Garrix, Khalid",Ocean (feat. Khalid),Epic Amsterdam,116,-1,3,35303,2019-03-28
196,spotify:track:4KUQFOGTaHrggl3hfMoaAe,"Sam C.S., Anirudh Ravichander","Kannamma - From ""Ispade Rajavum Idhaya Raniyum""",Think Music,196,-1,1,35287,2019-03-28
197,spotify:track:4mGdjNMo0RonTlOEb7cYg4,"YUNGBLUD, Halsey, Travis Barker",11 Minutes (with Halsey feat. Travis Barker),Locomotion Recordings/Geffen Records,40,93,5,35279,2019-03-28
198,spotify:track:3zkWCteF82vJwv0hRLba76,Shawn Mendes,Stitches,Island Records,183,183,3,35252,2019-03-28
199,spotify:track:5W83ErFkO3aKAIS1WMi6u0,"Anuel AA, KAROL G",Secreto,Anuel AA & Karol G - Secreto,100,146,5,35250,2019-03-28
200,spotify:track:2J0X46UkpfLlWbuCXFgDLr,"Steve Aoki, BTS",Waste It On Me (feat. BTS),"Ultra Records, LLC",82,184,5,35206,2019-03-28
