rank,uri,artist_names,track_name,source,peak_rank,previous_rank,weeks_on_chart,streams,End Date
1,spotify:track:4UMIv5jd9gK98a39BQRD9X,"Pritam, Arijit Singh, Amitabh Bhattacharya",Kesariya,Sony Music Entertainment India Pvt. Ltd.,1,1,15,7303100,2022-10-27
2,spotify:track:42TMa2hgBNjte4uV7jNCnQ,"Shubh, Ikky",Baller,SHUBH,2,2,7,4452865,2022-10-27
3,spotify:track:0zlGnseLGzRIBA0TJcb3Bo,"Yohani, Jubin Nautiyal, Tanishk Bagchi, Rashmi Virag, Surya Ragunaathan","Manike (From ""Thank God"")",T-Series,2,3,6,4340354,2022-10-27
4,spotify:track:08Isz2ETWSBhvIl8UpKYsp,Shubh,No Love,SHUBH,2,4,33,4213104,2022-10-27
5,spotify:track:7lvDsmTRXFE3dK4OjvRiWB,"Shae Gill, Ali Sethi",Pasoori,Giraffe Pakistan,1,5,36,3546274,2022-10-27
6,spotify:track:1aL9518P5G72N92b48tuKw,AP Dhillon,Summer High,RUN-UP RECORDS,3,6,12,3374781,2022-10-27
7,spotify:track:29m79w9xPMH4YCD6r8JSmV,"AP Dhillon, Gurinder Gill, Intense",Excuses,RUN-UP RECORDS,1,10,53,3047430,2022-10-27
8,spotify:track:5IgjP7X4th6nMNDh4akUHb,Chris Brown,Under The Influence,Chris Brown Entertainment/RCA Records,7,8,11,2972164,2022-10-27
9,spotify:track:0yCWDaAgOtg6TKlNCg9rwA,King,Tu Aake Dekhle,Warner Music India,6,9,91,2907427,2022-10-27
10,spotify:track:0snQrp1VaY5Pj1YIHRJpRJ,Aditya A,Chaand Baaliyan,Sony Music Entertainment India Pvt. Ltd.,2,7,36,2899545,2022-10-27
11,spotify:track:4SqPZorSDuUtvdJwVGeZRC,"Pritam, Arijit Singh, Amitabh Bhattacharya, Jonita Gandhi",Deva Deva,Sony Music Entertainment India Pvt. Ltd.,5,11,12,2853724,2022-10-27
12,spotify:track:3nqQXoyQOWXiESFLlDF1hG,"Sam Smith, Kim Petras",Unholy (feat. Kim Petras),Capitol Records UK / EMI,12,16,4,2567478,2022-10-27
13,spotify:track:3wz2vWhYnnBoFmgMkqtzLy,"Chani Nattan, Inderpal Moga",Daku,Kharku Life Records,13,20,10,2532185,2022-10-27
14,spotify:track:6ZYxNjuAU9Vy3VtF6W1dtE,Shubh,We Rollin,SHUBH,10,13,48,2521530,2022-10-27
15,spotify:track:2rOnSn2piaqLAlYjtfUBlY,"Tanishk Bagchi, Jubin Nautiyal, Asees Kaur","Raataan Lambiyan (From ""Shershaah"")",Sony Music Entertainment India Pvt. Ltd.,1,12,65,2459150,2022-10-27
16,spotify:track:3i7qScF9Oyp31O9bAutJez,"A.R. Rahman, Madhushree",Mallipoo,Think Music,8,14,6,2334625,2022-10-27
17,spotify:track:1Nr46gjiP50uPsz30gYhAd,"Santhosh Narayanan, Anirudh Ravichander","Thenmozhi (From ""Thiruchitrambalam"")",Sun Pictures,5,15,11,2233643,2022-10-27
18,spotify:track:0GavMn9kjiQk1yI6118jEY,"Dhanush, Anirudh Ravichander",Megham Karukatha,Sun Pictures,4,18,14,2069343,2022-10-27
19,spotify:track:2eAvDnpXP5W0cVtiI0PUxV,Ruth B.,Dandelions,Columbia,14,22,48,1959175,2022-10-27
20,spotify:track:7oN0Wo7sCVvXPdpxoio3JM,"Madhur Sharma, Swapnil Tare, Nusrat Fateh Ali Khan",Kali Kali Zulfon Ke (Lo-Fi),T-Series,17,17,8,1949436,2022-10-27
21,spotify:track:5W7DOVGQLTigu09afW7QMT,Sidhu Moose Wala,295,Sidhu Moose Wala,1,27,37,1903318,2022-10-27
22,spotify:track:1uJ2czshFLqimctgvsxfv2,"A.R. Rahman, A. R. Reihana, Bamba Bakya, Ilango Krishnan","Ponni Nadhi (From ""Ponniyin Selvan Part - 1"")",Tips Industries Ltd,10,19,11,1884129,2022-10-27
23,spotify:track:4aObqXLku7XQqfVQ8azYGo,Arjan Dhillon,25-25,Brown Studios,23,142,2,1766599,2022-10-27
24,spotify:track:3QzRIdkZZU2gxcajjWhcLj,Paradox,Jaadugar,T-Series,24,31,3,1763822,2022-10-27
25,spotify:track:6VhuP99TE6gYNQRJIlAWFD,Stephen Sanchez,Until I Found You,Republic Records,20,32,26,1755083,2022-10-27
26,spotify:track:2kOH2QZB7F7I1iVXqwKuBF,"Dhanush, Anirudh Ravichander","Mayakkama Kalakkama (From ""Thiruchitrambalam"")",Sun Pictures,21,21,9,1745062,2022-10-27
27,spotify:track:6zfvsbeuFKoWIdoRb3JdhA,"Pritam, Shreya Ghoshal, TUSHAR JOSHI",Rasiya,Sony Music Entertainment India Pvt. Ltd.,19,26,5,1736745,2022-10-27
28,spotify:track:2FZDNh6tm9mkZ9vTphuAh8,"Pritam, Tanishk Bagchi, Neeraj Shridhar",Bhool Bhulaiyaa 2 Title Track,T-Series,7,34,26,1716853,2022-10-27
30,spotify:track:2AilvPt1AQ8PixlCKqkjfj,Shubh,Elevated,SHUBH,30,42,43,1698583,2022-10-27
31,spotify:track:2FCXQHugkoHE1K3tiDu8pu,"Alka Yagnik, Arijit Singh","Agar Tum Saath Ho (From ""Tamasha"")",T-Series,4,29,178,1693960,2022-10-27
32,spotify:track:27nzJVsvXqXyeMIcVxvB54,"A.R. Rahman, Sathyaprakash, V.M. Mahalingam, Nakul Abhyankar, Ilango Krishnan","Chola Chola (From ""Ponniyin Selvan Part - 1"")",Tips Industries Ltd,16,23,4,1684425,2022-10-27
33,spotify:track:0V3wPSX9ygBnCm8psDIegu,Taylor Swift,Anti-Hero,Taylor Swift,33,-1,1,1676503,2022-10-27
34,spotify:track:3ZGJhN4unVspOqpwGvUL2W,Diljit Dosanjh,Lemonade,DILJIT DOSANJH,34,45,13,1666189,2022-10-27
35,spotify:track:20EQiQQYSyuifv6YMj64qP,King,OOPS,Warner Music India,25,30,9,1664148,2022-10-27
36,spotify:track:02MWAaffLxlfxAUY7c5dvx,Glass Animals,Heat Waves,Polydor Records,3,35,67,1650132,2022-10-27
37,spotify:track:0ojpEubhy4JNeVftmVuiN7,"Vishal Mishra, Armaan Malik",Pehla Pyaar,T-Series,11,25,74,1647891,2022-10-27
38,spotify:track:72zHuDxFQTjbL51qJQSA7j,"Jasleen Royal, B Praak, Romy, Anvita Dutt","Ranjha (From ""Shershaah"")",Sony Music Entertainment India Pvt. Ltd.,1,33,64,1640042,2022-10-27
41,spotify:track:58HvfVOeJY7lUuCqF0m3ly,Elley Duhé,MIDDLE OF THE NIGHT,Not Fit For Society/RCA Records,12,41,43,1584308,2022-10-27
42,spotify:track:7JVpb6CY3I1JwQCIEgw9XT,"Gulab Sidhu, Sukh Lotey",Ainak,Red Leaf Music,31,91,4,1553570,2022-10-27
43,spotify:track:5O2P9iiztwhomNh8xkR9lJ,One Direction,Night Changes,Syco Music,22,43,76,1533705,2022-10-27
44,spotify:track:2eTkxblLeqdTSsb2ivafDX,"Ankit Tiwari, Manoj Muntashir","Galliyan Returns (From ""Ek Villain Returns"")",T-Series,9,36,17,1504934,2022-10-27
45,spotify:track:2tMoOS9grHtn4upzb4LwMG,"Dhibu Ninan Thomas, Kapil Kapilan","Adiye - From ""Bachelor""",Think Music,16,46,47,1493863,2022-10-27
46,spotify:track:6TClJ8jXi3OBV7gcrU3jx5,"AP Dhillon, Gurinder Gill",TERE TE,RUN-UP RECORDS,7,50,49,1484151,2022-10-27
47,spotify:track:5iCY0TXNImK4hyKfcplQsg,Anuv Jain,Baarishein,Universal Music India Pvt. Ltd. (on behalf of Anuv Jain),37,44,76,1484060,2022-10-27
48,spotify:track:1y1rQTkWmrZdJmjwuK07GC,"Vishal Mishra, Manoj Muntashir","Kaise Hua (From ""Kabir Singh"")",T-Series,5,37,176,1465730,2022-10-27
49,spotify:track:6yvxu91deFKt3X1QoV6qMv,"Anirudh Ravichander, Jonita Gandhi","Arabic Kuthu - Halamithi Habibo (From ""Beast"")",Sun Pictures,2,57,37,1449042,2022-10-27
50,spotify:track:5PjdY0CKGZdEuoNab3yDmX,"The Kid LAROI, Justin Bieber",STAY (with Justin Bieber),Columbia,1,48,68,1442865,2022-10-27
51,spotify:track:5urYiIXu1ZhfMAOsp7WDTc,"Rajat Nagpal, Yasser Desai, Neha Kakkar, Rana Sotal","Dil Ko Karaar Aaya (From ""Sukoon"")",Desi Music Factory,3,40,75,1438322,2022-10-27
52,spotify:track:0DXfJ2iKRDEG7rPgssWFea,"Kanishk Seth, Kavita Seth","Rangisari (From ""Jugjugg Jeeyo"")",T-Series,22,52,20,1423974,2022-10-27
53,spotify:track:1smFN2CLqGROu0J0UyvDfL,"Pritam, Arijit Singh",Shayad,Sony Music Entertainment India Pvt. Ltd.,1,47,145,1401826,2022-10-27
54,spotify:track:0WtM2NBVQNNJLh6scP13H8,"Rema, Selena Gomez",Calm Down (with Selena Gomez),Mavin Records / Jonzing World,54,65,6,1385221,2022-10-27
55,spotify:track:5jQI2r1RdgtuT8S3iG8zFC,Taylor Swift,Lavender Haze,Taylor Swift,55,-1,1,1364637,2022-10-27
56,spotify:track:6J7whJ91XKvDnLWpa1Cqn2,"B. Ajaneesh Loknath, Vijay Prakash, Ananya Bhat, Nagraj Panar Valtur, Pramod Maravanthe","Singara Siriye (From ""Kantara"")",Divo Tv Private Limited,56,62,3,1363492,2022-10-27
57,spotify:track:2qxmye6gAegTMjLKEBoR3d,Alec Benjamin,Let Me Down Slowly,2018,34,51,133,1362708,2022-10-27
58,spotify:track:7B4uYqxTpTOS1sgxFB9Ann,"Sidhu Moose Wala, Wazir Patar",The Last Ride,Sidhu Moose Wala,3,54,24,1354305,2022-10-27
59,spotify:track:60YICjIPdL7LDBcCMK0tAk,"Sidhu Moose Wala, Sunny Malton, The Kidd",Levels,Sidhu Moose Wala,8,59,22,1340247,2022-10-27
60,spotify:track:3UhmuWcFaLS3AO3kI9ynQ2,"AP Dhillon, Shinda Kahlon, Gurinder Gill, Gminxr",Insane,RUN-UP RECORDS,3,58,80,1336436,2022-10-27
61,spotify:track:3yV2c3cYhkAwSsxAq6nRiv,Gajendra Verma,Mann Mera,Sony Music / Eros Now Music,42,49,84,1295529,2022-10-27
62,spotify:track:2uThc9fZx2BEL3t6uuRMO1,"aleemrk, Umair",Cold Hours,Independent,28,28,6,1286011,2022-10-27
63,spotify:track:32LKwbmh6yVsWoRRF8DIvf,Pav Dharia,Na Ja,Ishtar Punjabi,50,53,51,1257207,2022-10-27
64,spotify:track:43Xb3G04Pgp63fNhQW4T6W,"Pritam, Arijit Singh, Amitabh Bhattacharya",Dance Ka Bhoot,Sony Music Entertainment India Pvt. Ltd.,50,67,9,1250356,2022-10-27
65,spotify:track:1418IuVKQPTYqt7QNJ9RXN,King,Maan Meri Jaan,Warner Music India,65,73,2,1227795,2022-10-27
66,spotify:track:2J2Z1SkXYghSajLibnQHOa,Sia,Unstoppable,Monkey Puzzle Records/RCA Records,16,55,65,1213870,2022-10-27
67,spotify:track:2l3dFxtoSMgMQVyRIUHjpz,Mitraz,Akhiyaan,Mitraz Records,23,78,26,1202893,2022-10-27
68,spotify:track:6eTPyEkYUmDUFvNxJdNuOD,"Ayushmann Khurrana, Rochak Kohli",Pani Da Rang - Male Vocals,Eros Now Music,68,-1,11,1201409,2022-10-27
69,spotify:track:1wtOxkiel43cVs0Yux5Q4h,"Taylor Swift, Lana Del Rey",Snow On The Beach (feat. Lana Del Rey),Taylor Swift,69,-1,1,1191742,2022-10-27
70,spotify:track:2NTVtNcpC0i1R7LVGaCZCF,"Badshah, Nikhita Gandhi",Jugnu,Universal Music India Pvt Ltd.,5,83,52,1190711,2022-10-27
71,spotify:track:32FVH23yFXr8Z0sfjRw4It,AP Dhillon,Wo Noor,RUN-UP RECORDS,65,88,3,1190538,2022-10-27
72,spotify:track:4bD9z9qa4qg9BhryvYWB7c,"Pritam, Tochi Raina, Rekha Bhardwaj",Kabira,T-Series,56,56,163,1188369,2022-10-27
73,spotify:track:7MXVkk9YMctZqd1Srtv4MB,"The Weeknd, Daft Punk",Starboy,Universal Republic Records,57,64,65,1183178,2022-10-27
74,spotify:track:7sVEoPc5ZUUQerRkgTypUZ,"Javed Ali, Devi Sri Prasad","Srivalli (From ""Pushpa The Rise Part - 01"")",T-Series,4,69,40,1182985,2022-10-27
76,spotify:track:58f4twRnbZOOVUhMUpplJ4,"AP Dhillon, Gminxr, Gurinder Gill, Shinda Kahlon",Brown Munde,Run-up Records,1,72,101,1178524,2022-10-27
77,spotify:track:043SPVu75TXbs94ZfM9dfn,"Kaushik-Guddu, Raghav Chaitanya, Kunaal Vermaa","Dil (From ""Ek Villain Returns"")",T-Series,20,61,16,1177351,2022-10-27
78,spotify:track:1iZLpuGMr4tn1F5bZu32Kb,Harrdy Sandhu,Bijlee Bijlee,Universal Music India Pvt Ltd. – Distribution,2,100,52,1177289,2022-10-27
79,spotify:track:4Dvkj6JhhA12EX05fT7y2e,Harry Styles,As It Was,Columbia,5,60,30,1175676,2022-10-27
80,spotify:track:5O932cZmzOZGOGZz9RHx20,"Pritam, Arijit Singh",Khairiyat,T-Series,1,68,164,1165134,2022-10-27
81,spotify:track:0stbF4C1ACmIvx0aW81ZXa,"Nakash Aziz, Sunidhi Chauhan","Ra Ra Rakkamma (From ""Vikrant Rona"")",Lahari Music,30,80,16,1144372,2022-10-27
82,spotify:track:5zwwW9Oq7ubSxoCGyW1nbY,BLACKPINK,Pink Venom,YG Entertainment/Interscope Records,7,77,10,1130876,2022-10-27
83,spotify:track:3rWDp9tBPQR9z6U5YyRSK4,Taylor Swift,Midnight Rain,Taylor Swift,83,-1,1,1130297,2022-10-27
84,spotify:track:7gRFDGEzF9UkBV233yv2dc,BLACKPINK,Shut Down,YG Entertainment/Interscope Records,13,71,6,1123020,2022-10-27
85,spotify:track:5pcmtf1lwrMqmAWWm248fY,"AP Dhillon, Gurinder Gill",DESIRES,RUN-UP RECORDS,2,90,49,1116261,2022-10-27
86,spotify:track:1pean7zvZUqcWZaUucH63f,"Dhanush, Anirudh Ravichander","Thaai Kelavi (From ""Thiruchitrambalam"")",Sun Pictures,18,92,12,1114633,2022-10-27
87,spotify:track:3gOXq3FPPesm7VLPKmef6j,"Arijit Singh, Shashaa Tirupati",Rait Zara Si,T-Series,12,70,47,1109447,2022-10-27
88,spotify:track:06YVd30bpfbyLnfNp4Lsnf,Prashant Katheriya,Tum Chhupa Na Sakogi,Nawazish Productions,86,86,2,1102805,2022-10-27
89,spotify:track:7AsG1F1eMWd17RYan8M3Wm,"AP Dhillon, Shinda Kahlon",Dil Nu,RUN-UP RECORDS,85,104,3,1096124,2022-10-27
91,spotify:track:2tjWCe2W7sgvS3C8NHcdtI,"Akhil, Dhvani Bhanushali, Kunaal Vermaa, Abhijit Vaghani","Duniyaa (From ""Luka Chuppi"")",T-Series,1,66,192,1085356,2022-10-27
92,spotify:track:0tgVpDi06FyKpA1z0VMD4v,Ed Sheeran,Perfect,Atlantic Records UK,48,85,132,1083604,2022-10-27
93,spotify:track:2Fv2injs4qAm8mJBGaxVKU,"Arijit Singh, Mithoon","Tujhe Kitna Chahne Lage (From ""Kabir Singh"")",T-Series,2,74,178,1082086,2022-10-27
94,spotify:track:7k6QR9YHyW258yVN6FHO1T,"OAFF, Savera, Lothika, Kausar Munir",Doobey,Sony Music Entertainment India Pvt. Ltd.,2,87,40,1079366,2022-10-27
95,spotify:track:0gE8ZP2cTXpRDz53bTkpu6,"Vishal Chandrashekhar, S.P. Charan",Inthandham,Sony Music Entertainment India Pvt. Ltd.,30,79,12,1071740,2022-10-27
96,spotify:track:2vkNA9I029dTwX0y6d59Sc,"Anirudh Ravichander, Anthony Daasan","Dippam Dappam (From ""Kaathuvaakula Rendu Kaadhal"")",Sony Music Entertainment India Pvt. Ltd.,13,103,27,1071054,2022-10-27
97,spotify:track:5Odq8ohlgIbQKMZivbWkEo,"Charlie Puth, Jung Kook, BTS",Left and Right (Feat. Jung Kook of BTS),Atlantic Records,4,94,18,1057854,2022-10-27
98,spotify:track:7eQl3Yqv35ioqUfveKHitE,"Pritam, Mohit Chauhan, Irshad Kamil",Tum Se Hi,T-Series,56,76,136,1056747,2022-10-27
99,spotify:track:7IK26RNUdgoZWJdlarrcty,"AP Dhillon, Shinda Kahlon",All Night (Live),RUN-UP RECORDS,68,95,3,1055144,2022-10-27
100,spotify:track:3JkVYvxNoGf2HCWJo61462,"Sidhu Moose Wala, Sunny Malton, SOE",Never Fold,Sidhu Moose Wala,13,102,27,1050482,2022-10-27
101,spotify:track:1ZiReD9pPTttQWwSoYqdyH,Dikshant,Aankhon Se Batana,Sony Music Entertainment India Pvt. Ltd.,38,81,27,1047188,2022-10-27
102,spotify:track:5WWplXimzIjlJiN2N7T9Q3,"Anirudh Ravichander, Kamal Haasan","Pathala Pathala (From ""Vikram"")",Sony Music Entertainment India Pvt. Ltd.,6,116,24,1034750,2022-10-27
103,spotify:track:10XG8WGYgiQRBmbEaffnfi,"B. Ajaneesh Loknath, Sai Vignesh, Shashiraj Kavoor",Varaha Roopam Daiva Va Rishtam,Divo Tv Private Limited,103,-1,1,1027789,2022-10-27
105,spotify:track:0pqnGHJpmpxLKifKRmU6WP,Imagine Dragons,Believer,Kid Ina Korner / Interscope,25,105,192,1020949,2022-10-27
106,spotify:track:6zJejIfVYLgjud3lTk4DLB,Rosa Linn,SNAP,Nvak Collective,99,99,6,1016739,2022-10-27
107,spotify:track:3eX0NZfLtGzoLUxPNvRfqm,Taylor Swift,Maroon,Taylor Swift,107,-1,1,1015544,2022-10-27
108,spotify:track:1Hdz67JES35Z4h3Yd4PXvV,"Thaman S, Anirudh Ravichander, Ramya Behara, Sahithi Chaganti, Vivek","Bimbilikki Pilapi (From ""Prince "")(Tamil)",Aditya Music,107,163,8,1013194,2022-10-27
109,spotify:track:7qiZfU4dY1lWllzX7mPBI3,Ed Sheeran,Shape of You,Atlantic Records UK,63,113,129,1010285,2022-10-27
110,spotify:track:7eNSk0grNnO7MqjLZzs6MM,"Mithoon, Arijit Singh, Neeti Mohan, Karan Malhotra",Fitoor,YRF Music,12,93,16,1008705,2022-10-27
111,spotify:track:6FjbAnaPRPwiP3sciEYctO,"Pritam, Arijit Singh",Raabta,T-Series,84,84,22,996975,2022-10-27
112,spotify:track:0VjIjW4GlUZAMYd2vXMi3b,The Weeknd,Blinding Lights,Republic Records,4,111,152,992634,2022-10-27
113,spotify:track:5L70RGPJEdooqtrgR7vd6U,"Pritam, Arijit Singh, Tulsi Kumar",Hum Nashe Mein Toh Nahin,T-Series,30,96,24,989974,2022-10-27
114,spotify:track:5G7pZ8G8NFvS1MQ9H4L7dC,"Javed-Mohsin, Arijit Singh, Shreya Ghoshal, Kunaal Vermaa, Prashant Ingole",Pal,Sony Music Entertainment India Pvt. Ltd.,44,82,190,981613,2022-10-27
115,spotify:track:4OcvkkpF3xmyCGGY5IBlgi,"Akhil Sachdeva, Tulsi Kumar","Tera Ban Jaunga (From ""Kabir Singh"")",T-Series,4,89,167,980347,2022-10-27
116,spotify:track:5ZhKD46Q7mhsl0awl7ZMJc,"Sachin-Jigar, Atif Aslam",Jeena Jeena,Eros Now Music,90,120,70,970409,2022-10-27
117,spotify:track:6KtSNVgCmQEvDgIuHoXAkT,Azaan Sami Khan,Ik Lamha,Freebird Records,36,107,18,966576,2022-10-27
118,spotify:track:78tblPcz2otRZd1VOeU7zz,"Yuvan Shankar Raja, Sid Sriram","Kanja Poovu Kannala (From ""Viruman"")",Sony Music Entertainment India Pvt. Ltd.,17,122,20,962777,2022-10-27
119,spotify:track:4iEGv5Ne6HuCkFCjzxdWQK,Neeti Mohan,Meri Jaan,Saregama,11,126,35,951040,2022-10-27
120,spotify:track:3wwLWFRLiReDf5AqgmAJwT,"Rito Riba, Rajat Nagpal, Rana Sotal",Heer Ranjha,PlayDMF,120,-1,1,944119,2022-10-27
121,spotify:track:3mZLiEDAHIjZ8ms5Lxq33F,Diljit Dosanjh,Peaches,DILJIT DOSANJH,33,131,15,940438,2022-10-27
122,spotify:track:6udC4b4jOSnHb9ItnXgKLR,"Sachin-Jigar, Shreya Ghoshal, Tochi Raina",Saibo,Sony Music Entertainment India Pvt. Ltd.,65,106,104,936446,2022-10-27
123,spotify:track:5iaKalECn9aYPfh9w07yOX,"Taaruk Raina, Mismatched - Cast",Kho Gaye,Netflix Music,123,171,2,932986,2022-10-27
124,spotify:track:6v3KW9xbzN5yKLt9YKDYA2,"Shawn Mendes, Camila Cabello",Señorita,Island Records,1,118,175,929286,2022-10-27
126,spotify:track:7cWnks0lsRtpAi87COOiXK,"Salim–Sulaiman, Rahat Fateh Ali Khan, Jaideep Sahni",O Re Piya,YRF Music,124,138,10,910678,2022-10-27
128,spotify:track:6FQQiTpYnfc5803p84bQp1,Anirudh Ravichander,Vikram - Title Track,Sony Music Entertainment India Pvt. Ltd.,5,132,24,903731,2022-10-27
129,spotify:track:0NvGVd87SYZnryTcfQPKUO,Madhur Sharma,Kali Kali Zulfon Ke,Universal Music India Pvt Ltd.,61,108,21,902520,2022-10-27
130,spotify:track:0u2P5u6lvoDfwTYjAADbn4,"Billie Eilish, Khalid",lovely (with Khalid),Darkroom,23,125,186,890699,2022-10-27
132,spotify:track:7ouBSPZKQpm7zQz2leJXta,Arijit Singh,"Tum Hi Ho (From ""Aashiqui 2"")",T-Series,78,124,91,885416,2022-10-27
133,spotify:track:05WduITDDUt1QARk6DaZp3,Arjan Dhillon,Hommie Call,Brown Studios,133,-1,1,885356,2022-10-27
134,spotify:track:3qrdLVOClRU4yPkcXZ7c5u,"Ayushmann Khurrana, Tanishk-Vayu","Mere Liye Tum Kaafi Ho (From ""Shubh Mangal Zyada Saavdhan"")",T-Series,11,114,141,880407,2022-10-27
135,spotify:track:2PvaburAUlhNHxVhw5lvOq,Arijit Singh,"Humdard (From ""Ek Villain"")",T-Series,93,98,119,875840,2022-10-27
136,spotify:track:7mNZUnDWUDidWBFaUpVtOC,Vilen,Chidiya,Universal Music India Pvt Ltd.,4,101,122,875248,2022-10-27
137,spotify:track:7ef4DlsgrMEH11cDZd32M6,"Calvin Harris, Dua Lipa",One Kiss (with Dua Lipa),Sony Music UK,56,133,22,874380,2022-10-27
138,spotify:track:3B4etxytImrRKQgV3XHjnR,Katy Perry,Harleys In Hawaii,Capitol Records,32,136,63,864941,2022-10-27
139,spotify:track:0MHiYjjcHNYM9KURa6NveF,"Dabzee, SA","Manavaalan Thug - From ""Thallumaala""",Muzik247,24,141,11,862319,2022-10-27
140,spotify:track:0tpwqQhdfJXRcUDSNRjb9O,"Arijit Singh, Neeti Mohan, Rashmi Virag","Mere Yaaraa (From ""Sooryavanshi"")",T-Series,20,128,52,857733,2022-10-27
141,spotify:track:0NLkVxf0PyxsXBG3EuZcJf,Anuv Jain,Gul,Universal Music India Pvt. Ltd. (on behalf of Anuv Jain),108,123,6,855600,2022-10-27
143,spotify:track:26aOnndLckt8uAsk6odL5n,"A.R. Rahman, Shreya Ghoshal, Palakkad Sreeram, Mahesh Vinayakram, Kabilan","Ratchasa Maamaney (From ""Ponniyin Selvan Part - 1"")",Tips Industries Ltd,62,117,4,853296,2022-10-27
144,spotify:track:43YkTTlOD203o9E5ZxhUjF,Arijit Singh,"Main Dhoondne Ko Zamaane Mein (From ""Heartless"")",T-Series,94,129,63,852600,2022-10-27
145,spotify:track:3sqRODOZ1Z6hR4F2tnFAlg,Maninder Buttar,Sakhiyaan,Ishtar Punjabi,20,121,182,850532,2022-10-27
146,spotify:track:4D7BCuvgdJlYvlX5WlN54t,Taylor Swift,"You're On Your Own, Kid",Taylor Swift,146,-1,1,849092,2022-10-27
147,spotify:track:3fwyItGexa88kR8j76dIqv,Pratsofficial,Aziyat 2.0 - Reprise Version,Prats,85,119,20,848577,2022-10-27
148,spotify:track:0aA3jlllhKSEiXTmGPGSWz,"Jeetu Sharma, Abhilipsa Panda",Har Har Shambhu Shiv Mahadeva,Jeetu Sharma,15,169,18,843724,2022-10-27
149,spotify:track:0QzuaeCEEOV40Pn7IvKEny,Dhruv,double take,Little Worry/RCA Records,75,139,29,839638,2022-10-27
150,spotify:track:1xwAWUI6Dj0WGC3KiUPN0O,Taylor Swift,Vigilante Shit,Taylor Swift,150,-1,1,839527,2022-10-27
151,spotify:track:6eYsOcDdB5b6rTO5ubMxeV,"Anirudh Ravichander, Jonita Gandhi","Private Party (From ""Don"")",Sony Music Entertainment India Pvt. Ltd.,23,195,26,839339,2022-10-27
152,spotify:track:3C9kY7XZh6GCEmfazGJ2UB,Serena,Safari,"Ultra Records, LLC",82,156,90,837546,2022-10-27
153,spotify:track:57jOEZtoLQK4zF2x55bdkp,"Rochak Kohli, Arijit Singh, Neha Kakkar","Tu Hi Yaar Mera (From ""Pati Patni Aur Woh"")",T-Series,8,134,151,836102,2022-10-27
154,spotify:track:0dLbrlAVPPjpPqnYfmJsWk,"Atif Aslam, Alisha Chinai, Pritam",Tera Hone Laga Hoon,Tips Industries Ltd,83,127,76,835124,2022-10-27
155,spotify:track:6fhG2KJgwO7CrNflRaRmvp,"Ruth B., sped up + slowed, slater",Dandelions - slowed + reverb,Columbia,75,137,35,835035,2022-10-27
156,spotify:track:5Z9KJZvQzH6PFmb8SNkxuk,"Lil Nas X, Jack Harlow",INDUSTRY BABY (feat. Jack Harlow),Columbia,6,147,66,831114,2022-10-27
157,spotify:track:3APdIdF8H0jsxSuGOqXedS,Rashid Ali,Kabhi Kabhi Aditi,T-Series,86,144,54,830741,2022-10-27
158,spotify:track:1ccZZf0IQi5y0bHMl2aGDF,Sanam,Gulabi Aankhen,Universal Music India Pvt Ltd.,109,109,10,829450,2022-10-27
159,spotify:track:209pScL6fUhISxcLWkB6rf,Anirudh Ravichander,Lokiverse - Background Score,Sony Music Entertainment India Pvt. Ltd.,37,149,16,828482,2022-10-27
160,spotify:track:4wIWWEhbdgKAxhR68eE0Ye,"Arijit Singh, Chinmayi","Mast Magan (From ""2 States"")",T-Series,75,143,88,827969,2022-10-27
161,spotify:track:1feANd8EfcDP5UqSvbheM3,"Sachet Tandon, Sachet-Parampara","Bekhayali (From ""Kabir Singh"")",T-Series,1,130,167,822664,2022-10-27
162,spotify:track:2ZRo7axmMPeSVUvDbGkJah,XXXTENTACION,Hope,"Bad Vibes Forever, LLC",44,172,74,821436,2022-10-27
163,spotify:track:2SlruWHh8xSrv4XGeHelKq,Arjan Dhillon,It's My Time,Brown Studios,163,-1,1,818524,2022-10-27
164,spotify:track:1UWacd8x8tPPwmrPB1MoBI,"Pritam, Arijit Singh",Ae Dil Hai Mushkil Title Track,Sony Music Entertainment India Pvt. Ltd.,105,186,143,814372,2022-10-27
165,spotify:track:7KokYm8cMIXCsGVmUvKtqf,Taylor Swift,Karma,Taylor Swift,165,-1,1,808357,2022-10-27
166,spotify:track:6zAvNLJkdyRApUHnlJjKfO,Ali Zafar,Jhoom - R&B Mix,Lightingale Records,20,148,24,806674,2022-10-27
167,spotify:track:0loZn1c5heXie7OAtvK6nH,"Jubin Nautiyal, Rocky - Shiv",Humnava Mere,T-Series,86,166,86,806559,2022-10-27
168,spotify:track:6H7fLdt0AeWpuxUKXuXWrx,Hariharan,Shree Hanuman Chalisa,T-Series,145,145,11,806212,2022-10-27
169,spotify:track:2PcGqmKToUz0s65q1Acg7d,"AP Dhillon, Shinda Kahlon, Gminxr",SPACESHIP,RUN-UP RECORDS,15,175,49,802540,2022-10-27
170,spotify:track:0GQngE2rOYvlKwEQjTAsP8,"Pritam, Sreeram, Shilpa Rao",Subhanallah,T-Series,146,151,11,799722,2022-10-27
171,spotify:track:3k9PtGmPNnQtt32TKWm6f3,MC STAN,Basti Ka Hasti,MC Stan,113,181,3,798099,2022-10-27
172,spotify:track:1Ef0TmgS1QrVO6tKHrMMmH,"Vishal-Shekhar, Arijit Singh, Shilpa Rao, Kumaar","Ghungroo (From ""War"")",YRF Music,1,185,155,793096,2022-10-27
173,spotify:track:3KeMulXbLDJBQdY5PZbGEh,"A.R. Rahman, Shreya Ghoshal",Param Sundari,Sony Music Entertainment India Pvt. Ltd.,7,197,63,787380,2022-10-27
174,spotify:track:1L3Nsi7YXtBxTdnbqektia,Darshan Raval,Hawa Banke,Indie Music Label,26,153,33,787006,2022-10-27
175,spotify:track:4381FmKZc1uT2zzhBiknH7,"A.R. Rahman, Vagu Mazan, Thoughtsfornow","Adheeraa (From ""Cobra"")",Sony Music Entertainment India Pvt. Ltd.,61,168,11,786334,2022-10-27
176,spotify:track:1E16f7KcZmuXuhlenRwA2m,"VIBIE, Sachin-Jigar, Shreya Ghoshal, Tochi Raina, Bollywood Lofi",Saibo - Lofi Flip,Sony Music Entertainment India Pvt. Ltd.,158,158,9,784146,2022-10-27
178,spotify:track:0lYBSQXN6rCTvUZvg9S0lU,"DJ Snake, Justin Bieber",Let Me Love You,DJ Snake Def Jam,90,157,192,772366,2022-10-27
179,spotify:track:69xohKu8C1fsflYAiSNbwM,BTS,Run BTS,BIGHIT MUSIC,17,-1,14,771164,2022-10-27
180,spotify:track:2RgvvnMwtP0R2OkVZmFvnV,KK,"Ajab Si (From ""Om Shanti Om"")",T-Series,46,140,42,770702,2022-10-27
181,spotify:track:48QmG1dfvMuYLxMPt7KSRA,"Sean Paul, Dua Lipa",No Lie,Universal-Island Records Ltd.,19,174,50,770517,2022-10-27
182,spotify:track:0H2iJVgorRR0ZFgRqGUjUM,"Pritam, Arijit Singh",Channa Mereya,Sony Music Entertainment India Pvt. Ltd.,58,170,157,763887,2022-10-27
183,spotify:track:4L6hCEc9xFf01U4d66JzK0,Armaan Malik,Tu / You,Arista Records,110,178,13,763705,2022-10-27
185,spotify:track:3jyqXdAjwqO3gFtjnYrbq9,"Darshan Raval, Rochak Kohli","Ek Ladki Ko Dekha Toh Aisa Laga (From ""Ek Ladki Ko Dekha Toh Aisa Laga"")",Saregama,154,154,2,758836,2022-10-27
186,spotify:track:4gC6xOiJLHTpIARRdmYMaQ,"Lipsika Bhashyam, Aditya Iyengar",Ra Ra Reddy I Am Ready,Aditya Music,53,191,14,756763,2022-10-27
187,spotify:track:0gPgdRfB4jdGrlyXS0Vx78,"Vishal-Shekhar, KK, Shilpa Rao, Anvita Dutt Guptan",Khuda Jaane,YRF Music,37,160,21,756086,2022-10-27
188,spotify:track:3HiobOOpSpMsi95WBKPBYk,"Jeet Gannguli, Arijit Singh",Hamari Adhuri Kahani (Title Track),Sony Music Entertainment India Pvt. Ltd.,155,155,50,755639,2022-10-27
189,spotify:track:1AzNN19lPYC68iacrbWL8X,"Darbuka Siva, Sid Sriram","Mudhal Nee Mudivum Nee Title Track (From ""Mudhal Nee Mudivum Nee"")",Sony Music Entertainment India Pvt. Ltd.,24,164,39,753778,2022-10-27
190,spotify:track:6tkl6rjuXWtVOCaXSSSCz2,Armaan Malik,"Jab Tak (From ""M.S.Dhoni - The Untold Story"")",T-Series,37,200,24,751299,2022-10-27
191,spotify:track:1W1dS4VnIrYnllQJ3CAcZy,Sidhu Moose Wala,So High,Humble Music,38,-1,20,750750,2022-10-27
192,spotify:track:7BKLCZ1jbUBVqRi2FVlTVw,"The Chainsmokers, Halsey",Closer,Disruptor Records/Columbia,59,182,192,750231,2022-10-27
193,spotify:track:6bdpj89aYEBjhpsenXAsmO,"A.R. Rahman, Arijit Singh",Enna Sona,Sony Music Entertainment India Pvt. Ltd.,34,159,80,747452,2022-10-27
194,spotify:track:1J14CdDAvBTE1AJYUOwl6C,Duncan Laurence,Arcade,"Universal Music, a division of Universal International Music BV",7,193,88,747195,2022-10-27
195,spotify:track:68AyTcvyK46hpzwohHUkJI,"Harnoor, Gifty",Waalian,Sky Digital,1,176,98,744880,2022-10-27
196,spotify:track:2IoZMG3RqiTmsy7Li3zGFg,"Sachet Tandon, Parampara Tandon, Sachet-Parampara","Mere Sohneya (From ""Kabir Singh"")",T-Series,4,146,138,744513,2022-10-27
197,spotify:track:0XwRlvv3KlOu4HWlOH34XG,Diljit Dosanjh,Lover,Diljit Dosanjh,13,-1,60,740210,2022-10-27
198,spotify:track:4Tq1eNoLWXqJsizbNnobSz,"A.R. Rahman, Yogi Sekar, Ilango Krishnan","Devaralan Aattam (From ""Ponniyin Selvan Part - 1"")",Tips Industries Ltd,131,135,4,738825,2022-10-27
199,spotify:track:1DIXPcTDzTj8ZMHt3PDt8p,"Coolio, L.V.",Gangsta's Paradise,"Tommy Boy Music, LLC",165,165,2,736458,2022-10-27
200,spotify:track:0heeNYlwOGuUSe7TgUD27B,Taylor Swift,Question...?,Taylor Swift,200,-1,1,736346,2022-10-27
