rank,uri,artist_names,track_name,source,peak_rank,previous_rank,weeks_on_chart,streams,End Date
184,spotify:track:6GQK4G5o60E8YA18DGpAzv,Harshit Saxena,Hale Dil,T-Series,98,168,25,1317371,2025-04-24
185,spotify:track:0FIDCNYYjNvPVimz5icugS,"The Weeknd, Playboi Carti",Timeless (feat Playboi Carti),XO / Republic Records,78,154,19,1314534,2025-04-24
186,spotify:track:610keNiNVTIkYD0CqeSerg,"Cheema Y, Gur Sidhu",California Love,Brown Town Music,27,189,82,1302361,2025-04-24
187,spotify:track:2Z6HgNji9cNlFLNORw6wDQ,"Mansheel Gujral, Akhil Sachdeva","Channa Ve - From ""Bhoot - Part One: The Haunted Ship""",Zee Music Company,33,-1,69,1296254,2025-04-24
188,spotify:track:209QxKVJzh2FLUmZHpYs4m,"Badshah, Karan Aujla, Hiten",God Damn,Universal Music India Pvt Ltd.,15,-1,55,1294053,2025-04-24
189,spotify:track:5PvwPy5eRO8BPwpRzCHK3D,Ankit Tiwari,Sunn Raha Hai (Male Version),T-Series,140,183,16,1292633,2025-04-24
190,spotify:track:2E5kZ1qnB7V9bcwBEKvZv8,"Arijit Singh, Prasad S, Kunaal Vermaa","Kasturi (From ""Amar Prem Ki Prem Kahani"")",Times Music,61,196,27,1291550,2025-04-24
191,spotify:track:0TWfc3QZIQkijjTY4T9ptE,"Sachin Jaat, Masoom Sharma, Swara Verma",Gundey Dore Pe,Rajak Media Entertainment,162,162,2,1286990,2025-04-24
192,spotify:track:0rk2X5TAhraBC5aCIXK2Rq,"Jawad Ahmad, Shaarib Toshi, Arijit Singh, Shreya Ghoshal",Samjhawan,Sony Music Entertainment India Pvt. Ltd.,70,-1,192,1283823,2025-04-24
193,spotify:track:3AWDeHLc88XogCaCnZQLVI,The Weeknd,Cry For Me,XO / Republic Records,149,159,8,1281831,2025-04-24
194,spotify:track:5fBghXeYCGIEVuExKytoJ9,Shubh,Fell For You,SHUBH,19,136,13,1280248,2025-04-24
195,spotify:track:3bQsp4Vr9Rg4fNCx6HPOgX,Anuv Jain,Alag Aasmaan,Universal Music India Pvt. Ltd. (on behalf of Anuv Jain),30,-1,71,1278270,2025-04-24
196,spotify:track:3F3ZuXYFXGM1V6pk3b3zmi,"Diljit Dosanjh, thiarajxtt",Kinni Kinni,DILJIT DOSANJH,24,178,73,1278245,2025-04-24
197,spotify:track:4r8JqkhpTb5tzSKKHnVJIJ,"Vishal-Shekhar, Mohit Chauhan, Shekhar Ravjiani, Shruti Pathak",Tujhe Bhula Diya,T-Series,94,195,35,1276027,2025-04-24
198,spotify:track:1feANd8EfcDP5UqSvbheM3,"Sachet Tandon, Sachet-Parampara","Bekhayali (From ""Kabir Singh"")",T-Series,1,-1,266,1274086,2025-04-24
199,spotify:track:4kaLkst9lT3sQ5Crgxs3ic,"Ayushmann Khurrana, Rochak Kohli",Pani Da Rang - Male Vocals,Eros Now Music,68,-1,47,1265721,2025-04-24
200,spotify:track:7wW9scVNLYFLsmBb1yAUmS,Yo Yo Honey Singh,Blue Eyes,T-Series,38,166,45,1264714,2025-04-24
