rank,uri,artist_names,track_name,source,peak_rank,previous_rank,weeks_on_chart,streams,End Date
1,spotify:track:29m79w9xPMH4YCD6r8JSmV,"AP Dhillon, Gurinder Gill, Intense",Excuses,RUN-UP RECORDS,1,1,23,4753732,2022-03-31
2,spotify:track:6yvxu91deFKt3X1QoV6qMv,"Anirudh Ravichander, Jonita Gandhi","Arabic Kuthu - Halamithi Habibo (From ""Beast"")",Sun Pictures,2,2,7,3100743,2022-03-31
3,spotify:track:0snQrp1VaY5Pj1YIHRJpRJ,Aditya A,Chaand Baaliyan,Sony Music Entertainment India Pvt. Ltd.,3,3,6,2842313,2022-03-31
4,spotify:track:02MWAaffLxlfxAUY7c5dvx,Glass Animals,Heat Waves,Polydor Records,3,4,37,2553594,2022-03-31
5,spotify:track:2rOnSn2piaqLAlYjtfUBlY,"Tanishk Bagchi, Jubin Nautiyal, Asees Kaur","Raataan Lambiyan (From ""Shershaah"")",Sony Music Entertainment India Pvt. Ltd.,1,5,35,2124446,2022-03-31
7,spotify:track:72zHuDxFQTjbL51qJQSA7j,"Jasleen Royal, B Praak, Romy, Anvita Dutt","Ranjha (From ""Shershaah"")",Sony Music Entertainment India Pvt. Ltd.,1,7,34,1834092,2022-03-31
8,spotify:track:5pcmtf1lwrMqmAWWm248fY,"AP Dhillon, Gurinder Gill",DESIRES,RUN-UP RECORDS,2,6,19,1830867,2022-03-31
9,spotify:track:5PjdY0CKGZdEuoNab3yDmX,"The Kid LAROI, Justin Bieber",STAY (with Justin Bieber),Columbia,1,11,38,1769451,2022-03-31
10,spotify:track:7k6QR9YHyW258yVN6FHO1T,"OAFF, Savera, Lothika, Kausar Munir",Doobey,Sony Music Entertainment India Pvt. Ltd.,2,8,10,1749389,2022-03-31
11,spotify:track:3UhmuWcFaLS3AO3kI9ynQ2,"AP Dhillon, Shinda Kahlon, Gurinder Gill, Gminxr",Insane,RUN-UP RECORDS,3,10,50,1722425,2022-03-31
12,spotify:track:7sVEoPc5ZUUQerRkgTypUZ,"Javed Ali, Devi Sri Prasad","Srivalli (From ""Pushpa The Rise Part - 01"")",T-Series,4,12,10,1569846,2022-03-31
13,spotify:track:4iEGv5Ne6HuCkFCjzxdWQK,Neeti Mohan,Meri Jaan,Saregama,13,13,5,1568382,2022-03-31
14,spotify:track:58f4twRnbZOOVUhMUpplJ4,"AP Dhillon, Gminxr, Gurinder Gill, Shinda Kahlon",Brown Munde,Run-up Records,1,14,71,1535306,2022-03-31
15,spotify:track:58HvfVOeJY7lUuCqF0m3ly,Elley Duhé,MIDDLE OF THE NIGHT,Not Fit For Society/RCA Records,15,18,13,1534357,2022-03-31
16,spotify:track:2J2Z1SkXYghSajLibnQHOa,Sia,Unstoppable,Monkey Puzzle Records/RCA Records,16,24,35,1525771,2022-03-31
17,spotify:track:0yCWDaAgOtg6TKlNCg9rwA,King,Tu Aake Dekhle,Warner Music India,6,16,61,1499875,2022-03-31
18,spotify:track:7lvDsmTRXFE3dK4OjvRiWB,"Shae Gill, Ali Sethi",Pasoori,Giraffe Pakistan,18,27,6,1458636,2022-03-31
19,spotify:track:605r6rtj7kBlJwZWmYx1Dt,Shubh,We Rollin,SHUBH,13,23,18,1441194,2022-03-31
20,spotify:track:6lpbzOMBOYHRsp6WEMvRvn,"Thalapathy Vijay, Anirudh Ravichander","Jolly O Gymkhana (From ""Beast"")",Sun Pictures,15,15,2,1440178,2022-03-31
21,spotify:track:5Z9KJZvQzH6PFmb8SNkxuk,"Lil Nas X, Jack Harlow",INDUSTRY BABY (feat. Jack Harlow),Columbia,6,19,36,1425344,2022-03-31
22,spotify:track:1iZLpuGMr4tn1F5bZu32Kb,Harrdy Sandhu,Bijlee Bijlee,Universal Music India Pvt Ltd. – Distribution,2,17,22,1375278,2022-03-31
23,spotify:track:3gOXq3FPPesm7VLPKmef6j,"Arijit Singh, Shashaa Tirupati",Rait Zara Si,T-Series,12,22,17,1344475,2022-03-31
24,spotify:track:2FCXQHugkoHE1K3tiDu8pu,"Alka Yagnik, Arijit Singh","Agar Tum Saath Ho (From ""Tamasha"")",T-Series,4,25,148,1307898,2022-03-31
25,spotify:track:2tMoOS9grHtn4upzb4LwMG,"Dhibu Ninan Thomas, Kapil Kapilan","Adiye - From ""Bachelor""",Think Music,16,21,17,1302903,2022-03-31
26,spotify:track:6TClJ8jXi3OBV7gcrU3jx5,"AP Dhillon, Gurinder Gill",TERE TE,RUN-UP RECORDS,7,20,19,1278671,2022-03-31
27,spotify:track:0tpwqQhdfJXRcUDSNRjb9O,"Arijit Singh, Neeti Mohan, Rashmi Virag","Mere Yaaraa (From ""Sooryavanshi"")",T-Series,20,28,22,1234434,2022-03-31
28,spotify:track:2eAvDnpXP5W0cVtiI0PUxV,Ruth B.,Dandelions,Columbia,28,30,18,1228736,2022-03-31
29,spotify:track:2NTVtNcpC0i1R7LVGaCZCF,"Badshah, Nikhita Gandhi",Jugnu,Universal Music India Pvt Ltd.,5,26,22,1183160,2022-03-31
30,spotify:track:58dGRQrNmAJeRMFuguUbvD,"Spice, Sean Paul, Shaggy",Go Down Deh (feat. Sean Paul & Shaggy),VP Records,30,37,8,1160457,2022-03-31
31,spotify:track:7hUxzSsK2OHjeKWkzeArIU,"B Praak, Jaani","Meri Jaan Meri Jaan (From ""Bachchhan Paandey"")",T-Series,29,29,4,1125213,2022-03-31
32,spotify:track:5urYiIXu1ZhfMAOsp7WDTc,"Rajat Nagpal, Yasser Desai, Neha Kakkar, Rana Sotal","Dil Ko Karaar Aaya (From ""Sukoon"")",Desi Music Factory,3,36,45,1123325,2022-03-31
33,spotify:track:3szxldqiYs7nkvtmooRod8,"Devi Sri Prasad, Indravathi Chauhan, Chandra Bose","Oo Antava Oo Oo Antava (From ""Pushpa - The Rise"")(Telugu)",Aditya Music,6,32,16,1099939,2022-03-31
34,spotify:track:48QmG1dfvMuYLxMPt7KSRA,"Sean Paul, Dua Lipa",No Lie,Universal-Island Records Ltd.,19,34,20,1093888,2022-03-31
35,spotify:track:4iKGu3xtvm90eBw0EIPWJP,"Rahul Sipligunj, Kala Bhairava, M. M. Keeravaani, Chandra Bose","Naatu Naatu (From ""Rrr"")",Lahari Music,23,100,20,1088852,2022-03-31
36,spotify:track:2PcGqmKToUz0s65q1Acg7d,"AP Dhillon, Shinda Kahlon, Gminxr",SPACESHIP,RUN-UP RECORDS,15,31,19,1062548,2022-03-31
37,spotify:track:5O2P9iiztwhomNh8xkR9lJ,One Direction,Night Changes,Syco Music,37,46,46,1046888,2022-03-31
38,spotify:track:4HdzYTQiouB9BVYX7JOrhh,"Anirudh Ravichander, Rokesh","Jalabulajangu (From ""Don"")",Sony Music Entertainment India Pvt. Ltd.,34,35,15,1040030,2022-03-31
39,spotify:track:1HhNoOuqm1a5MXYEgAFl8o,"Imagine Dragons, JID, Arcane, League of Legends",Enemy (with JID) - from the series Arcane League of Legends,Kid Ina Korner / Interscope,31,38,15,1028457,2022-03-31
40,spotify:track:2qxmye6gAegTMjLKEBoR3d,Alec Benjamin,Let Me Down Slowly,2018,34,39,103,1026227,2022-03-31
41,spotify:track:0hNPo5brQ2MLlrdVKZfHK9,Sid Sriram,Kalaavathi,Saregama India Ltd,21,33,7,999889,2022-03-31
42,spotify:track:4gvrJnKCKIPiacNsWVQwEU,"CKay, Dj Yo!, AX'EL",love nwantiti (feat. Dj Yo! & AX'EL) - Remix,WM South Africa,4,40,28,998071,2022-03-31
43,spotify:track:1GjRIaC1VRaPw8cl5CAjuF,"Sunidhi Chauhan, Devi Sri Prasad","Saami Saami (From ""Pushpa The Rise Part - 01"")",T-Series,23,41,11,958757,2022-03-31
44,spotify:track:1SOClUWhOi8vHZYMz3GluK,Jaymes Young,Infinity,Atlantic Records,22,44,17,947792,2022-03-31
45,spotify:track:3D0pmiK3zyF9PudyJ8mkor,"AP Dhillon, Amari",Ma Belle,RUN-UP RECORDS,17,42,37,942018,2022-03-31
46,spotify:track:1AzNN19lPYC68iacrbWL8X,"Darbuka Siva, Sid Sriram","Mudhal Nee Mudivum Nee Title Track (From ""Mudhal Nee Mudivum Nee"")",Sony Music Entertainment India Pvt. Ltd.,24,45,9,924944,2022-03-31
47,spotify:track:1smFN2CLqGROu0J0UyvDfL,"Pritam, Arijit Singh",Shayad,Sony Music Entertainment India Pvt. Ltd.,1,48,115,905496,2022-03-31
48,spotify:track:6XPmY4hIb1RGRyNuq0UBsl,The PropheC,Kina Chir,PropheC Productions,12,62,23,896427,2022-03-31
49,spotify:track:4ZNIkO2j6K2c0Nm8zWXmdn,Ram Miriyala,Tillu Anna DJ Pedithe,Aditya Music,30,43,8,890595,2022-03-31
51,spotify:track:0e8nrvls4Qqv5Rfa2UhqmO,Lil Nas X,THATS WHAT I WANT,Columbia,37,59,17,853694,2022-03-31
52,spotify:track:4lmtILzOIIvOzMBPMUzvKx,"Amaal Mallik, Arijit Singh, Shreya Ghoshal","Heer Raanjhana (From ""Bachchhan Paandey"")",T-Series,47,47,3,852950,2022-03-31
53,spotify:track:7hU3IHwjX150XLoTVmjD0q,LISA,MONEY,YG Entertainment/Interscope Records,6,50,29,849478,2022-03-31
54,spotify:track:2ZRo7axmMPeSVUvDbGkJah,XXXTENTACION,Hope,"Bad Vibes Forever, LLC",44,58,44,840710,2022-03-31
55,spotify:track:0tgVpDi06FyKpA1z0VMD4v,Ed Sheeran,Perfect,Atlantic Records UK,48,53,102,840155,2022-03-31
56,spotify:track:2Fv2injs4qAm8mJBGaxVKU,"Arijit Singh, Mithoon","Tujhe Kitna Chahne Lage (From ""Kabir Singh"")",T-Series,2,60,148,835301,2022-03-31
57,spotify:track:2BeY2dQPbD8xYxx3yhBTVD,Gajendra Verma,Mann Mera,Sony Music / Eros Now Music,57,68,55,827409,2022-03-31
58,spotify:track:09vHbIezp9NP31CZWysk3v,"Tanishk Bagchi, Pav Dharia, Nikhita Gandhi","Najaa (From ""Sooryavanshi"")",T-Series,7,51,21,821706,2022-03-31
59,spotify:track:3B4etxytImrRKQgV3XHjnR,Katy Perry,Harleys In Hawaii,Capitol Records,32,57,33,813687,2022-03-31
60,spotify:track:6v3KW9xbzN5yKLt9YKDYA2,"Shawn Mendes, Camila Cabello",Señorita,Island Records,1,64,145,812232,2022-03-31
61,spotify:track:6G699QfN1BWYWXfiblH51F,"Tanishk Bagchi, Zahrah S Khan, Dev Negi","Kusu Kusu (From ""Satyameva Jayate 2"")",T-Series,16,55,20,807697,2022-03-31
62,spotify:track:6Uj1ctrBOjOas8xZXGqKk4,Doja Cat,Woman,Kemosabe Records/RCA Records,6,70,33,796062,2022-03-31
63,spotify:track:7G8LfMpY6TGN9dbZ9m0Jdd,Kala Bhairava,"Komuram Bheemudo (From ""RRR"")",Lahari Music,63,-1,1,794126,2022-03-31
64,spotify:track:0Z2SFlnXH9yMN36djUeqyE,"Sidhu Moose Wala, Sunny Malton",Fuck Em All,Sidhu Moose Wala,64,-1,1,793180,2022-03-31
65,spotify:track:4fouWK6XVHhzl78KzQ1UjL,GAYLE,abcdefu,Atlantic/Arthouse Records,16,52,18,791220,2022-03-31
66,spotify:track:6h5vL07MyGY6WdWPYK4IMG,Hemachandra Vedala,"Dosti (From ""RRR"")",Lahari Music,66,-1,2,788607,2022-03-31
67,spotify:track:5O932cZmzOZGOGZz9RHx20,"Pritam, Arijit Singh",Khairiyat,T-Series,1,72,134,783130,2022-03-31
68,spotify:track:1J14CdDAvBTE1AJYUOwl6C,Duncan Laurence,Arcade,"Universal Music, a division of Universal International Music BV",7,69,58,778225,2022-03-31
69,spotify:track:0NWWEG9qTxDKNARVQf6eDS,"Jassa Dhillon, Gur Sidhu",Shadow,Brown Town Music,66,66,2,774604,2022-03-31
70,spotify:track:7BKLCZ1jbUBVqRi2FVlTVw,"The Chainsmokers, Halsey",Closer,Disruptor Records/Columbia,59,73,162,766533,2022-03-31
71,spotify:track:2aV8nAkyt5nsWdQTruzgmJ,"Arijit Singh, Manan Bhardwaj, Khushalii Kumar",Dhokha,T-Series,54,71,5,762682,2022-03-31
72,spotify:track:1y1rQTkWmrZdJmjwuK07GC,"Vishal Mishra, Manoj Muntashir","Kaise Hua (From ""Kabir Singh"")",T-Series,5,78,146,762231,2022-03-31
73,spotify:track:0u2P5u6lvoDfwTYjAADbn4,"Billie Eilish, Khalid",lovely (with Khalid),Darkroom,23,81,156,754631,2022-03-31
74,spotify:track:1SC5rEoYDGUK4NfG82494W,Lil Nas X,MONTERO (Call Me By Your Name),Columbia,1,76,53,746431,2022-03-31
75,spotify:track:0pqnGHJpmpxLKifKRmU6WP,Imagine Dragons,Believer,Kid Ina Korner / Interscope,25,80,162,745494,2022-03-31
76,spotify:track:6qZyM6JV8ohLC4S2EL5sFh,"Sachet Tandon, Nikhita Gandhi, Madhubanti Bagchi, Sachin-Jigar",Barbaadiyan,T-Series,14,77,26,740900,2022-03-31
77,spotify:track:7mNZUnDWUDidWBFaUpVtOC,Vilen,Chidiya,Universal Music India Pvt Ltd.,4,92,92,740131,2022-03-31
78,spotify:track:0VjIjW4GlUZAMYd2vXMi3b,The Weeknd,Blinding Lights,Republic Records,4,65,122,738020,2022-03-31
79,spotify:track:3KeMulXbLDJBQdY5PZbGEh,"A.R. Rahman, Shreya Ghoshal",Param Sundari,Sony Music Entertainment India Pvt. Ltd.,7,67,37,737396,2022-03-31
80,spotify:track:2tjWCe2W7sgvS3C8NHcdtI,"Akhil, Dhvani Bhanushali, Kunaal Vermaa, Abhijit Vaghani","Duniyaa (From ""Luka Chuppi"")",T-Series,1,87,162,731494,2022-03-31
81,spotify:track:7qiZfU4dY1lWllzX7mPBI3,Ed Sheeran,Shape of You,Atlantic Records UK,63,88,99,728445,2022-03-31
82,spotify:track:1UUgngRGzFWfgpyN0WAN1r,"Anirudh Ravichander, Ravi G, Shashaa Tirupati","Naan Pizhai (From ""Kaathuvaakula Rendu Kaadhal"")",Sony Music Entertainment India Pvt. Ltd.,53,56,12,726788,2022-03-31
83,spotify:track:3jf5303mzzJ96O8xFTcEn4,"B Praak, Jaani","Mann Bharryaa 2.0 (From ""Shershaah"")",Sony Music Entertainment India Pvt. Ltd.,3,79,33,725968,2022-03-31
84,spotify:track:7eQl3Yqv35ioqUfveKHitE,"Pritam, Mohit Chauhan, Irshad Kamil",Tum Se Hi,T-Series,56,95,106,708715,2022-03-31
85,spotify:track:6I3mqTwhRpn34SLVafSH7G,Justin Bieber,Ghost,RBMG/Def Jam,85,90,25,702609,2022-03-31
86,spotify:track:5zfRl79umXWvKoA7p4KEPa,"Udit Narayan, Alka Yagnik","Tip Tip (From ""Sooryavanshi"")",T-Series,18,83,21,697098,2022-03-31
87,spotify:track:4uLG79ROWYEXx1kJvDVbWI,"Haricharan, Shreya Ghoshal",Tere Rang,T-Series,23,84,17,695076,2022-03-31
88,spotify:track:2nDzukOYADCVZXytiGnnFI,"Khan Bhaini, Shipra Goyal",Chak Chak Chak,BANG Music,88,-1,1,694687,2022-03-31
89,spotify:track:5eGsHi6RcL33gb9k89UYaB,"Tegi Pannu, Manni Sandhu",Schedule,Collab Creations Ltd,40,82,31,692956,2022-03-31
90,spotify:track:5QDLhrAOJJdNAmCTJ8xMyW,BTS,Dynamite,BIGHIT MUSIC,1,91,84,686566,2022-03-31
91,spotify:track:70ifdSj5JAvKISNn2cD87A,"OAFF, Savera, Lothika, Ankur Tewari",Gehraiyaan Title Track,Sony Music Entertainment India Pvt. Ltd.,13,85,9,686058,2022-03-31
92,spotify:track:5D507IC1VOAg7bKkmOblr6,"Anirudh Ravichander, Adithya RK","Bae (From ""Don"")",Sony Music Entertainment India Pvt. Ltd.,56,63,8,685381,2022-03-31
93,spotify:track:3e7sxremeOE3wTySiOhGiP,"ZAYN, Sia",Dusk Till Dawn (feat. Sia) - Radio Edit,RCA Records Label,51,98,130,680458,2022-03-31
94,spotify:track:0XwRlvv3KlOu4HWlOH34XG,Diljit Dosanjh,Lover,Diljit Dosanjh,13,86,32,680048,2022-03-31
95,spotify:track:68AyTcvyK46hpzwohHUkJI,"Harnoor, Gifty",Waalian,Sky Digital,1,96,77,672456,2022-03-31
96,spotify:track:1NfnyCDpRMTso2ow5fcfTL,"Jaz Dhami, Karan Aujla, Yeah Proof",Bas,Oneness Entertainment,61,61,2,672053,2022-03-31
97,spotify:track:2MJz8BxxMsERULatmBikDH,Pink Sweat$,At My Worst,Atlantic Records,3,97,65,670839,2022-03-31
99,spotify:track:4vWcMkEsnEeolYB5kUmr9Q,"Hesham Abdul Wahab, Darshana Rajendran",Darshana,Think Music,75,89,11,654387,2022-03-31
100,spotify:track:6Ffl1BBRfr8I2ASR6iiRTe,"Mankirt Aulakh, Flamme Music",Judge,Sky Digital,34,74,8,653239,2022-03-31
101,spotify:track:7tETj4CM2fUOust66B0xQ9,"Vishal Mishra, Prudhvi Chandra, M. M. Keeravaani, Sahithi Chaganti, Harika Narayan",Etthara Jenda,Lahari Music,101,-1,1,652940,2022-03-31
102,spotify:track:5G7pZ8G8NFvS1MQ9H4L7dC,"Javed-Mohsin, Arijit Singh, Shreya Ghoshal, Kunaal Vermaa, Prashant Ingole",Pal,Sony Music Entertainment India Pvt. Ltd.,44,104,160,650160,2022-03-31
103,spotify:track:1mWdTewIgB3gtBM3TOSFhB,BTS,Butter,BIGHIT MUSIC,1,102,45,642972,2022-03-31
104,spotify:track:3H3x4NhR3wJh6IvRHmPvkd,"Thaman S, Srivardhani Kuchi, Aditi, Satya Yamini, Roshini, Tejaswini","Tum Tum (From ""Enemy"")",Divo,35,99,18,642694,2022-03-31
105,spotify:track:4oglYe270D9yn6Gc0JWc03,"Kanika Kapoor, Devi Sri Prasad","Oo Bolega Ya Oo Oo Bolega (From ""Pushpa The Rise Part - 01"")",T-Series,27,94,11,640378,2022-03-31
106,spotify:track:39LLxExYz6ewLAcYrzQQyP,Dua Lipa,Levitating,Warner Records,11,108,50,640022,2022-03-31
107,spotify:track:6IaHIJYxIG8xbosaRr25AC,Harnoor,Parshawan,Legacy Records,30,109,42,638616,2022-03-31
108,spotify:track:7Bnc9gWHdjZAmjSuTY42CJ,"Mithoon, Arijit Singh",Aashiqui Aa Gayi,T-Series,25,103,17,635134,2022-03-31
109,spotify:track:0qOnSQQF0yzuPWsXrQ9paz,"Gym Class Heroes, Adam Levine",Stereo Hearts (feat. Adam Levine),Decaydance/Fueled By Ramen,12,111,61,631695,2022-03-31
110,spotify:track:2hDMBVN3P47GEhH5VtmA6m,"Tegi Pannu, Manni Sandhu",Untouchable,Collab Creations Ltd,66,106,9,624280,2022-03-31
112,spotify:track:0dLbrlAVPPjpPqnYfmJsWk,"Atif Aslam, Alisha Chinai, Pritam",Tera Hone Laga Hoon,Tips Industries Ltd,112,123,46,620391,2022-03-31
113,spotify:track:4hPxFf3Rd18BRtTYRcqZir,"Mithoon, Arijit Singh, Manoj Muntashir",Soch Liya,T-Series,31,112,16,614198,2022-03-31
114,spotify:track:3qrdLVOClRU4yPkcXZ7c5u,"Ayushmann Khurrana, Tanishk-Vayu","Mere Liye Tum Kaafi Ho (From ""Shubh Mangal Zyada Saavdhan"")",T-Series,11,119,112,612660,2022-03-31
115,spotify:track:6fhG2KJgwO7CrNflRaRmvp,"Ruth B., sped up + slowed, slater",Dandelions - slowed + reverb,Columbia,115,127,5,612429,2022-03-31
116,spotify:track:1U8rhryVYw9gWZ6zvw4Orc,"OAFF, Savera, Shalmali Kholgade, Kausar Munir",Beqaaboo,Sony Music Entertainment India Pvt. Ltd.,42,105,7,611152,2022-03-31
117,spotify:track:2rU33n6Fhd6G1MzYhUj6C5,"Jubin Nautiyal, Emraan Hashmi",Lut Gaye,T-Series,1,110,56,609939,2022-03-31
119,spotify:track:3AVXwaOGCEL8cmBecfcsFJ,Charlie Puth,Light Switch,Atlantic Records,44,126,10,600909,2022-03-31
120,spotify:track:6R6BpMBFQrF7n2uEOxYmss,"Javed-Mohsin, Darshan Raval","Kabhii Tumhhe (From ""Shershaah"")",Sony Music Entertainment India Pvt. Ltd.,5,122,33,600774,2022-03-31
121,spotify:track:6IWZKBeAkeCzaYNE8SmedK,"Rochak Kohli, Jubin Nautiyal, Neeti Mohan","Meri Zindagi Hai Tu (From ""Satyameva Jayate 2"")",T-Series,84,121,22,599683,2022-03-31
122,spotify:track:3zHq9ouUJQFQRf3cm1rRLu,Ellie Goulding,"Love Me Like You Do - From ""Fifty Shades Of Grey""",Polydor Records,111,131,110,594868,2022-03-31
123,spotify:track:2YmXGUx32C3CUEgcAyHcGf,"Devi Sri Prasad, Sid Sriram, Chandra Bose","Srivalli (From ""Pushpa - The Rise"")(Telugu)",Aditya Music,2,101,24,592451,2022-03-31
124,spotify:track:5iCY0TXNImK4hyKfcplQsg,Anuv Jain,Baarishein,Universal Music India Pvt. Ltd. (on behalf of Anuv Jain),62,137,46,592425,2022-03-31
125,spotify:track:0lYBSQXN6rCTvUZvg9S0lU,"DJ Snake, Justin Bieber",Let Me Love You,DJ Snake Def Jam,90,125,162,590816,2022-03-31
126,spotify:track:4faDlXyZMSxEuxBdd5gDIz,"AP Dhillon, Intense",Toxic,RUN-UP RECORDS,39,114,51,588257,2022-03-31
127,spotify:track:6udC4b4jOSnHb9ItnXgKLR,"Sachin-Jigar, Shreya Ghoshal, Tochi Raina",Saibo,Sony Music Entertainment India Pvt. Ltd.,65,134,74,587622,2022-03-31
128,spotify:track:5eN1nmOe9R29OBL6soTJov,"AP Dhillon, Shinda Kahlon, Gurinder Gill, Gminxr",MAJHE AALE,RUN-UP RECORDS,29,115,19,583479,2022-03-31
129,spotify:track:1u8c2t2Cy7UBoG4ArRcF5g,Taylor Swift,Blank Space,"Big Machine Records, LLC",69,132,72,582394,2022-03-31
130,spotify:track:1y5beX4vn7QPfg36r4jiWo,"Maninder Buttar, Zara Khan, Tanishk Bagchi","Sakhiyan2.0 (From ""BellBottom"")",Saregama,7,124,33,582105,2022-03-31
131,spotify:track:0b11D9D0hMOYCIMN3OKreM,"Witt Lowry, Ava Max",Into Your Arms (feat. Ava Max),Witt Lowry,31,130,58,578371,2022-03-31
132,spotify:track:6JUQViD0hLXlvWXCV4uUF8,Manan Bhardwaj,Chitta,T-Series,8,133,24,577839,2022-03-31
133,spotify:track:6CTN8S2qzPwZdwwp0Nugvy,Manan Bhardwaj,"Shiddat Title Track (From ""Shiddat"")",T-Series,14,128,26,577153,2022-03-31
134,spotify:track:50RcuWjfUcoJfWMNegXF0b,"Yuvan Shankar Raja, Harini Ivaturi, Justin Prabhakaran","Ee Raathale (From ""Radhe Shyam"")",T-Series,44,75,5,576575,2022-03-31
135,spotify:track:4bD9z9qa4qg9BhryvYWB7c,"Pritam, Tochi Raina, Rekha Bhardwaj",Kabira,T-Series,72,145,133,572708,2022-03-31
136,spotify:track:4iFPsNzNV7V9KJgcOX7TEO,"Atif Aslam, Pritam",Tu Jaane Na,Tips Industries Ltd,108,141,50,569623,2022-03-31
137,spotify:track:1Ef0TmgS1QrVO6tKHrMMmH,"Vishal-Shekhar, Arijit Singh, Shilpa Rao, Kumaar","Ghungroo (From ""War"")",YRF Music,1,116,134,567621,2022-03-31
138,spotify:track:46HNZY1i7O6jwTA7Slo2PI,"Coldplay, BTS",My Universe,Parlophone UK,5,149,27,564760,2022-03-31
139,spotify:track:68EMU2RD1ECNeOeJ5qAXCV,"Charlie Puth, Selena Gomez",We Don't Talk Anymore (feat. Selena Gomez),Artist Partner,77,144,90,559948,2022-03-31
140,spotify:track:5nujrmhLynf4yMoMtj8AQF,"Dua Lipa, DaBaby",Levitating (feat. DaBaby),Warner Records,8,139,74,556315,2022-03-31
141,spotify:track:3sqRODOZ1Z6hR4F2tnFAlg,Maninder Buttar,Sakhiyaan,Ishtar Punjabi,20,146,152,551832,2022-03-31
142,spotify:track:7F8RNvTQlvbeBLeenycvN6,"A.R. Rahman, Javed Ali, Mohit Chauhan",Kun Faya Kun,T-Series,60,148,103,547496,2022-03-31
143,spotify:track:43YkTTlOD203o9E5ZxhUjF,Arijit Singh,"Main Dhoondne Ko Zamaane Mein (From ""Heartless"")",T-Series,94,152,33,547079,2022-03-31
144,spotify:track:4ZUxhQNRCzlh6alqBHPNRC,"Devi Sri Prasad, Mounika Yadav, Chandra Bose","Saami Saami (From ""Pushpa - The Rise"")(Telugu)",Aditya Music,11,120,22,546879,2022-03-31
145,spotify:track:32LKwbmh6yVsWoRRF8DIvf,Pav Dharia,Na Ja,Ishtar Punjabi,50,129,21,546871,2022-03-31
146,spotify:track:57jOEZtoLQK4zF2x55bdkp,"Rochak Kohli, Arijit Singh, Neha Kakkar","Tu Hi Yaar Mera (From ""Pati Patni Aur Woh"")",T-Series,8,157,121,546244,2022-03-31
147,spotify:track:0GnqC8ZVxrZPULa5EQGWbW,"Navaan Sandhu, Gurlez Akhtar",Jealousy (feat. Gurlez Akhtar),Sky Digital,99,118,6,546194,2022-03-31
148,spotify:track:3C9kY7XZh6GCEmfazGJ2UB,Serena,Safari,"Ultra Records, LLC",82,142,60,546007,2022-03-31
149,spotify:track:6zl5Tp2B2JAcEfucv4D5p1,"Prem Dhillon, Desi Crew","Wait & Watch (From ""Babbar"")",Times Music,149,156,2,544337,2022-03-31
150,spotify:track:5cF0dROlMOK5uNZtivgu50,Charlie Puth,Attention,Artist Partner,110,155,101,543683,2022-03-31
151,spotify:track:4cluDES4hQEUhmXj6TXkSo,One Direction,What Makes You Beautiful,Syco Music UK,151,197,11,543624,2022-03-31
152,spotify:track:3APdIdF8H0jsxSuGOqXedS,Rashid Ali,Kabhi Kabhi Aditi,T-Series,86,166,24,543012,2022-03-31
153,spotify:track:59CfNbkERJ3NoTXDvoURjj,Dove Cameron,Boyfriend,Disruptor Records/Columbia,128,140,4,541347,2022-03-31
154,spotify:track:285HeuLxsngjFn4GGegGNm,"David Guetta, AFROJACK, Bebe Rexha, Nicki Minaj","Hey Mama (feat. Nicki Minaj, Bebe Rexha & Afrojack)",Parlophone (France),106,135,20,540055,2022-03-31
155,spotify:track:5gSVKG0R4xc8qtDIoyDNy8,"AP Dhillon, Gurinder Gill, Money Musik",Saada Pyaar,RUN-UP RECORDS,55,138,43,539265,2022-03-31
156,spotify:track:4iJyoBOLtHqaGxP12qzhQI,"Justin Bieber, Daniel Caesar, Giveon",Peaches (feat. Daniel Caesar & Giveon),RBMG/Def Jam,1,154,54,537653,2022-03-31
157,spotify:track:7ouBSPZKQpm7zQz2leJXta,Arijit Singh,"Tum Hi Ho (From ""Aashiqui 2"")",T-Series,78,158,61,534420,2022-03-31
158,spotify:track:5EYZZvmNAH5VZCwuzYJqoA,"Jatin-Lalit, Shaan, Kailash Kher, Prasoon Joshi",Chand Sifarish,YRF Music,158,177,8,527489,2022-03-31
159,spotify:track:6cUOiOY5qh2FpIQWIYAd2h,"Pritam, Darshan Raval, Antara Mitra",Mehrama,Sony Music Entertainment India Pvt. Ltd.,10,164,100,521127,2022-03-31
160,spotify:track:1NX33DecZrq4ZUGDc47AfN,Arijit Singh,"Tera Yaar Hoon Main (From ""Sonu Ke Titu Ki Sweety"")",T-Series,54,176,161,514762,2022-03-31
162,spotify:track:3RiPr603aXAoi4GHyXx0uy,Coldplay,Hymn for the Weekend,Parlophone UK,118,150,8,514323,2022-03-31
164,spotify:track:6UelLqGlWMcVH1E5c4H7lY,Harry Styles,Watermelon Sugar,Columbia,26,163,103,511780,2022-03-31
165,spotify:track:3F2BSn4ayglzMwquBRHZq6,"Kavita Seth, Kanishk Seth",Rangi Saari,Kavita Seth,138,143,12,511553,2022-03-31
166,spotify:track:4wIWWEhbdgKAxhR68eE0Ye,"Arijit Singh, Chinmayi","Mast Magan (From ""2 States"")",T-Series,75,162,59,510985,2022-03-31
167,spotify:track:2gQPv5jvVPqU2a9HhMNO1v,BoyWithUke,Toxic,Republic Records,100,-1,8,510166,2022-03-31
168,spotify:track:0a6zRnrjmaOcqsEIFkXIhw,Akhil,Khaab,Crown Records,101,167,109,509919,2022-03-31
169,spotify:track:4jPy3l0RUwlUI9T5XHBW2m,"24kGoldn, iann dior",Mood (feat. iann dior),Records/Columbia,2,175,84,505930,2022-03-31
170,spotify:track:1zi7xx7UVEFkmKfv06H8x0,"Drake, Wizkid, Kyla",One Dance,Cash Money Records/Young Money Ent./Universal Rec.,23,169,50,505788,2022-03-31
171,spotify:track:1O5mTSQa0sCce9ghhDqIZl,"A.R. Rahman, Javed Ali",Jashn-E-Bahaaraa,UTV,37,180,60,503037,2022-03-31
172,spotify:track:62Sz3DMNFu4c1KXVIAkMe7,Shubh,No Love,SHUBH,150,173,3,501941,2022-03-31
173,spotify:track:6h09y5UH6sDRERJALlaJPi,"Sachin-Jigar, Atif Aslam",Jeena Jeena,Eros Now Music,90,189,48,495368,2022-03-31
174,spotify:track:7MXVkk9YMctZqd1Srtv4MB,"The Weeknd, Daft Punk",Starboy,Universal Republic Records,84,178,38,494417,2022-03-31
175,spotify:track:7KhHA3mzt7A3LFlOJEAKpI,"Alan Walker, Sabrina Carpenter, Farruko",On My Way,Kreatell Music,1,185,159,487649,2022-03-31
176,spotify:track:28VbwtsYnj85UEODGpQRem,"Alan Walker, Ava Max","Alone, Pt. II",Kreatell Music,60,190,116,487574,2022-03-31
177,spotify:track:35mvY5S1H3J2QZyna3TFe0,Ariana Grande,positions,Republic Records,3,182,75,487531,2022-03-31
178,spotify:track:3HiobOOpSpMsi95WBKPBYk,"Jeet Gannguli, Arijit Singh",Hamari Adhuri Kahani (Title Track),Sony Music Entertainment India Pvt. Ltd.,168,198,24,486861,2022-03-31
180,spotify:track:2a7zxjZ1I88Z6sYm0ThuSc,"Jordan Sandhu, Mehar Vaani, Desi Crew",Black Effect,Times Music – Speed Records,72,159,11,486070,2022-03-31
181,spotify:track:6gwnKOvdBKkTU4CQ7KpIAu,"Shaarib Toshi, Arijit Singh","Bandeya - From ""Dil Juunglee""",Pooja Music,181,-1,3,484870,2022-03-31
182,spotify:track:6qS40yL7kXVoChI8SSCQIQ,"Karan Aujla, KR$NA, Mehar Vaani",Ykwim,Rehaan Records,22,161,11,484831,2022-03-31
183,spotify:track:08kTa3SL9sV6Iy8KLKtGql,Prateek Kuhad,Kasoor,Prateek Kuhad,11,165,32,483925,2022-03-31
184,spotify:track:2Bs4jQEGMycglOfWPBqrVG,One Direction,Steal My Girl,Syco Music,184,-1,1,482236,2022-03-31
185,spotify:track:0QBzMgT7NIeoCYy3sJCof1,"Camila Cabello, Ed Sheeran",Bam Bam (feat. Ed Sheeran),Epic,136,136,4,482072,2022-03-31
187,spotify:track:1UWacd8x8tPPwmrPB1MoBI,"Pritam, Arijit Singh",Ae Dil Hai Mushkil Title Track,Sony Music Entertainment India Pvt. Ltd.,105,199,126,480818,2022-03-31
188,spotify:track:2Xr1dTzJee307rmrkt8c0g,CKay,love nwantiti (ah ah ah),Chocolate City Music,7,147,28,479736,2022-03-31
189,spotify:track:3Vi5XqYrmQgOYBajMWSvCi,Doja Cat,Need to Know,Kemosabe Records/RCA Records,9,186,35,478981,2022-03-31
190,spotify:track:0H2iJVgorRR0ZFgRqGUjUM,"Pritam, Arijit Singh",Channa Mereya,Sony Music Entertainment India Pvt. Ltd.,58,194,132,478334,2022-03-31
191,spotify:track:2P91MQbaiQOfbiz9VqhqKQ,Lauv,I Like Me Better,Lauv,30,187,162,478189,2022-03-31
192,spotify:track:55nRhkhe7ckZhazYrv6ZOX,Zehr Vibe,Distance Love,Sky Digital,19,200,19,477930,2022-03-31
193,spotify:track:2PEo8JQ48mfEv8a2HLqDvt,"Sachin-Jigar, Rashmeet Kaur, Shamur, IP Singh","Nadiyon Paar (Let the Music Play Again) (From ""Roohi"")",Sony Music Entertainment India Pvt. Ltd.,5,171,56,473561,2022-03-31
194,spotify:track:4SFknyjLcyTLJFPKD2m96o,BLACKPINK,How You Like That,YG Entertainment/Interscope Records,4,184,92,473294,2022-03-31
195,spotify:track:1feANd8EfcDP5UqSvbheM3,"Sachet Tandon, Sachet-Parampara","Bekhayali (From ""Kabir Singh"")",T-Series,1,-1,144,472594,2022-03-31
196,spotify:track:2PvaburAUlhNHxVhw5lvOq,Arijit Singh,"Humdard (From ""Ek Villain"")",T-Series,93,-1,96,470742,2022-03-31
197,spotify:track:5o6q9gQXi5umBrUczroW79,"Priya Saraiya, Sachin-Jigar","Kalle Kalle (From ""Chandigarh Kare Aashiqui"")",T-Series,58,170,11,470302,2022-03-31
198,spotify:track:3e1JStKIIfidujpSzjqv3F,"Jahnvi Shrimankar, Shail Hada, Dipti, Pragati, Rucha, Arohi, Archana",Dholida,Saregama,82,151,5,469566,2022-03-31
199,spotify:track:6bdpj89aYEBjhpsenXAsmO,"A.R. Rahman, Arijit Singh",Enna Sona,Sony Music Entertainment India Pvt. Ltd.,34,-1,77,467716,2022-03-31
