rank,uri,artist_names,track_name,source,peak_rank,previous_rank,weeks_on_chart,streams,End Date
1,spotify:track:4UMIv5jd9gK98a39BQRD9X,"Pritam, Arijit Singh, Amitabh Bhattacharya",Kesariya,Sony Music Entertainment India Pvt. Ltd.,1,1,14,7012140,2022-10-20
2,spotify:track:42TMa2hgBNjte4uV7jNCnQ,"Shubh, Ikky",Baller,SHUBH,2,2,6,4392949,2022-10-20
3,spotify:track:0zlGnseLGzRIBA0TJcb3Bo,"Yohani, Jubin Nautiyal, Tanishk Bagchi, Rashmi Virag, Surya Ragunaathan","Manike (From ""Thank God"")",T-Series,2,3,5,4357766,2022-10-20
4,spotify:track:08Isz2ETWSBhvIl8UpKYsp,Shubh,No Love,SHUBH,2,4,32,4111948,2022-10-20
5,spotify:track:7lvDsmTRXFE3dK4OjvRiWB,"Shae Gill, Ali Sethi",Pasoori,Giraffe Pakistan,1,6,35,3311955,2022-10-20
6,spotify:track:1aL9518P5G72N92b48tuKw,AP Dhillon,Summer High,RUN-UP RECORDS,3,5,11,3309967,2022-10-20
7,spotify:track:0snQrp1VaY5Pj1YIHRJpRJ,Aditya A,Chaand Baaliyan,Sony Music Entertainment India Pvt. Ltd.,2,10,35,3178790,2022-10-20
8,spotify:track:5IgjP7X4th6nMNDh4akUHb,Chris Brown,Under The Influence,Chris Brown Entertainment/RCA Records,7,7,10,3140053,2022-10-20
9,spotify:track:0yCWDaAgOtg6TKlNCg9rwA,King,Tu Aake Dekhle,Warner Music India,6,11,90,2987921,2022-10-20
10,spotify:track:29m79w9xPMH4YCD6r8JSmV,"AP Dhillon, Gurinder Gill, Intense",Excuses,RUN-UP RECORDS,1,8,52,2938876,2022-10-20
11,spotify:track:4SqPZorSDuUtvdJwVGeZRC,"Pritam, Arijit Singh, Amitabh Bhattacharya, Jonita Gandhi",Deva Deva,Sony Music Entertainment India Pvt. Ltd.,5,9,11,2635957,2022-10-20
12,spotify:track:2rOnSn2piaqLAlYjtfUBlY,"Tanishk Bagchi, Jubin Nautiyal, Asees Kaur","Raataan Lambiyan (From ""Shershaah"")",Sony Music Entertainment India Pvt. Ltd.,1,14,64,2494076,2022-10-20
13,spotify:track:6ZYxNjuAU9Vy3VtF6W1dtE,Shubh,We Rollin,SHUBH,10,15,47,2435865,2022-10-20
14,spotify:track:3i7qScF9Oyp31O9bAutJez,"A.R. Rahman, Madhushree",Mallipoo,Think Music,8,13,5,2397623,2022-10-20
15,spotify:track:1Nr46gjiP50uPsz30gYhAd,"Santhosh Narayanan, Anirudh Ravichander","Thenmozhi (From ""Thiruchitrambalam"")",Sun Pictures,5,18,10,2267165,2022-10-20
16,spotify:track:3nqQXoyQOWXiESFLlDF1hG,"Sam Smith, Kim Petras",Unholy (feat. Kim Petras),Capitol Records UK / EMI,16,43,3,2200336,2022-10-20
17,spotify:track:7oN0Wo7sCVvXPdpxoio3JM,"Madhur Sharma, Swapnil Tare, Nusrat Fateh Ali Khan",Kali Kali Zulfon Ke (Lo-Fi),T-Series,17,79,7,2148379,2022-10-20
18,spotify:track:0GavMn9kjiQk1yI6118jEY,"Dhanush, Anirudh Ravichander",Megham Karukatha,Sun Pictures,4,17,13,2122703,2022-10-20
19,spotify:track:1uJ2czshFLqimctgvsxfv2,"A.R. Rahman, A. R. Reihana, Bamba Bakya, Ilango Krishnan","Ponni Nadhi (From ""Ponniyin Selvan Part - 1"")",Tips Industries Ltd,10,12,10,2082029,2022-10-20
20,spotify:track:3wz2vWhYnnBoFmgMkqtzLy,"Chani Nattan, Inderpal Moga",Daku,Kharku Life Records,20,20,9,2035092,2022-10-20
21,spotify:track:2kOH2QZB7F7I1iVXqwKuBF,"Dhanush, Anirudh Ravichander","Mayakkama Kalakkama (From ""Thiruchitrambalam"")",Sun Pictures,21,31,8,1985154,2022-10-20
22,spotify:track:2eAvDnpXP5W0cVtiI0PUxV,Ruth B.,Dandelions,Columbia,14,21,47,1977310,2022-10-20
23,spotify:track:27nzJVsvXqXyeMIcVxvB54,"A.R. Rahman, Sathyaprakash, V.M. Mahalingam, Nakul Abhyankar, Ilango Krishnan","Chola Chola (From ""Ponniyin Selvan Part - 1"")",Tips Industries Ltd,16,16,3,1963307,2022-10-20
25,spotify:track:0ojpEubhy4JNeVftmVuiN7,"Vishal Mishra, Armaan Malik",Pehla Pyaar,T-Series,11,22,73,1859046,2022-10-20
26,spotify:track:6zfvsbeuFKoWIdoRb3JdhA,"Pritam, Shreya Ghoshal, TUSHAR JOSHI",Rasiya,Sony Music Entertainment India Pvt. Ltd.,19,19,4,1825354,2022-10-20
27,spotify:track:5W7DOVGQLTigu09afW7QMT,Sidhu Moose Wala,295,Sidhu Moose Wala,1,23,36,1804459,2022-10-20
28,spotify:track:2uThc9fZx2BEL3t6uuRMO1,"aleemrk, Umair",Cold Hours,Independent,28,48,5,1789232,2022-10-20
29,spotify:track:2FCXQHugkoHE1K3tiDu8pu,"Alka Yagnik, Arijit Singh","Agar Tum Saath Ho (From ""Tamasha"")",T-Series,4,27,177,1783116,2022-10-20
30,spotify:track:20EQiQQYSyuifv6YMj64qP,King,OOPS,Warner Music India,25,25,8,1774504,2022-10-20
31,spotify:track:3QzRIdkZZU2gxcajjWhcLj,Paradox,Jaadugar,T-Series,31,71,2,1771632,2022-10-20
32,spotify:track:6VhuP99TE6gYNQRJIlAWFD,Stephen Sanchez,Until I Found You,Republic Records,20,33,25,1771604,2022-10-20
33,spotify:track:72zHuDxFQTjbL51qJQSA7j,"Jasleen Royal, B Praak, Romy, Anvita Dutt","Ranjha (From ""Shershaah"")",Sony Music Entertainment India Pvt. Ltd.,1,28,63,1711016,2022-10-20
34,spotify:track:2FZDNh6tm9mkZ9vTphuAh8,"Pritam, Tanishk Bagchi, Neeraj Shridhar",Bhool Bhulaiyaa 2 Title Track,T-Series,7,32,25,1685410,2022-10-20
35,spotify:track:02MWAaffLxlfxAUY7c5dvx,Glass Animals,Heat Waves,Polydor Records,3,29,66,1679961,2022-10-20
36,spotify:track:2eTkxblLeqdTSsb2ivafDX,"Ankit Tiwari, Manoj Muntashir","Galliyan Returns (From ""Ek Villain Returns"")",T-Series,9,30,16,1644580,2022-10-20
37,spotify:track:1y1rQTkWmrZdJmjwuK07GC,"Vishal Mishra, Manoj Muntashir","Kaise Hua (From ""Kabir Singh"")",T-Series,5,36,175,1625528,2022-10-20
40,spotify:track:5urYiIXu1ZhfMAOsp7WDTc,"Rajat Nagpal, Yasser Desai, Neha Kakkar, Rana Sotal","Dil Ko Karaar Aaya (From ""Sukoon"")",Desi Music Factory,3,45,74,1598896,2022-10-20
41,spotify:track:58HvfVOeJY7lUuCqF0m3ly,Elley Duhé,MIDDLE OF THE NIGHT,Not Fit For Society/RCA Records,12,35,42,1598429,2022-10-20
42,spotify:track:2AilvPt1AQ8PixlCKqkjfj,Shubh,Elevated,SHUBH,42,42,42,1595306,2022-10-20
43,spotify:track:5O2P9iiztwhomNh8xkR9lJ,One Direction,Night Changes,Syco Music,22,34,75,1581712,2022-10-20
44,spotify:track:5iCY0TXNImK4hyKfcplQsg,Anuv Jain,Baarishein,Universal Music India Pvt. Ltd. (on behalf of Anuv Jain),37,37,75,1566554,2022-10-20
45,spotify:track:3ZGJhN4unVspOqpwGvUL2W,Diljit Dosanjh,Lemonade,DILJIT DOSANJH,41,41,12,1562287,2022-10-20
46,spotify:track:2tMoOS9grHtn4upzb4LwMG,"Dhibu Ninan Thomas, Kapil Kapilan","Adiye - From ""Bachelor""",Think Music,16,38,46,1536309,2022-10-20
47,spotify:track:1smFN2CLqGROu0J0UyvDfL,"Pritam, Arijit Singh",Shayad,Sony Music Entertainment India Pvt. Ltd.,1,40,144,1532921,2022-10-20
48,spotify:track:5PjdY0CKGZdEuoNab3yDmX,"The Kid LAROI, Justin Bieber",STAY (with Justin Bieber),Columbia,1,44,67,1478247,2022-10-20
49,spotify:track:3yV2c3cYhkAwSsxAq6nRiv,Gajendra Verma,Mann Mera,Sony Music / Eros Now Music,42,75,83,1456835,2022-10-20
50,spotify:track:6TClJ8jXi3OBV7gcrU3jx5,"AP Dhillon, Gurinder Gill",TERE TE,RUN-UP RECORDS,7,64,48,1447142,2022-10-20
51,spotify:track:2qxmye6gAegTMjLKEBoR3d,Alec Benjamin,Let Me Down Slowly,2018,34,51,132,1399049,2022-10-20
52,spotify:track:0DXfJ2iKRDEG7rPgssWFea,"Kanishk Seth, Kavita Seth","Rangisari (From ""Jugjugg Jeeyo"")",T-Series,22,46,19,1388847,2022-10-20
53,spotify:track:32LKwbmh6yVsWoRRF8DIvf,Pav Dharia,Na Ja,Ishtar Punjabi,50,61,50,1382710,2022-10-20
54,spotify:track:7B4uYqxTpTOS1sgxFB9Ann,"Sidhu Moose Wala, Wazir Patar",The Last Ride,Sidhu Moose Wala,3,47,23,1364210,2022-10-20
55,spotify:track:2J2Z1SkXYghSajLibnQHOa,Sia,Unstoppable,Monkey Puzzle Records/RCA Records,16,52,64,1318158,2022-10-20
56,spotify:track:4bD9z9qa4qg9BhryvYWB7c,"Pritam, Tochi Raina, Rekha Bhardwaj",Kabira,T-Series,56,100,162,1315937,2022-10-20
57,spotify:track:6yvxu91deFKt3X1QoV6qMv,"Anirudh Ravichander, Jonita Gandhi","Arabic Kuthu - Halamithi Habibo (From ""Beast"")",Sun Pictures,2,49,36,1311801,2022-10-20
58,spotify:track:3UhmuWcFaLS3AO3kI9ynQ2,"AP Dhillon, Shinda Kahlon, Gurinder Gill, Gminxr",Insane,RUN-UP RECORDS,3,50,79,1309697,2022-10-20
59,spotify:track:60YICjIPdL7LDBcCMK0tAk,"Sidhu Moose Wala, Sunny Malton, The Kidd",Levels,Sidhu Moose Wala,8,53,21,1296148,2022-10-20
60,spotify:track:4Dvkj6JhhA12EX05fT7y2e,Harry Styles,As It Was,Columbia,5,63,29,1239630,2022-10-20
61,spotify:track:043SPVu75TXbs94ZfM9dfn,"Kaushik-Guddu, Raghav Chaitanya, Kunaal Vermaa","Dil (From ""Ek Villain Returns"")",T-Series,20,56,15,1238743,2022-10-20
62,spotify:track:6J7whJ91XKvDnLWpa1Cqn2,"B. Ajaneesh Loknath, Vijay Prakash, Ananya Bhat, Nagraj Panar Valtur, Pramod Maravanthe","Singara Siriye (From ""Kantara"")",Divo Tv Private Limited,62,134,2,1231741,2022-10-20
64,spotify:track:7MXVkk9YMctZqd1Srtv4MB,"The Weeknd, Daft Punk",Starboy,Universal Republic Records,57,67,64,1218479,2022-10-20
65,spotify:track:0WtM2NBVQNNJLh6scP13H8,"Rema, Selena Gomez",Calm Down (with Selena Gomez),Mavin Records / Jonzing World,65,88,5,1216724,2022-10-20
66,spotify:track:2tjWCe2W7sgvS3C8NHcdtI,"Akhil, Dhvani Bhanushali, Kunaal Vermaa, Abhijit Vaghani","Duniyaa (From ""Luka Chuppi"")",T-Series,1,58,191,1211085,2022-10-20
67,spotify:track:43Xb3G04Pgp63fNhQW4T6W,"Pritam, Arijit Singh, Amitabh Bhattacharya",Dance Ka Bhoot,Sony Music Entertainment India Pvt. Ltd.,50,55,8,1207323,2022-10-20
68,spotify:track:5O932cZmzOZGOGZz9RHx20,"Pritam, Arijit Singh",Khairiyat,T-Series,1,69,163,1202593,2022-10-20
69,spotify:track:7sVEoPc5ZUUQerRkgTypUZ,"Javed Ali, Devi Sri Prasad","Srivalli (From ""Pushpa The Rise Part - 01"")",T-Series,4,77,39,1197457,2022-10-20
70,spotify:track:3gOXq3FPPesm7VLPKmef6j,"Arijit Singh, Shashaa Tirupati",Rait Zara Si,T-Series,12,74,46,1189846,2022-10-20
71,spotify:track:7gRFDGEzF9UkBV233yv2dc,BLACKPINK,Shut Down,YG Entertainment/Interscope Records,13,60,5,1179136,2022-10-20
72,spotify:track:58f4twRnbZOOVUhMUpplJ4,"AP Dhillon, Gminxr, Gurinder Gill, Shinda Kahlon",Brown Munde,Run-up Records,1,76,100,1179060,2022-10-20
73,spotify:track:1418IuVKQPTYqt7QNJ9RXN,King,Maan Meri Jaan,Warner Music India,73,-1,1,1172792,2022-10-20
74,spotify:track:2Fv2injs4qAm8mJBGaxVKU,"Arijit Singh, Mithoon","Tujhe Kitna Chahne Lage (From ""Kabir Singh"")",T-Series,2,72,177,1165232,2022-10-20
76,spotify:track:7eQl3Yqv35ioqUfveKHitE,"Pritam, Mohit Chauhan, Irshad Kamil",Tum Se Hi,T-Series,56,80,135,1155437,2022-10-20
77,spotify:track:5zwwW9Oq7ubSxoCGyW1nbY,BLACKPINK,Pink Venom,YG Entertainment/Interscope Records,7,57,9,1149253,2022-10-20
78,spotify:track:2l3dFxtoSMgMQVyRIUHjpz,Mitraz,Akhiyaan,Mitraz Records,23,82,25,1148422,2022-10-20
79,spotify:track:0gE8ZP2cTXpRDz53bTkpu6,"Vishal Chandrashekhar, S.P. Charan",Inthandham,Sony Music Entertainment India Pvt. Ltd.,30,54,11,1147216,2022-10-20
80,spotify:track:0stbF4C1ACmIvx0aW81ZXa,"Nakash Aziz, Sunidhi Chauhan","Ra Ra Rakkamma (From ""Vikrant Rona"")",Lahari Music,30,73,15,1132521,2022-10-20
81,spotify:track:1ZiReD9pPTttQWwSoYqdyH,Dikshant,Aankhon Se Batana,Sony Music Entertainment India Pvt. Ltd.,38,66,26,1125932,2022-10-20
82,spotify:track:5G7pZ8G8NFvS1MQ9H4L7dC,"Javed-Mohsin, Arijit Singh, Shreya Ghoshal, Kunaal Vermaa, Prashant Ingole",Pal,Sony Music Entertainment India Pvt. Ltd.,44,99,189,1119132,2022-10-20
83,spotify:track:2NTVtNcpC0i1R7LVGaCZCF,"Badshah, Nikhita Gandhi",Jugnu,Universal Music India Pvt Ltd.,5,93,51,1117339,2022-10-20
84,spotify:track:6FjbAnaPRPwiP3sciEYctO,"Pritam, Arijit Singh",Raabta,T-Series,84,124,21,1116319,2022-10-20
85,spotify:track:0tgVpDi06FyKpA1z0VMD4v,Ed Sheeran,Perfect,Atlantic Records UK,48,83,131,1115582,2022-10-20
86,spotify:track:06YVd30bpfbyLnfNp4Lsnf,Prashant Katheriya,Tum Chhupa Na Sakogi,Nawazish Productions,86,-1,1,1095907,2022-10-20
87,spotify:track:7k6QR9YHyW258yVN6FHO1T,"OAFF, Savera, Lothika, Kausar Munir",Doobey,Sony Music Entertainment India Pvt. Ltd.,2,92,39,1095169,2022-10-20
88,spotify:track:32FVH23yFXr8Z0sfjRw4It,AP Dhillon,Wo Noor,RUN-UP RECORDS,65,65,2,1088075,2022-10-20
89,spotify:track:4OcvkkpF3xmyCGGY5IBlgi,"Akhil Sachdeva, Tulsi Kumar","Tera Ban Jaunga (From ""Kabir Singh"")",T-Series,4,95,166,1078067,2022-10-20
90,spotify:track:5pcmtf1lwrMqmAWWm248fY,"AP Dhillon, Gurinder Gill",DESIRES,RUN-UP RECORDS,2,87,48,1074391,2022-10-20
91,spotify:track:7JVpb6CY3I1JwQCIEgw9XT,"Gulab Sidhu, Sukh Lotey",Ainak,Red Leaf Music,31,59,3,1066665,2022-10-20
92,spotify:track:1pean7zvZUqcWZaUucH63f,"Dhanush, Anirudh Ravichander","Thaai Kelavi (From ""Thiruchitrambalam"")",Sun Pictures,18,70,11,1065803,2022-10-20
93,spotify:track:7eNSk0grNnO7MqjLZzs6MM,"Mithoon, Arijit Singh, Neeti Mohan, Karan Malhotra",Fitoor,YRF Music,12,89,15,1064988,2022-10-20
94,spotify:track:5Odq8ohlgIbQKMZivbWkEo,"Charlie Puth, Jung Kook, BTS",Left and Right (Feat. Jung Kook of BTS),Atlantic Records,4,84,17,1062327,2022-10-20
95,spotify:track:7IK26RNUdgoZWJdlarrcty,"AP Dhillon, Shinda Kahlon",All Night (Live),RUN-UP RECORDS,68,68,2,1061671,2022-10-20
96,spotify:track:5L70RGPJEdooqtrgR7vd6U,"Pritam, Arijit Singh, Tulsi Kumar",Hum Nashe Mein Toh Nahin,T-Series,30,97,23,1057990,2022-10-20
98,spotify:track:2PvaburAUlhNHxVhw5lvOq,Arijit Singh,"Humdard (From ""Ek Villain"")",T-Series,93,144,118,1050876,2022-10-20
99,spotify:track:6zJejIfVYLgjud3lTk4DLB,Rosa Linn,SNAP,Nvak Collective,99,117,5,1048125,2022-10-20
100,spotify:track:1iZLpuGMr4tn1F5bZu32Kb,Harrdy Sandhu,Bijlee Bijlee,Universal Music India Pvt Ltd. – Distribution,2,105,51,1047412,2022-10-20
101,spotify:track:7mNZUnDWUDidWBFaUpVtOC,Vilen,Chidiya,Universal Music India Pvt Ltd.,4,113,121,1044870,2022-10-20
102,spotify:track:3JkVYvxNoGf2HCWJo61462,"Sidhu Moose Wala, Sunny Malton, SOE",Never Fold,Sidhu Moose Wala,13,101,26,1039273,2022-10-20
103,spotify:track:2vkNA9I029dTwX0y6d59Sc,"Anirudh Ravichander, Anthony Daasan","Dippam Dappam (From ""Kaathuvaakula Rendu Kaadhal"")",Sony Music Entertainment India Pvt. Ltd.,13,78,26,1038357,2022-10-20
104,spotify:track:7AsG1F1eMWd17RYan8M3Wm,"AP Dhillon, Shinda Kahlon",Dil Nu,RUN-UP RECORDS,85,85,2,1031541,2022-10-20
105,spotify:track:0pqnGHJpmpxLKifKRmU6WP,Imagine Dragons,Believer,Kid Ina Korner / Interscope,25,102,191,1023565,2022-10-20
106,spotify:track:6udC4b4jOSnHb9ItnXgKLR,"Sachin-Jigar, Shreya Ghoshal, Tochi Raina",Saibo,Sony Music Entertainment India Pvt. Ltd.,65,120,103,1022509,2022-10-20
107,spotify:track:6KtSNVgCmQEvDgIuHoXAkT,Azaan Sami Khan,Ik Lamha,Freebird Records,36,103,17,1021334,2022-10-20
108,spotify:track:0NvGVd87SYZnryTcfQPKUO,Madhur Sharma,Kali Kali Zulfon Ke,Universal Music India Pvt Ltd.,61,110,20,1019975,2022-10-20
109,spotify:track:1ccZZf0IQi5y0bHMl2aGDF,Sanam,Gulabi Aankhen,Universal Music India Pvt Ltd.,109,115,9,1019838,2022-10-20
111,spotify:track:0VjIjW4GlUZAMYd2vXMi3b,The Weeknd,Blinding Lights,Republic Records,4,98,151,1015380,2022-10-20
113,spotify:track:7qiZfU4dY1lWllzX7mPBI3,Ed Sheeran,Shape of You,Atlantic Records UK,63,109,128,997727,2022-10-20
114,spotify:track:3qrdLVOClRU4yPkcXZ7c5u,"Ayushmann Khurrana, Tanishk-Vayu","Mere Liye Tum Kaafi Ho (From ""Shubh Mangal Zyada Saavdhan"")",T-Series,11,116,140,993751,2022-10-20
116,spotify:track:5WWplXimzIjlJiN2N7T9Q3,"Anirudh Ravichander, Kamal Haasan","Pathala Pathala (From ""Vikram"")",Sony Music Entertainment India Pvt. Ltd.,6,96,23,988080,2022-10-20
117,spotify:track:26aOnndLckt8uAsk6odL5n,"A.R. Rahman, Shreya Ghoshal, Palakkad Sreeram, Mahesh Vinayakram, Kabilan","Ratchasa Maamaney (From ""Ponniyin Selvan Part - 1"")",Tips Industries Ltd,62,62,3,970798,2022-10-20
118,spotify:track:6v3KW9xbzN5yKLt9YKDYA2,"Shawn Mendes, Camila Cabello",Señorita,Island Records,1,121,174,969682,2022-10-20
119,spotify:track:3fwyItGexa88kR8j76dIqv,Pratsofficial,Aziyat 2.0 - Reprise Version,Prats,85,129,19,956994,2022-10-20
120,spotify:track:5ZhKD46Q7mhsl0awl7ZMJc,"Sachin-Jigar, Atif Aslam",Jeena Jeena,Eros Now Music,90,133,69,953398,2022-10-20
121,spotify:track:3sqRODOZ1Z6hR4F2tnFAlg,Maninder Buttar,Sakhiyaan,Ishtar Punjabi,20,150,181,945615,2022-10-20
122,spotify:track:78tblPcz2otRZd1VOeU7zz,"Yuvan Shankar Raja, Sid Sriram","Kanja Poovu Kannala (From ""Viruman"")",Sony Music Entertainment India Pvt. Ltd.,17,86,19,945165,2022-10-20
123,spotify:track:0NLkVxf0PyxsXBG3EuZcJf,Anuv Jain,Gul,Universal Music India Pvt. Ltd. (on behalf of Anuv Jain),108,108,5,943277,2022-10-20
124,spotify:track:7ouBSPZKQpm7zQz2leJXta,Arijit Singh,"Tum Hi Ho (From ""Aashiqui 2"")",T-Series,78,125,90,937755,2022-10-20
125,spotify:track:0u2P5u6lvoDfwTYjAADbn4,"Billie Eilish, Khalid",lovely (with Khalid),Darkroom,23,126,185,933065,2022-10-20
126,spotify:track:4iEGv5Ne6HuCkFCjzxdWQK,Neeti Mohan,Meri Jaan,Saregama,11,118,34,930450,2022-10-20
127,spotify:track:0dLbrlAVPPjpPqnYfmJsWk,"Atif Aslam, Alisha Chinai, Pritam",Tera Hone Laga Hoon,Tips Industries Ltd,83,127,75,926739,2022-10-20
128,spotify:track:0tpwqQhdfJXRcUDSNRjb9O,"Arijit Singh, Neeti Mohan, Rashmi Virag","Mere Yaaraa (From ""Sooryavanshi"")",T-Series,20,122,51,921561,2022-10-20
129,spotify:track:43YkTTlOD203o9E5ZxhUjF,Arijit Singh,"Main Dhoondne Ko Zamaane Mein (From ""Heartless"")",T-Series,94,128,62,919261,2022-10-20
130,spotify:track:1feANd8EfcDP5UqSvbheM3,"Sachet Tandon, Sachet-Parampara","Bekhayali (From ""Kabir Singh"")",T-Series,1,136,166,898816,2022-10-20
131,spotify:track:3mZLiEDAHIjZ8ms5Lxq33F,Diljit Dosanjh,Peaches,DILJIT DOSANJH,33,114,14,897989,2022-10-20
132,spotify:track:6FQQiTpYnfc5803p84bQp1,Anirudh Ravichander,Vikram - Title Track,Sony Music Entertainment India Pvt. Ltd.,5,107,23,889574,2022-10-20
133,spotify:track:7ef4DlsgrMEH11cDZd32M6,"Calvin Harris, Dua Lipa",One Kiss (with Dua Lipa),Sony Music UK,56,111,21,870053,2022-10-20
134,spotify:track:57jOEZtoLQK4zF2x55bdkp,"Rochak Kohli, Arijit Singh, Neha Kakkar","Tu Hi Yaar Mera (From ""Pati Patni Aur Woh"")",T-Series,8,171,150,868990,2022-10-20
135,spotify:track:4Tq1eNoLWXqJsizbNnobSz,"A.R. Rahman, Yogi Sekar, Ilango Krishnan","Devaralan Aattam (From ""Ponniyin Selvan Part - 1"")",Tips Industries Ltd,131,131,3,866942,2022-10-20
136,spotify:track:3B4etxytImrRKQgV3XHjnR,Katy Perry,Harleys In Hawaii,Capitol Records,32,172,62,863888,2022-10-20
137,spotify:track:6fhG2KJgwO7CrNflRaRmvp,"Ruth B., sped up + slowed, slater",Dandelions - slowed + reverb,Columbia,75,132,34,862388,2022-10-20
138,spotify:track:7cWnks0lsRtpAi87COOiXK,"Salim–Sulaiman, Rahat Fateh Ali Khan, Jaideep Sahni",O Re Piya,YRF Music,124,142,9,861947,2022-10-20
139,spotify:track:0QzuaeCEEOV40Pn7IvKEny,Dhruv,double take,Little Worry/RCA Records,75,141,28,858937,2022-10-20
140,spotify:track:2RgvvnMwtP0R2OkVZmFvnV,KK,"Ajab Si (From ""Om Shanti Om"")",T-Series,46,173,41,857220,2022-10-20
141,spotify:track:0MHiYjjcHNYM9KURa6NveF,"Dabzee, SA","Manavaalan Thug - From ""Thallumaala""",Muzik247,24,119,10,856993,2022-10-20
142,spotify:track:4aObqXLku7XQqfVQ8azYGo,Arjan Dhillon,25-25,Brown Studios,142,-1,1,856175,2022-10-20
143,spotify:track:4wIWWEhbdgKAxhR68eE0Ye,"Arijit Singh, Chinmayi","Mast Magan (From ""2 States"")",T-Series,75,166,87,854475,2022-10-20
144,spotify:track:3APdIdF8H0jsxSuGOqXedS,Rashid Ali,Kabhi Kabhi Aditi,T-Series,86,130,53,854390,2022-10-20
145,spotify:track:6H7fLdt0AeWpuxUKXuXWrx,Hariharan,Shree Hanuman Chalisa,T-Series,145,145,10,849521,2022-10-20
146,spotify:track:2IoZMG3RqiTmsy7Li3zGFg,"Sachet Tandon, Parampara Tandon, Sachet-Parampara","Mere Sohneya (From ""Kabir Singh"")",T-Series,4,168,137,845760,2022-10-20
147,spotify:track:5Z9KJZvQzH6PFmb8SNkxuk,"Lil Nas X, Jack Harlow",INDUSTRY BABY (feat. Jack Harlow),Columbia,6,139,65,844979,2022-10-20
148,spotify:track:6zAvNLJkdyRApUHnlJjKfO,Ali Zafar,Jhoom - R&B Mix,Lightingale Records,20,112,23,842203,2022-10-20
149,spotify:track:209pScL6fUhISxcLWkB6rf,Anirudh Ravichander,Lokiverse - Background Score,Sony Music Entertainment India Pvt. Ltd.,37,160,15,839862,2022-10-20
150,spotify:track:0UZLaEOSIc5kg0cc7eszqC,Vishal Mishra,Manjha,Desi Music Factory,53,-1,27,837377,2022-10-20
151,spotify:track:0GQngE2rOYvlKwEQjTAsP8,"Pritam, Sreeram, Shilpa Rao",Subhanallah,T-Series,146,167,10,834673,2022-10-20
153,spotify:track:1L3Nsi7YXtBxTdnbqektia,Darshan Raval,Hawa Banke,Indie Music Label,26,197,32,830854,2022-10-20
154,spotify:track:3jyqXdAjwqO3gFtjnYrbq9,"Darshan Raval, Rochak Kohli","Ek Ladki Ko Dekha Toh Aisa Laga (From ""Ek Ladki Ko Dekha Toh Aisa Laga"")",Saregama,154,-1,1,823453,2022-10-20
155,spotify:track:3HiobOOpSpMsi95WBKPBYk,"Jeet Gannguli, Arijit Singh",Hamari Adhuri Kahani (Title Track),Sony Music Entertainment India Pvt. Ltd.,155,162,49,823399,2022-10-20
156,spotify:track:3C9kY7XZh6GCEmfazGJ2UB,Serena,Safari,"Ultra Records, LLC",82,149,89,823029,2022-10-20
157,spotify:track:0lYBSQXN6rCTvUZvg9S0lU,"DJ Snake, Justin Bieber",Let Me Love You,DJ Snake Def Jam,90,158,191,812757,2022-10-20
158,spotify:track:1E16f7KcZmuXuhlenRwA2m,"VIBIE, Sachin-Jigar, Shreya Ghoshal, Tochi Raina, Bollywood Lofi",Saibo - Lofi Flip,Sony Music Entertainment India Pvt. Ltd.,158,182,8,811482,2022-10-20
159,spotify:track:6bdpj89aYEBjhpsenXAsmO,"A.R. Rahman, Arijit Singh",Enna Sona,Sony Music Entertainment India Pvt. Ltd.,34,198,79,811197,2022-10-20
160,spotify:track:0gPgdRfB4jdGrlyXS0Vx78,"Vishal-Shekhar, KK, Shilpa Rao, Anvita Dutt Guptan",Khuda Jaane,YRF Music,37,154,20,808376,2022-10-20
161,spotify:track:70wFZWY6cKFxp3Qcq8uxH4,King,Ektarfa,Warner Music India,51,157,20,808040,2022-10-20
163,spotify:track:1Hdz67JES35Z4h3Yd4PXvV,"Thaman S, Anirudh Ravichander, Ramya Behara, Sahithi Chaganti, Vivek","Bimbilikki Pilapi (From ""Prince "")(Tamil)",Aditya Music,107,175,7,806647,2022-10-20
164,spotify:track:1AzNN19lPYC68iacrbWL8X,"Darbuka Siva, Sid Sriram","Mudhal Nee Mudivum Nee Title Track (From ""Mudhal Nee Mudivum Nee"")",Sony Music Entertainment India Pvt. Ltd.,24,146,38,802164,2022-10-20
165,spotify:track:1DIXPcTDzTj8ZMHt3PDt8p,"Coolio, L.V.",Gangsta's Paradise,"Tommy Boy Music, LLC",165,-1,1,801987,2022-10-20
166,spotify:track:0loZn1c5heXie7OAtvK6nH,"Jubin Nautiyal, Rocky - Shiv",Humnava Mere,T-Series,86,165,85,801780,2022-10-20
167,spotify:track:4DKv9524rd34cCKFmW7Xsb,"Vishal Chandrashekhar, Sai Vignesh",Kurumugil,Sony Music Entertainment India Pvt. Ltd.,80,123,5,801731,2022-10-20
168,spotify:track:4381FmKZc1uT2zzhBiknH7,"A.R. Rahman, Vagu Mazan, Thoughtsfornow","Adheeraa (From ""Cobra"")",Sony Music Entertainment India Pvt. Ltd.,61,138,10,800947,2022-10-20
169,spotify:track:0aA3jlllhKSEiXTmGPGSWz,"Jeetu Sharma, Abhilipsa Panda",Har Har Shambhu Shiv Mahadeva,Jeetu Sharma,15,135,17,800616,2022-10-20
170,spotify:track:0H2iJVgorRR0ZFgRqGUjUM,"Pritam, Arijit Singh",Channa Mereya,Sony Music Entertainment India Pvt. Ltd.,58,177,156,798965,2022-10-20
171,spotify:track:5iaKalECn9aYPfh9w07yOX,"Taaruk Raina, Mismatched - Cast",Kho Gaye,Netflix Music,171,-1,1,796560,2022-10-20
172,spotify:track:2ZRo7axmMPeSVUvDbGkJah,XXXTENTACION,Hope,"Bad Vibes Forever, LLC",44,183,73,794190,2022-10-20
173,spotify:track:4iFPsNzNV7V9KJgcOX7TEO,"Atif Aslam, Pritam",Tu Jaane Na,Tips Industries Ltd,108,170,79,790708,2022-10-20
174,spotify:track:48QmG1dfvMuYLxMPt7KSRA,"Sean Paul, Dua Lipa",No Lie,Universal-Island Records Ltd.,19,163,49,789789,2022-10-20
175,spotify:track:2PcGqmKToUz0s65q1Acg7d,"AP Dhillon, Shinda Kahlon, Gminxr",SPACESHIP,RUN-UP RECORDS,15,195,48,787812,2022-10-20
176,spotify:track:68AyTcvyK46hpzwohHUkJI,"Harnoor, Gifty",Waalian,Sky Digital,1,188,97,787127,2022-10-20
177,spotify:track:6mTvwBzWTGDOVeCNQEqtOE,"Amaal Mallik, Arijit Singh, Tulsi Kumar",Soch Na Sake,T-Series,163,-1,17,783080,2022-10-20
178,spotify:track:4L6hCEc9xFf01U4d66JzK0,Armaan Malik,Tu / You,Arista Records,110,185,12,781950,2022-10-20
179,spotify:track:0a6zRnrjmaOcqsEIFkXIhw,Akhil,Khaab,Crown Records,101,155,131,781873,2022-10-20
180,spotify:track:2VrSkfinwUSNc7uAXiL0FA,"ShaSings, Xtreeemit",Let Me Down Slowly / Mai Dhoondhne Ko Zamaney / Kabhi Jo Badal Barsey (Medley),ShaSings,123,194,9,781698,2022-10-20
181,spotify:track:3k9PtGmPNnQtt32TKWm6f3,MC STAN,Basti Ka Hasti,MC Stan,113,-1,2,781443,2022-10-20
182,spotify:track:7BKLCZ1jbUBVqRi2FVlTVw,"The Chainsmokers, Halsey",Closer,Disruptor Records/Columbia,59,174,191,779208,2022-10-20
183,spotify:track:0rMeOAvbQZ2RTG4B6L1M4p,Darshan Raval,Asal Mein,Indie Music Label,21,-1,78,774238,2022-10-20
184,spotify:track:1NX33DecZrq4ZUGDc47AfN,Arijit Singh,"Tera Yaar Hoon Main (From ""Sonu Ke Titu Ki Sweety"")",T-Series,54,199,185,769624,2022-10-20
185,spotify:track:1Ef0TmgS1QrVO6tKHrMMmH,"Vishal-Shekhar, Arijit Singh, Shilpa Rao, Kumaar","Ghungroo (From ""War"")",YRF Music,1,187,154,764510,2022-10-20
186,spotify:track:1UWacd8x8tPPwmrPB1MoBI,"Pritam, Arijit Singh",Ae Dil Hai Mushkil Title Track,Sony Music Entertainment India Pvt. Ltd.,105,184,142,763885,2022-10-20
187,spotify:track:6XPmY4hIb1RGRyNuq0UBsl,The PropheC,Kina Chir,PropheC Productions,12,181,52,763529,2022-10-20
188,spotify:track:0FBQ4NrrHUbR9kus7rzrOj,Atif Aslam,Dil Diyan Gallan,YRF Music,82,-1,142,760968,2022-10-20
189,spotify:track:3jtKSUiVDowKNBqVQbWaig,"Amit Trivedi, Kavita Seth, Amitabh Bhattacharya",Iktara,Sony Music Entertainment India Pvt. Ltd.,73,-1,43,759438,2022-10-20
190,spotify:track:4BoFJMLSO3ZoD48KgnslSe,Yashal Shahid,Mere Humsafar (Original Score) [Female Version],ARY DIGITAL,92,161,13,759272,2022-10-20
191,spotify:track:4gC6xOiJLHTpIARRdmYMaQ,"Lipsika Bhashyam, Aditya Iyengar",Ra Ra Reddy I Am Ready,Aditya Music,53,148,13,758607,2022-10-20
192,spotify:track:3NpbGCDrcQTERaZb5dHhd3,"Guru Randhawa, Asees Kaur, Vishal Shelke","Nain Ta Heere (From ""Jugjugg Jeeyo"")",T-Series,104,-1,14,758362,2022-10-20
193,spotify:track:1J14CdDAvBTE1AJYUOwl6C,Duncan Laurence,Arcade,"Universal Music, a division of Universal International Music BV",7,186,87,757497,2022-10-20
194,spotify:track:0lNr0bkRupchqckGeSMSpZ,"Yuvan Shankar Raja, Selvaraghavan","Veera Soora (From ""Naane Varuvean"")",Saregama,104,156,3,752897,2022-10-20
195,spotify:track:6eYsOcDdB5b6rTO5ubMxeV,"Anirudh Ravichander, Jonita Gandhi","Private Party (From ""Don"")",Sony Music Entertainment India Pvt. Ltd.,23,137,25,749806,2022-10-20
196,spotify:track:3e7sxremeOE3wTySiOhGiP,"ZAYN, Sia",Dusk Till Dawn (feat. Sia) - Radio Edit,RCA Records Label,51,191,159,744788,2022-10-20
197,spotify:track:3KeMulXbLDJBQdY5PZbGEh,"A.R. Rahman, Shreya Ghoshal",Param Sundari,Sony Music Entertainment India Pvt. Ltd.,7,196,62,743618,2022-10-20
198,spotify:track:0gHFDbhx2RFBrhJplPxlcT,"Diljit Dosanjh, Diamond Platnumz",Jugni,Warner Music India,153,153,2,743187,2022-10-20
200,spotify:track:6tkl6rjuXWtVOCaXSSSCz2,Armaan Malik,"Jab Tak (From ""M.S.Dhoni - The Untold Story"")",T-Series,37,-1,23,742644,2022-10-20
