rank,uri,artist_names,track_name,source,peak_rank,previous_rank,weeks_on_chart,streams,End Date
1,spotify:track:4XTgFBxBHN6var1BzAgE1m,"Maanu, Annural Khalid",Jhol,Giraffe Music,1,2,19,9076984,2025-04-24
2,spotify:track:5ThyDv6aRVU8AH4vXQNldF,"Kushagra, Bharath, Saaheal",Finding Her,EYP Creations,2,3,7,9024180,2025-04-24
3,spotify:track:4vHRQnzGcKEtqsLH70tAms,"Sachet-Parampara, Parampara Tandon, Kausar Munir","Raanjhan (From ""Do Patti"")",T-Series,1,1,27,7904231,2025-04-24
4,spotify:track:4LMlVCXHJtCE9abhmn0mYo,"Afusic, AliSoomroMusic",Pal Pal,Universal Music MENA (Pakistan),4,5,4,6343885,2025-04-24
5,spotify:track:2ZzZ2qwZBWlDKs420hhloc,"Bayaan, Hasan Raheem, Rovalio",Maand,Sony Music Entertainment,4,4,8,5317193,2025-04-24
6,spotify:track:0eCajpR75pDW0r64U6hP2x,Anuv Jain,Jo Tum Mere Ho,Universal Music India Pvt. Ltd. (on behalf of Anuv Jain),1,7,37,4970261,2025-04-24
7,spotify:track:6nRGPf5tpeJtKpXZO5cgIT,"Aditya Rikhari, UNPLG'd",Paro,Universal Music India Pvt Ltd.,7,9,7,4408851,2025-04-24
8,spotify:track:3vCzLB6kS2lGcIpm1OOUsy,"Anurag Saikia, Raj Shekhar, Romy, Amarabha Banerjee, Varun Jain, Madhubanti Bagchi, Mismatched - Cast",Ishq Hai,Netflix Music,1,6,19,4408781,2025-04-24
9,spotify:track:1hlbywc8Jhl1FFqJxAMabE,"Faheem Abdullah, Rauhan Malik, Amir Ameer",Ishq,Artiste First,2,8,56,4327886,2025-04-24
10,spotify:track:2Fv2injs4qAm8mJBGaxVKU,"Arijit Singh, Mithoon","Tujhe Kitna Chahne Lage (From ""Kabir Singh"")",T-Series,2,10,308,3719827,2025-04-24
11,spotify:track:4Qm7r3ImER8S2Ori1gLMAf,"Anuv Jain, AP Dhillon",Afsos,"Universal Music India Pvt. Ltd. (on behalf of Anuv Jain, AP DHILLON INC/Republic Records)",6,11,12,3641945,2025-04-24
12,spotify:track:1hA697u7e1jX2XM8sWA6Uy,"Sachin-Jigar, Arijit Singh, Amitabh Bhattacharya",Apna Bana Le,Zee Music Company,1,18,96,3417725,2025-04-24
13,spotify:track:2cPUB8EOT6AfJ8oxhyoNXL,"Pritam, Javed Bashir",Ye Tune Kya Kiya,T-Series,12,13,62,3384750,2025-04-24
14,spotify:track:4ulroyDK6rN73nVkCkWhur,"Jasleen Royal, Stebin Ben, Vijay Deverakonda, Radhikka Madan, Priya Saraiya, Aditya Sharma",Sahiba,Warner Music India,1,12,22,3384493,2025-04-24
15,spotify:track:5zCnGtCl5Ac5zlFHXaZmhy,"Ram Sampath, Arijit Singh, Prashant Pandey","Sajni (From ""Laapataa Ladies"")",T-Series,1,17,51,3217780,2025-04-24
16,spotify:track:7eQl3Yqv35ioqUfveKHitE,"Pritam, Mohit Chauhan, Irshad Kamil",Tum Se Hi,T-Series,12,14,266,3080340,2025-04-24
17,spotify:track:22ZIAjVRJTjYj5EwD0MjEJ,Masoom Sharma,2 Khatole (Lofi Mix),Tuffan Music,17,24,4,3048474,2025-04-24
18,spotify:track:4d2jV5fmX6hbRwaRbY39dt,Karan Aujla,Wavy,Karan Aujla Music,4,15,23,3032879,2025-04-24
19,spotify:track:7so0lgd0zP2Sbgs2d7a1SZ,"Lady Gaga, Bruno Mars",Die With A Smile,Interscope Records,4,16,30,3004222,2025-04-24
20,spotify:track:5J9L7IbadCt0ivs9xmNrr0,Zain Zohaib,Ranjheya Ve,Zain Zohaib,20,21,9,2968217,2025-04-24
21,spotify:track:3PWfXDaGLxwN9UJDHMEyKi,"Masoom Sharma, Sheenam Katholic, Kay D, Aarohi Raghav",Teri Ramjhol Bole Gi (feat. Kay D & Aarohi Raghav),Empire Media,18,20,6,2873802,2025-04-24
22,spotify:track:2Ul0NiluAcBWG6BJBl40sT,"Himesh Reshammiya, Arijit Singh, Shabbir Ahmed",Tera Chehra,Sony Music / Eros Now Music,3,22,12,2855267,2025-04-24
23,spotify:track:2ceeTJAzKy295Fm0VsaXtE,"Sachin-Jigar, Raghav Chaitanya, Varun Jain, Indraneel","Tum Se (From ""Teri Baaton Mein Aisa Uljha Jiya"")",T-Series,10,19,63,2828761,2025-04-24
24,spotify:track:3yHyiUDJdz02FZ6jfUbsmY,"Arijit Singh, Shreyas Puranik, Siddharth - Garima","Satranga (From ""ANIMAL"")",T-Series,2,30,78,2819964,2025-04-24
25,spotify:track:2618Fg2I7K5leCzDUhOjbr,"Ali & Shjr, Haider Ali, Ali Raza",Heer,Giraffe Music,23,23,5,2798210,2025-04-24
26,spotify:track:5AnWrUzsrFgBvhn6dUElnr,"Sachin-Jigar, Amitabh Bhattacharya, Madhubanti Bagchi, Divya Kumar","Aaj Ki Raat (From ""Stree 2"")",Saregama India Ltd,1,26,39,2761178,2025-04-24
27,spotify:track:2PvaburAUlhNHxVhw5lvOq,Arijit Singh,"Humdard (From ""Ek Villain"")",T-Series,20,36,249,2656607,2025-04-24
28,spotify:track:5a0Z7Dz4e5Z81IM0iccFVY,"Himesh Reshammiya, Ankit Tiwari, Palak Muchhal, Sameer Anjaan",Sanam Teri Kasam,Sony Music / Eros Now Music,1,25,12,2613849,2025-04-24
29,spotify:track:2GXXZFUxYg2LvG8SR0byOE,"Sachin-Jigar, Atif Aslam",Jeena Jeena,Eros Now Music,29,52,189,2604542,2025-04-24
30,spotify:track:5FXMRdJjKq1BIX4e8Eg9mK,"Vishal-Shekhar, KK",Ajab Si,T-Series,19,29,172,2603932,2025-04-24
31,spotify:track:5npFBWhVs3VVlc0nY5xQMA,"Sachin-Jigar, Arijit Singh","Tainu Khabar Nahi - From ""Munjya""",Zee Music Company,17,33,45,2538416,2025-04-24
32,spotify:track:0TL0LFcwIBF5eX7arDIKxY,Anuv Jain,Husn,Universal Music India Pvt. Ltd. (on behalf of Anuv Jain),1,38,73,2537622,2025-04-24
33,spotify:track:5VvkNZesG4T86mUULEG5Wp,"Sachet-Parampara, Sachet Tandon, Parampara Tandon, Kausar Munir",Maiyya,T-Series,19,27,20,2535332,2025-04-24
34,spotify:track:45PA9lW7U5LYnlpGrdTyHY,"Jasleen Royal, Ujjwal Kashyap",Sang Rahiyo,Warner Music India,21,41,59,2513432,2025-04-24
35,spotify:track:6fScgF2Y63ScU73nYju0ny,"Atif Aslam, Arko",O Saathi,T-Series,28,43,143,2479391,2025-04-24
36,spotify:track:5ZLkihi6DVsHwDL3B8ym1t,Shubh,One Love,SHUBH,3,49,88,2369801,2025-04-24
37,spotify:track:56zZ48jdyY2oDXHVnwg5Di,"Mithoon, Arijit Singh",Tum Hi Ho,T-Series,37,45,221,2340011,2025-04-24
38,spotify:track:0SAZ4IHYMtjW4Lxrjm7NnG,"Altamash Faridi, Sohail Sen, Mudassar Aziz",Aashiq Tera,Eros Now Music,35,35,7,2332993,2025-04-24
39,spotify:track:4Lo6I7kkHWgAVRmdILLhig,"Arijit Singh, Afsana Khan, Tanishk Bagchi, Irshad Kamil","Tu Hain Toh Main Hoon (From ""Sky Force"")",Saregama India Ltd,7,44,13,2331782,2025-04-24
40,spotify:track:2IoZMG3RqiTmsy7Li3zGFg,"Sachet Tandon, Parampara Tandon, Sachet-Parampara","Mere Sohneya (From ""Kabir Singh"")",T-Series,4,59,262,2304372,2025-04-24
41,spotify:track:4y2sSEDG8aP4nDyXWnmPjw,"Masoom Sharma, Swara Verma, Dev Chouhan, Pooja Saxena",Blender,GSC Music,19,28,16,2300473,2025-04-24
42,spotify:track:5pPyvA03RKSJrAnnDcq0nh,"Sachin-Jigar, Shreya Ghoshal, Tochi Raina",Saibo,Sony Music Entertainment India Pvt. Ltd.,31,105,234,2273430,2025-04-24
43,spotify:track:1dFrZr9eMUsFqeag04ClqD,Dhanda Nyoliwala,Russian Bandana,Universal Music India Pvt Ltd.,6,34,30,2269628,2025-04-24
44,spotify:track:4MtsPGGUTIs4qFD8gOSJ3D,"Masoom Sharma, Rahul Muana, Swara Verma, Ruba Khan",Chambal K Dakku,Bajewala Records,26,40,6,2265731,2025-04-24
45,spotify:track:0YQJoDL6f46J0n1rOVkpxJ,"Karan Aujla, Ikky",Softly,WM Canada,4,39,88,2260850,2025-04-24
46,spotify:track:0hFkx6EoIRvNmEVXQIIJtk,Aditya Rikhari,Paaro,Universal Music India Pvt Ltd.,46,48,6,2259759,2025-04-24
47,spotify:track:2nP1wLRh85mo5Wdj4RQldp,"Amit Trivedi, Madhubanti Bagchi, Amitabh Bhattacharya","Uyi Amma - From ""Azaad""",Zee Music Company,24,37,14,2258531,2025-04-24
48,spotify:track:02Ck2nLoW3TpgGV6uwvK5Z,"Anurag Kulkarni, Sameera Bharadwaj, Vijai Bulganin, Purnachary","Premalo (From ""Court"")",Saregama India Ltd,20,42,6,2241353,2025-04-24
49,spotify:track:6kYoY0PhBelP64UMnhsEZx,"Alka Yagnik, Arijit Singh","Agar Tum Saath Ho (From ""Tamasha"")",T-Series,4,50,308,2236251,2025-04-24
50,spotify:track:4Tkb7zsDmsawB7S5TpKQV1,"Atif Aslam, Shiraz Uppal",Pehli Dafa,T-Series,50,61,77,2214887,2025-04-24
51,spotify:track:3t3wsY5IdLVzB9WidegJSU,"Atif Aslam, Shreya Ghoshal, Sachin-Jigar",Jeene Laga Hoon,Tips Industries Ltd,51,62,33,2200650,2025-04-24
52,spotify:track:2JlzHPGIVaLNAppX1viq7f,"Santhosh Narayanan, The Indian Choral Ensemble, Vivek","Kanimaa (From ""Retro"")",T-Series,47,47,4,2176945,2025-04-24
53,spotify:track:78BWCd70D1X6LMkDZm1UoF,Yo Yo Honey Singh,Millionaire,T-Series,3,32,34,2160588,2025-04-24
54,spotify:track:3WLJ7D5kh44K5eJ1NqZQ6W,Anuv Jain,Baarishein,Universal Music India Pvt. Ltd. (on behalf of Anuv Jain),16,60,206,2156783,2025-04-24
55,spotify:track:0XRb6eZE4dBIJdqwf1Mixu,"Juss, MixSingh",Suniyan Suniyan,Mix It Up Studio,3,70,49,2155586,2025-04-24
56,spotify:track:6H7fLdt0AeWpuxUKXuXWrx,Hariharan,Shree Hanuman Chalisa,T-Series,31,31,141,2125381,2025-04-24
57,spotify:track:25jtUwCQfXwnxENh8Bvoj4,"Diljit Dosanjh, MixSingh, Raj Ranjodh",Water,Famous Studios,37,51,9,2119813,2025-04-24
58,spotify:track:3yV2c3cYhkAwSsxAq6nRiv,Gajendra Verma,Mann Mera,Sony Music / Eros Now Music,26,88,210,2114294,2025-04-24
59,spotify:track:4FeczSomVWVyU4FW7xDeAI,"A.R. Rahman, Chinmayi, Murtuza Khan, Qadir Khan",Tere Bina,Sony Music Entertainment India Pvt. Ltd.,57,57,36,2106832,2025-04-24
60,spotify:track:3F3difXqjmx6tfA4JmaKAj,"Maanu, Annural Khalid, Abdullah Siddiqui",Jhol - Acoustic,Giraffe Music,57,66,9,2098322,2025-04-24
61,spotify:track:7yDHHVKLbvDmVw1XXhDDIO,"Vishal Mishra, Raj Shekhar",Pehle Bhi Main,T-Series,1,63,73,2075137,2025-04-24
62,spotify:track:6bmmHeCvZI92pRiTHxEdTC,"Pritam, Arijit Singh, Irshad Kamil",O Maahi,T-Series,4,83,71,2044070,2025-04-24
63,spotify:track:0GQngE2rOYvlKwEQjTAsP8,"Pritam, Sreeram, Shilpa Rao",Subhanallah,T-Series,34,53,107,2042688,2025-04-24
64,spotify:track:3zSSCPpLZ5Oc8nelhhGjKz,AUR,Tu hai kahan,Sony Music Entertainment,1,82,80,2027217,2025-04-24
65,spotify:track:72zHuDxFQTjbL51qJQSA7j,"Jasleen Royal, B Praak, Romy","Ranjha (From ""Shershaah"")",Sony Music Entertainment India Pvt. Ltd.,1,94,194,2011527,2025-04-24
66,spotify:track:0KSOLEBixnBYIKNHF1VbzF,"Atif Aslam, Hadiqa Kiani",Hona Tha Pyar,Tips Industries Ltd,54,54,8,1995815,2025-04-24
67,spotify:track:1bxzr3JK05fMTcweGAZUHp,"Shilpa Rao, Anirudh Ravichander, Ramajogayya Sastry","Chuttamalle (From ""Devara Part 1"")",T-Series,4,56,38,1976578,2025-04-24
68,spotify:track:48Ix6ReYdJf2H4mKb3TIpj,"Atif Aslam, Alisha Chinai, Pritam",Tera Hone Laga Hoon,Tips Industries Ltd,30,64,206,1972764,2025-04-24
69,spotify:track:75OSVIdR2KPpEmViMt8MX2,"Afusic, Talwiinder, AliSoomroMusic",Pal Pal (with Talwiinder),Universal Music MENA (Pakistan),69,-1,1,1964926,2025-04-24
70,spotify:track:7eQoMQdE4JqngwYDOqLBU0,"dox, JASKARAN, Rita Kim",Superstar,5.5 Records Under Exclusive License to AWAL,70,76,2,1960824,2025-04-24
71,spotify:track:0gPgdRfB4jdGrlyXS0Vx78,"Vishal-Shekhar, KK, Shilpa Rao, Anvita Dutt Guptan",Khuda Jaane,YRF Music,35,46,133,1939790,2025-04-24
72,spotify:track:3FqtduiaqnFYvBgKuc6QWQ,"Karan Aujla, Seshnolan",Winning Speech,Karan Aujla,8,67,49,1930740,2025-04-24
73,spotify:track:5JCDVLwteSXuwVqjCa7SwH,"Shankar-Ehsaan-Loy, Shreya Ghoshal, Javed Bashir, Yusuf Mohammed, Vajid Ali",O Rangrez,Sony Music Entertainment India Pvt. Ltd.,48,74,25,1928749,2025-04-24
74,spotify:track:1d5lpW3gUyq537iuyrb9Lf,Aditya Rikhari,Samjho Na,CollabX Productions,23,86,105,1910531,2025-04-24
75,spotify:track:0FBQ4NrrHUbR9kus7rzrOj,Atif Aslam,Dil Diyan Gallan,YRF Music,53,92,271,1908468,2025-04-24
76,spotify:track:1PALLCSlHwAI4upY3sMg8u,"Aditya Rikhari, Tulsi Kumar, Lijo George-Dj Chetas","Jaana Samjho Na (From ""Bhool Bhulaiyaa 3"")",T-Series,9,79,25,1902311,2025-04-24
77,spotify:track:3ygfdwvBJ2Y5XhJiiHFFZE,Sachet Tandon,Maiyya Mainu,Zee Music Company,5,115,129,1896032,2025-04-24
78,spotify:track:4tJz5wXpwIvG2KMKPbYWwz,"Santhosh Narayanan, Vivek","Kannadi Poove (From ""Retro"")",T-Series,67,90,7,1880286,2025-04-24
79,spotify:track:6457ZKiycyQm6qrNcu5y15,"Komal Chaudhary, Masoom Sharma",Mere Mittar,Komal Chaudhary,55,55,5,1877230,2025-04-24
80,spotify:track:0M0ANKNzmM4Odd7FNKghzW,Mitraz,"Akhiyaan Gulaab (From ""Teri Baaton Mein Aisa Uljha Jiya"")",T-Series,2,91,65,1873742,2025-04-24
81,spotify:track:5rrKuqb2jWfbubPZyobWbx,Masoom Sharma,Mard,Masoom Sharma,81,95,3,1873541,2025-04-24
82,spotify:track:0cUdmruT6kjxa5KpteSdwc,Bayaan,Nahin Milta,rearts records,75,75,5,1872328,2025-04-24
83,spotify:track:1r6GbBLdtUK1Vl1IHT14wP,"Mohammad Faiz, Jaani","Dekhha Tenu (From ""Mr. And Mrs. Mahi"")",Sony Music Entertainment India Pvt. Ltd.,2,93,49,1869637,2025-04-24
84,spotify:track:4eBvRhTJ2AcxCsbfTUjoRp,Shubh,Cheques,SHUBH,1,80,100,1867525,2025-04-24
85,spotify:track:1mQUEvGR7Sbt2OCz2gFrdx,"Amitabh Bhattacharya, Sachin-Jigar, Pawan Singh, Simran Choudhary","Aayi Nai (From ""Stree 2"")",Saregama India Ltd,2,68,37,1850669,2025-04-24
86,spotify:track:7aE1lfskJLMHQnzCCP1zsV,"Akhil Sachdeva, Mansheel Gujral","Humsafar (From ""Badrinath Ki Dulhania"")",T-Series,44,98,66,1842399,2025-04-24
87,spotify:track:1eZefeDb8uOsjvcbl1fJrG,"Diljit Dosanjh, Badshah, Raj Ranjodh","Naina (From ""Crew"")",Tips Industries Ltd,3,78,59,1839735,2025-04-24
88,spotify:track:2L5fXA2pNlTXJvQTeMZn4z,"Masoom Sharma, Swara Verma",Lofar,Shikaari Music,25,69,6,1833784,2025-04-24
89,spotify:track:5Ggb9pKiKcr5vNV9v1e1vs,"Varun Jain, Shilpa Rao, Sachin-Jigar, Amitabh Bhattacharya",Tumhare Hi Rahenge Hum,Saregama India Ltd,8,58,36,1832885,2025-04-24
90,spotify:track:4MU4Kfkd9EnkArK2ocQyqK,"Arijit Singh, Harshdeep Kaur",Zaalima,Zee Music Company,78,102,96,1823845,2025-04-24
91,spotify:track:4wIWWEhbdgKAxhR68eE0Ye,"Arijit Singh, Chinmayi","Mast Magan (From ""2 States"")",T-Series,45,112,218,1798434,2025-04-24
92,spotify:track:3be9ACTxtcL6Zm4vJRUiPG,yung kai,blue,BMG Rights Management (US) LLC,16,73,20,1794566,2025-04-24
93,spotify:track:1y1rQTkWmrZdJmjwuK07GC,"Vishal Mishra, Manoj Muntashir","Kaise Hua (From ""Kabir Singh"")",T-Series,5,85,306,1792764,2025-04-24
94,spotify:track:1fkjRQA8wXPPyxqYLbxuqy,"Vishal-Shekhar, Sanam Puri, Shipra Goyal",Ishq Bulaava,Sony Music Entertainment India Pvt. Ltd.,94,116,4,1781916,2025-04-24
95,spotify:track:2iNqdCchlUZEgjJbQyZf8T,"Kailash Kher, Paresh Kamath, Naresh Kamath",Teri Deewani,Sony Music Entertainment India Pvt. Ltd.,62,101,38,1780107,2025-04-24
96,spotify:track:3tgdOveYac7YMEAQD9sGLf,"Vishal-Shekhar, Papon, Irshad Kamil",Bulleya,YRF Music,30,71,15,1775971,2025-04-24
97,spotify:track:4XxfOvudrnBRdlgzEaq1sd,Diljit Dosanjh,Born to Shine,FAMOUS STUDIOS INC,14,77,95,1769171,2025-04-24
98,spotify:track:5PUXKVVVQ74C3gl5vKy9Li,"Jasleen Royal, Arijit Singh, Dulquer Salmaan",Heeriye (feat. Arijit Singh),Warner Music India,1,140,91,1761649,2025-04-24
99,spotify:track:0NXnuTqFQHDsbEIoKIAVCN,"Josh Brar, Kinza Hashmi",Tere Bina Na Guzara E,Times Music – Speed Records,19,96,28,1761153,2025-04-24
100,spotify:track:5zcfnScTSFGCHGY1yeXWke,"Vishal-Shekhar, Kamal Khan",Ishq Sufiyana (Male),T-Series,46,72,22,1747343,2025-04-24
101,spotify:track:76ZWOhRRQzmb4xMoZzTjJ9,"Yo Yo Honey Singh, Paradox",Payal,T-Series,14,65,22,1745719,2025-04-24
102,spotify:track:18YHbIhrleUkKKj2DvEp79,"Pritam, KK",Zara Sa,Sony Music Entertainment India Pvt. Ltd.,33,110,112,1734728,2025-04-24
103,spotify:track:0645eBDehHcqfiF15hscQV,"Vishal Mishra, Rashmeet Kaur","Janiye (from the Netflix Film ""Chor Nikal Ke Bhaga"")",Netflix Music,5,81,94,1719766,2025-04-24
104,spotify:track:1o8YPl0hyGbpRcHplXNvsm,"Vishal Mishra, Sachin-Jigar, Amitabh Bhattacharya","Khoobsurat (From ""Stree 2"")",Saregama India Ltd,5,87,36,1718863,2025-04-24
105,spotify:track:5vGiuYFSGekGLgbxhV1rD5,"Atif Aslam, Pritam",Tu Jaane Na,Tips Industries Ltd,66,99,186,1717132,2025-04-24
106,spotify:track:4Jv2S12lwUBOEve08icgj5,"Masoom Sharma, Harsh Sandhu",Gentleman 2,AVN Music Series,76,84,5,1694184,2025-04-24
107,spotify:track:4bD9z9qa4qg9BhryvYWB7c,"Pritam, Tochi Raina, Rekha Bhardwaj",Kabira,T-Series,31,127,293,1685170,2025-04-24
108,spotify:track:52itZ0w0CydihB2JCZEIft,"Pritam, Mohit Chauhan, Irshad Kamil",Pee Loon,T-Series,37,97,63,1681043,2025-04-24
109,spotify:track:4VsP4Dm8gsibRxB5I2hEkw,Kaifi Khalil,Kahani Suno 2.0,1944121 Records DK,1,163,123,1673794,2025-04-24
110,spotify:track:1smFN2CLqGROu0J0UyvDfL,"Pritam, Arijit Singh",Shayad,Sony Music Entertainment India Pvt. Ltd.,1,121,275,1668819,2025-04-24
111,spotify:track:0l6g8Z8mqGbGXFOjigYetD,"Pritam, Arijit Singh",Hawayein,Sony Music Entertainment India Pvt. Ltd.,51,129,185,1662938,2025-04-24
112,spotify:track:4UMIv5jd9gK98a39BQRD9X,"Pritam, Arijit Singh, Amitabh Bhattacharya",Kesariya,Sony Music Entertainment India Pvt. Ltd.,1,117,145,1660322,2025-04-24
113,spotify:track:6mTvwBzWTGDOVeCNQEqtOE,"Amaal Mallik, Arijit Singh, Tulsi Kumar",Soch Na Sake,T-Series,46,118,121,1660126,2025-04-24
114,spotify:track:4BTPzhEsyW3blWcxcuhLM0,"Shankar-Ehsaan-Loy, Shankar Mahadevan, Caralisa Monteiro, Shafqat Amanat Ali",Mitwa,Sony Music Entertainment India Pvt. Ltd.,81,126,36,1656890,2025-04-24
115,spotify:track:1syH0Fc7nsprIjKwlTRBEx,"Masoom Sharma, Amar Karnawal, Pinna Music",Ek Khatola Jail Ke Bhitar,Masoom Sharma,61,89,5,1640192,2025-04-24
116,spotify:track:5UGrftqh9U3zKQUt3vs7Ob,Shubh,Supreme,Shubh,116,-1,1,1630644,2025-04-24
117,spotify:track:25Nxyrng0Z3jC5Q0hAibpw,Karan Aujla,"Tauba Tauba (From ""Bad Newz"")",Saregama India Ltd,1,114,42,1618412,2025-04-24
118,spotify:track:6y5SuF4NxGkvwpAdqcAkD3,"Pritam, Arijit Singh, Shreya Ghoshal, Shadab Faridi, Altamash Faridi, Amitabh Bhattacharya",Ve Kamleya,Saregama India Ltd,15,143,89,1600092,2025-04-24
119,spotify:track:3bZPdEskcnMdepwCaDSJRl,"Vishal-Shekhar, Shafqat Amanat Ali, Sunidhi Chauhan",Bin Tere,Sony Music Entertainment India Pvt. Ltd.,109,120,11,1598735,2025-04-24
120,spotify:track:1YMLgvsQdE27r30q0fsLeV,Arijit Singh,Tera Fitoor,Tips Industries Ltd,61,103,91,1592675,2025-04-24
121,spotify:track:3bRAgqTWL1fHb8k8X56KLu,"Swarnalatha, Pushpavanam Kuppusamy","Thottu Thottu (Form ""Ethirum Puthirum"")",Music Masters Audio Video LLP,121,134,2,1586922,2025-04-24
122,spotify:track:5XeFesFbtLpXzIVDNQP22n,Arctic Monkeys,I Wanna Be Yours,Domino Recording Co,48,132,128,1572873,2025-04-24
123,spotify:track:6FjbAnaPRPwiP3sciEYctO,"Pritam, Arijit Singh",Raabta,T-Series,41,147,132,1572802,2025-04-24
124,spotify:track:5cgKosPPj5Cs9a2JQufUc1,"Pritam, Arijit Singh",Ilahi,T-Series,86,111,17,1568876,2025-04-24
125,spotify:track:5thVzD79BxlDTYy0LfHzvu,"Aparshakti Khurana, Savi Kahlon",Zaroor,Sony Music Entertainment India Pvt. Ltd.,13,157,38,1558008,2025-04-24
126,spotify:track:2C6CJGFLbisteRuY6Plb7b,"Danny, Avvy Sra, Sagar",Ve Haaniyaan,Dreamiyata Music,10,171,64,1548659,2025-04-24
127,spotify:track:5GJ3WaxTSlxDY3csctX20H,"Himesh Reshammiya, Sameer Anjaan",Bewajah,Eros Now Music,12,104,11,1541773,2025-04-24
128,spotify:track:4OcvkkpF3xmyCGGY5IBlgi,"Akhil Sachdeva, Tulsi Kumar","Tera Ban Jaunga (From ""Kabir Singh"")",T-Series,4,153,293,1535224,2025-04-24
129,spotify:track:4DrDsY7ExVwT371fdjcjgA,"Cheema Y, Gur Sidhu, Jasmeen Akhtar",Police,Brown Town Music,52,108,9,1534129,2025-04-24
130,spotify:track:0MTdYgTZ25sLCO6kVnDoje,"Sai Abhyankkar, Sai Smriti","Aasa Kooda - From ""Think Indie""",Think Music,3,122,44,1533555,2025-04-24
131,spotify:track:79hQvdTHNBkq2fp2ZrM8b2,"Javed-Mohsin, Arijit Singh, Shreya Ghoshal, Kunaal Vermaa, Prashant Ingole",Pal,Sony Music Entertainment India Pvt. Ltd.,34,-1,313,1525669,2025-04-24
132,spotify:track:6ygiy70ujkNOYXM1tQuMNe,"Karan Aujla, Ikky, Preston Pablo",Admirin' You (feat. Preston Pablo),WM Canada,24,124,90,1524339,2025-04-24
133,spotify:track:1UWacd8x8tPPwmrPB1MoBI,"Pritam, Arijit Singh",Ae Dil Hai Mushkil Title Track,Sony Music Entertainment India Pvt. Ltd.,79,137,273,1511457,2025-04-24
134,spotify:track:29m79w9xPMH4YCD6r8JSmV,"AP Dhillon, Gurinder Gill, Intense",Excuses,RUN-UP RECORDS,1,123,183,1507646,2025-04-24
135,spotify:track:1uQU9b93tlMlMoZ0h2bRgf,"Sai Abhyankkar, Vivek","Sithira Puthiri - From ""Think Indie""",Think Music,101,106,10,1504586,2025-04-24
136,spotify:track:0OdztoASgKBBNcAgtErk0X,"Abdul Hannan, Rovalio",Bikhra,2636621 Records DK,136,199,3,1499005,2025-04-24
137,spotify:track:2MvCNH9ua0CeOgUQfZf56z,Javed Ali,Guzarish,T-Series,109,109,28,1492017,2025-04-24
138,spotify:track:2wG1mwTiuvqll9YYLMjSaY,ATLXS,PASSO BEM SOLTO - Slowed,broke,138,145,3,1488706,2025-04-24
139,spotify:track:1kDZSmw3mKQeAjcmPTLS3M,"Pritam, Arijit Singh, Shreya Ghoshal, Amitabh Bhattacharya","Tum Kya Mile, Pt. 2",Saregama India Ltd,9,146,95,1487094,2025-04-24
140,spotify:track:7AAap8D4C4pTyNoMkM9vjG,"Shankar-Ehsaan-Loy, Diljit Dosanjh",Ishq Di Baajiyaan,Sony Music Entertainment India Pvt. Ltd.,100,135,35,1485558,2025-04-24
141,spotify:track:5a11x5PUFvJEadMRqtNtTr,"Atif Aslam, Shreya Ghoshal, Sachin-Jigar",Piya O Re Piya,Tips Industries Ltd,114,158,13,1485307,2025-04-24
142,spotify:track:0fK7ie6XwGxQTIkpFoWkd1,JENNIE,like JENNIE,OA Entertainment/Columbia,131,142,6,1480518,2025-04-24
143,spotify:track:3bTnREOf1CyY4Gz5jfHUiI,"Leon James, Sid Sriram, Sanjana Kalmanje","Vazhithunaiye - From ""Dragon""",Think Music,76,100,9,1477627,2025-04-24
144,spotify:track:37AGZMVr5V8mEMcCmGHroZ,"Kailash Kher, Paresh Kamath, Naresh Kamath",Saiyyan,Sony Music Entertainment India Pvt. Ltd.,71,169,69,1475238,2025-04-24
145,spotify:track:5UprhHX9Zdm0DeZzbPHbEN,"Atif Aslam, Manoj Muntashir",Tere Sang Yaara,Zee Music Company,101,-1,40,1474512,2025-04-24
146,spotify:track:0s76ExpXyMGVBlKLUr683e,Aditya Rikhari,Faasle,CollabX Productions,123,150,34,1472477,2025-04-24
147,spotify:track:5QWuignQQWDlbtQsjKX0Kq,"G. V. Prakash, Vivek, Dhanush, Jonita Gandhi","Yedi (From ""Nilavuku En Mel Ennadi Kobam"")",Wunderbar Films,111,149,5,1469967,2025-04-24
148,spotify:track:7G5wpuR61ABrT7R1snos7C,"Pritam, Arijit Singh",Kalank - Title Track,Zee Music Company,5,156,272,1469201,2025-04-24
149,spotify:track:1tCduDqB3J8r90FAxprLzO,Arko,Nazm Nazm,Zee Music Company,106,200,47,1467889,2025-04-24
150,spotify:track:4Qu8LlchmRCaPBKBArcNsA,"Shankar-Ehsaan-Loy, Shafqat Amanat Ali",Tere Naina,Sony Music Entertainment India Pvt. Ltd.,113,165,15,1459145,2025-04-24
151,spotify:track:7CyPwkp0oE8Ro9Dd5CUDjW,"The Weeknd, JENNIE, Lily-Rose Depp","One Of The Girls (with JENNIE, Lily Rose Depp)",XO / Republic Records,98,133,68,1458925,2025-04-24
152,spotify:track:73K33p4Vyz9koXGqmL5eFs,"Sachet Tandon, Parampara Tandon, Kumaar, Sachet-Parampara",Malang Sajna,T-Series,4,141,118,1457088,2025-04-24
153,spotify:track:6xHPBEvcG0RQDfyTq7jc8P,"Cheema Y, Gur Sidhu",Young G.O.A.T,Brown Town Music,72,139,9,1449478,2025-04-24
154,spotify:track:69Qzz3yyQSsA0T95jLDoPL,"Gurnazar, Chet Singh",Dil Tu Jaan Tu,Mars Films / Jhankar Music,14,190,39,1442195,2025-04-24
155,spotify:track:7Imk0IG6S5GA5iYWkjmMW5,"Palak Muchhal, Arijit Singh","Chahun Main Ya Naa (From ""Aashiqui 2"")",T-Series,103,160,80,1436759,2025-04-24
156,spotify:track:6egfWbtFFhMToV2DvmEzmo,"Bunny, Hunny, Sagar","Tu Hain Toh (From ""Mr. And Mrs. Mahi"")",Sony Music Entertainment India Pvt. Ltd.,8,138,44,1433604,2025-04-24
157,spotify:track:0tgVpDi06FyKpA1z0VMD4v,Ed Sheeran,Perfect,Atlantic Records UK,29,155,262,1423847,2025-04-24
158,spotify:track:7KQdgW7QzNd9oPoCzjCU76,Shubh,Bandana,Shubh,8,128,56,1422482,2025-04-24
159,spotify:track:7flUTy7LFKqIqERV7qgxeO,Yo Yo Honey Singh,"MANIAC - Bonus Track [From ""GLORY""]",T-Series,12,107,9,1420775,2025-04-24
160,spotify:track:6vuMdb0E8buJeSHArN3dXk,"Amaal Mallik, Armaan Malik, Kunaal Vermaa","Chale Aana (From ""De De Pyaar De"")",T-Series,18,144,134,1420633,2025-04-24
161,spotify:track:1upGq2z1JcGm2en01psP8y,"Baggh-e SMG, Farmaan SMG, BIG KAY SMG",C.R.E.A.M POSSE,SMG STUDIO'S,148,148,2,1418621,2025-04-24
162,spotify:track:7MXVkk9YMctZqd1Srtv4MB,"The Weeknd, Daft Punk",Starboy,Universal Republic Records,12,170,195,1405269,2025-04-24
163,spotify:track:1WxzZoWBTmB68AtyA6ejBB,"Sohail Sen, Monali Thakur, Kausar Munir",Haan Ke Haan,YRF Music,9,130,38,1392645,2025-04-24
164,spotify:track:6rFckZb1cuJYzsZiGHgqks,"Karan Aujla, Ikky",52 Bars,Rehaan Records,12,175,34,1390685,2025-04-24
165,spotify:track:1fcCPXmH4vUzG6UQTTjZp5,"Mithoon, Arijit Singh, Shashaa Tirupati",Phir Bhi Tumko Chaahunga,Zee Music Company,117,167,35,1387580,2025-04-24
166,spotify:track:6SZgnc7BvRmSXErk0hyXkq,"Anirudh Ravichander, Paal Dabba, G. V. Prakash, Rokesh","God Bless U (From ""Good Bad Ugly"")",T-Series,125,125,2,1387472,2025-04-24
167,spotify:track:2HNG9q8rXbnijbPTwCMgsb,"Atif Aslam, Roop Kumar Rathod, Mithoon, Naresh Sharma","Woh Lamhe Woh Baatein - From ""Zeher""",UME - Global Clearing House,167,184,3,1385896,2025-04-24
168,spotify:track:3HiobOOpSpMsi95WBKPBYk,"Jeet Gannguli, Arijit Singh, Rashmi Virag",Hamari Adhuri Kahani (Title Track),Sony Music Entertainment India Pvt. Ltd.,56,161,180,1383471,2025-04-24
169,spotify:track:2S6N9pbnkhQRyAx80HmF79,Mohammed Irfan,"Banjaara (From ""Ek Villain"")",T-Series,128,-1,50,1372925,2025-04-24
170,spotify:track:5vUumh0QzTwWlla9hK1XJd,"Deepthi Suresh, Anirudh Ravichander, Vignesh Shivan","Paththavaikkum (From ""Devara Part 1"")",T-Series,27,113,10,1372318,2025-04-24
171,spotify:track:7qiZfU4dY1lWllzX7mPBI3,Ed Sheeran,Shape of You,Atlantic Records UK,63,191,241,1371842,2025-04-24
172,spotify:track:4OEBP1iwGmLtcM8UKRLm80,"Arijit Singh, Antara Mitra","Itni Si Baat Hain (From ""Azhar"")",T-Series,138,192,28,1369154,2025-04-24
173,spotify:track:7m4CgL81VVIHaaiSxyH922,Yo Yo Honey Singh,Desi Kalakaar,T-Series,13,131,66,1368656,2025-04-24
174,spotify:track:3xMHXmedL5Rvfxmiar9Ryv,"Anirudh Ravichander, Arijit Singh, Shilpa Rao, Kumaar",Chaleya,T-Series,1,-1,88,1368115,2025-04-24
175,spotify:track:36N5awamOX6XX5pQn3aFXZ,"Darshan Raval, Jonita Gandhi, Rochak Kohli, Gurpreet Saini","Soni Soni (From ""Ishq Vishk Rebound"")",Tips Industries Ltd,4,176,47,1364206,2025-04-24
176,spotify:track:32765xcLM1fd6wQIpkN9A0,"Ami Mishra, Kunaal Vermaa",Hasi - Male Version,Sony Music Entertainment India Pvt. Ltd.,77,185,95,1362428,2025-04-24
177,spotify:track:0dJacN6K3mSGLE9p7QE0lO,KK,"Beete Lamhein (From ""The Train"")",T-Series,75,182,50,1355983,2025-04-24
178,spotify:track:2PxZSFOv7RebkeSEwQTjr7,Mustafa Zahid,Tera Mera Rishta,Vishesh Films Pvt Ltd.,152,152,7,1341922,2025-04-24
179,spotify:track:2tva3nN2kQhBjHMC7Zlty6,Javed Ali,Deewana Kar Raha Hai,T-Series,119,119,15,1324824,2025-04-24
180,spotify:track:2ZD4aIEepqZsdxPxLSuUhm,"Pritam, Arijit Singh, Amitabh Bhattacharya, Nikhita Gandhi",Tere Pyaar Mein,T-Series,5,181,96,1324800,2025-04-24
181,spotify:track:3nKQrVVlwbAQSnFbgZWdN0,"Avvy Sra, Karan Aujla, Jaani",White Brown Black,Universal Music India Pvt Ltd. – Distribution,29,-1,122,1323340,2025-04-24
182,spotify:track:0loZn1c5heXie7OAtvK6nH,"Jubin Nautiyal, Manoj Muntashir",Humnava Mere,T-Series,66,177,151,1322065,2025-04-24
183,spotify:track:1wnozUBSe7OMpmZiTPJC5j,"A.R. Rahman, Javed Ali, KIRTI SAGATHIA, Pooja AV","Tum Tak (From ""Raanjhanaa"")",Sony Music Entertainment India Pvt. Ltd.,113,173,27,1321749,2025-04-24
