rank,uri,artist_names,track_name,source,peak_rank,previous_rank,weeks_on_chart,streams,End Date
1,spotify:track:0eCajpR75pDW0r64U6hP2x,Anuv Jain,Jo Tum Mere Ho,Universal Music India Pvt. Ltd. (on behalf of Anuv Jain),1,1,7,10403941,2024-09-26
2,spotify:track:5AnWrUzsrFgBvhn6dUElnr,"Sachin-Jigar, Amitabh Bhattacharya, Madhubanti Bagchi, Divya Kumar","Aaj Ki Raat (From ""Stree 2"")",Saregama India Ltd,1,2,9,7150319,2024-09-26
3,spotify:track:1mQUEvGR7Sbt2OCz2gFrdx,"Amitabh Bhattacharya, Sachin-Jigar, Pawan Singh, Simran Choudhary","Aayi Nai (From ""Stree 2"")",Saregama India Ltd,2,3,7,5795041,2024-09-26
4,spotify:track:5zCnGtCl5Ac5zlFHXaZmhy,"Ram Sampath, Arijit Singh, Prashant Pandey","Sajni (From ""Laapataa Ladies"")",T-Series,1,5,21,4999791,2024-09-26
5,spotify:track:78BWCd70D1X6LMkDZm1UoF,Yo Yo Honey Singh,Millionaire,T-Series,3,4,4,4935995,2024-09-26
6,spotify:track:1hlbywc8Jhl1FFqJxAMabE,"Faheem Abdullah, Rauhan Malik, Amir Ameer",Ishq,Artiste First,6,6,26,4872885,2024-09-26
7,spotify:track:7KB0zREYCrQU3refE5x0M3,"Anirudh Ravichander, Malaysia Vasudevan, Deepthi Suresh, Yugendran Vasudevan","Manasilaayo (From ""Vettaiyan"")",Sony Music Entertainment India Pvt. Ltd.,7,9,3,4789088,2024-09-26
8,spotify:track:25Nxyrng0Z3jC5Q0hAibpw,Karan Aujla,"Tauba Tauba (From ""Bad Newz"")",Saregama India Ltd,1,7,12,4224768,2024-09-26
9,spotify:track:0TL0LFcwIBF5eX7arDIKxY,Anuv Jain,Husn,Universal Music India Pvt. Ltd. (on behalf of Anuv Jain),1,12,43,4213856,2024-09-26
10,spotify:track:1o8YPl0hyGbpRcHplXNvsm,"Vishal Mishra, Sachin-Jigar, Amitabh Bhattacharya","Khoobsurat (From ""Stree 2"")",Saregama India Ltd,5,10,6,3913783,2024-09-26
11,spotify:track:5Ggb9pKiKcr5vNV9v1e1vs,"Varun Jain, Shilpa Rao, Sachin-Jigar, Amitabh Bhattacharya",Tumhare Hi Rahenge Hum,Saregama India Ltd,8,8,6,3889061,2024-09-26
12,spotify:track:1bxzr3JK05fMTcweGAZUHp,"Shilpa Rao, Anirudh Ravichander, Ramajogayya Sastry","Chuttamalle (From ""Devara Part 1"")",T-Series,4,11,8,3620038,2024-09-26
13,spotify:track:5thVzD79BxlDTYy0LfHzvu,"Aparshakti Khurana, Savi Kahlon",Zaroor,Sony Music Entertainment India Pvt. Ltd.,13,15,8,3512579,2024-09-26
14,spotify:track:2Fv2injs4qAm8mJBGaxVKU,"Arijit Singh, Mithoon","Tujhe Kitna Chahne Lage (From ""Kabir Singh"")",T-Series,2,13,278,3511840,2024-09-26
15,spotify:track:0xpeiTGSEchBhqrjDuIcSS,"Dhibu Ninan Thomas, Vaikom Vijayalakshmi, Manu Manjith","Angu Vaana Konilu - From ""ARM""",Think Music,15,-1,1,3277439,2024-09-26
16,spotify:track:0XRb6eZE4dBIJdqwf1Mixu,"Juss, MixSingh",Suniyan Suniyan,Mix It Up Studio,3,16,19,3190397,2024-09-26
17,spotify:track:1WxzZoWBTmB68AtyA6ejBB,"Sohail Sen, Monali Thakur, Kausar Munir",Haan Ke Haan,YRF Music,9,14,8,3145974,2024-09-26
18,spotify:track:4XxfOvudrnBRdlgzEaq1sd,Diljit Dosanjh,Born to Shine,FAMOUS STUDIOS INC,18,20,65,3072653,2024-09-26
19,spotify:track:7eQl3Yqv35ioqUfveKHitE,"Pritam, Mohit Chauhan, Irshad Kamil",Tum Se Hi,T-Series,17,22,236,3024780,2024-09-26
20,spotify:track:5xlYVZxEwriP6hetG7QJw7,AP Dhillon,Old Money,AP Dhillon,13,18,6,2996078,2024-09-26
21,spotify:track:0YQJoDL6f46J0n1rOVkpxJ,"Karan Aujla, Ikky",Softly,WM Canada,4,21,58,2991237,2024-09-26
22,spotify:track:7bzR0C8NhnBA79iTXUCJ7o,Vishal Mishra,"Jaanam (From ""Bad Newz"")",Saregama India Ltd,7,17,11,2903076,2024-09-26
23,spotify:track:3yHyiUDJdz02FZ6jfUbsmY,"Arijit Singh, Shreyas Puranik, Siddharth - Garima","Satranga (From ""ANIMAL"")",T-Series,2,24,48,2892615,2024-09-26
24,spotify:track:5sUSbJo0brScvv48ZZ1HrQ,"Atif Aslam, Jyotica Tangri",O Meri Laila,Zee Music Company,16,23,22,2863222,2024-09-26
25,spotify:track:69Qzz3yyQSsA0T95jLDoPL,"Gurnazar, Chet Singh",Dil Tu Jaan Tu,Mars Films / Jhankar Music,14,26,9,2861024,2024-09-26
26,spotify:track:1hA697u7e1jX2XM8sWA6Uy,"Sachin-Jigar, Arijit Singh, Amitabh Bhattacharya",Apna Bana Le,Zee Music Company,1,25,66,2855507,2024-09-26
27,spotify:track:3WLJ7D5kh44K5eJ1NqZQ6W,Anuv Jain,Baarishein,Universal Music India Pvt. Ltd. (on behalf of Anuv Jain),18,33,176,2799711,2024-09-26
28,spotify:track:7yDHHVKLbvDmVw1XXhDDIO,"Vishal Mishra, Raj Shekhar",Pehle Bhi Main,T-Series,1,27,43,2796987,2024-09-26
29,spotify:track:0MTdYgTZ25sLCO6kVnDoje,"Sai Abhyankkar, Sai Smriti","Aasa Kooda - From ""Think Indie""",Think Music,3,19,14,2679278,2024-09-26
30,spotify:track:2ceeTJAzKy295Fm0VsaXtE,"Sachin-Jigar, Raghav Chaitanya, Varun Jain, Indraneel","Tum Se (From ""Teri Baaton Mein Aisa Uljha Jiya"")",T-Series,10,34,33,2599287,2024-09-26
31,spotify:track:5pPyvA03RKSJrAnnDcq0nh,"Sachin-Jigar, Shreya Ghoshal, Tochi Raina",Saibo,Sony Music Entertainment India Pvt. Ltd.,31,41,204,2545626,2024-09-26
32,spotify:track:5npFBWhVs3VVlc0nY5xQMA,"Sachin-Jigar, Arijit Singh","Tainu Khabar Nahi - From ""Munjya""",Zee Music Company,17,30,15,2535721,2024-09-26
33,spotify:track:6bmmHeCvZI92pRiTHxEdTC,"Pritam, Arijit Singh, Irshad Kamil",O Maahi,T-Series,4,32,41,2523178,2024-09-26
34,spotify:track:3zSSCPpLZ5Oc8nelhhGjKz,AUR,Tu hai kahan,Sony Music Entertainment,1,42,50,2480229,2024-09-26
35,spotify:track:3xMHXmedL5Rvfxmiar9Ryv,"Anirudh Ravichander, Arijit Singh, Shilpa Rao, Kumaar",Chaleya,T-Series,1,31,59,2435512,2024-09-26
36,spotify:track:1r6GbBLdtUK1Vl1IHT14wP,"Mohammad Faiz, Jaani","Dekhha Tenu (From ""Mr. And Mrs. Mahi"")",Sony Music Entertainment India Pvt. Ltd.,2,38,19,2424398,2024-09-26
37,spotify:track:7m4CgL81VVIHaaiSxyH922,Yo Yo Honey Singh,Desi Kalakaar,T-Series,13,49,36,2410211,2024-09-26
38,spotify:track:2PvaburAUlhNHxVhw5lvOq,Arijit Singh,"Humdard (From ""Ek Villain"")",T-Series,28,47,219,2410032,2024-09-26
39,spotify:track:0645eBDehHcqfiF15hscQV,"Vishal Mishra, Rashmeet Kaur","Janiye (from the Netflix Film ""Chor Nikal Ke Bhaga"")",Netflix Music,5,40,64,2409084,2024-09-26
40,spotify:track:5ZLkihi6DVsHwDL3B8ym1t,Shubh,One Love,SHUBH,3,36,58,2372741,2024-09-26
41,spotify:track:36N5awamOX6XX5pQn3aFXZ,"Darshan Raval, Jonita Gandhi, Rochak Kohli, Gurpreet Saini","Soni Soni (From ""Ishq Vishk Rebound"")",Tips Industries Ltd,4,37,17,2366394,2024-09-26
42,spotify:track:45PA9lW7U5LYnlpGrdTyHY,Jasleen Royal,Sang Rahiyo,Warner Music India,21,48,29,2365168,2024-09-26
43,spotify:track:0M0ANKNzmM4Odd7FNKghzW,Mitraz,"Akhiyaan Gulaab (From ""Teri Baaton Mein Aisa Uljha Jiya"")",T-Series,2,43,35,2352940,2024-09-26
44,spotify:track:2tjWCe2W7sgvS3C8NHcdtI,"Akhil, Dhvani Bhanushali, Kunaal Vermaa, Abhijit Vaghani","Duniyaa (From ""Luka Chuppi"")",T-Series,1,44,292,2332164,2024-09-26
45,spotify:track:0xN4nwgOWg59k0t94CJAj4,"Yuvan Shankar Raja, Shenbagaraj, Velu, Sam, Narayanan Ravishankar","Matta (From ""The Greatest Of All Time"")",T-Series,29,29,3,2320325,2024-09-26
46,spotify:track:3FqtduiaqnFYvBgKuc6QWQ,"Karan Aujla, Mxrci",Winning Speech,Karan Aujla,8,45,19,2312900,2024-09-26
47,spotify:track:5PUXKVVVQ74C3gl5vKy9Li,"Jasleen Royal, Arijit Singh, Dulquer Salmaan",Heeriye (feat. Arijit Singh),Warner Music India,1,39,61,2291004,2024-09-26
48,spotify:track:2GXXZFUxYg2LvG8SR0byOE,"Sachin-Jigar, Atif Aslam",Jeena Jeena,Eros Now Music,37,46,165,2264290,2024-09-26
49,spotify:track:1a1xLj9W8libnO9PvJf6ao,"Sushin Shyam, Dabzee, Vinayak Sasikumar",Illuminati,Think Music,3,28,25,2256013,2024-09-26
50,spotify:track:48Ix6ReYdJf2H4mKb3TIpj,"Atif Aslam, Alisha Chinai, Pritam",Tera Hone Laga Hoon,Tips Industries Ltd,35,58,176,2164500,2024-09-26
51,spotify:track:0rMeOAvbQZ2RTG4B6L1M4p,Darshan Raval,Asal Mein,Indie Music Label,21,54,174,2154948,2024-09-26
52,spotify:track:1d5lpW3gUyq537iuyrb9Lf,Aditya Rikhari,Samjho Na,CollabX Productions,46,52,75,2134373,2024-09-26
53,spotify:track:1y1rQTkWmrZdJmjwuK07GC,"Vishal Mishra, Manoj Muntashir","Kaise Hua (From ""Kabir Singh"")",T-Series,5,50,276,2132222,2024-09-26
54,spotify:track:0OA00aPt3BV10qeMIs3meW,"Hanumankind, Kalmi",Big Dawgs,Universal Music India Pvt Ltd.,2,35,9,2124686,2024-09-26
55,spotify:track:4eBvRhTJ2AcxCsbfTUjoRp,Shubh,Cheques,SHUBH,1,51,70,2123555,2024-09-26
56,spotify:track:0FBQ4NrrHUbR9kus7rzrOj,Atif Aslam,Dil Diyan Gallan,YRF Music,53,53,241,2113725,2024-09-26
57,spotify:track:2C6CJGFLbisteRuY6Plb7b,"Danny, Avvy Sra, Sagar",Ve Haaniyaan,Dreamiyata Music,10,59,34,2013377,2024-09-26
58,spotify:track:6egfWbtFFhMToV2DvmEzmo,"Bunny, Hunny, Sagar","Tu Hain Toh (From ""Mr. And Mrs. Mahi"")",Sony Music Entertainment India Pvt. Ltd.,8,57,14,1993454,2024-09-26
59,spotify:track:4Pow6acOGSaXcs6Gd05SP5,"Jasleen Royal, B Praak, Romy, Anvita Dutt",Ranjha,Sony Music Entertainment India Pvt. Ltd.,1,61,164,1979360,2024-09-26
60,spotify:track:1eZefeDb8uOsjvcbl1fJrG,"Diljit Dosanjh, Badshah, Raj Ranjodh","Naina (From ""Crew"")",Tips Industries Ltd,3,55,29,1977207,2024-09-26
61,spotify:track:1QZRCi2Z1DQQaR6bGAzhtN,Yo Yo Honey Singh,Love Dose,T-Series,32,78,20,1976958,2024-09-26
62,spotify:track:0GQngE2rOYvlKwEQjTAsP8,"Pritam, Sreeram, Shilpa Rao",Subhanallah,T-Series,54,62,77,1954906,2024-09-26
63,spotify:track:0rlLBWFFTQiOWi963SH9bb,The Local Train,Choo Lo,The Local Train,49,72,66,1932125,2024-09-26
64,spotify:track:1tf2iody5iRLYYPDSBpzRc,"Badshah, Arijit Singh",Soulmate,Universal Music India Pvt Ltd.,2,60,27,1927203,2024-09-26
65,spotify:track:7Je0oWG9OjLhHEXd2eHsFF,"Dhibu Ninan Thomas, K. S. Harisankar, Anila Rajeev","Kiliye - From ""ARM""",Think Music,65,-1,1,1922859,2024-09-26
66,spotify:track:3yV2c3cYhkAwSsxAq6nRiv,Gajendra Verma,Mann Mera,Sony Music / Eros Now Music,26,84,182,1907384,2024-09-26
67,spotify:track:56zZ48jdyY2oDXHVnwg5Di,"Mithoon, Arijit Singh",Tum Hi Ho,T-Series,42,68,191,1886701,2024-09-26
68,spotify:track:4UMIv5jd9gK98a39BQRD9X,"Pritam, Arijit Singh, Amitabh Bhattacharya",Kesariya,Sony Music Entertainment India Pvt. Ltd.,1,67,115,1886603,2024-09-26
69,spotify:track:1smFN2CLqGROu0J0UyvDfL,"Pritam, Arijit Singh",Shayad,Sony Music Entertainment India Pvt. Ltd.,1,63,245,1882820,2024-09-26
70,spotify:track:3ZGJhN4unVspOqpwGvUL2W,Diljit Dosanjh,Lemonade,DILJIT DOSANJH,26,65,113,1866649,2024-09-26
71,spotify:track:0gPgdRfB4jdGrlyXS0Vx78,"Vishal-Shekhar, KK, Shilpa Rao, Anvita Dutt Guptan",Khuda Jaane,YRF Music,37,64,103,1852784,2024-09-26
72,spotify:track:0loZn1c5heXie7OAtvK6nH,"Jubin Nautiyal, Rocky - Shiv",Humnava Mere,T-Series,66,66,122,1846864,2024-09-26
73,spotify:track:2FCXQHugkoHE1K3tiDu8pu,"Alka Yagnik, Arijit Singh","Agar Tum Saath Ho (From ""Tamasha"")",T-Series,4,70,278,1843644,2024-09-26
74,spotify:track:2cPUB8EOT6AfJ8oxhyoNXL,"Pritam, Javed Bashir",Ye Tune Kya Kiya,T-Series,64,77,32,1830539,2024-09-26
75,spotify:track:52itZ0w0CydihB2JCZEIft,"Pritam, Mohit Chauhan, Irshad Kamil",Pee Loon,T-Series,63,79,33,1820899,2024-09-26
76,spotify:track:7KQdgW7QzNd9oPoCzjCU76,Shubh,Bandana,Shubh,8,75,26,1812043,2024-09-26
77,spotify:track:1kDZSmw3mKQeAjcmPTLS3M,"Pritam, Arijit Singh, Shreya Ghoshal, Amitabh Bhattacharya","Tum Kya Mile, Pt. 2",Saregama India Ltd,9,69,65,1808356,2024-09-26
78,spotify:track:7wW9scVNLYFLsmBb1yAUmS,Yo Yo Honey Singh,Blue Eyes,T-Series,38,80,15,1799820,2024-09-26
79,spotify:track:0UZLaEOSIc5kg0cc7eszqC,Vishal Mishra,Manjha,Desi Music Factory,16,76,122,1776458,2024-09-26
80,spotify:track:2IoZMG3RqiTmsy7Li3zGFg,"Sachet Tandon, Parampara Tandon, Sachet-Parampara","Mere Sohneya (From ""Kabir Singh"")",T-Series,4,73,232,1774230,2024-09-26
81,spotify:track:7acH6yiK56etufZpUIv1YW,Shubh,Be Mine,Shubh,61,74,12,1764579,2024-09-26
82,spotify:track:6H7fLdt0AeWpuxUKXuXWrx,Hariharan,Shree Hanuman Chalisa,T-Series,39,92,111,1755531,2024-09-26
83,spotify:track:1418IuVKQPTYqt7QNJ9RXN,King,Maan Meri Jaan,Warner Music India,1,87,102,1747316,2024-09-26
84,spotify:track:5vGiuYFSGekGLgbxhV1rD5,"Atif Aslam, Pritam",Tu Jaane Na,Tips Industries Ltd,73,99,156,1746348,2024-09-26
85,spotify:track:5XeFesFbtLpXzIVDNQP22n,Arctic Monkeys,I Wanna Be Yours,Domino Recording Co,48,83,98,1730380,2024-09-26
86,spotify:track:1hHrBEkN0JIaeFPegy4Xak,"A.R. Rahman, Santhosh Narayanan, Shweta Mohan, Gana Kadhar","Water Packet (From ""Raayan"")",Sun Pictures,40,56,9,1714850,2024-09-26
87,spotify:track:3APdIdF8H0jsxSuGOqXedS,Rashid Ali,Kabhi Kabhi Aditi,T-Series,58,91,135,1703735,2024-09-26
88,spotify:track:3HiobOOpSpMsi95WBKPBYk,"Jeet Gannguli, Arijit Singh",Hamari Adhuri Kahani (Title Track),Sony Music Entertainment India Pvt. Ltd.,56,89,150,1687017,2024-09-26
89,spotify:track:3nKQrVVlwbAQSnFbgZWdN0,"Avvy Sra, Karan Aujla, Jaani",White Brown Black,Universal Music India Pvt Ltd. – Distribution,29,101,93,1671991,2024-09-26
90,spotify:track:3F3ZuXYFXGM1V6pk3b3zmi,"Diljit Dosanjh, thiarajxtt",Kinni Kinni,DILJIT DOSANJH,24,81,46,1670167,2024-09-26
91,spotify:track:29YePgOxuPLfU7uZKxKf6w,"Monali Thakur, Amit Trivedi",Sawaar Loon,T-Series,91,100,4,1659966,2024-09-26
92,spotify:track:2RgvvnMwtP0R2OkVZmFvnV,KK,"Ajab Si (From ""Om Shanti Om"")",T-Series,34,88,142,1659476,2024-09-26
93,spotify:track:5ouREJYZCYqwF0p7VeUtfH,Karan Aujla,IDK HOW,Karan Aujla/Rehaan Records,7,82,13,1657615,2024-09-26
94,spotify:track:4Tkb7zsDmsawB7S5TpKQV1,"Atif Aslam, Shiraz Uppal",Pehli Dafa,T-Series,90,90,47,1637995,2024-09-26
95,spotify:track:62tJcdKJKBBGYbav0XHWAr,"electronic kili, Vinayak Sasikumar","Eyy Banane - From ""Vaazha""",Think Music,95,125,2,1633665,2024-09-26
96,spotify:track:5BKKKNwrebowaMoUdBaNby,King,Tu Aake Dekhle,Warner Music India,3,109,191,1602317,2024-09-26
97,spotify:track:3bQsp4Vr9Rg4fNCx6HPOgX,Anuv Jain,Alag Aasmaan,Universal Music India Pvt. Ltd. (on behalf of Anuv Jain),30,112,54,1588374,2024-09-26
98,spotify:track:6c4Po8zyQjB4cR5XgLhcGb,"Prabh Singh, Jay Trak, Rooh Sandhu",9:45,Prabh Singh Official,9,86,64,1587655,2024-09-26
99,spotify:track:46QbY78ha62aiu6gBgC7lS,Diljit Dosanjh,G.O.A.T.,FAMOUS STUDIOS INC,1,85,41,1584691,2024-09-26
100,spotify:track:4VsP4Dm8gsibRxB5I2hEkw,Kaifi Khalil,Kahani Suno 2.0,1944121 Records DK,1,98,93,1580937,2024-09-26
101,spotify:track:5WXQbgwGwyauXOqswlEeQY,"Tanishk Bagchi, Arijit Singh, Asees Kaur","Bolna (From ""Kapoor & Sons (Since 1921)"")",Sony Music Entertainment India Pvt. Ltd.,59,94,83,1572567,2024-09-26
102,spotify:track:6mTvwBzWTGDOVeCNQEqtOE,"Amaal Mallik, Arijit Singh, Tulsi Kumar",Soch Na Sake,T-Series,46,102,91,1519008,2024-09-26
103,spotify:track:7KmCQLSSde0UX5OqCgvGN9,Karan Aujla,ANTIDOTE,Karan Aujla/Rehaan Records,32,103,13,1516418,2024-09-26
104,spotify:track:6ygiy70ujkNOYXM1tQuMNe,"Karan Aujla, Ikky, Preston Pablo",Admirin' You (feat. Preston Pablo),WM Canada,24,106,60,1514974,2024-09-26
105,spotify:track:1UWacd8x8tPPwmrPB1MoBI,"Pritam, Arijit Singh",Ae Dil Hai Mushkil Title Track,Sony Music Entertainment India Pvt. Ltd.,79,105,243,1505936,2024-09-26
106,spotify:track:6t9KM2EQD4H2KbrTgHGYf3,"Sachin-Jigar, Jasmine Sandlas, Amitabh Bhattacharya","Taras - From ""Munjya""",Zee Music Company,38,95,15,1503361,2024-09-26
107,spotify:track:3qrdLVOClRU4yPkcXZ7c5u,"Ayushmann Khurrana, Tanishk-Vayu","Mere Liye Tum Kaafi Ho (From ""Shubh Mangal Zyada Saavdhan"")",T-Series,11,107,233,1501087,2024-09-26
108,spotify:track:4bD9z9qa4qg9BhryvYWB7c,"Pritam, Tochi Raina, Rekha Bhardwaj",Kabira,T-Series,31,97,263,1495734,2024-09-26
109,spotify:track:26elzgFl8tvajnDfeoY1YF,"Darshan Raval, Prakriti Kakar",Mannat,Warner Music India,18,96,42,1489873,2024-09-26
110,spotify:track:7tpuDHfin2ZewPYOHTi3Uw,"Dabzee, Ribin Richard",Habibi Drip,Pauly Jr. Pictures,71,71,8,1480329,2024-09-26
111,spotify:track:4FeczSomVWVyU4FW7xDeAI,"A.R. Rahman, Chinmayi, Murtuza Khan, Qadir Khan",Tere Bina,Sony Music Entertainment India Pvt. Ltd.,111,122,6,1471736,2024-09-26
112,spotify:track:73K33p4Vyz9koXGqmL5eFs,"Sachet Tandon, Parampara Tandon, Kumaar, Sachet-Parampara",Malang Sajna,T-Series,4,108,88,1462940,2024-09-26
113,spotify:track:79hQvdTHNBkq2fp2ZrM8b2,"Javed-Mohsin, Arijit Singh, Shreya Ghoshal, Kunaal Vermaa, Prashant Ingole",Pal,Sony Music Entertainment India Pvt. Ltd.,34,118,290,1459213,2024-09-26
114,spotify:track:6ivemTXTn27PwVjtd0oqDs,Anuv Jain,Gul,Universal Music India Pvt. Ltd. (on behalf of Anuv Jain),76,138,48,1455033,2024-09-26
115,spotify:track:2qSkIjg1o9h3YT9RAgYN75,Sabrina Carpenter,Espresso,Island Records,26,110,22,1449392,2024-09-26
116,spotify:track:5O2P9iiztwhomNh8xkR9lJ,One Direction,Night Changes,Syco Music,22,123,176,1448495,2024-09-26
117,spotify:track:37AGZMVr5V8mEMcCmGHroZ,"Kailash Kher, Paresh Kamath, Naresh Kamath",Saiyyan,Sony Music Entertainment India Pvt. Ltd.,117,134,39,1445624,2024-09-26
118,spotify:track:7MXVkk9YMctZqd1Srtv4MB,"The Weeknd, Daft Punk",Starboy,Universal Republic Records,12,117,165,1440630,2024-09-26
119,spotify:track:4wIWWEhbdgKAxhR68eE0Ye,"Arijit Singh, Chinmayi","Mast Magan (From ""2 States"")",T-Series,45,113,188,1438467,2024-09-26
120,spotify:track:6y5SuF4NxGkvwpAdqcAkD3,"Pritam, Arijit Singh, Shreya Ghoshal, Shadab Faridi, Altamash Faridi, Amitabh Bhattacharya",Ve Kamleya,Saregama India Ltd,15,114,59,1438362,2024-09-26
121,spotify:track:3bmsaFp11I9pbicxzlStf3,Akshath,nadaaniyan,Universal Music India Pvt Ltd.,6,93,15,1428486,2024-09-26
122,spotify:track:2RelZc0EwHPsVwrW6B6taZ,"Bombay the Artist, Charan","Vekh Sohneyaa - From ""Call Me Bae""",Sony Music Entertainment India Pvt. Ltd. / Amazon Seller Services Private Limited,122,-1,1,1423079,2024-09-26
123,spotify:track:6fScgF2Y63ScU73nYju0ny,"Atif Aslam, Arko",O Saathi,T-Series,58,121,113,1419890,2024-09-26
124,spotify:track:7F8RNvTQlvbeBLeenycvN6,"A.R. Rahman, Javed Ali, Mohit Chauhan",Kun Faya Kun,T-Series,60,119,129,1412218,2024-09-26
125,spotify:track:7fW9J3EpVWVN1ouv0slAs0,KK,"Kya Mujhe Pyar Hai (From ""Woh Lamhe"")",T-Series,42,132,86,1388840,2024-09-26
126,spotify:track:7uNnlVit5qDvfOje0pqICF,"Mohit Chauhan, Suzanne D'Mello",Tum Ho,T-Series,62,115,17,1383816,2024-09-26
127,spotify:track:5ivRSlOhVIXN2QMzqgsX0s,The Local Train,Aaoge Tum Kabhi,The Local Train,116,129,15,1373411,2024-09-26
128,spotify:track:7CyPwkp0oE8Ro9Dd5CUDjW,"The Weeknd, JENNIE, Lily-Rose Depp","One Of The Girls (with JENNIE, Lily Rose Depp)",XO / Republic Records,98,127,38,1370726,2024-09-26
129,spotify:track:0tgVpDi06FyKpA1z0VMD4v,Ed Sheeran,Perfect,Atlantic Records UK,29,130,232,1354149,2024-09-26
130,spotify:track:0Jiaz0O4AqnJICa9PxHhaR,Darshan Raval,Mahiye Jinna Sohna,Warner Music India,2,126,66,1348518,2024-09-26
131,spotify:track:3AJwUDP919kvQ9QcozQPxg,Coldplay,Yellow,Parlophone UK,131,-1,1,1344031,2024-09-26
132,spotify:track:29m79w9xPMH4YCD6r8JSmV,"AP Dhillon, Gurinder Gill, Intense",Excuses,RUN-UP RECORDS,1,120,153,1341050,2024-09-26
133,spotify:track:0snQrp1VaY5Pj1YIHRJpRJ,Aditya A,Chaand Baaliyan,Sony Music Entertainment India Pvt. Ltd.,2,124,136,1340401,2024-09-26
134,spotify:track:0l6g8Z8mqGbGXFOjigYetD,"Pritam, Arijit Singh",Hawayein,Sony Music Entertainment India Pvt. Ltd.,51,131,155,1328633,2024-09-26
135,spotify:track:2oenSXLDbWVaaL7QjSGYj5,"Diljit Dosanjh, Intense, Sultaan",Lalkara,DILJIT DOSANJH,22,111,51,1323605,2024-09-26
136,spotify:track:2eAvDnpXP5W0cVtiI0PUxV,Ruth B.,Dandelions,Columbia,14,146,140,1314168,2024-09-26
137,spotify:track:610keNiNVTIkYD0CqeSerg,"Cheema Y, Gur Sidhu",California Love,Brown Town Music,27,128,70,1307056,2024-09-26
138,spotify:track:2IEhtVeM9TVql8fZdKdlo9,"Atif Aslam, Chinmayi, Pritam",Main Rang Sharbaton Ka,Tips Industries Ltd,73,135,38,1303519,2024-09-26
139,spotify:track:32VAw8DL9ixX5XSW2VLcZ4,"Parmish Verma, PARDHAAN, Desi Crew",Aam Jahe Munde,Parmish Verma Films,20,116,64,1292891,2024-09-26
140,spotify:track:4OcvkkpF3xmyCGGY5IBlgi,"Akhil Sachdeva, Tulsi Kumar","Tera Ban Jaunga (From ""Kabir Singh"")",T-Series,4,137,263,1281140,2024-09-26
141,spotify:track:4uK0M8AI6gyFmyzUneQpbi,"A.R. Rahman, Arijit Singh, Shashaa Tirupati","Rait Zara Si (From ""Atrangi Re"")",T-Series,12,139,138,1278337,2024-09-26
142,spotify:track:1feANd8EfcDP5UqSvbheM3,"Sachet Tandon, Sachet-Parampara","Bekhayali (From ""Kabir Singh"")",T-Series,1,157,246,1273749,2024-09-26
143,spotify:track:32765xcLM1fd6wQIpkN9A0,"Ami Mishra, Kunaal Vermaa",Hasi - Male Version,Sony Music Entertainment India Pvt. Ltd.,77,140,65,1269695,2024-09-26
144,spotify:track:6qtszUy5n1os6eLP337zZK,"A.R. Rahman, Dhanush","Adangaatha Asuran (From ""Raayan"")",Sun Pictures,16,104,10,1260292,2024-09-26
145,spotify:track:3hRV0jL3vUpRrcy398teAU,Lord Huron,The Night We Met,Play It Again Sam,126,144,14,1257463,2024-09-26
146,spotify:track:5Tkf5CbtVYHA1SiKo1NrJE,"Sachin-Jigar, Arijit Singh, Amitabha Bhattacharya","Phir Aur Kya Chahiye (From ""Zara Hatke Zara Bachke"")",Saregama,1,150,70,1256557,2024-09-26
147,spotify:track:4kaLkst9lT3sQ5Crgxs3ic,"Ayushmann Khurrana, Rochak Kohli",Pani Da Rang - Male Vocals,Eros Now Music,68,151,31,1252162,2024-09-26
148,spotify:track:6RUA84fCWd7hqtmofzU6l3,"Nakash Aziz, AKASA, Anirudh Ravichander","Daavudi (From ""Devara Part 1"")",T-Series,148,181,2,1243689,2024-09-26
149,spotify:track:2fsBaSK1551VvUD9Uvbb9Q,"Darshan Raval, Prakriti Giri",Tu Hai,Warner Music India,47,148,21,1240642,2024-09-26
150,spotify:track:7G5wpuR61ABrT7R1snos7C,"Pritam, Arijit Singh",Kalank - Title Track,Zee Music Company,5,143,248,1238819,2024-09-26
151,spotify:track:5W7DOVGQLTigu09afW7QMT,Sidhu Moose Wala,295,Sidhu Moose Wala,1,147,137,1238806,2024-09-26
152,spotify:track:1hQia6rxgfM1ly2hE3StWp,"Vishal-Shekhar, Shekhar Ravjiani, Salim Merchant, Neeti Mohan",Ishq Wala Love,Sony Music Entertainment India Pvt. Ltd.,100,166,73,1236171,2024-09-26
153,spotify:track:7Imk0IG6S5GA5iYWkjmMW5,"Palak Muchhal, Arijit Singh","Chahun Main Ya Naa (From ""Aashiqui 2"")",T-Series,108,154,50,1231847,2024-09-26
154,spotify:track:6GQK4G5o60E8YA18DGpAzv,Harshit Saxena,Hale Dil,T-Series,98,164,8,1229073,2024-09-26
155,spotify:track:209QxKVJzh2FLUmZHpYs4m,"Badshah, Karan Aujla, Hiten",God Damn,Universal Music India Pvt Ltd.,15,169,27,1225513,2024-09-26
156,spotify:track:5KNuHsIeFtD0oukst77hBi,Roop Kumar Rathod,Maula Mere Maula,Saregama,156,159,10,1217529,2024-09-26
157,spotify:track:72vuBPMhwFNlSYpTSf6fVD,"Diljit Dosanjh, Sia, Greg Kurstin",Hass Hass,Warner Music India,5,149,44,1216793,2024-09-26
158,spotify:track:6vuMdb0E8buJeSHArN3dXk,"Amaal Mallik, Armaan Malik, Kunaal Vermaa","Chale Aana (From ""De De Pyaar De"")",T-Series,18,180,110,1211749,2024-09-26
159,spotify:track:72CkpVdvmc8t28o8I9N32J,"Atif Aslam, Manoj Muntashir",Tere Sang Yaara,Zee Music Company,150,195,14,1211162,2024-09-26
160,spotify:track:1fcCPXmH4vUzG6UQTTjZp5,"Mithoon, Arijit Singh, Shashaa Tirupati",Phir Bhi Tumko Chaahunga,Zee Music Company,160,-1,5,1208211,2024-09-26
161,spotify:track:1YMLgvsQdE27r30q0fsLeV,Arijit Singh,Tera Fitoor,Tips Industries Ltd,61,190,64,1203774,2024-09-26
162,spotify:track:2iNqdCchlUZEgjJbQyZf8T,"Kailash Kher, Paresh Kamath, Naresh Kamath",Teri Deewani,Sony Music Entertainment India Pvt. Ltd.,162,196,9,1194595,2024-09-26
163,spotify:track:4brSaQIT3bnnE41D042fgL,Ankit Tiwari,Tu Hai Ki Nahi,T-Series,163,-1,2,1194115,2024-09-26
164,spotify:track:7tI8dRuH2Yc6RuoTjxo4dU,Jimin,Who,BIGHIT MUSIC,61,176,10,1185354,2024-09-26
165,spotify:track:2ZD4aIEepqZsdxPxLSuUhm,"Pritam, Arijit Singh, Amitabh Bhattacharya, Nikhita Gandhi",Tere Pyaar Mein,T-Series,5,141,85,1182949,2024-09-26
166,spotify:track:2dMlTWQbY9tfPFLIqAa7Tv,Kaifi Khalil,Kahani Meri,Novice Records LLC,64,188,20,1181718,2024-09-26
167,spotify:track:0ojpEubhy4JNeVftmVuiN7,"Vishal Mishra, Armaan Malik",Pehla Pyaar,T-Series,11,171,174,1180099,2024-09-26
168,spotify:track:0dJacN6K3mSGLE9p7QE0lO,KK,"Beete Lamhein (From ""The Train"")",T-Series,75,186,25,1179667,2024-09-26
169,spotify:track:4BTPzhEsyW3blWcxcuhLM0,"Shankar-Ehsaan-Loy, Shankar Mahadevan, Caralisa Monteiro, Shafqat Amanat Ali",Mitwa,Sony Music Entertainment India Pvt. Ltd.,169,191,9,1178356,2024-09-26
170,spotify:track:4r8JqkhpTb5tzSKKHnVJIJ,"Vishal-Shekhar, Mohit Chauhan, Shekhar Ravjiani, Shruti Pathak",Tujhe Bhula Diya,T-Series,170,173,7,1173280,2024-09-26
171,spotify:track:6IR6mzRO60hnMjNoq8rCPE,"Raghav, Tanishk Bagchi, Asees Kaur","Teri Baaton Mein Aisa Uljha Jiya Title Song (From ""Teri Baaton Mein Aisa Uljha Jiya"")",T-Series,5,160,34,1173154,2024-09-26
172,spotify:track:11qnwt18ZckPqchzK2I3U7,"Mithoon, Arijit Singh, Sayeed Quadri",Dil Jhoom,Zee Music Company,93,165,33,1172780,2024-09-26
173,spotify:track:0TrsGqtFXMWCrF9pPMICY9,"Jyoti Nooran, Jaani, Bunny",Paon Ki Jutti,Universal Music India Pvt Ltd. – Distribution,8,156,18,1171358,2024-09-26
174,spotify:track:7AAap8D4C4pTyNoMkM9vjG,"Shankar-Ehsaan-Loy, Diljit Dosanjh",Ishq Di Baajiyaan,Sony Music Entertainment India Pvt. Ltd.,153,168,9,1170632,2024-09-26
175,spotify:track:54PRUdMOYzglMGnsg9kIta,"Raghav Chaitanya, Manoj Muntashir, Pritam","Hua Main (From ""ANIMAL"")",T-Series,6,167,50,1165213,2024-09-26
176,spotify:track:6rFckZb1cuJYzsZiGHgqks,"Karan Aujla, Ikky",52 Bars,Rehaan Records,12,-1,18,1161039,2024-09-26
177,spotify:track:3ygfdwvBJ2Y5XhJiiHFFZE,Sachet Tandon,Maiyya Mainu,Zee Music Company,5,174,99,1160890,2024-09-26
178,spotify:track:2S6N9pbnkhQRyAx80HmF79,Mohammed Irfan,"Banjaara (From ""Ek Villain"")",T-Series,146,163,32,1155452,2024-09-26
179,spotify:track:6b2WJDzGt5X8dYfpkWtvXW,"Anirudh Ravichander, Ramajogayya Sastry","Fear Song (From ""Devara Part 1"") [Telugu]",T-Series,170,199,6,1154237,2024-09-26
180,spotify:track:6EB454nVg2u6sbeCvWAPej,"Sam C.S., Anirudh Ravichander, Shakthisree Gopalan","Yaanji - From ""Vikram Vedha""",Think Music,122,177,43,1151668,2024-09-26
181,spotify:track:5BQePe9rcCJozHK3oPayYk,Shubh,MVP,Shubh,24,145,20,1150703,2024-09-26
182,spotify:track:0YxKKO272sacGBJKjf6FnB,"Jaani, B Praak",Saari Duniya Jalaa Denge,T-Series,3,158,44,1150598,2024-09-26
183,spotify:track:5O932cZmzOZGOGZz9RHx20,"Pritam, Arijit Singh",Khairiyat,T-Series,1,162,263,1146822,2024-09-26
184,spotify:track:6GH5qLVhOvbgRvqFdAKQ9a,"Thalapathy Vijay, Yuvan Shankar Raja, Madan Karky","Whistle Podu (From ""The Greatest Of All Time"")",T-Series,141,142,3,1144414,2024-09-26
185,spotify:track:1BpvuKIG7jK5EiTp2tv5z8,Shubh,King Shit,SHUBH,5,153,38,1138257,2024-09-26
186,spotify:track:1zzejMGRYKP5XOa3FmzXfa,Sai Abhyankkar,"Katchi Sera - From ""Think Indie""",Think Music,6,136,34,1138070,2024-09-26
187,spotify:track:6RUKPb4LETWmmr3iAEQktW,"The Chainsmokers, Coldplay",Something Just Like This,Disruptor Records/Columbia,84,-1,65,1133228,2024-09-26
