rank,uri,artist_names,track_name,source,peak_rank,previous_rank,weeks_on_chart,streams,End Date
188,spotify:track:3hB9lDLyAClYVZivMMl20N,Prateek Kuhad,Co2,Elektra (NEK),177,183,5,1232462,2024-10-24
189,spotify:track:4uK0M8AI6gyFmyzUneQpbi,"A.R. Rahman, Arijit Singh, Shashaa Tirupati","Rait Zara Si (From ""Atrangi Re"")",T-Series,12,193,142,1231786,2024-10-24
190,spotify:track:1wnozUBSe7OMpmZiTPJC5j,"A.R. Rahman, Javed Ali, KIRTI SAGATHIA, Pooja AV",Tum Tak,Sony Music Entertainment India Pvt. Ltd.,167,167,3,1230177,2024-10-24
191,spotify:track:72CkpVdvmc8t28o8I9N32J,"Atif Aslam, Manoj Muntashir",Tere Sang Yaara,Zee Music Company,150,-1,16,1228956,2024-10-24
192,spotify:track:51DEaelXeJJ6cFFYbX8Hal,"Javed-Mohsin, Vishal Mishra, Shreya Ghoshal",Zihaal e Miskin,Universal Music India Pvt Ltd.,7,-1,53,1223392,2024-10-24
193,spotify:track:7igpahReLzGbhI2XiokrXQ,Rasraj Ji Maharaj,Hanuman Chalisa (Lo-fi),Shubham Audio Video,193,-1,1,1219159,2024-10-24
194,spotify:track:5W7DOVGQLTigu09afW7QMT,Sidhu Moose Wala,295,Sidhu Moose Wala,1,175,141,1206110,2024-10-24
195,spotify:track:0dJacN6K3mSGLE9p7QE0lO,KK,"Beete Lamhein (From ""The Train"")",T-Series,75,197,29,1203633,2024-10-24
196,spotify:track:0rk2X5TAhraBC5aCIXK2Rq,"Jawad Ahmad, Shaarib Toshi, Arijit Singh, Shreya Ghoshal",Samjhawan,Sony Music Entertainment India Pvt. Ltd.,70,-1,178,1202831,2024-10-24
197,spotify:track:1hQia6rxgfM1ly2hE3StWp,"Vishal-Shekhar, Shekhar Ravjiani, Salim Merchant, Neeti Mohan",Ishq Wala Love,Sony Music Entertainment India Pvt. Ltd.,100,160,77,1202634,2024-10-24
198,spotify:track:1feANd8EfcDP5UqSvbheM3,"Sachet Tandon, Sachet-Parampara","Bekhayali (From ""Kabir Singh"")",T-Series,1,176,250,1202424,2024-10-24
199,spotify:track:54PbBpquVfhfrwRwvjSXbI,"Charlie Puth, Selena Gomez",We Don't Talk Anymore (feat. Selena Gomez),Artist Partner,77,198,121,1196970,2024-10-24
200,spotify:track:5DgY6Ab0vpyUMKnY9ubFOF,"Anirudh Ravichander, Super Subu",Hukum - Thalaivar Alappara,Sun Pictures,1,166,66,1194609,2024-10-24
