rank,uri,artist_names,track_name,source,peak_rank,previous_rank,weeks_on_chart,streams,End Date
1,spotify:track:5QVHNa0ppJUOoqSd36ovQS,"Arijit Singh, B Praak, Jaani","Pachtaoge (From ""Jaani Ve"")",T-Series,1,1,4,1058238,2019-09-19
2,spotify:track:6v3KW9xbzN5yKLt9YKDYA2,"Shawn Mendes, Camila Cabello",Señorita,Island Records,1,2,13,908712,2019-09-19
3,spotify:track:2Fv2injs4qAm8mJBGaxVKU,"Arijit Singh, Mithoon","Tujhe Kitna Chahne Lage (From ""Kabir Singh"")",T-Series,2,3,16,720417,2019-09-19
5,spotify:track:3ZjMdVOWxQ53FKrmkgCv95,"Sachet Tandon, Dhvani Bhanushali, Tanishk Bagchi","Psycho Saiyaan (From ""Saaho"")",T-Series,3,4,11,591463,2019-09-19
6,spotify:track:0WdbnNKO0Jt4BZACSDQh44,"Vishal-Shekhar, Arijit Singh, Shilpa Rao, Kumaar","Ghungroo (From ""War"")",YRF Music,6,6,2,560153,2019-09-19
7,spotify:track:5djZm1zFGcJUSUqbBjrAZH,"Neha Kakkar, Tulsi Kumar, B Praak","O Saki Saki (From ""Batla House"")",T-Series,2,5,10,544940,2019-09-19
8,spotify:track:1feANd8EfcDP5UqSvbheM3,"Sachet Tandon, Sachet-Parampara","Bekhayali (From ""Kabir Singh"")",T-Series,1,8,17,509460,2019-09-19
10,spotify:track:6SNFuJXjkgauo3Kg9XJcj6,DIVINE,Kohinoor,Universal Music India Pvt Ltd.,10,-1,1,466781,2019-09-19
11,spotify:track:2IoZMG3RqiTmsy7Li3zGFg,"Sachet Tandon, Parampara Tandon, Sachet-Parampara","Mere Sohneya (From ""Kabir Singh"")",T-Series,4,12,15,453229,2019-09-19
12,spotify:track:4OcvkkpF3xmyCGGY5IBlgi,"Akhil Sachdeva, Tulsi Kumar","Tera Ban Jaunga (From ""Kabir Singh"")",T-Series,4,14,14,452544,2019-09-19
13,spotify:track:2tjWCe2W7sgvS3C8NHcdtI,"Akhil, Dhvani Bhanushali, Kunaal Vermaa, Abhijit Vaghani","Duniyaa (From ""Luka Chuppi"")",T-Series,1,13,30,436624,2019-09-19
14,spotify:track:21jGcNKet2qwijlDFuPiPb,Post Malone,Circles,Republic Records,9,9,3,413232,2019-09-19
15,spotify:track:1y1rQTkWmrZdJmjwuK07GC,"Vishal Mishra, Manoj Muntashir","Kaise Hua (From ""Kabir Singh"")",T-Series,5,16,14,389324,2019-09-19
16,spotify:track:5I3Xih0C2ID3fqngBrBbGv,"Badshah, Neeti Mohan","Bad Boy (From ""Saaho"")",T-Series,8,11,5,387325,2019-09-19
17,spotify:track:3NkJNL3WqO1Lqc3uNDxvCN,"Ariana Grande, Miley Cyrus, Lana Del Rey",Don’t Call Me Angel (Charlie’s Angels) (with Miley Cyrus & Lana Del Rey),Silver Cloud/Charlie's Angels,17,-1,1,355839,2019-09-19
18,spotify:track:6vBdBCoOhKHiYDDOcorfNo,"Post Malone, Young Thug",Goodbyes (feat. Young Thug),Republic Records,7,15,11,349993,2019-09-19
20,spotify:track:7LzouaWGFCy4tkXDOOnEyM,Camila Cabello,Liar,Syco Music/Epic,20,32,2,315785,2019-09-19
21,spotify:track:0RiRZpuVRbi7oqRdSMwhQY,"Post Malone, Swae Lee",Sunflower - Spider-Man: Into the Spider-Verse,Republic Records,3,20,30,311872,2019-09-19
24,spotify:track:3sqRODOZ1Z6hR4F2tnFAlg,Maninder Buttar,Sakhiyaan,Ishtar Punjabi,21,26,30,291161,2019-09-19
25,spotify:track:6NLzzwFbAD1imLXGBMj9jo,"The Doorbeen, Shreya Sharma",PRADA,Jjust Music,15,19,6,290539,2019-09-19
26,spotify:track:6aPMWbbdhDhiJHlknZb9Yx,"Arijit Singh, Sachet-Parampara","Bekhayali (Arijit Singh Version) [From ""Kabir Singh""]",T-Series,7,25,16,285696,2019-09-19
27,spotify:track:0mJTAdmY8olbGQjopDYff3,"Dhvani Bhanushali, Nikhil D'Souza, Tanishk Bagchi",Vaaste,T-Series,3,29,24,283358,2019-09-19
28,spotify:track:6vuMdb0E8buJeSHArN3dXk,"Amaal Mallik, Armaan Malik, Kunaal Vermaa","Chale Aana (From ""De De Pyaar De"")",T-Series,18,27,20,275920,2019-09-19
29,spotify:track:4gyPGtExOjj1rsByKW33LR,Badshah,Paagal,Sony Music Entertainment India Pvt. Ltd.,12,24,10,274291,2019-09-19
30,spotify:track:7hADNKBDHS8MblpUzLebLf,"Anirudh Ravichander, Inno Genga","Hoyna Hoyna (From ""Gang Leader"")",Sony Music Entertainment India Pvt. Ltd.,30,66,5,274007,2019-09-19
31,spotify:track:6V9fHiv84WlVTg7CSnIVY2,Halsey,Graveyard,Capitol Records,31,-1,1,269683,2019-09-19
32,spotify:track:05mDaV9Vb3wrzjF6OPZnhq,Post Malone,Saint-Tropez,Republic Records,28,28,2,262537,2019-09-19
33,spotify:track:1z0A545pZMaqYRkruladlk,"Garry Sandhu, Neha Kakkar, Mellow D","Hauli Hauli (From ""De De Pyaar De"")",T-Series,15,30,21,259476,2019-09-19
34,spotify:track:39ujbBjTwwqUFySaCYDMMT,"Badshah, Diljit Dosanjh, Aastha Gill",Proper Patola,Sony Music Entertainment India Pvt. Ltd.,18,34,30,257789,2019-09-19
35,spotify:track:3UYiU57SMiAS5LqolhHJw1,Camila Cabello,Shameless,Syco Music/Epic,18,18,2,257259,2019-09-19
36,spotify:track:04UzZSWfw8hkK832P27QLq,"Nikk, Avneet Kaur",Yaari,BANG Music,18,31,11,254351,2019-09-19
37,spotify:track:7sWRlDoTDX8geTR8zzr2vt,Post Malone,Hollywood's Bleeding,Republic Records,23,23,2,251439,2019-09-19
38,spotify:track:1LMwOxNStAp24Py3mWoRkb,"Shweta Mohan, Shankar Mahadevan, Shankar-Ehsaan-Loy","Baby Won't You Tell Me (From ""Saaho"")",T-Series,16,22,4,233455,2019-09-19
39,spotify:track:7KhHA3mzt7A3LFlOJEAKpI,"Alan Walker, Sabrina Carpenter, Farruko",On My Way,Kreatell Music,1,37,27,232860,2019-09-19
41,spotify:track:1bvIoSekCZWAgthW01kbo9,"Jasbir Jassi, Badshah, Dhvani Bhanushali","Koka (From ""Khandaani Shafakhana"")",T-Series,13,35,12,231725,2019-09-19
42,spotify:track:40S8Et5fYlBCa0QgBTEOE1,"Guru Randhawa, Tulsi Kumar","Enni Soni (From ""Saaho"")",T-Series,26,33,7,231059,2019-09-19
43,spotify:track:7qEHsqek33rTcFNT9PFqLf,Lewis Capaldi,Someone You Loved,Vertigo Berlin,40,47,21,226383,2019-09-19
44,spotify:track:6wo37KVqFJhtuxPTpLCcfe,"The Chainsmokers, ILLENIUM, Lennon Stella",Takeaway,Disruptor Records/Columbia,20,45,8,221986,2019-09-19
45,spotify:track:5G7pZ8G8NFvS1MQ9H4L7dC,"Javed-Mohsin, Arijit Singh, Shreya Ghoshal, Kunaal Vermaa, Prashant Ingole",Pal,Sony Music Entertainment India Pvt. Ltd.,45,48,30,217129,2019-09-19
46,spotify:track:6b2RcmUt1g9N9mQ3CbjX2Y,Sam Smith,How Do You Sleep?,PLG - Capitol,37,44,9,216394,2019-09-19
47,spotify:track:2Fxmhks0bxGSBdJ92vM42m,Billie Eilish,bad guy,Darkroom/Interscope Records,3,52,25,214024,2019-09-19
48,spotify:track:0ojpEubhy4JNeVftmVuiN7,"Vishal Mishra, Armaan Malik",Pehla Pyaar,T-Series,11,49,13,213930,2019-09-19
49,spotify:track:322tcqPhma7F6hfCeLisx0,"Lauv, Anne-Marie","fuck, i'm lonely",Lauv,24,39,7,212261,2019-09-19
50,spotify:track:5X5db3FrBOHbibrFKA02MQ,"Abhijeet Srivastava, Vishal-Shekhar","Chashni (From ""Bharat"")",T-Series,24,40,20,212056,2019-09-19
52,spotify:track:2YpeDb67231RjR0MgVLzsG,"Lil Nas X, Billy Ray Cyrus",Old Town Road (feat. Billy Ray Cyrus) - Remix,Columbia,2,41,24,207194,2019-09-19
53,spotify:track:0mHU8dcIvGrGDazLMmQpSg,Jubin Nautiyal,Tujhe Kitna Chahein Aur (Film Version),T-Series,12,58,13,201133,2019-09-19
54,spotify:track:6qajA2wXvAI4HMey8b1JVK,"Badshah, Tulsi Kumar, Abhijeet, Chandra Dixit","Sheher Ki Ladki (From ""Khandaani Shafakhana"")",T-Series,20,42,11,199447,2019-09-19
55,spotify:track:4bKkdGBttnK4SYjT4zPC1U,"Tony Kakkar, Neha Kakkar, Young Desi","Coca Cola (From ""Luka Chuppi"")",T-Series,14,50,30,191078,2019-09-19
56,spotify:track:2P91MQbaiQOfbiz9VqhqKQ,Lauv,I Like Me Better,Lauv,30,61,30,189785,2019-09-19
57,spotify:track:1dGr1c8CrMLDpV6mPbImSI,Taylor Swift,Lover,Taylor Swift,9,36,5,188109,2019-09-19
58,spotify:track:5p7ujcrUXASCNwRaWNHR1C,Halsey,Without Me,Capitol Records,11,60,30,187865,2019-09-19
59,spotify:track:5wdlz4N7s1Xyr4y4RXhZJM,"Karan Sehmbi, Tanishk Bagchi, Goldboy","Photo (From ""Luka Chuppi"")",T-Series,15,53,30,187279,2019-09-19
60,spotify:track:5O932cZmzOZGOGZz9RHx20,"Pritam, Arijit Singh",Khairiyat,T-Series,60,105,2,185192,2019-09-19
61,spotify:track:6cARnc9YVlBNigjNSX63pp,"Neha Kakkar, Dhvani Bhanushali, Ikka","Dilbar (From ""Satyameva Jayate"")",T-Series,28,51,30,183981,2019-09-19
62,spotify:track:57DhVYA7E1CyrE4OKuyLb7,Maninder Buttar,Ik Tera,Ishtar Punjabi,47,55,4,183271,2019-09-19
63,spotify:track:0Iz4CkptElGHo16r797Jsb,"Atif Aslam, Nusrat Fateh Ali Khan, Rochak Kohli","Dekhte Dekhte (From ""Batti Gul Meter Chalu"")",T-Series,39,59,30,183034,2019-09-19
64,spotify:track:51Fjme0JiitpyXKuyQiCDo,"Y2K, bbno$",Lalala,Columbia,64,72,11,181959,2019-09-19
65,spotify:track:39vrbjCMTRXEdiIr2IsBgd,Badshah,She Move It Like,Sony Music Entertainment India Pvt. Ltd.,14,62,30,180802,2019-09-19
67,spotify:track:0pqnGHJpmpxLKifKRmU6WP,Imagine Dragons,Believer,Kid Ina Korner / Interscope,52,64,30,178643,2019-09-19
68,spotify:track:4At0CnQes5Kx1ROSnnP4lK,Tony Kakkar,Dheeme Dheeme,Desi Music Factory,20,57,16,175442,2019-09-19
70,spotify:track:0Ryd8975WihbObpp5cPW1t,"Ariana Grande, Social House",boyfriend (with Social House),Republic Records,12,67,7,171769,2019-09-19
72,spotify:track:1aIhAX6324JZmhNnGltwkK,Arijit Singh,"Tera Yaar Hoon Main (From ""Sonu Ke Titu Ki Sweety"")",T-Series,61,74,29,167338,2019-09-19
74,spotify:track:3YVQHUpNexOqkLI7IclsoT,Darshan Raval,Hawa Banke,Indie Music Label,26,68,9,164247,2019-09-19
75,spotify:track:6YmRRCqSd6n4Qd3ziRfPSc,"Yo Yo Honey Singh, Malkit Singh",Gur Nalo Ishq Mitha - The Yoyo Remake,T-Series,36,65,8,164094,2019-09-19
76,spotify:track:1ZaeaGLhFSckG8sv1y7AWk,"Harrdy Sandhu, Jaani",Kya Baat Ay,Sony Music Entertainment India Pvt. Ltd.,42,83,30,162941,2019-09-19
77,spotify:track:7BKLCZ1jbUBVqRi2FVlTVw,"The Chainsmokers, Halsey",Closer,Disruptor Records/Columbia,59,94,30,161515,2019-09-19
79,spotify:track:7CZyCXKG6d5ALeq41sLzbw,"Post Malone, Ozzy Osbourne, Travis Scott",Take What You Want (feat. Ozzy Osbourne & Travis Scott),Republic Records,71,71,2,160687,2019-09-19
80,spotify:track:7AFASza1mXqntmGtbxXprO,XXXTENTACION,changes,"Bad Vibes Forever, LLC",80,180,7,160428,2019-09-19
81,spotify:track:2C6WXnmZ66tHhHlnvwePiK,"Post Malone, Halsey, Future",Die For Me (feat. Future & Halsey),Republic Records,56,56,2,159129,2019-09-19
83,spotify:track:6osaMSJh9NguagEDQcZaKx,"DJ Snake, J Balvin, Tyga",Loco Contigo (feat. J. Balvin & Tyga),DJ Snake Music Productions Limited,28,91,14,156369,2019-09-19
84,spotify:track:68iBMrMRc1rg4eAxJbvxch,"Tanishk Bagchi, Dhvani Bhanushali, Rashmi Virag",Leja Re,T-Series,60,100,30,155811,2019-09-19
86,spotify:track:4ymPEyiXabTe1NO8q8EFxG,"Darshan Raval, Asees Kaur, Lijo George-Dj Chetas","Chogada (From ""Loveyatri"")",T-Series,55,89,30,155586,2019-09-19
87,spotify:track:1mjWhM7GQTTxJxg2F0iCRS,"Armaan Malik, Rochak Kohli, Bappi Lahiri","Dil Mein Ho Tum (From ""Cheat India"")",T-Series,60,79,30,154043,2019-09-19
88,spotify:track:7yEuRloGyxyu1KaWBTPP1Z,"Shreya Ghoshal, Nakash Aziz, Vishal-Shekhar","Slow Motion (From ""Bharat"")",T-Series,23,84,21,153880,2019-09-19
89,spotify:track:0cWLJcdvM6QlOQ7UJdB4jb,"Ash King, Sachin-Jigar","Nazar Na Lag Jaaye (From ""Stree"")",T-Series,77,87,29,152278,2019-09-19
90,spotify:track:2si0ZNx4yRbggTvrIom8A2,"Rochak Kohli, Atif Aslam, Tulsi Kumar",Paniyon Sa,T-Series,68,76,29,152272,2019-09-19
92,spotify:track:0H2iJVgorRR0ZFgRqGUjUM,"Pritam, Arijit Singh",Channa Mereya,Sony Music Entertainment India Pvt. Ltd.,58,93,30,151320,2019-09-19
93,spotify:track:790uNrqzKWCvj8rR1QXNpU,"Neha Kakkar, Mika Singh, Kumar Sanu","Aankh Marey (From ""Simmba"")",T-Series,14,81,30,150859,2019-09-19
94,spotify:track:2bT1PH7Cw3J9p3t7nlXCdh,Shawn Mendes,If I Can't Have You,Island Records,1,86,20,149934,2019-09-19
95,spotify:track:6ocbgoVGwYJhOv1GgI9NsF,Ariana Grande,7 rings,Republic Records,1,98,30,149390,2019-09-19
96,spotify:track:6sTbnkzOtPpojgnn50cCHJ,"Ankit Tiwari, Dhvani Bhanushali","Rula Diya (From ""Batla House"")",T-Series,53,88,8,147908,2019-09-19
97,spotify:track:1000nHvUdawXuUHgBod4Wv,Lil Nas X,Panini,Columbia,26,136,11,147694,2019-09-19
99,spotify:track:5r7k55M31Q22AEJkF1GTyw,"Ammy Virk, Sonam Bajwa",Wang Da Naap,Ishtar Punjabi,54,80,18,145982,2019-09-19
100,spotify:track:6RnFfNQik3Cq6vrmifPMlA,"Neha Kakkar, Maninder Buttar",Sorry Song,Desi Music Factory,19,82,10,145191,2019-09-19
101,spotify:track:698ItKASDavgwZ3WjaWjtz,Alan Walker,Faded,Kreatell Music,47,99,30,144793,2019-09-19
102,spotify:track:0e7ipj03S05BNilyu5bRzt,"Post Malone, 21 Savage",rockstar (feat. 21 Savage),Republic Records,43,95,30,144686,2019-09-19
103,spotify:track:5MnAi6ZF7cE8pAz7wYr9Ta,"Vishal-Shekhar, Atif Aslam, Irshad Kamil",Dil Diyan Gallan,YRF Music,92,92,27,144586,2019-09-19
104,spotify:track:05dYneZZZ2mytSmnsvzFoW,Anirudh Ravichander,Gangu Leader,Sony Music Entertainment India Pvt. Ltd.,104,-1,1,144507,2019-09-19
105,spotify:track:4f5kLqyOJ5ZPnalEVMQrB2,"Rahat Fateh Ali Khan, Asees Kaur, Tanishk Bagchi","Tere Bin (From ""Simmba"")",T-Series,26,96,30,144233,2019-09-19
106,spotify:track:22vgEDb5hykfaTwLuskFGD,Jonas Brothers,Sucker,Jonas Brothers Recording,1,101,29,141513,2019-09-19
107,spotify:track:1SNiXDwSilLujcYdvfqVpT,"The Chainsmokers, Bebe Rexha",Call You Mine,Disruptor Records/Columbia,15,109,16,140803,2019-09-19
108,spotify:track:3QGsuHI8jO1Rx4JWLUh9jd,Shawn Mendes,Treat You Better,Island Records,49,102,30,140005,2019-09-19
109,spotify:track:0a6zRnrjmaOcqsEIFkXIhw,Akhil,Khaab,Crown Records,106,106,28,139890,2019-09-19
110,spotify:track:0Xek5rqai2jcOWCYWJfVCF,"Post Malone, DaBaby",Enemies (feat. DaBaby),Republic Records,77,77,2,139427,2019-09-19
112,spotify:track:2dpaYNEQHiRxtZbfNsse99,"Marshmello, Bastille",Happier,Joytime Collective,17,110,30,137679,2019-09-19
113,spotify:track:0rk2X5TAhraBC5aCIXK2Rq,"Jawad Ahmad, Shaarib Toshi, Arijit Singh, Shreya Ghoshal",Samjhawan,Sony Music Entertainment India Pvt. Ltd.,70,116,30,137410,2019-09-19
114,spotify:track:1vBE1z8mudo2Oob531MabR,"Tanishk Bagchi, Zahrah S Khan",Khud Se Zyada,Universal Music India Pvt Ltd.,44,118,4,136631,2019-09-19
115,spotify:track:0oukMLKedsqQ3ltnI2daRO,"QARAN, Ash King",Haaye Oye (feat. Ash King),Sony Music Entertainment India Pvt. Ltd.,74,108,22,136080,2019-09-19
116,spotify:track:6Kynli1iHBqJRWUCohcV9h,DIVINE,Kaam 25 - Sacred Games,Netflix India Originals LLC,66,141,25,134781,2019-09-19
117,spotify:track:7cFuzwgbtHXmSKuCzo0qCW,"The Doorbeen, Ragini",Lamberghini,Times Music,12,104,30,134376,2019-09-19
118,spotify:track:6bdpj89aYEBjhpsenXAsmO,"A.R. Rahman, Arijit Singh",Enna Sona,Sony Music Entertainment India Pvt. Ltd.,34,103,30,134355,2019-09-19
119,spotify:track:1zB4vmk8tFRmM9UULNzbLB,Imagine Dragons,Thunder,Kid Ina Korner / Interscope,70,128,30,132593,2019-09-19
120,spotify:track:5x3K3Ld54TtkYKdQvrFOV3,"Guru Randhawa, Neha Kakkar","Morni Banke (From ""Badhaai Ho"")",T-Series,27,112,30,132314,2019-09-19
121,spotify:track:6N5WkgPIDoTdbCXyyIIKAv,Zaeden,tere bina,Universal Music India Pvt Ltd.,69,69,2,131773,2019-09-19
122,spotify:track:0l6g8Z8mqGbGXFOjigYetD,"Pritam, Arijit Singh",Hawayein,Sony Music Entertainment India Pvt. Ltd.,51,115,30,131138,2019-09-19
123,spotify:track:0lYBSQXN6rCTvUZvg9S0lU,"DJ Snake, Justin Bieber",Let Me Love You,DJ Snake Def Jam,109,127,30,129026,2019-09-19
124,spotify:track:4pBxb7WuLsC3YyA9cj4T2l,"Guru Randhawa, Pitbull, DJ BLACKOUT, Dj Money Willz",Slowly Slowly,T-Series,29,111,22,127912,2019-09-19
125,spotify:track:62RXe5I6L7n32fUMd8Puvo,Shreya Ghoshal,Yeh Aaina,T-Series,10,124,13,127342,2019-09-19
126,spotify:track:0F7FA14euOIX8KcbEturGH,Lil Nas X,Old Town Road,Columbia,13,142,28,127047,2019-09-19
127,spotify:track:1rfofaqEpACxVEHIZBJe6W,"Camila Cabello, Young Thug",Havana (feat. Young Thug),Syco Music/Epic,86,131,30,126910,2019-09-19
128,spotify:track:7fa9MBXhVfQ8P8Df9OEbD8,"Maroon 5, Cardi B",Girls Like You (feat. Cardi B) - Cardi B Version,Interscope Records*,39,122,30,126831,2019-09-19
129,spotify:track:7yy3HgKJEcwArL5k0v5rhF,"Guru Randhawa, Benny Dayal, Sachin-Jigar","Crazy Habibi Vs Decent Munda (From ""Arjun Patiala"")",T-Series,37,107,11,126341,2019-09-19
130,spotify:track:6wZJsut8fjiWiMPaccRAOX,Ritviz,Udd Gaye,Ritviz,81,146,30,126248,2019-09-19
132,spotify:track:7FGq80cy8juXBCD2nrqdWU,"benny blanco, Halsey, Khalid",Eastside (with Halsey & Khalid),Friends Keep Secrets/Interscope Records,25,133,30,125357,2019-09-19
133,spotify:track:26wLOs3ZuHJa2Ihhx6QIE6,5 Seconds of Summer,Teeth,UMGRI Interscope,88,113,4,124937,2019-09-19
134,spotify:track:12V0iduYsoXxsQYTSeFB2H,Jass Manak,Viah,GEET MP3,67,130,23,124435,2019-09-19
135,spotify:track:6EOKwHETwSkZ9gW2b6ASE0,Lil Tecca,Ransom,Republic Records,66,123,11,124415,2019-09-19
136,spotify:track:7E4sdzJDrVMu8qcwyxz3vP,"Tanishk Bagchi, Jubin Nautiyal",Sawarne Lage,Sony Music Entertainment India Pvt. Ltd.,136,154,12,123288,2019-09-19
137,spotify:track:3ExeNEpJJQXfmq1cwj0LVo,"Amit Trivedi, Shellee, Ammy Virk, Shahid Mallya",Daryaa,Eros Now Music,116,150,29,122882,2019-09-19
138,spotify:track:7heMX7gyHP0mhTlNgd7Lxd,"A.R. Rahman, Badshah, Tanishk Bagchi, Shashaa Tirupati, Jubin Nautiyal",The Humma Song,Sony Music Entertainment India Pvt. Ltd.,29,132,30,122645,2019-09-19
139,spotify:track:1UWacd8x8tPPwmrPB1MoBI,"Pritam, Arijit Singh",Ae Dil Hai Mushkil Title Track,Sony Music Entertainment India Pvt. Ltd.,105,125,30,122636,2019-09-19
140,spotify:track:3RFNUexrtXExkzTEiJ0eBh,Arjun Kanungo,Woh Baarishein,Universal Music India Pvt Ltd.,74,121,13,122618,2019-09-19
141,spotify:track:6QPFWNUw9iGFZAXgqecunp,"Pritam, TUSHAR JOSHI","Woh Din (From ""Chhichhore"")",T-Series,105,120,3,121018,2019-09-19
142,spotify:track:7aiClxsDWFRQ0Kzk5KI5ku,blackbear,hot girl bummer,Alamo,142,-1,1,120006,2019-09-19
143,spotify:track:6fScgF2Y63ScU73nYju0ny,"Atif Aslam, Arko",O Saathi,T-Series,58,140,30,118073,2019-09-19
144,spotify:track:499rs8fMaltXk2BOlq9P0m,"Guru Randhawa, Tulsi Kumar, Haricharan","Ye Chota Nuvvunna (From ""Saaho"") (feat. Tulsi Kumar, Haricharan Seshadri)",T-Series,63,90,7,117814,2019-09-19
145,spotify:track:2mwBSO58y92EYmEFpDfmS7,"Guru Randhawa, Arjun",Suit Suit,T-Series,50,143,30,117477,2019-09-19
146,spotify:track:6RRNNciQGZEXnqk8SQ9yv5,Taylor Swift,You Need To Calm Down,Taylor Swift,2,117,14,116758,2019-09-19
148,spotify:track:7FMvOZMzbhKWBvwNCOByvc,"Anirudh Ravichander, Sid Sriram","Ninnu Chuse Anandamlo (From ""Gang Leader"")",Sony Music Entertainment India Pvt. Ltd.,148,-1,1,115238,2019-09-19
149,spotify:track:7xQAfvXzm3AkraOtGPWIZg,Post Malone,Wow.,Republic Records,6,85,30,114970,2019-09-19
150,spotify:track:0KoiMHhqKLoL4xM54rcWYY,"DJ Snake, Selena Gomez, Ozuna, Cardi B","Taki Taki (feat. Selena Gomez, Ozuna & Cardi B)",DJ Snake Music Productions Limited,29,138,30,114784,2019-09-19
151,spotify:track:1MhHomaXgrPMBroXkpWSSa,"Amrita Singh, Ankit Tiwari, Asees Kaur, Ash King, Atif Aslam, Badshah, Dhvani Bhanushali, Guru Randhawa, Himesh Reshammiya, Jubin Nautiyal, Karan Sehmbi, Neha Kakkar, Palak Muchhal, Sachin-Jigar, Shruti Pathak, Sunidhi Chauhan, Tony Kakkar, Rashmi Virag, Kedrock, Sd Style",Valentine's Mashup 2019,T-Series,66,148,11,114322,2019-09-19
152,spotify:track:1y4jsQt7MjnZhiD1L6qFBC,Sub Urban,Cradles,NCS,53,134,19,112736,2019-09-19
153,spotify:track:5icOoE6VgqFKohjWWNp0Ac,"Marshmello, CHVRCHES",Here With Me,Marshmello/Republic,6,158,28,112596,2019-09-19
154,spotify:track:5n8BCU2JmPORrFboGeDlXV,"Guru Randhawa, Nikhita Gandhi, Sachin-Jigar","Main Deewana Tera (From ""Arjun Patiala"")",T-Series,27,135,12,111792,2019-09-19
155,spotify:track:4hQ6UGyWQIGJmHSo0J88JW,Selena Gomez,Back To You - From 13 Reasons Why – Season 2 Soundtrack,UMGRI Interscope,66,152,30,111644,2019-09-19
156,spotify:track:4e9dIemIXO8Tzg0k4aWujk,"Pritam, Arijit Singh, Nikhita Gandhi","Raabta (Title Track) [From ""Raabta""]",T-Series,140,151,3,111613,2019-09-19
157,spotify:track:5sul5AkWmzi2fE70oS7mK9,Arijit Singh,"Ik Vaari Aa (From ""Raabta"")",T-Series,70,149,26,110752,2019-09-19
158,spotify:track:5cjVsWqIkBQC7acTRhL0RO,"Aastha Gill, Sachin Sanghvi, Jigar Saraiya, Divya Kumar",Kamariya,T-Series,85,156,30,110730,2019-09-19
159,spotify:track:1fzAokzOONl4XEPUFoammu,"Alka Yagnik, Arijit Singh","Agar Tum Saath Ho (From ""Tamasha"")",T-Series,116,165,16,110186,2019-09-19
160,spotify:track:0lks2Kt9veMOFEAPN0fsqN,"Alan Walker, K-391, Emelie Hollow",Lily,Kreatell Music,88,139,26,110164,2019-09-19
161,spotify:track:28w9HJdplcvHhwwRIbcoKY,"Sachet Tandon, Sachin-Jigar","Sachiya Mohabbatan (From ""Arjun Patiala"")",T-Series,16,145,10,109699,2019-09-19
162,spotify:track:5SVpD60u9vjoQ2OeoKsTkb,"Badshah, Asees Kaur, Jubin Nautiyal",Akh Lad Jaave,T-Series,44,160,30,108959,2019-09-19
163,spotify:track:6RUKPb4LETWmmr3iAEQktW,"The Chainsmokers, Coldplay",Something Just Like This,Disruptor Records/Columbia,84,161,30,108671,2019-09-19
164,spotify:track:5KawlOMHjWeUjQtnuRs22c,"BTS, Halsey",Boy With Luv (feat. Halsey),BIGHIT MUSIC,1,144,23,108214,2019-09-19
165,spotify:track:44O26Gv1wQrlUj14PpTolM,"Sunidhi Chauhan, Divya Kumar, Amit Trivedi","Halka Halka (From ""Fanney Khan"")",T-Series,154,168,10,108139,2019-09-19
166,spotify:track:7COXchtUOMd6uIT6HvmRaI,"Lauv, Troye Sivan",i'm so tired...,Lauv,7,157,30,107982,2019-09-19
167,spotify:track:6YhDs8isyaiVECBSViAFDS,"A.R. Rahman, Vijay","Verithanam (From ""Bigil"")",Sony Music Entertainment India Pvt. Ltd.,122,126,3,107474,2019-09-19
168,spotify:track:3jtKSUiVDowKNBqVQbWaig,"Amit Trivedi, Kavita Seth, Amitabh Bhattacharya",Iktara,Sony Music Entertainment India Pvt. Ltd.,73,164,23,106963,2019-09-19
169,spotify:track:5a8j5OD7qFql7c8Buy8dm6,"Nora Fatehi, Rayvanny",Pepeta,Nora Fatehi,169,-1,1,106098,2019-09-19
170,spotify:track:0tBbt8CrmxbjRP0pueQkyU,"Selena Gomez, Marshmello",Wolves,Selena Gomez PS,57,167,30,103598,2019-09-19
171,spotify:track:3SJVCbBFTxR6UvvTWRNbMp,Diljit Dosanjh,Jind Mahi,Diljit Dosanjh,105,182,24,103483,2019-09-19
172,spotify:track:0OfaueVeRebAfWsAHajj3z,Darshan Raval,Tera Zikr,Sony Music Entertainment India Pvt. Ltd.,172,194,7,102918,2019-09-19
173,spotify:track:3NKuSd9Qa5fzwhqiuKYFh4,"Yo Yo Honey Singh, Simar Kaur, Ishers","Dil Chori (From ""Sonu Ke Titu Ki Sweety"")",T-Series,85,169,30,102773,2019-09-19
174,spotify:track:44ADyYoY5liaRa3EOAl4uf,Miley Cyrus,Slide Away,RCA/Legacy,162,162,4,102508,2019-09-19
175,spotify:track:0u2P5u6lvoDfwTYjAADbn4,"Billie Eilish, Khalid",lovely (with Khalid),Darkroom,67,173,30,102208,2019-09-19
176,spotify:track:42WGQxg2lPIFBt8ZRHQ4Q4,"Mithoon, Atif Aslam, Armaan Malik, Arijit Singh, Amaal Mallik, Salman Khan, Mohit Chauhan, Yo Yo Honey Singh, Ankit Tiwari, Sonu Nigam, Neeti Mohan, Sabri Brothers, Tulsi Kumar, Rashmi Virag, Dj Chetas",Romantic Mashup 2,T-Series,176,185,4,101513,2019-09-19
177,spotify:track:6qCNaRRr5xJALfNJvh0NAw,"Zack Knight, Jasmin Walia",Bom Diggy Diggy,T-Series,132,174,27,101195,2019-09-19
178,spotify:track:4bD9z9qa4qg9BhryvYWB7c,"Pritam, Tochi Raina, Rekha Bhardwaj",Kabira,T-Series,117,188,19,99938,2019-09-19
179,spotify:track:1sy3urvLEBQdQZyRZkXOLC,"Meet Bros., Mika Singh, Jyotica Tangri",Dhagala Lagali,Zee Music Company,139,147,3,99798,2019-09-19
180,spotify:track:6HGoVbCUr63SgU3TjxEVj6,Imran Khan,Satisfya,Ik Records,180,-1,1,99713,2019-09-19
181,spotify:track:6XHVuErjQ4XNm6nDPVCxVX,"Chris Brown, Drake",No Guidance (feat. Drake),Chris Brown Entertainment/RCA Records,67,175,12,99574,2019-09-19
183,spotify:track:0Bz7dfqPY4JOGZO3O1j8Wh,"Pritam, Amit Mishra, Shilpa Rao",Bulleya,Sony Music Entertainment India Pvt. Ltd.,167,179,13,99163,2019-09-19
184,spotify:track:2m8P30Ly9Az1uGvFmhLTBI,Neha Kakkar,"Gali Gali (From ""Kgf Chapter 1"")",T-Series,104,172,26,99132,2019-09-19
185,spotify:track:6yIdwnpDHufLWgQcveTPMk,"ZAYN, Taylor Swift",I Don’t Wanna Live Forever (Fifty Shades Darker),"Big Machine Records, LLC",44,181,30,99064,2019-09-19
186,spotify:track:1j4kHkkpqZRBwE0A4CN4Yv,"ZAYN, Sia",Dusk Till Dawn (feat. Sia) - Radio Edit,RCA Records Label,63,189,26,97624,2019-09-19
187,spotify:track:5aA9HqRPZHROKWrO5RczTm,Darshan Raval,Kaash Aisa Hota,Indie Music Label,83,177,26,97562,2019-09-19
189,spotify:track:6fxVffaTuwjgEk5h9QyRjy,Ed Sheeran,Photograph,Atlantic Records UK,75,190,29,97434,2019-09-19
190,spotify:track:1WSGTYKLEpKfNQYYW5Oymt,"benny blanco, Selena Gomez, J Balvin, Tainy","I Can’t Get Enough (benny blanco, Selena Gomez, J Balvin, Tainy)",NEON16/Friends Keep Secrets/Interscope Records,2,193,30,95754,2019-09-19
191,spotify:track:1ozrNv9W4KlprAmvgH0Yrq,Guru Randhawa,"High Rated Gabru (From ""Nawabzaade"")",T-Series,107,183,30,95203,2019-09-19
192,spotify:track:342pJxy678kgQrZXCL9RG7,Yo Yo Honey Singh,Urvashi,T-Series,121,197,25,94749,2019-09-19
193,spotify:track:1gl8BBFdMRrgb3P7Jz5JQT,Guri,Nira Ishq,GEET MP3,63,192,27,94066,2019-09-19
194,spotify:track:6SRWhUJcD2YKahCwHavz3X,"Alan Walker, Au/Ra, Tomine Harket",Darkside,Kreatell Music,60,196,30,93516,2019-09-19
195,spotify:track:1aUfggX5E0nKDikNuiDQ3D,Guru Randhawa,Ishq Tera,T-Series,195,-1,1,93224,2019-09-19
197,spotify:track:0rIAC4PXANcKmitJfoqmVm,Normani,Motivation,Keep Cool/RCA Records,188,-1,2,92107,2019-09-19
198,spotify:track:2Rk4JlNc2TPmZe2af99d45,"Taylor Swift, Brendon Urie, Panic! At The Disco",ME! (feat. Brendon Urie of Panic! At The Disco),Taylor Swift,1,187,21,91906,2019-09-19
199,spotify:track:3Oe3VdPn6rAueriQvFhCBA,"Garry Sandhu, Jasmine Sandlas",Illegal Weapon,Fresh Media Records,149,-1,8,91237,2019-09-19
