rank,uri,artist_names,track_name,source,peak_rank,previous_rank,weeks_on_chart,streams,End Date
1,spotify:track:7yDHHVKLbvDmVw1XXhDDIO,"Vishal Mishra, Raj Shekhar",Pehle Bhi Main,T-Series,1,1,7,9456893,2024-01-18
2,spotify:track:0TL0LFcwIBF5eX7arDIKxY,Anuv Jain,Husn,Universal Music India Pvt. Ltd. (on behalf of Anuv Jain),2,2,7,9068287,2024-01-18
3,spotify:track:3yHyiUDJdz02FZ6jfUbsmY,"Arijit Singh, Shreyas Puranik, Siddharth - Garima","Satranga (From ""ANIMAL"")",T-Series,2,3,12,7664671,2024-01-18
4,spotify:track:3zSSCPpLZ5Oc8nelhhGjKz,AUR,Tu hai kahan,Sony Music Entertainment,1,4,14,6190868,2024-01-18
5,spotify:track:1BpvuKIG7jK5EiTp2tv5z8,Shubh,King Shit,SHUBH,5,10,2,5336691,2024-01-18
6,spotify:track:6bmmHeCvZI92pRiTHxEdTC,"Pritam, Arijit Singh, Irshad Kamil",O Maahi,T-Series,5,5,5,5196579,2024-01-18
7,spotify:track:3xMHXmedL5Rvfxmiar9Ryv,"Anirudh Ravichander, Arijit Singh, Shilpa Rao, Kumaar",Chaleya,T-Series,1,6,23,5134550,2024-01-18
8,spotify:track:5ZLkihi6DVsHwDL3B8ym1t,Shubh,One Love,SHUBH,3,8,22,4901006,2024-01-18
9,spotify:track:4ApCig0GTR4IEp7Ijsyo3r,"Manan Bhardwaj, Bhupinder Babbal",Arjan Vailly,T-Series,1,7,9,4153008,2024-01-18
10,spotify:track:5PUXKVVVQ74C3gl5vKy9Li,"Jasleen Royal, Arijit Singh, Dulquer Salmaan",Heeriye (feat. Arijit Singh),Warner Music India,1,11,25,3723314,2024-01-18
11,spotify:track:0YxKKO272sacGBJKjf6FnB,"Jaani, B Praak",Saari Duniya Jalaa Denge,T-Series,3,9,8,3595267,2024-01-18
12,spotify:track:54PRUdMOYzglMGnsg9kIta,"Raghav Chaitanya, Manoj Muntashir, Pritam","Hua Main (From ""ANIMAL"")",T-Series,6,12,14,3271348,2024-01-18
13,spotify:track:4eBvRhTJ2AcxCsbfTUjoRp,Shubh,Cheques,SHUBH,1,13,34,3136759,2024-01-18
14,spotify:track:1hA697u7e1jX2XM8sWA6Uy,"Sachin-Jigar, Arijit Singh, Amitabh Bhattacharya",Apna Bana Le,Zee Music Company,1,14,30,3126594,2024-01-18
15,spotify:track:6c4Po8zyQjB4cR5XgLhcGb,"Prabh Singh, Jay Trak, Rooh Sandhu",9:45,Prabh Singh Official,9,16,28,2991592,2024-01-18
16,spotify:track:0UZLaEOSIc5kg0cc7eszqC,Vishal Mishra,Manjha,Desi Music Factory,16,18,86,2984696,2024-01-18
17,spotify:track:5BBB2PDgDWi6NBECj0wJiA,"Savi Kahlon, The Masterz",Apa Fer Milaangey,Single Track Studios,17,22,3,2867619,2024-01-18
18,spotify:track:35FFqjqaPv1Fr9B1GtJdZO,"Harshavardhan Rameshwar, Choir","Abrar’s Entry | Jamal Kudu (From ""ANIMAL"")",T-Series,8,17,6,2772909,2024-01-18
19,spotify:track:0Jiaz0O4AqnJICa9PxHhaR,Darshan Raval,Mahiye Jinna Sohna,Warner Music India,2,15,30,2743673,2024-01-18
20,spotify:track:0YQJoDL6f46J0n1rOVkpxJ,"Karan Aujla, Ikky",Softly,WM Canada,4,20,22,2706158,2024-01-18
21,spotify:track:4UMIv5jd9gK98a39BQRD9X,"Pritam, Arijit Singh, Amitabh Bhattacharya",Kesariya,Sony Music Entertainment India Pvt. Ltd.,1,19,79,2657783,2024-01-18
22,spotify:track:2pIoyDWZV5OSW0xd6n41xV,"Pritam, Arijit Singh, Swanand Kirkire, IP Singh",Lutt Putt Gaya,T-Series,22,31,8,2635441,2024-01-18
23,spotify:track:4H1FLy4H7nS9wy9gg9JeFQ,"Santhosh Narayanan, Dhvani Kailas, Vivek","Unakku Thaan - From ""Chithha""",Think Music,11,33,6,2601894,2024-01-18
24,spotify:track:72vuBPMhwFNlSYpTSf6fVD,"Diljit Dosanjh, Sia, Greg Kurstin",Hass Hass,Warner Music India,5,23,12,2576150,2024-01-18
25,spotify:track:0645eBDehHcqfiF15hscQV,"Vishal Mishra, Rashmeet Kaur","Janiye (from the Netflix Film ""Chor Nikal Ke Bhaga"")",Netflix Music,5,21,28,2536810,2024-01-18
26,spotify:track:73K33p4Vyz9koXGqmL5eFs,"Sachet Tandon, Parampara Tandon, Kumaar, Sachet-Parampara",Malang Sajna,T-Series,4,26,52,2474047,2024-01-18
27,spotify:track:26elzgFl8tvajnDfeoY1YF,"Darshan Raval, Prakriti Kakar",Mannat,Warner Music India,21,25,6,2411757,2024-01-18
28,spotify:track:1418IuVKQPTYqt7QNJ9RXN,King,Maan Meri Jaan,Warner Music India,1,24,66,2359071,2024-01-18
29,spotify:track:38h4tmH1AWBVuemWAy4R4y,"Pritam, Arijit Singh, Shreya Ghoshal, Amitabh Bhattacharya","Tum Kya Mile, Pt. 2",Saregama India Ltd,9,28,29,2328574,2024-01-18
30,spotify:track:3bQsp4Vr9Rg4fNCx6HPOgX,Anuv Jain,Alag Aasmaan,Universal Music India Pvt. Ltd. (on behalf of Anuv Jain),30,32,18,2317415,2024-01-18
31,spotify:track:1y1rQTkWmrZdJmjwuK07GC,"Vishal Mishra, Manoj Muntashir","Kaise Hua (From ""Kabir Singh"")",T-Series,5,30,240,2309559,2024-01-18
32,spotify:track:4u0D2jZ20wQaEMHBSqsDnZ,King,Tu Jaana Na Piya,Warner Music India,15,27,12,2265557,2024-01-18
33,spotify:track:5Tkf5CbtVYHA1SiKo1NrJE,"Sachin-Jigar, Arijit Singh, Amitabha Bhattacharya","Phir Aur Kya Chahiye (From ""Zara Hatke Zara Bachke"")",Saregama,1,34,34,2253064,2024-01-18
34,spotify:track:3F3ZuXYFXGM1V6pk3b3zmi,"Diljit Dosanjh, thiarajxtt",Kinni Kinni,DILJIT DOSANJH,25,35,10,2226998,2024-01-18
35,spotify:track:7iekl4P95GuphG8x8a3cNT,"Pritam, Arijit Singh, Jonita Gandhi, Ranveer Singh, Amitabh Bhattacharya",What Jhumka ?,Saregama India Ltd,6,29,27,2185292,2024-01-18
36,spotify:track:3WLJ7D5kh44K5eJ1NqZQ6W,Anuv Jain,Baarishein,Universal Music India Pvt. Ltd. (on behalf of Anuv Jain),18,37,140,2179338,2024-01-18
37,spotify:track:4thOONDx78zsY8sHGfU1M2,Shubh,You and Me,SHUBH,37,50,2,2160188,2024-01-18
38,spotify:track:2FCXQHugkoHE1K3tiDu8pu,"Alka Yagnik, Arijit Singh","Agar Tum Saath Ho (From ""Tamasha"")",T-Series,4,38,242,2128265,2024-01-18
39,spotify:track:7CVw4gVPpH1TPQttQGVmhZ,"Karun, Lambo Drive, Arpit Bala, ReVo LEKHAK",Maharani,TEESRI DUNIYA,39,39,6,2085499,2024-01-18
40,spotify:track:6oz1L5jcqZWYuId7nxvIan,Shubh,Still Rollin,SHUBH,4,44,35,2023963,2024-01-18
41,spotify:track:2ZD4aIEepqZsdxPxLSuUhm,"Pritam, Arijit Singh, Amitabh Bhattacharya, Nikhita Gandhi",Tere Pyaar Mein,T-Series,5,40,50,2007861,2024-01-18
42,spotify:track:0hY9eA74QrMCJuWEx7fo9y,"Thaman S, Sri Krishna, Sahithi Chaganti, Mahesh Babu, Saraswati Putra Ramajogayya Sastry","Kurchi Madathapetti (From ""Guntur Kaaram"")(Telugu)",Aditya Music,42,108,2,2001037,2024-01-18
43,spotify:track:4VsP4Dm8gsibRxB5I2hEkw,Kaifi Khalil,Kahani Suno 2.0,1944121 Records DK,1,42,57,1996721,2024-01-18
44,spotify:track:0rMeOAvbQZ2RTG4B6L1M4p,Darshan Raval,Asal Mein,Indie Music Label,21,36,138,1983977,2024-01-18
45,spotify:track:7e2dvR0ySx1bBJRDxVJiG1,AUR,Shikayat,Sony Music Entertainment,43,43,3,1935262,2024-01-18
46,spotify:track:3nKQrVVlwbAQSnFbgZWdN0,"Avvy Sra, Karan Aujla, Jaani",White Brown Black,Universal Music India Pvt Ltd. – Distribution,29,51,57,1918887,2024-01-18
47,spotify:track:1smFN2CLqGROu0J0UyvDfL,"Pritam, Arijit Singh",Shayad,Sony Music Entertainment India Pvt. Ltd.,1,57,209,1821372,2024-01-18
48,spotify:track:610keNiNVTIkYD0CqeSerg,"Cheema Y, Gur Sidhu",California Love,Brown Town Music,27,55,34,1813280,2024-01-18
49,spotify:track:0xIuPDzJSnJywALez8dwKR,AP Dhillon,With You,Mass Appeal India,2,46,23,1805233,2024-01-18
50,spotify:track:3dpM3ijJz0vGzbkh5DcMXz,"Payal Dev, Vishal Mishra, A.M. Turaz","Naseeb Se (From ""Satyaprem Ki Katha"")",T-Series,44,48,33,1795215,2024-01-18
51,spotify:track:6H7fLdt0AeWpuxUKXuXWrx,Hariharan,Shree Hanuman Chalisa,T-Series,39,45,75,1784380,2024-01-18
52,spotify:track:2q9lPN7CT92W1Ry77j2acn,"Pritam, Arijit Singh, Shreya Ghoshal, Shadab Faridi, Altamash Faridi, Amitabh Bhattacharya",Ve Kamleya,Saregama India Ltd,32,41,23,1782744,2024-01-18
53,spotify:track:6GZIAVSu0YXF7FYzyRl1MP,"Sachin-Jigar, Varun Jain, Shadab Faridi, Altamash Faridi, Amitabh Bhattacharya","Tere Vaaste (From ""Zara Hatke Zara Bachke"")",Saregama,1,52,34,1762776,2024-01-18
54,spotify:track:3NwmvlTYDZPRBGDMGgJH8K,Shubh,Safety Off,SHUBH,54,100,2,1747280,2024-01-18
55,spotify:track:4blqlsA1uf2d2I40E90EUC,"Pritam, Arijit Singh, Shilpa Rao","Tere Hawaale (From ""Laal Singh Chaddha"")",T-Series,11,49,47,1746364,2024-01-18
56,spotify:track:0n2LpEAixGBWK8mwUSGtGb,Sunanda Sharma,Chandigarh Ka Chokra,Warner Music / Sky Digital JV,56,58,5,1743943,2024-01-18
57,spotify:track:7eQl3Yqv35ioqUfveKHitE,"Pritam, Mohit Chauhan, Irshad Kamil",Tum Se Hi,T-Series,27,61,200,1719572,2024-01-18
58,spotify:track:6A2ZwOsMeomTIVhLvfXngC,Shubh,No Love,SHUBH,2,68,97,1706246,2024-01-18
59,spotify:track:4wIWWEhbdgKAxhR68eE0Ye,"Arijit Singh, Chinmayi","Mast Magan (From ""2 States"")",T-Series,45,47,152,1696260,2024-01-18
60,spotify:track:0snQrp1VaY5Pj1YIHRJpRJ,Aditya A,Chaand Baaliyan,Sony Music Entertainment India Pvt. Ltd.,2,54,100,1694532,2024-01-18
61,spotify:track:3yV2c3cYhkAwSsxAq6nRiv,Gajendra Verma,Mann Mera,Sony Music / Eros Now Music,26,56,146,1686639,2024-01-18
62,spotify:track:2oenSXLDbWVaaL7QjSGYj5,"Diljit Dosanjh, Intense, Sultaan",Lalkara,DILJIT DOSANJH,22,67,15,1642643,2024-01-18
63,spotify:track:5XeFesFbtLpXzIVDNQP22n,Arctic Monkeys,I Wanna Be Yours,Domino Recording Co,48,66,62,1615801,2024-01-18
64,spotify:track:2Fv2injs4qAm8mJBGaxVKU,"Arijit Singh, Mithoon","Tujhe Kitna Chahne Lage (From ""Kabir Singh"")",T-Series,2,64,242,1610051,2024-01-18
65,spotify:track:53QrRlALFJfZgdcGLKwy5s,Shubh,Dior,SHUBH,65,96,28,1605187,2024-01-18
66,spotify:track:4uK0M8AI6gyFmyzUneQpbi,"A.R. Rahman, Arijit Singh, Shashaa Tirupati","Rait Zara Si (From ""Atrangi Re"")",T-Series,12,59,102,1603418,2024-01-18
67,spotify:track:5G7pZ8G8NFvS1MQ9H4L7dC,"Javed-Mohsin, Arijit Singh, Shreya Ghoshal, Kunaal Vermaa, Prashant Ingole",Pal,Sony Music Entertainment India Pvt. Ltd.,34,53,254,1598293,2024-01-18
68,spotify:track:0FBQ4NrrHUbR9kus7rzrOj,Atif Aslam,Dil Diyan Gallan,YRF Music,65,65,205,1596730,2024-01-18
69,spotify:track:2PvaburAUlhNHxVhw5lvOq,Arijit Singh,"Humdard (From ""Ek Villain"")",T-Series,28,60,183,1586672,2024-01-18
70,spotify:track:5BKKKNwrebowaMoUdBaNby,King,Tu Aake Dekhle,Warner Music India,3,62,155,1583176,2024-01-18
71,spotify:track:24MMjyA3NLqCsDJfsn51eg,"Sharn, The Paul",Mi Amor,Desi Avenue,7,63,53,1581753,2024-01-18
72,spotify:track:23y8MwhdvbSalGitHeokpk,Anirudh Ravichander,Badass,Sony Music Entertainment India Pvt. Ltd.,4,99,16,1579946,2024-01-18
73,spotify:track:2vPrBucKCfKmafHhSfJ2pt,"Pritam, Arijit Singh, Amitabh Bhattacharya, Charan","Pyaar Hota Kayi Baar Hai (From ""Tu Jhoothi Main Makkaar"")",T-Series,9,71,49,1577534,2024-01-18
74,spotify:track:5aMLADD1Ho6Ogq8s8mIzB9,"Sachet-Parampara, Sachet Tandon, Parampara Tandon, Manoj Muntashir","Ram Siya Ram (From ""Adipurush"")",T-Series,11,85,33,1565326,2024-01-18
75,spotify:track:42TMa2hgBNjte4uV7jNCnQ,"Shubh, Ikky",Baller,SHUBH,2,86,71,1551476,2024-01-18
76,spotify:track:6JP8RinqsLkPiBi7B0VLGJ,"Savi Kahlon, The Masterz",Apa Fer Milaange,Single Track Studios,76,152,2,1544225,2024-01-18
77,spotify:track:5DgY6Ab0vpyUMKnY9ubFOF,"Anirudh Ravichander, Super Subu",Hukum - Thalaivar Alappara,Sun Pictures,1,87,27,1536809,2024-01-18
78,spotify:track:2rOnSn2piaqLAlYjtfUBlY,"Tanishk Bagchi, Jubin Nautiyal, Asees Kaur","Raataan Lambiyan (From ""Shershaah"")",Sony Music Entertainment India Pvt. Ltd.,1,72,129,1534744,2024-01-18
79,spotify:track:5W7DOVGQLTigu09afW7QMT,Sidhu Moose Wala,295,Sidhu Moose Wala,1,75,101,1527378,2024-01-18
80,spotify:track:13ZISM2bmrMBCRlMzl669x,"Anirudh Ravichander, Vijay, Asal Kolaar",Naa Ready,Sony Music Entertainment India Pvt. Ltd.,4,92,30,1514024,2024-01-18
81,spotify:track:3HiobOOpSpMsi95WBKPBYk,"Jeet Gannguli, Arijit Singh",Hamari Adhuri Kahani (Title Track),Sony Music Entertainment India Pvt. Ltd.,56,74,114,1507255,2024-01-18
82,spotify:track:7MXVkk9YMctZqd1Srtv4MB,"The Weeknd, Daft Punk",Starboy,Universal Republic Records,12,90,129,1505659,2024-01-18
83,spotify:track:0tgVpDi06FyKpA1z0VMD4v,Ed Sheeran,Perfect,Atlantic Records UK,29,80,196,1497662,2024-01-18
84,spotify:track:48Ix6ReYdJf2H4mKb3TIpj,"Atif Aslam, Alisha Chinai, Pritam",Tera Hone Laga Hoon,Tips Industries Ltd,59,83,140,1493662,2024-01-18
85,spotify:track:5rpCUsEfBLIumvrxrahnKF,"Hasan Raheem, Umair, Talwiinder",Wishes,1698613 Records DK2,70,70,6,1482098,2024-01-18
86,spotify:track:1UWacd8x8tPPwmrPB1MoBI,"Pritam, Arijit Singh",Ae Dil Hai Mushkil Title Track,Sony Music Entertainment India Pvt. Ltd.,79,89,207,1467010,2024-01-18
87,spotify:track:4OcvkkpF3xmyCGGY5IBlgi,"Akhil Sachdeva, Tulsi Kumar","Tera Ban Jaunga (From ""Kabir Singh"")",T-Series,4,77,227,1465982,2024-01-18
88,spotify:track:0ojpEubhy4JNeVftmVuiN7,"Vishal Mishra, Armaan Malik",Pehla Pyaar,T-Series,11,82,138,1462271,2024-01-18
89,spotify:track:0gPgdRfB4jdGrlyXS0Vx78,"Vishal-Shekhar, KK, Shilpa Rao, Anvita Dutt Guptan",Khuda Jaane,YRF Music,37,78,67,1462186,2024-01-18
90,spotify:track:7ouBSPZKQpm7zQz2leJXta,Arijit Singh,"Tum Hi Ho (From ""Aashiqui 2"")",T-Series,44,81,155,1456118,2024-01-18
91,spotify:track:6ygiy70ujkNOYXM1tQuMNe,"Karan Aujla, Ikky, Preston Pablo",Admirin' You (feat. Preston Pablo),WM Canada,24,84,24,1452606,2024-01-18
92,spotify:track:4afA2YQlZfYzJbfnNoNknK,"Jubin Nautiyal, Payal Dev, Manoj Muntashir",Mere Ghar Ram Aaye Hain,T-Series,65,114,9,1447599,2024-01-18
93,spotify:track:0rlLBWFFTQiOWi963SH9bb,The Local Train,Choo Lo,The Local Train,78,93,30,1444468,2024-01-18
94,spotify:track:0l6g8Z8mqGbGXFOjigYetD,"Pritam, Arijit Singh",Hawayein,Sony Music Entertainment India Pvt. Ltd.,51,79,119,1432769,2024-01-18
95,spotify:track:3iFYJMrRS0fLrwDNVbqNF0,Darshan Raval,Saajan Ve,Warner Music India,95,95,2,1429476,2024-01-18
96,spotify:track:3wz2vWhYnnBoFmgMkqtzLy,"Chani Nattan, Inderpal Moga",Daku,Kharku Life Records,5,98,74,1412120,2024-01-18
97,spotify:track:2IoZMG3RqiTmsy7Li3zGFg,"Sachet Tandon, Parampara Tandon, Sachet-Parampara","Mere Sohneya (From ""Kabir Singh"")",T-Series,4,88,196,1410663,2024-01-18
98,spotify:track:04ChFQZCKl2yRcvc0VR7qN,"Denny, Rahul Mishra, Kunaal Vermaa",Chale Jaana Phir (Humko Tere Bina),For The Record Music,14,131,28,1396663,2024-01-18
99,spotify:track:72zHuDxFQTjbL51qJQSA7j,"Jasleen Royal, B Praak, Romy, Anvita Dutt","Ranjha (From ""Shershaah"")",Sony Music Entertainment India Pvt. Ltd.,1,97,128,1392204,2024-01-18
100,spotify:track:2A4lcqTJZgUs1XrW6TSvt0,"Rajat Nagpal, Yasser Desai, Rana Sotal",Hum Toh Deewane,PlayDMF,50,76,16,1381749,2024-01-18
101,spotify:track:0CtZpaOhtzvLV3FfcsVpQo,"Vishal-Shekhar, Shilpa Rao, Caralisa Monteiro, Vishal Dadlani, Shekhar Ravjiani, Kumaar","Besharam Rang (From ""Pathaan"")",YRF Music,4,91,58,1373125,2024-01-18
102,spotify:track:4VosVUajzm6nzGlSb6nP3L,"Parmish Verma, Paradox",Check It Out,SDA Studios,19,102,27,1370147,2024-01-18
103,spotify:track:51DEaelXeJJ6cFFYbX8Hal,"Javed-Mohsin, Vishal Mishra, Shreya Ghoshal",Zihaal e Miskin,Universal Music India Pvt Ltd.,7,73,34,1369319,2024-01-18
104,spotify:track:6WzRpISELf3YglGAh7TXcG,"The Weeknd, Playboi Carti, Madonna",Popular (with Playboi Carti & Madonna) - From The Idol Vol. 1 (Music from the HBO Original Series),XO / Republic Records,104,113,14,1352517,2024-01-18
105,spotify:track:32765xcLM1fd6wQIpkN9A0,"Ami Mishra, Kunaal Vermaa",Hasi - Male Version,Sony Music Entertainment India Pvt. Ltd.,97,103,29,1346916,2024-01-18
106,spotify:track:6mTvwBzWTGDOVeCNQEqtOE,"Amaal Mallik, Arijit Singh, Tulsi Kumar",Soch Na Sake,T-Series,64,101,55,1334564,2024-01-18
107,spotify:track:32VAw8DL9ixX5XSW2VLcZ4,"Parmish Verma, PARDHAAN, Desi Crew",Aam Jahe Munde,Parmish Verma Films,29,105,28,1330308,2024-01-18
108,spotify:track:29m79w9xPMH4YCD6r8JSmV,"AP Dhillon, Gurinder Gill, Intense",Excuses,RUN-UP RECORDS,1,107,117,1316011,2024-01-18
109,spotify:track:6ivemTXTn27PwVjtd0oqDs,Anuv Jain,Gul,Universal Music India Pvt. Ltd. (on behalf of Anuv Jain),76,104,38,1295901,2024-01-18
110,spotify:track:5DezAsjtSLUxW9j00eh0Ia,"Santhosh Narayanan, Dhee, Vivek","Maamadura - From ""Jigarthanda DoubleX""",Think Music,39,138,10,1294532,2024-01-18
111,spotify:track:1dkTPBQqSnQ15GIMPY8W7l,"lusttqwe, jesp, bexter",Jeena Jeena,Finest Music,37,181,130,1294503,2024-01-18
112,spotify:track:6udC4b4jOSnHb9ItnXgKLR,"Sachin-Jigar, Shreya Ghoshal, Tochi Raina",Saibo,Sony Music Entertainment India Pvt. Ltd.,31,69,168,1293805,2024-01-18
113,spotify:track:2AilvPt1AQ8PixlCKqkjfj,Shubh,Elevated,SHUBH,27,164,107,1271866,2024-01-18
114,spotify:track:6wkHR8cU4INbp145hngbQO,"Sukha, Chani Nattan, Prodgk, Gurlez Akhtar",8 ASLE,SODHI MUSIC INC.,114,139,4,1254734,2024-01-18
115,spotify:track:7G5wpuR61ABrT7R1snos7C,"Pritam, Arijit Singh",Kalank - Title Track,Zee Music Company,5,109,212,1253721,2024-01-18
116,spotify:track:6FahmzZYKH0zb2f9hrVsvw,"Anirudh Ravichander, Nikhita Gandhi","Ordinary Person (From ""Leo"")",Sony Music Entertainment India Pvt. Ltd.,5,125,13,1250166,2024-01-18
117,spotify:track:0EH7sgeiFqDa3eS7ieW2zs,"Akon, Hamsika Iyer",Chammak Challo,T-Series,105,127,40,1248315,2024-01-18
118,spotify:track:03yKEFruN3BS2coglBtt2N,"Laddi Chahal, Parmish Verma, Gurlez Akhtar",Rubicon Drill,Parmish Verma Films,12,128,57,1239667,2024-01-18
119,spotify:track:7m4CgL81VVIHaaiSxyH922,Yo Yo Honey Singh,Desi Kalakaar,T-Series,13,117,17,1238308,2024-01-18
120,spotify:track:3ZGJhN4unVspOqpwGvUL2W,Diljit Dosanjh,Lemonade,DILJIT DOSANJH,26,106,77,1232485,2024-01-18
121,spotify:track:4bD9z9qa4qg9BhryvYWB7c,"Pritam, Tochi Raina, Rekha Bhardwaj",Kabira,T-Series,31,121,227,1220600,2024-01-18
122,spotify:track:2RgvvnMwtP0R2OkVZmFvnV,KK,"Ajab Si (From ""Om Shanti Om"")",T-Series,34,112,106,1219895,2024-01-18
123,spotify:track:2tjWCe2W7sgvS3C8NHcdtI,"Akhil, Dhvani Bhanushali, Kunaal Vermaa, Abhijit Vaghani","Duniyaa (From ""Luka Chuppi"")",T-Series,1,116,256,1218224,2024-01-18
124,spotify:track:5WXQbgwGwyauXOqswlEeQY,"Tanishk Bagchi, Arijit Singh, Asees Kaur","Bolna (From ""Kapoor & Sons (Since 1921)"")",Sony Music Entertainment India Pvt. Ltd.,101,124,47,1205100,2024-01-18
125,spotify:track:1knnSlcBlhlcNsQkGyVl9X,"Shiva Choudhary, Sapna Choudhary",Jale 2,Desi Geet,125,157,3,1203745,2024-01-18
126,spotify:track:3eSm4iAkLsn3BeggfiQOH9,"Gaurav Chatterji, Aasa Singh, Hansika Pareek, Hrishi Giridhar, Pratik Gangavane","Kaise Ab Kahein - From ""Gutar Gu""",Sikhya Entertainment Records,78,94,24,1194038,2024-01-18
127,spotify:track:6bdpj89aYEBjhpsenXAsmO,"A.R. Rahman, Arijit Singh",Enna Sona,Sony Music Entertainment India Pvt. Ltd.,34,120,141,1185162,2024-01-18
128,spotify:track:6FAYpZ4jve8vpvTwUvjK6H,"Vishal-Shekhar, Arijit Singh, Sukriti Kakar, Vishal Dadlani, Shekhar Ravjiani, Kumaar",Jhoome Jo Pathaan,YRF Music,3,118,56,1162605,2024-01-18
129,spotify:track:0czcoKJbJt08NqKrvSbbz7,"Pritam, Arijit Singh, Amitabh Bhattacharya","O Bedardeya (From ""Tu Jhoothi Main Makkaar"")",T-Series,1,122,45,1161056,2024-01-18
130,spotify:track:3jyqXdAjwqO3gFtjnYrbq9,"Darshan Raval, Rochak Kohli","Ek Ladki Ko Dekha Toh Aisa Laga (From ""Ek Ladki Ko Dekha Toh Aisa Laga"")",Saregama,59,149,61,1161040,2024-01-18
131,spotify:track:3wwLWFRLiReDf5AqgmAJwT,"Rito Riba, Rajat Nagpal, Rana Sotal",Heer Ranjha,PlayDMF,11,119,64,1160670,2024-01-18
132,spotify:track:6ZYxNjuAU9Vy3VtF6W1dtE,Shubh,We Rollin,SHUBH,10,132,112,1160069,2024-01-18
133,spotify:track:7mSzDKajY2wUtstQSLdzMK,"Mohit Chauhan, Rochak Kohli",Rang Lageya,Saregama,35,123,51,1159822,2024-01-18
134,spotify:track:6MZyrnqwsLnrWY5Gk0AyXg,Suzonn,Farq hai,Suzonn,60,158,19,1157088,2024-01-18
135,spotify:track:3mUkVsovIuscQlSoMhmAZt,"Madhur Sharma, Swapnil Tare, Nusrat Fateh Ali Khan",Kali Kali Zulfon Ke (Lo-Fi),T-Series,6,115,71,1153407,2024-01-18
136,spotify:track:6fScgF2Y63ScU73nYju0ny,"Atif Aslam, Arko",O Saathi,T-Series,58,133,77,1152790,2024-01-18
137,spotify:track:1feANd8EfcDP5UqSvbheM3,"Sachet Tandon, Sachet-Parampara","Bekhayali (From ""Kabir Singh"")",T-Series,1,134,210,1144227,2024-01-18
138,spotify:track:0H2iJVgorRR0ZFgRqGUjUM,"Pritam, Arijit Singh",Channa Mereya,Sony Music Entertainment India Pvt. Ltd.,58,140,208,1137165,2024-01-18
139,spotify:track:0GlMiCB4JQRIN6n9h7WkNi,Shubh,Hood Anthem,SHUBH,139,142,2,1134606,2024-01-18
140,spotify:track:3ygfdwvBJ2Y5XhJiiHFFZE,Sachet Tandon,Maiyya Mainu,Zee Music Company,5,153,68,1121187,2024-01-18
141,spotify:track:6f3ANRNQ8nCiPZ6VqXqq93,"Amaal Mallik, Armaan Malik, Rashmi Virag",Main Rahoon Ya Na Rahoon,T-Series,141,159,6,1120406,2024-01-18
142,spotify:track:5O932cZmzOZGOGZz9RHx20,"Pritam, Arijit Singh",Khairiyat,T-Series,1,135,228,1115805,2024-01-18
143,spotify:track:6V7UVqe8XnAS4WPdpaw5TK,"Asees Kaur, Stebin Ben",Tu Mile Dil Khile,Saregama,20,129,49,1111179,2024-01-18
144,spotify:track:5O2P9iiztwhomNh8xkR9lJ,One Direction,Night Changes,Syco Music,22,144,140,1108933,2024-01-18
145,spotify:track:28lvraTNIN8qiTpoIK7m8Z,"AP Dhillon, Shinda Kahlon",True Stories,Mass Appeal India,15,151,31,1102525,2024-01-18
146,spotify:track:2sT0eosuhBEkw8dz6qFxUo,"Anurag Saikia, Raghav Chaitanya, Raj Shekhar, Nikhita Gandhi",Aise Kyun,Netflix Music,126,126,4,1101490,2024-01-18
147,spotify:track:6cUOiOY5qh2FpIQWIYAd2h,"Pritam, Darshan Raval, Antara Mitra",Mehrama,Sony Music Entertainment India Pvt. Ltd.,10,137,164,1096858,2024-01-18
148,spotify:track:533hHUYw7BW8VVQ1o0IdTR,Swati Mishra,Ram Ayenge,Swati Mishra,81,143,3,1096136,2024-01-18
149,spotify:track:2eAvDnpXP5W0cVtiI0PUxV,Ruth B.,Dandelions,Columbia,14,145,112,1079682,2024-01-18
150,spotify:track:0tpwqQhdfJXRcUDSNRjb9O,"Arijit Singh, Neeti Mohan, Rashmi Virag","Mere Yaaraa (From ""Sooryavanshi"")",T-Series,20,130,88,1078270,2024-01-18
151,spotify:track:7CyPwkp0oE8Ro9Dd5CUDjW,"The Weeknd, JENNIE, Lily-Rose Depp","One Of The Girls (with JENNIE, Lily Rose Depp)",XO / Republic Records,151,185,2,1078145,2024-01-18
152,spotify:track:0NuWRfZRWzn1oc9piFhK9n,"MC SQUARE, Hiten",Laado,Sony Music Entertainment India Pvt. Ltd.,11,169,19,1073875,2024-01-18
153,spotify:track:0biCSADTAblvLTLtJz4pXO,"Vishal-Shekhar, Arijit Singh, Caralisa Monteiro, Jaideep Sahni",Nashe Si Chadh Gayi,YRF Music,133,161,24,1067889,2024-01-18
154,spotify:track:5Gy67YHzPZTk9Q0D73LAGH,"Jeet Gannguli, Arijit Singh","Khamoshiyan (From ""Khamoshiyan"")",Sony Music Entertainment India Pvt. Ltd.,90,146,38,1067655,2024-01-18
155,spotify:track:6biqkuWq069vByAEeGxZlr,Shubh,Her,SHUBH,30,-1,38,1064439,2024-01-18
156,spotify:track:6FjbAnaPRPwiP3sciEYctO,"Pritam, Arijit Singh",Raabta,T-Series,41,136,86,1064266,2024-01-18
157,spotify:track:6Z4rRhYZVQsYKmrxD40tru,"Riar Saab, Abhijay Sharma",Obsessed,"Mass Appeal India, LLC",2,147,37,1061231,2024-01-18
158,spotify:track:4SJMuaIYcBS8ke96lDYOsw,Karan Aujla,On Top,Karan Aujla Music,17,175,34,1058032,2024-01-18
159,spotify:track:7v0t3o17J796y9OG2n3ebl,"B Praak, Jaani",Kya Loge Tum,Universal Music India Pvt Ltd. – Distribution,10,141,35,1057695,2024-01-18
160,spotify:track:1RdrAqXa2fUj2XytsKaUwl,Irshad Khan,Haryana Hood,Bajewala Records Haryanvi,40,160,39,1056735,2024-01-18
161,spotify:track:3rUGC1vUpkDG9CZFHMur1t,Tate McRae,greedy,RCA Records Label,119,171,12,1056413,2024-01-18
162,spotify:track:1d5lpW3gUyq537iuyrb9Lf,Aditya Rikhari,Samjho Na,CollabX Productions,73,154,39,1054828,2024-01-18
163,spotify:track:2NmBCDkjvJVvEZkH5QDOeb,"Varinder Brar, Rav Dhaliwal, Ultra Beats",Thaa,Varinder Brar Music,10,162,39,1054148,2024-01-18
164,spotify:track:0DXfJ2iKRDEG7rPgssWFea,"Kanishk Seth, Kavita Seth","Rangisari (From ""Jugjugg Jeeyo"")",T-Series,22,150,62,1048683,2024-01-18
165,spotify:track:7o1SDLghDwMc4OW3rKakVt,"Bir, Dhanju, thiarajxtt",Afterhours,Sky Digital,87,174,31,1048124,2024-01-18
166,spotify:track:0GQngE2rOYvlKwEQjTAsP8,"Pritam, Sreeram, Shilpa Rao",Subhanallah,T-Series,107,165,45,1046940,2024-01-18
167,spotify:track:7Imk0IG6S5GA5iYWkjmMW5,"Palak Muchhal, Arijit Singh","Chahun Main Ya Naa (From ""Aashiqui 2"")",T-Series,148,148,14,1043046,2024-01-18
168,spotify:track:1AMD2AkfGrKoKhwkvYLbza,"Sunny Yaduvanshi, AK Rok, Nitesh Ujoli, Elvish Yadav",Yadav Brand 2 (feat. Elvish Yadav),Flame Music,9,177,45,1041185,2024-01-18
169,spotify:track:6O1RAYwmOqkcoJQr7J9SFJ,"Manan Bhardwaj, Arijit Singh",Oonchi Oonchi Deewarein,T-Series,52,155,14,1038443,2024-01-18
170,spotify:track:3APdIdF8H0jsxSuGOqXedS,Rashid Ali,Kabhi Kabhi Aditi,T-Series,73,184,99,1038381,2024-01-18
171,spotify:track:3qrdLVOClRU4yPkcXZ7c5u,"Ayushmann Khurrana, Tanishk-Vayu","Mere Liye Tum Kaafi Ho (From ""Shubh Mangal Zyada Saavdhan"")",T-Series,11,156,204,1029830,2024-01-18
172,spotify:track:4OEBP1iwGmLtcM8UKRLm80,"Arijit Singh, Antara Mitra","Itni Si Baat Hain (From ""Azhar"")",T-Series,144,166,6,1027073,2024-01-18
173,spotify:track:7K6RLbkpqZI4OaoSnLcBiU,"AUR, ZAYN",Tu hai kahan (feat. ZAYN),Sony Music Entertainment,173,-1,1,1021164,2024-01-18
174,spotify:track:6aQIGqAo9PxRKjUkhYtR6R,"Anirudh Ravichander, Priya Mali","Hayyoda (From ""Jawan"")",T-Series,14,193,21,1015312,2024-01-18
175,spotify:track:0rk2X5TAhraBC5aCIXK2Rq,"Jawad Ahmad, Shaarib Toshi, Arijit Singh, Shreya Ghoshal",Samjhawan,Sony Music Entertainment India Pvt. Ltd.,70,111,142,1007099,2024-01-18
176,spotify:track:7aE1lfskJLMHQnzCCP1zsV,"Akhil Sachdeva, Mansheel Gujral","Humsafar (From ""Badrinath Ki Dulhania"")",T-Series,158,163,13,1005825,2024-01-18
177,spotify:track:7H3mfOvtPNA8YDF3EdKy0L,"Neeraj Shridhar, Kavita Seth, Pritam",Tum Hi Ho Bandhu,Eros Now Music,144,176,13,1005243,2024-01-18
178,spotify:track:6V4N3h4HYD1Ask9cUTxjjg,"Taimour Baig, Raffey Anwar, AUR",Long time no see,Universal Music MENA,66,170,13,1004211,2024-01-18
179,spotify:track:3JkVYvxNoGf2HCWJo61462,"Sidhu Moose Wala, Sunny Malton, SOE",Never Fold,Sidhu Moose Wala,13,194,91,1001809,2024-01-18
180,spotify:track:3yNhGgQMPOdqVFpjRu8k8x,"Thaman S, Sanjith Hegde, Saraswati Putra Ramajogayya Sastry","Dum Masala (From ""Guntur Kaaram"")(Telugu)",Aditya Music,180,-1,1,998784,2024-01-18
181,spotify:track:1fGXJZny7HUQnLKwttxmYw,"Vishal Mishra, Raj Shekhar","Marham (Pehle Bhi Main) [From ""ANIMAL""]",T-Series,181,-1,1,998229,2024-01-18
182,spotify:track:43YkTTlOD203o9E5ZxhUjF,Arijit Singh,"Main Dhoondne Ko Zamaane Mein (From ""Heartless"")",T-Series,62,172,119,995099,2024-01-18
183,spotify:track:1YMLgvsQdE27r30q0fsLeV,Arijit Singh,Tera Fitoor,Tips Industries Ltd,87,-1,28,995029,2024-01-18
184,spotify:track:2qxmye6gAegTMjLKEBoR3d,Alec Benjamin,Let Me Down Slowly,2018,34,192,197,994910,2024-01-18
185,spotify:track:1g9V1QE7vbeAx5Xm04DfLi,"Dhruv Vikram, Shruti Haasan, Chinmayi","Odiyamma (From ""Hi Nanna"") [TELUGU]",T-Series,185,-1,1,991290,2024-01-18
186,spotify:track:4Tkb7zsDmsawB7S5TpKQV1,"Atif Aslam, Shiraz Uppal",Pehli Dafa,T-Series,159,197,11,987743,2024-01-18
187,spotify:track:7lNbI1xd39QRdf6Mj8tvTv,Javed Ali,"Saudebazi (Encore) [From ""Aakrosh""]",T-Series,108,173,21,986143,2024-01-18
188,spotify:track:7qiZfU4dY1lWllzX7mPBI3,Ed Sheeran,Shape of You,Atlantic Records UK,63,190,193,980856,2024-01-18
