rank,uri,artist_names,track_name,source,peak_rank,previous_rank,weeks_on_chart,streams,End Date
185,spotify:track:4BGfzLrK6lgvKDjKSU7wrN,"Faheem Abdullah, Huzaif Nazar",Sajde,Artiste First,185,-1,1,1301142,2025-06-05
186,spotify:track:2C6CJGFLbisteRuY6Plb7b,"Danny, Avvy Sra, Sagar",Ve Haaniyaan,Dreamiyata Music,10,165,70,1296220,2025-06-05
187,spotify:track:6t9KM2EQD4H2KbrTgHGYf3,"Sachin-Jigar, Jasmine Sandlas, Amitabh Bhattacharya","Taras - From ""Munjya""",Zee Music Company,38,-1,43,1295064,2025-06-05
188,spotify:track:08GYLNhKthS3arMdXsveRI,"Talwiinder, NDS, Rippy Grewal",Haseen,Talwiinder,188,-1,1,1292444,2025-06-05
189,spotify:track:1feANd8EfcDP5UqSvbheM3,"Sachet Tandon, Sachet-Parampara","Bekhayali (From ""Kabir Singh"")",T-Series,1,174,269,1289883,2025-06-05
190,spotify:track:4chxJYv0qsOKQukt6cKp97,Mustafa Zahid,Toh Phir Aao,Vishesh Films Pvt Ltd.,155,155,2,1286478,2025-06-05
191,spotify:track:69Qzz3yyQSsA0T95jLDoPL,"Gurnazar, Chet Singh",Dil Tu Jaan Tu,Mars Films / Jhankar Music,14,183,45,1285431,2025-06-05
192,spotify:track:1WxzZoWBTmB68AtyA6ejBB,"Sohail Sen, Monali Thakur, Kausar Munir",Haan Ke Haan,YRF Music,9,188,42,1284915,2025-06-05
193,spotify:track:3OLFqbd9ZeVjaUKTiaLsD6,"Pritam, Javed Ali, Irshan Ashraf, Shadab",Tu Hi Haqeeqat,Sony Music Entertainment India Pvt. Ltd.,174,-1,9,1282801,2025-06-05
194,spotify:track:5QWuignQQWDlbtQsjKX0Kq,"G. V. Prakash, Vivek, Dhanush, Jonita Gandhi","Yedi (From ""Nilavuku En Mel Ennadi Kobam"")",Wunderbar Films,111,156,11,1273222,2025-06-05
195,spotify:track:7wW9scVNLYFLsmBb1yAUmS,Yo Yo Honey Singh,Blue Eyes,T-Series,38,194,50,1272865,2025-06-05
196,spotify:track:7CyPwkp0oE8Ro9Dd5CUDjW,"The Weeknd, JENNIE, Lily-Rose Depp","One Of The Girls (with JENNIE, Lily Rose Depp)",XO / Republic Records,98,187,74,1268465,2025-06-05
197,spotify:track:5GJ3WaxTSlxDY3csctX20H,Himesh Reshammiya,Bewajah,Sony Music Entertainment India Pvt. Ltd.,12,152,17,1266491,2025-06-05
198,spotify:track:0rk2X5TAhraBC5aCIXK2Rq,"Jawad Ahmad, Shaarib Toshi, Arijit Singh, Shreya Ghoshal",Samjhawan,Sony Music Entertainment India Pvt. Ltd.,70,160,198,1255000,2025-06-05
199,spotify:track:5W7DOVGQLTigu09afW7QMT,Sidhu Moose Wala,295,Sidhu Moose Wala,1,-1,145,1251027,2025-06-05
200,spotify:track:3nKQrVVlwbAQSnFbgZWdN0,"Avvy Sra, Karan Aujla, Jaani",White Brown Black,Universal Music India Pvt Ltd. – Distribution,29,-1,125,1250306,2025-06-05
