rank,uri,artist_names,track_name,source,peak_rank,previous_rank,weeks_on_chart,streams,End Date
189,spotify:track:2y0hUGvHaKm2p5xmJF4HBe,Arijit Singh,"Saware (From ""Phantom"")",T-Series,82,178,46,980149,2024-01-18
190,spotify:track:6TClJ8jXi3OBV7gcrU3jx5,"AP Dhillon, Gurinder Gill",TERE TE,RUN-UP RECORDS,7,-1,97,978429,2024-01-18
191,spotify:track:1ExaQYPap38faw3FEqKcGY,"Mankirt Aulakh, Simar Kaur, Flamme Music",Koka,Sky Digital,184,-1,4,974978,2024-01-18
192,spotify:track:7fW9J3EpVWVN1ouv0slAs0,KK,"Kya Mujhe Pyar Hai (From ""Woh Lamhe"")",T-Series,42,179,53,972376,2024-01-18
193,spotify:track:4ZVtid5khBfDx6Co0vTUE6,"Jassa Dhillon, thiarajxtt",SPAIN,Jassa Dhillon,14,-1,34,971457,2024-01-18
194,spotify:track:3GEiVoaUXq468gfYs2EPfh,"DIVINE, Sidhu Moose Wala",Chorni,DIVINE,8,199,27,967700,2024-01-18
195,spotify:track:2uWZ7EGddFlA1DJ3Rzzvs2,"Karan Aujla, Ikky, Yarah",Bachke Bachke (feat. Yarah),WM Canada,57,180,20,967245,2024-01-18
196,spotify:track:1q6pMQBRILzkz0g4rKEXdM,Palak Muchhal,"Kaun Tujhe (From ""M.S.Dhoni - The Untold Story"")",T-Series,57,182,27,964318,2024-01-18
197,spotify:track:18YHbIhrleUkKKj2DvEp79,"Pritam, KK",Zara Sa,Sony Music Entertainment India Pvt. Ltd.,33,198,47,962278,2024-01-18
198,spotify:track:5nQA7m7xypeL7dFaGRwJO5,Shallum Lama,Timro Pratiksa,Sony Music Entertainment India Pvt. Ltd.,132,168,6,960595,2024-01-18
199,spotify:track:2F5IqHVyzaEbnKiKQvfAFT,"Payal Dev, Vishal Mishra, Manoj Muntashir",Ram Aayenge,T-Series,199,-1,1,959548,2024-01-18
200,spotify:track:0Bz7dfqPY4JOGZO3O1j8Wh,"Pritam, Amit Mishra, Shilpa Rao",Bulleya,Sony Music Entertainment India Pvt. Ltd.,124,188,23,956687,2024-01-18
