rank,uri,artist_names,track_name,source,peak_rank,previous_rank,weeks_on_chart,streams,End Date
1,spotify:track:5ThyDv6aRVU8AH4vXQNldF,"Kushagra, Bharath, Saaheal",Finding Her,EYP Creations,1,1,13,7590180,2025-06-05
2,spotify:track:5UGrftqh9U3zKQUt3vs7Ob,Shubh,Supreme,Shubh,2,2,7,6759422,2025-06-05
3,spotify:track:4vHRQnzGcKEtqsLH70tAms,"Sachet-Parampara, Parampara Tandon, Kausar Munir","Raanjhan (From ""Do Patti"")",T-Series,1,3,33,5405513,2025-06-05
4,spotify:track:0eCajpR75pDW0r64U6hP2x,Anuv Jain,Jo Tum Mere Ho,Universal Music India Pvt. Ltd. (on behalf of Anuv Jain),1,5,43,4852270,2025-06-05
5,spotify:track:5FDVyL6VahLO3B4T7xRYD9,"Guru Randhawa, Sanjoy, Gill Machhrai",Qatal,Warner Music India,4,4,6,4537097,2025-06-05
6,spotify:track:1hlbywc8Jhl1FFqJxAMabE,"Faheem Abdullah, Rauhan Malik, Amir Ameer",Ishq,Artiste First,2,6,62,4488888,2025-06-05
7,spotify:track:1hA697u7e1jX2XM8sWA6Uy,"Sachin-Jigar, Arijit Singh, Amitabh Bhattacharya",Apna Bana Le,Zee Music Company,1,7,102,4002096,2025-06-05
8,spotify:track:7f88cYg6oaAaSJMfF2GANl,"Jakes Bejoy, Sid Sriram, Sithara Krishnakumar",Minnalvala,Sony Music Entertainment India Pvt. Ltd.,8,17,4,3664913,2025-06-05
9,spotify:track:3vCzLB6kS2lGcIpm1OOUsy,"Anurag Saikia, Raj Shekhar, Romy, Amarabha Banerjee, Varun Jain, Madhubanti Bagchi, Mismatched - Cast",Ishq Hai,Netflix Music,1,8,25,3553227,2025-06-05
10,spotify:track:2cPUB8EOT6AfJ8oxhyoNXL,"Pritam, Javed Bashir",Ye Tune Kya Kiya,T-Series,9,9,68,3541124,2025-06-05
11,spotify:track:6nRGPf5tpeJtKpXZO5cgIT,"Aditya Rikhari, UNPLG'd",Paro,Universal Music India Pvt Ltd.,7,10,13,3448246,2025-06-05
12,spotify:track:4FeczSomVWVyU4FW7xDeAI,"A.R. Rahman, Chinmayi, Murtuza Khan, Qadir Khan",Tere Bina,Sony Music Entertainment India Pvt. Ltd.,11,11,42,3433647,2025-06-05
13,spotify:track:2oJxsbdvHuzkQ44hoyMsis,"Yo Yo Honey Singh, Simar Kaur, Alfaaz","Laal Pari (From ""Housefull 5"")",T-Series,12,12,4,3418955,2025-06-05
14,spotify:track:2HI1eYwbbiJGqi0XaeByOI,"Sanju Rathod, G-SPXRK",Shaky,Sanjay Rathod,14,35,3,3394021,2025-06-05
15,spotify:track:1JioaCninhpfY1filFEIZi,"AP Dhillon, Shinda Kahlon",STFU,AP Dhillon,15,16,3,3226342,2025-06-05
16,spotify:track:5wqMM6wOwXmX4rc1C3lUkd,"Karan Aujla, Signature By SB",Courtside,Karan Aujla Music,13,13,3,3029623,2025-06-05
17,spotify:track:5zCnGtCl5Ac5zlFHXaZmhy,"Ram Sampath, Arijit Singh, Prashant Pandey","Sajni (From ""Laapataa Ladies"")",T-Series,1,19,57,3027457,2025-06-05
18,spotify:track:4ulroyDK6rN73nVkCkWhur,"Jasleen Royal, Stebin Ben, Vijay Deverakonda, Radhikka Madan, Priya Saraiya, Aditya Sharma",Sahiba,Warner Music India,1,14,28,3010475,2025-06-05
19,spotify:track:4d2jV5fmX6hbRwaRbY39dt,"Karan Aujla, Jay Trak",Wavy,Karan Aujla Music,4,18,29,2920676,2025-06-05
20,spotify:track:2Fv2injs4qAm8mJBGaxVKU,"Arijit Singh, Mithoon","Tujhe Kitna Chahne Lage (From ""Kabir Singh"")",T-Series,2,15,314,2894095,2025-06-05
21,spotify:track:3yV2c3cYhkAwSsxAq6nRiv,Gajendra Verma,Mann Mera,Sony Music / Eros Now Music,21,21,216,2887226,2025-06-05
22,spotify:track:2PvaburAUlhNHxVhw5lvOq,Arijit Singh,"Humdard (From ""Ek Villain"")",T-Series,20,26,255,2818378,2025-06-05
23,spotify:track:3yHyiUDJdz02FZ6jfUbsmY,"Arijit Singh, Shreyas Puranik, Siddharth - Garima","Satranga (From ""ANIMAL"")",T-Series,2,22,84,2798530,2025-06-05
24,spotify:track:4Qm7r3ImER8S2Ori1gLMAf,"Anuv Jain, AP Dhillon",Afsos,"Universal Music India Pvt. Ltd. (on behalf of Anuv Jain, AP DHILLON INC/Republic Records)",6,20,18,2752434,2025-06-05
25,spotify:track:45PA9lW7U5LYnlpGrdTyHY,"Jasleen Royal, Ujjwal Kashyap",Sang Rahiyo,Warner Music India,19,23,65,2750976,2025-06-05
26,spotify:track:2ceeTJAzKy295Fm0VsaXtE,"Sachin-Jigar, Raghav Chaitanya, Varun Jain, Indraneel","Tum Se (From ""Teri Baaton Mein Aisa Uljha Jiya"")",T-Series,10,25,69,2711047,2025-06-05
27,spotify:track:2IoZMG3RqiTmsy7Li3zGFg,"Sachet Tandon, Parampara Tandon, Sachet-Parampara","Mere Sohneya (From ""Kabir Singh"")",T-Series,4,24,268,2682837,2025-06-05
28,spotify:track:4eBvRhTJ2AcxCsbfTUjoRp,Shubh,Cheques,SHUBH,1,28,106,2630937,2025-06-05
29,spotify:track:5fBghXeYCGIEVuExKytoJ9,Shubh,Fell For You,SHUBH,19,34,19,2598600,2025-06-05
30,spotify:track:0SAZ4IHYMtjW4Lxrjm7NnG,"Altamash Faridi, Sohail Sen, Mudassar Aziz",Aashiq Tera,Eros Now Music,30,39,13,2568759,2025-06-05
31,spotify:track:6kYoY0PhBelP64UMnhsEZx,"Alka Yagnik, Arijit Singh","Agar Tum Saath Ho (From ""Tamasha"")",T-Series,4,27,314,2525085,2025-06-05
32,spotify:track:5npFBWhVs3VVlc0nY5xQMA,"Sachin-Jigar, Arijit Singh","Tainu Khabar Nahi - From ""Munjya""",Zee Music Company,17,31,51,2515494,2025-06-05
33,spotify:track:5AnWrUzsrFgBvhn6dUElnr,"Sachin-Jigar, Amitabh Bhattacharya, Madhubanti Bagchi, Divya Kumar","Aaj Ki Raat (From ""Stree 2"")",Saregama India Ltd,1,36,45,2497558,2025-06-05
34,spotify:track:7so0lgd0zP2Sbgs2d7a1SZ,"Lady Gaga, Bruno Mars",Die With A Smile,Interscope Records,4,33,36,2456907,2025-06-05
35,spotify:track:72zHuDxFQTjbL51qJQSA7j,"Jasleen Royal, B Praak, Romy","Ranjha (From ""Shershaah"")",Sony Music Entertainment India Pvt. Ltd.,1,46,200,2445506,2025-06-05
36,spotify:track:1fkjRQA8wXPPyxqYLbxuqy,"Vishal-Shekhar, Sanam Puri, Shipra Goyal",Ishq Bulaava,Sony Music Entertainment India Pvt. Ltd.,36,75,10,2435958,2025-06-05
37,spotify:track:2GXXZFUxYg2LvG8SR0byOE,"Sachin-Jigar, Atif Aslam, Priya Saraiya",Jeena Jeena,Sony Music Entertainment India Pvt. Ltd.,24,38,195,2415593,2025-06-05
38,spotify:track:5VvkNZesG4T86mUULEG5Wp,"Sachet-Parampara, Sachet Tandon, Parampara Tandon, Kausar Munir",Maiyya,T-Series,19,32,26,2384311,2025-06-05
39,spotify:track:3trnNo4KeaUlFuUiV7iRCj,"Himesh Reshammiya, Arijit Singh",Tera Chehra,Sony Music Entertainment India Pvt. Ltd.,3,42,18,2377415,2025-06-05
40,spotify:track:22ZIAjVRJTjYj5EwD0MjEJ,Masoom Sharma,2 Khatole (Lofi Mix),Tuffan Music,17,43,10,2371992,2025-06-05
41,spotify:track:56zZ48jdyY2oDXHVnwg5Di,"Mithoon, Arijit Singh",Tum Hi Ho,T-Series,26,41,227,2353594,2025-06-05
42,spotify:track:0FBQ4NrrHUbR9kus7rzrOj,Atif Aslam,Dil Diyan Gallan,YRF Music,29,29,277,2344345,2025-06-05
43,spotify:track:5ZLkihi6DVsHwDL3B8ym1t,Shubh,One Love,SHUBH,3,30,94,2337772,2025-06-05
44,spotify:track:0TL0LFcwIBF5eX7arDIKxY,Anuv Jain,Husn,Universal Music India Pvt. Ltd. (on behalf of Anuv Jain),1,44,79,2308891,2025-06-05
45,spotify:track:6fScgF2Y63ScU73nYju0ny,"Atif Aslam, Arko",O Saathi,T-Series,28,40,149,2301801,2025-06-05
46,spotify:track:3FqtduiaqnFYvBgKuc6QWQ,"Karan Aujla, Seshnolan",Winning Speech,Karan Aujla,8,47,55,2300707,2025-06-05
47,spotify:track:5J9L7IbadCt0ivs9xmNrr0,Zain Zohaib,Ranjheya Ve,Zain Zohaib,20,37,15,2280460,2025-06-05
48,spotify:track:3PWfXDaGLxwN9UJDHMEyKi,"Masoom Sharma, Sheenam Katholic, Kay D, Aarohi Raghav",Teri Ramjhol Bole Gi (feat. Kay D & Aarohi Raghav),Empire Media,18,45,12,2269342,2025-06-05
49,spotify:track:0YQJoDL6f46J0n1rOVkpxJ,"Karan Aujla, Ikky",Softly,WM Canada,4,49,94,2234921,2025-06-05
50,spotify:track:76ec1a1bkFfOqoVf6e7nae,"Pritam, Arijit Singh, Shashwat Singh, Qaisar-Ul-Jafri, Sandeep Srivastava","Zamaana Lage (From ""Metro ... In Dino"")",T-Series,50,-1,1,2214359,2025-06-05
51,spotify:track:5Ggb9pKiKcr5vNV9v1e1vs,"Varun Jain, Shilpa Rao, Sachin-Jigar, Amitabh Bhattacharya",Tumhare Hi Rahenge Hum,Saregama India Ltd,8,50,42,2208030,2025-06-05
52,spotify:track:2nP1wLRh85mo5Wdj4RQldp,"Amit Trivedi, Madhubanti Bagchi, Amitabh Bhattacharya","Uyi Amma - From ""Azaad""",Zee Music Company,24,48,20,2192807,2025-06-05
53,spotify:track:3t3wsY5IdLVzB9WidegJSU,"Atif Aslam, Shreya Ghoshal, Sachin-Jigar",Jeene Laga Hoon,Tips Industries Ltd,28,54,39,2171278,2025-06-05
54,spotify:track:4wIWWEhbdgKAxhR68eE0Ye,"Arijit Singh, Chinmayi","Mast Magan (From ""2 States"")",T-Series,45,52,224,2158442,2025-06-05
55,spotify:track:6bmmHeCvZI92pRiTHxEdTC,"Pritam, Arijit Singh, Irshad Kamil",O Maahi,T-Series,4,58,77,2145642,2025-06-05
56,spotify:track:3ygfdwvBJ2Y5XhJiiHFFZE,Sachet Tandon,Maiyya Mainu,Zee Music Company,5,53,135,2093289,2025-06-05
57,spotify:track:5pPyvA03RKSJrAnnDcq0nh,"Sachin-Jigar, Shreya Ghoshal, Tochi Raina",Saibo,Sony Music Entertainment India Pvt. Ltd.,22,68,240,2067333,2025-06-05
58,spotify:track:1mQUEvGR7Sbt2OCz2gFrdx,"Amitabh Bhattacharya, Sachin-Jigar, Pawan Singh, Simran Choudhary","Aayi Nai (From ""Stree 2"")",Saregama India Ltd,2,59,43,2050395,2025-06-05
59,spotify:track:3WLJ7D5kh44K5eJ1NqZQ6W,Anuv Jain,Baarishein,Universal Music India Pvt. Ltd. (on behalf of Anuv Jain),16,55,212,2043700,2025-06-05
60,spotify:track:0fAPcsD7qrEAfO2EH0ce4V,Shubh,Aura,SHUBH,58,95,17,2031862,2025-06-05
61,spotify:track:0kYBzFJ5a2Jozi6cI4y9Bp,"Jeet Gannguli, Mustafa Zahid",Jo Tere Sang,Sony Music Entertainment India Pvt. Ltd.,61,104,5,2024901,2025-06-05
62,spotify:track:0XRb6eZE4dBIJdqwf1Mixu,"Juss, MixSingh",Suniyan Suniyan,Mix It Up Studio,3,57,55,2024588,2025-06-05
63,spotify:track:2iNqdCchlUZEgjJbQyZf8T,"Kailash Kher, Paresh Kamath, Naresh Kamath",Teri Deewani,Sony Music Entertainment India Pvt. Ltd.,62,79,44,2022543,2025-06-05
64,spotify:track:5vGiuYFSGekGLgbxhV1rD5,"Atif Aslam, Pritam",Tu Jaane Na,Tips Industries Ltd,56,56,192,1997045,2025-06-05
65,spotify:track:18YHbIhrleUkKKj2DvEp79,"Pritam, KK",Zara Sa,Sony Music Entertainment India Pvt. Ltd.,33,88,118,1986887,2025-06-05
66,spotify:track:6H7fLdt0AeWpuxUKXuXWrx,Hariharan,Shree Hanuman Chalisa,T-Series,31,66,147,1981907,2025-06-05
67,spotify:track:4MU4Kfkd9EnkArK2ocQyqK,"Arijit Singh, Harshdeep Kaur",Zaalima,Zee Music Company,65,74,102,1977450,2025-06-05
68,spotify:track:4Tkb7zsDmsawB7S5TpKQV1,"Atif Aslam, Shiraz Uppal",Pehli Dafa,T-Series,50,51,83,1967042,2025-06-05
69,spotify:track:48Ix6ReYdJf2H4mKb3TIpj,"Atif Aslam, Alisha Chinai, Pritam",Tera Hone Laga Hoon,Tips Industries Ltd,30,60,212,1952909,2025-06-05
70,spotify:track:5FXMRdJjKq1BIX4e8Eg9mK,"Vishal-Shekhar, KK",Ajab Si,T-Series,19,71,178,1949474,2025-06-05
71,spotify:track:1EBYBmNTZBolUAd7D7AvZf,"Shreya Ghoshal, Rajat Nagpal, Freebot, Karl Wine",Besos,PlayDMF,71,-1,1,1943827,2025-06-05
72,spotify:track:4y2sSEDG8aP4nDyXWnmPjw,"Masoom Sharma, Swara Verma, Dev Chouhan, Pooja Saxena",Blender,GSC Music,19,78,22,1926717,2025-06-05
73,spotify:track:7KQdgW7QzNd9oPoCzjCU76,Shubh,Bandana,Shubh,8,62,62,1925663,2025-06-05
74,spotify:track:7aE1lfskJLMHQnzCCP1zsV,"Akhil Sachdeva, Mansheel Gujral","Humsafar (From ""Badrinath Ki Dulhania"")",T-Series,44,86,72,1904218,2025-06-05
75,spotify:track:4UMIv5jd9gK98a39BQRD9X,"Pritam, Arijit Singh, Amitabh Bhattacharya",Kesariya,Sony Music Entertainment India Pvt. Ltd.,1,85,151,1893377,2025-06-05
76,spotify:track:0GQngE2rOYvlKwEQjTAsP8,"Pritam, Sreeram, Shilpa Rao",Subhanallah,T-Series,34,69,113,1885521,2025-06-05
77,spotify:track:4MtsPGGUTIs4qFD8gOSJ3D,"Masoom Sharma, Rahul Muana, Swara Verma, Ruba Khan",Chambal K Dakku,Bajewala Records,26,73,12,1880808,2025-06-05
78,spotify:track:1r6GbBLdtUK1Vl1IHT14wP,"Mohammad Faiz, Jaani","Dekhha Tenu (From ""Mr. And Mrs. Mahi"")",Sony Music Entertainment India Pvt. Ltd.,2,67,55,1871623,2025-06-05
79,spotify:track:1dFrZr9eMUsFqeag04ClqD,Dhanda Nyoliwala,Russian Bandana,Universal Music India Pvt Ltd.,6,84,36,1866661,2025-06-05
80,spotify:track:4BTPzhEsyW3blWcxcuhLM0,"Shankar-Ehsaan-Loy, Shankar Mahadevan, Caralisa Monteiro, Shafqat Amanat Ali",Mitwa,Sony Music Entertainment India Pvt. Ltd.,80,112,42,1865256,2025-06-05
81,spotify:track:1YMLgvsQdE27r30q0fsLeV,Arijit Singh,Tera Fitoor,Tips Industries Ltd,61,64,97,1857327,2025-06-05
82,spotify:track:7eQl3Yqv35ioqUfveKHitE,"Pritam, Mohit Chauhan, Irshad Kamil",Tum Se Hi,T-Series,12,63,272,1853010,2025-06-05
83,spotify:track:0hFkx6EoIRvNmEVXQIIJtk,Aditya Rikhari,Paaro,Universal Music India Pvt Ltd.,46,72,12,1852112,2025-06-05
84,spotify:track:2JlzHPGIVaLNAppX1viq7f,"Santhosh Narayanan, The Indian Choral Ensemble, Vivek","Kanimaa (From ""Retro"")",T-Series,16,61,10,1817714,2025-06-05
85,spotify:track:7yDHHVKLbvDmVw1XXhDDIO,"Vishal Mishra, Raj Shekhar",Pehle Bhi Main,T-Series,1,65,79,1812949,2025-06-05
86,spotify:track:7AAap8D4C4pTyNoMkM9vjG,"Shankar-Ehsaan-Loy, Diljit Dosanjh",Ishq Di Baajiyaan,Sony Music Entertainment India Pvt. Ltd.,86,109,41,1807586,2025-06-05
87,spotify:track:0gPgdRfB4jdGrlyXS0Vx78,"Vishal-Shekhar, KK, Shilpa Rao, Anvita Dutt Guptan",Khuda Jaane,YRF Music,29,80,139,1802258,2025-06-05
88,spotify:track:5OMUXgfXsSukZ0zxelpC3b,"A.R. Rahman, Jaswinder Singh, Shiraz Uppal","Raanjhanaa (From ""Raanjhanaa"")",Sony Music Entertainment India Pvt. Ltd.,88,111,42,1798817,2025-06-05
89,spotify:track:32765xcLM1fd6wQIpkN9A0,"Ami Mishra, Kunaal Vermaa",Hasi - Male Version,Sony Music Entertainment India Pvt. Ltd.,77,110,101,1795444,2025-06-05
90,spotify:track:1tCduDqB3J8r90FAxprLzO,Arko,Nazm Nazm,Zee Music Company,82,82,53,1787094,2025-06-05
91,spotify:track:0l6g8Z8mqGbGXFOjigYetD,"Pritam, Arijit Singh",Hawayein,Sony Music Entertainment India Pvt. Ltd.,51,96,191,1785703,2025-06-05
92,spotify:track:4OEBP1iwGmLtcM8UKRLm80,"Arijit Singh, Antara Mitra","Itni Si Baat Hain (From ""Azhar"")",T-Series,81,81,34,1773282,2025-06-05
93,spotify:track:6y5SuF4NxGkvwpAdqcAkD3,"Pritam, Arijit Singh, Shreya Ghoshal, Shadab Faridi, Altamash Faridi, Amitabh Bhattacharya",Ve Kamleya,Saregama India Ltd,15,114,95,1763592,2025-06-05
94,spotify:track:25jtUwCQfXwnxENh8Bvoj4,"Diljit Dosanjh, MixSingh, Raj Ranjodh",Water,Famous Studios,36,91,15,1761092,2025-06-05
95,spotify:track:5PUXKVVVQ74C3gl5vKy9Li,"Jasleen Royal, Arijit Singh, Dulquer Salmaan",Heeriye (feat. Arijit Singh),Warner Music India,1,93,97,1754349,2025-06-05
96,spotify:track:0KSOLEBixnBYIKNHF1VbzF,"Atif Aslam, Hadiqa Kiani",Hona Tha Pyar,Tips Industries Ltd,54,77,14,1753257,2025-06-05
97,spotify:track:1y1rQTkWmrZdJmjwuK07GC,"Vishal Mishra, Manoj Muntashir","Kaise Hua (From ""Kabir Singh"")",T-Series,5,70,312,1748939,2025-06-05
98,spotify:track:3Kl8p2PxVf8eAayLwTxOIm,"Pritam, KK",Dil Ibaadat,Sony Music Entertainment India Pvt. Ltd.,54,124,24,1744186,2025-06-05
99,spotify:track:0645eBDehHcqfiF15hscQV,"Vishal Mishra, Rashmeet Kaur","Janiye (from the Netflix Film ""Chor Nikal Ke Bhaga"")",Netflix Music,5,90,100,1739531,2025-06-05
100,spotify:track:6rFckZb1cuJYzsZiGHgqks,"Karan Aujla, Ikky",52 Bars,Rehaan Records,12,107,40,1736359,2025-06-05
101,spotify:track:1smFN2CLqGROu0J0UyvDfL,"Pritam, Arijit Singh",Shayad,Sony Music Entertainment India Pvt. Ltd.,1,123,281,1735308,2025-06-05
102,spotify:track:0M0ANKNzmM4Odd7FNKghzW,Mitraz,"Akhiyaan Gulaab (From ""Teri Baaton Mein Aisa Uljha Jiya"")",T-Series,2,103,71,1728499,2025-06-05
103,spotify:track:5BEz37uGx2cfFe5YAPWlHW,"Dhee, Siva Ananth, A.R. Rahman",Muththa Mazhai,Saregama India Ltd,103,-1,1,1721893,2025-06-05
104,spotify:track:4WSfFnizOJOxTSGSD4ljP7,"Ajay Bhagta, Manisha Sharma, Kb Dhull, Pranjal Dahiya",Jaat Intro (feat. Pranjal Dahiya),Sky Digital,104,-1,1,1710532,2025-06-05
105,spotify:track:3tgdOveYac7YMEAQD9sGLf,"Vishal-Shekhar, Papon, Irshad Kamil",Bulleya,YRF Music,30,87,21,1708356,2025-06-05
106,spotify:track:78BWCd70D1X6LMkDZm1UoF,Yo Yo Honey Singh,Millionaire,T-Series,3,101,40,1702599,2025-06-05
107,spotify:track:7eQoMQdE4JqngwYDOqLBU0,"dox, JASKARAN, Rita Kim",Superstar,5.5 Records Under Exclusive License to AWAL,70,83,8,1690851,2025-06-05
108,spotify:track:6ygiy70ujkNOYXM1tQuMNe,"Karan Aujla, Ikky, Preston Pablo",Admirin' You (feat. Preston Pablo),WM Canada,24,106,96,1680621,2025-06-05
109,spotify:track:73K33p4Vyz9koXGqmL5eFs,"Sachet Tandon, Parampara Tandon, Kumaar, Sachet-Parampara",Malang Sajna,T-Series,4,76,124,1673447,2025-06-05
110,spotify:track:4bD9z9qa4qg9BhryvYWB7c,"Pritam, Tochi Raina, Rekha Bhardwaj",Kabira,T-Series,31,98,299,1670548,2025-06-05
111,spotify:track:4kaLkst9lT3sQ5Crgxs3ic,"Ayushmann Khurrana, Rochak Kohli",Pani Da Rang - Male Vocals,Eros Now Music,68,136,52,1657935,2025-06-05
112,spotify:track:1d5lpW3gUyq537iuyrb9Lf,Aditya Rikhari,Samjho Na,CollabX Productions,23,99,111,1653356,2025-06-05
113,spotify:track:1PDREqVNvmphIoNac3Vz8c,"Himesh Reshammiya, Ankit Tiwari, Palak Muchhal",Sanam Teri Kasam,Sony Music Entertainment India Pvt. Ltd.,1,89,18,1639022,2025-06-05
114,spotify:track:1UWacd8x8tPPwmrPB1MoBI,"Pritam, Arijit Singh",Ae Dil Hai Mushkil Title Track,Sony Music Entertainment India Pvt. Ltd.,79,116,279,1634705,2025-06-05
115,spotify:track:1bxzr3JK05fMTcweGAZUHp,"Shilpa Rao, Anirudh Ravichander, Ramajogayya Sastry","Chuttamalle (From ""Devara Part 1"")",T-Series,4,94,44,1626833,2025-06-05
116,spotify:track:0NXnuTqFQHDsbEIoKIAVCN,"Josh Brar, Kinza Hashmi",Tere Bina Na Guzara E,Times Music – Speed Records,19,108,34,1613451,2025-06-05
117,spotify:track:5zcfnScTSFGCHGY1yeXWke,"Vishal-Shekhar, Kamal Khan",Ishq Sufiyana (Male),T-Series,46,92,28,1612493,2025-06-05
118,spotify:track:7m4CgL81VVIHaaiSxyH922,Yo Yo Honey Singh,Desi Kalakaar,T-Series,13,150,72,1595719,2025-06-05
119,spotify:track:4XxfOvudrnBRdlgzEaq1sd,Diljit Dosanjh,Born to Shine,FAMOUS STUDIOS INC,14,115,101,1590053,2025-06-05
120,spotify:track:1o8YPl0hyGbpRcHplXNvsm,"Vishal Mishra, Sachin-Jigar, Amitabh Bhattacharya","Khoobsurat (From ""Stree 2"")",Saregama India Ltd,5,102,42,1588721,2025-06-05
121,spotify:track:6FjbAnaPRPwiP3sciEYctO,"Pritam, Arijit Singh",Raabta,T-Series,41,126,138,1587473,2025-06-05
122,spotify:track:4Qu8LlchmRCaPBKBArcNsA,"Shankar-Ehsaan-Loy, Shafqat Amanat Ali",Tere Naina,Sony Music Entertainment India Pvt. Ltd.,113,122,21,1580059,2025-06-05
123,spotify:track:2Z6HgNji9cNlFLNORw6wDQ,"Mansheel Gujral, Akhil Sachdeva","Channa Ve - From ""Bhoot - Part One: The Haunted Ship""",Zee Music Company,33,132,72,1567760,2025-06-05
124,spotify:track:2PxZSFOv7RebkeSEwQTjr7,Mustafa Zahid,Tera Mera Rishta,Vishesh Films Pvt Ltd.,88,105,13,1562608,2025-06-05
125,spotify:track:3be9ACTxtcL6Zm4vJRUiPG,yung kai,blue,BMG Rights Management (US) LLC,16,97,26,1560589,2025-06-05
126,spotify:track:7MXVkk9YMctZqd1Srtv4MB,"The Weeknd, Daft Punk",Starboy,Universal Republic Records,12,137,201,1545632,2025-06-05
127,spotify:track:1wnozUBSe7OMpmZiTPJC5j,"A.R. Rahman, Javed Ali, KIRTI SAGATHIA, Pooja AV","Tum Tak (From ""Raanjhanaa"")",Sony Music Entertainment India Pvt. Ltd.,113,179,33,1532262,2025-06-05
128,spotify:track:5XeFesFbtLpXzIVDNQP22n,Arctic Monkeys,I Wanna Be Yours,Domino Recording Co,48,117,134,1524939,2025-06-05
129,spotify:track:5xlYVZxEwriP6hetG7QJw7,AP Dhillon,Old Money,AP Dhillon,13,129,30,1524428,2025-06-05
130,spotify:track:1EjxJHY9A6LMOlvyZdwDly,"Pritam, Neeraj Shridhar",Tum Mile,Sony Music Entertainment India Pvt. Ltd.,130,182,7,1523560,2025-06-05
131,spotify:track:2aH78X2rspZ3RibbAFXdjh,"Masoom Sharma, Pinna Music, Amar Karnawal",Mard,Masoom Sharma,81,151,9,1521852,2025-06-05
132,spotify:track:4bIQXffbALkCC0Xo6aTicP,"Shaarib Toshi, Toshi Sabri",Maahi,Sony Music Entertainment India Pvt. Ltd.,132,170,3,1506670,2025-06-05
133,spotify:track:2L5fXA2pNlTXJvQTeMZn4z,"Masoom Sharma, Swara Verma",Lofar,Shikaari Music,25,118,12,1493286,2025-06-05
134,spotify:track:29m79w9xPMH4YCD6r8JSmV,"AP Dhillon, Gurinder Gill, Intense",Excuses,RUN-UP RECORDS,1,130,189,1492532,2025-06-05
135,spotify:track:6GQK4G5o60E8YA18DGpAzv,Harshit Saxena,Hale Dil,T-Series,98,113,31,1489566,2025-06-05
136,spotify:track:37AGZMVr5V8mEMcCmGHroZ,"Kailash Kher, Paresh Kamath, Naresh Kamath",Saiyyan,Sony Music Entertainment India Pvt. Ltd.,71,142,75,1489164,2025-06-05
137,spotify:track:0vua5LbAth2HzKqpbnVRZk,"A.R. Rahman, Sid Sriram",Nee Singam Dhan,Sony Music Entertainment India Pvt. Ltd.,94,186,19,1488387,2025-06-05
138,spotify:track:25Nxyrng0Z3jC5Q0hAibpw,Karan Aujla,"Tauba Tauba (From ""Bad Newz"")",Saregama India Ltd,1,163,48,1486351,2025-06-05
139,spotify:track:5JCDVLwteSXuwVqjCa7SwH,"Shankar-Ehsaan-Loy, Shreya Ghoshal, Javed Bashir, Yusuf Mohammed, Vajid Ali",O Rangrez,Sony Music Entertainment India Pvt. Ltd.,48,148,31,1486141,2025-06-05
140,spotify:track:2iZeKe5avjtKVmjfSFkpxd,"Pritam, Rahat Fateh Ali Khan, Tulsi Kumar, Irshad Kamil",Tum Jo Aaye,T-Series,100,100,11,1481404,2025-06-05
141,spotify:track:6voByoJq77rN6FITdRhtLb,"Karan Aujla, Manna Music",48 Rhymes,WM Canada,141,-1,3,1465459,2025-06-05
142,spotify:track:2HNG9q8rXbnijbPTwCMgsb,"Atif Aslam, Roop Kumar Rathod, Mithoon, Naresh Sharma","Woh Lamhe Woh Baatein - From ""Zeher""",UME - Global Clearing House,77,143,9,1460009,2025-06-05
143,spotify:track:5cgKosPPj5Cs9a2JQufUc1,"Pritam, Arijit Singh",Ilahi,T-Series,86,171,22,1458841,2025-06-05
144,spotify:track:7G5wpuR61ABrT7R1snos7C,"Pritam, Arijit Singh",Kalank - Title Track,Zee Music Company,5,138,278,1457661,2025-06-05
145,spotify:track:0MTdYgTZ25sLCO6kVnDoje,"Sai Abhyankkar, Sai Smriti","Aasa Kooda - From ""Think Indie""",Think Music,3,127,50,1446450,2025-06-05
146,spotify:track:1PALLCSlHwAI4upY3sMg8u,"Aditya Rikhari, Tulsi Kumar, Lijo George-Dj Chetas","Jaana Samjho Na (From ""Bhool Bhulaiyaa 3"")",T-Series,9,119,31,1439651,2025-06-05
147,spotify:track:3xMHXmedL5Rvfxmiar9Ryv,"Anirudh Ravichander, Arijit Singh, Shilpa Rao, Kumaar",Chaleya,T-Series,1,158,94,1438563,2025-06-05
148,spotify:track:4Lo6I7kkHWgAVRmdILLhig,"Arijit Singh, Afsana Khan, Tanishk Bagchi, Irshad Kamil","Tu Hain Toh Main Hoon (From ""Sky Force"")",Saregama India Ltd,7,125,19,1433965,2025-06-05
149,spotify:track:6jUqTvRGOOyJmhxDQaWpNb,Mustafa Zahid,"Zaroorat (From ""Ek Villain"")",T-Series,131,131,7,1432780,2025-06-05
150,spotify:track:76ZWOhRRQzmb4xMoZzTjJ9,"Yo Yo Honey Singh, Paradox",Payal,T-Series,14,153,28,1430727,2025-06-05
151,spotify:track:7AsG1F1eMWd17RYan8M3Wm,"AP Dhillon, Shinda Kahlon",Dil Nu,RUN-UP RECORDS,33,147,73,1427706,2025-06-05
152,spotify:track:6457ZKiycyQm6qrNcu5y15,"Komal Chaudhary, Masoom Sharma",Mere Mittar,Komal Chaudhary,55,164,11,1421670,2025-06-05
153,spotify:track:52itZ0w0CydihB2JCZEIft,"Pritam, Mohit Chauhan, Irshad Kamil",Pee Loon,T-Series,37,120,69,1414801,2025-06-05
154,spotify:track:7qiZfU4dY1lWllzX7mPBI3,Ed Sheeran,Shape of You,Atlantic Records UK,63,140,247,1409490,2025-06-05
155,spotify:track:1kDZSmw3mKQeAjcmPTLS3M,"Pritam, Arijit Singh, Shreya Ghoshal, Amitabh Bhattacharya","Tum Kya Mile, Pt. 2",Saregama India Ltd,9,172,101,1408022,2025-06-05
156,spotify:track:5GQPBzoRBDxcAjwSSluQXD,Connie Francis,Pretty Little Baby,Universal Records,125,135,3,1407043,2025-06-05
157,spotify:track:0cUdmruT6kjxa5KpteSdwc,Bayaan,Nahin Milta,rearts records,75,134,11,1395095,2025-06-05
158,spotify:track:1eZefeDb8uOsjvcbl1fJrG,"Diljit Dosanjh, Badshah, Raj Ranjodh","Naina (From ""Crew"")",Tips Industries Ltd,3,162,65,1383853,2025-06-05
159,spotify:track:5sUSbJo0brScvv48ZZ1HrQ,"Atif Aslam, Jyotica Tangri",O Meri Laila,Zee Music Company,16,146,52,1381190,2025-06-05
160,spotify:track:3HiobOOpSpMsi95WBKPBYk,"Jeet Gannguli, Arijit Singh, Rashmi Virag",Hamari Adhuri Kahani (Title Track),Sony Music Entertainment India Pvt. Ltd.,56,168,185,1372957,2025-06-05
161,spotify:track:0tgVpDi06FyKpA1z0VMD4v,Ed Sheeran,Perfect,Atlantic Records UK,29,154,268,1368433,2025-06-05
162,spotify:track:3beYHVCFKzbdNjJqjKeYpM,"Pritam, Shafqat Amanat Ali",Teri Jhuki Nazar,Sony Music Entertainment India Pvt. Ltd.,162,-1,6,1368089,2025-06-05
163,spotify:track:4tJz5wXpwIvG2KMKPbYWwz,"Santhosh Narayanan, Vivek","Kannadi Poove (From ""Retro"")",T-Series,37,128,13,1361962,2025-06-05
164,spotify:track:7Imk0IG6S5GA5iYWkjmMW5,"Palak Muchhal, Arijit Singh","Chahun Main Ya Naa (From ""Aashiqui 2"")",T-Series,103,149,86,1356456,2025-06-05
165,spotify:track:5thVzD79BxlDTYy0LfHzvu,"Aparshakti Khurana, Savi Kahlon",Zaroor,Sony Music Entertainment India Pvt. Ltd.,13,139,44,1351815,2025-06-05
166,spotify:track:3YPH7vhnUqI7EKMXNEuXDi,"Masoom Sharma, Swara Verma",Warning,Gem Tunes Haryanvi,130,-1,2,1348505,2025-06-05
167,spotify:track:5UprhHX9Zdm0DeZzbPHbEN,"Atif Aslam, Manoj Muntashir",Tere Sang Yaara,Zee Music Company,101,161,46,1346623,2025-06-05
168,spotify:track:3iiiuE1iI2viPi0Z55eiPM,"Jakes Bejoy, M. G. Sreekumar",Kanmanipoove,Sony Music Entertainment India Pvt. Ltd.,158,167,4,1346229,2025-06-05
169,spotify:track:79hQvdTHNBkq2fp2ZrM8b2,"Javed-Mohsin, Arijit Singh, Shreya Ghoshal, Kunaal Vermaa, Prashant Ingole",Pal,Sony Music Entertainment India Pvt. Ltd.,34,157,319,1342999,2025-06-05
170,spotify:track:1QZRCi2Z1DQQaR6bGAzhtN,Yo Yo Honey Singh,Love Dose,T-Series,32,176,53,1342013,2025-06-05
171,spotify:track:6egfWbtFFhMToV2DvmEzmo,"Bunny, Hunny, Sagar","Tu Hain Toh (From ""Mr. And Mrs. Mahi"")",Sony Music Entertainment India Pvt. Ltd.,8,144,50,1334472,2025-06-05
172,spotify:track:0xlWd9o8yjKpJ02WJy79kZ,"Atif Aslam, Shreya Ghoshal",Tere Liye,Tips Industries Ltd,155,185,5,1333787,2025-06-05
173,spotify:track:3USxtqRwSYz57Ewm6wWRMp,Glass Animals,Heat Waves,Polydor Records,3,-1,123,1333083,2025-06-05
174,spotify:track:2tva3nN2kQhBjHMC7Zlty6,Javed Ali,Deewana Kar Raha Hai,T-Series,119,184,19,1329651,2025-06-05
175,spotify:track:0QCIpQV3twfqo9kh0t8Zza,"MOLIY, Silent Addy, Skillibeng, Shenseea",Shake It To The Max (FLY) - Remix,WONDERGIRL LLC,175,-1,1,1324594,2025-06-05
176,spotify:track:6xHPBEvcG0RQDfyTq7jc8P,"Cheema Y, Gur Sidhu",Young G.O.A.T,Brown Town Music,72,180,15,1321486,2025-06-05
177,spotify:track:4sTlQPMyoFMPdhAJvErBN3,ATLXS,PASSO BEM SOLTO - Slowed,broke,133,169,9,1320426,2025-06-05
178,spotify:track:2S6N9pbnkhQRyAx80HmF79,Mohammed Irfan,"Banjaara (From ""Ek Villain"")",T-Series,128,133,56,1320115,2025-06-05
179,spotify:track:5KNuHsIeFtD0oukst77hBi,Roop Kumar Rathod,Maula Mere Maula,Saregama,75,-1,33,1313310,2025-06-05
180,spotify:track:5Tkf5CbtVYHA1SiKo1NrJE,"Sachin-Jigar, Arijit Singh, Amitabha Bhattacharya","Phir Aur Kya Chahiye (From ""Zara Hatke Zara Bachke"")",Saregama,1,159,99,1307815,2025-06-05
181,spotify:track:1tf2iody5iRLYYPDSBpzRc,"Badshah, Arijit Singh",Soulmate,Universal Music India Pvt Ltd.,2,193,56,1306416,2025-06-05
182,spotify:track:5a2Hoi1wuhCA6Ob7pbOlpW,"Divya Kumar, Priya Saraiya",Sun Saathiya,Zee Music Company,121,-1,22,1305559,2025-06-05
183,spotify:track:4VsP4Dm8gsibRxB5I2hEkw,Kaifi Khalil,Kahani Suno 2.0,1944121 Records DK,1,175,129,1303021,2025-06-05
184,spotify:track:1fcCPXmH4vUzG6UQTTjZp5,"Mithoon, Arijit Singh, Shashaa Tirupati",Phir Bhi Tumko Chaahunga,Zee Music Company,117,178,41,1302990,2025-06-05
