rank,uri,artist_names,track_name,source,peak_rank,previous_rank,weeks_on_chart,streams,End Date
1,spotify:track:6VBhH7CyP56BXjp8VsDFPZ,"Pritam, Arijit Singh, Amitabh Bhattacharya","Kesariya (From ""Brahmastra"")",Sony Music Entertainment India Pvt. Ltd.,1,1,9,8564115,2022-09-15
2,spotify:track:7lvDsmTRXFE3dK4OjvRiWB,"Shae Gill, Ali Sethi",Pasoori,Giraffe Pakistan,1,2,30,3970692,2022-09-15
3,spotify:track:1aL9518P5G72N92b48tuKw,AP Dhillon,Summer High,RUN-UP RECORDS,3,3,6,3870347,2022-09-15
4,spotify:track:08Isz2ETWSBhvIl8UpKYsp,Shubh,No Love,SHUBH,2,4,27,3498786,2022-09-15
5,spotify:track:0IGXY47K2ha3AHfX57wY1O,"Pritam, Arijit Singh, Amitabh Bhattacharya, Jonita Gandhi","Deva Deva (From ""Brahmastra"")",Sony Music Entertainment India Pvt. Ltd.,5,25,6,3025559,2022-09-15
6,spotify:track:29m79w9xPMH4YCD6r8JSmV,"AP Dhillon, Gurinder Gill, Intense",Excuses,RUN-UP RECORDS,1,6,47,2917848,2022-09-15
7,spotify:track:6TQS7URegxmcb8tTNpoXzi,"Dhanush, Anirudh Ravichander","Megham Karukatha (From ""Thiruchitrambalam"")",Sun Pictures,4,5,8,2795452,2022-09-15
8,spotify:track:0snQrp1VaY5Pj1YIHRJpRJ,Aditya A,Chaand Baaliyan,Sony Music Entertainment India Pvt. Ltd.,2,8,30,2395971,2022-09-15
9,spotify:track:5IgjP7X4th6nMNDh4akUHb,Chris Brown,Under The Influence,Chris Brown Entertainment/RCA Records,9,13,5,2368969,2022-09-15
10,spotify:track:42TMa2hgBNjte4uV7jNCnQ,"Shubh, Ikky",Baller,SHUBH,10,-1,1,2270533,2022-09-15
11,spotify:track:0yCWDaAgOtg6TKlNCg9rwA,King,Tu Aake Dekhle,Warner Music India,6,9,85,2223811,2022-09-15
12,spotify:track:1Nr46gjiP50uPsz30gYhAd,"Santhosh Narayanan, Anirudh Ravichander","Thenmozhi (From ""Thiruchitrambalam"")",Sun Pictures,5,7,5,2157636,2022-09-15
13,spotify:track:2rOnSn2piaqLAlYjtfUBlY,"Tanishk Bagchi, Jubin Nautiyal, Asees Kaur","Raataan Lambiyan (From ""Shershaah"")",Sony Music Entertainment India Pvt. Ltd.,1,15,59,2092931,2022-09-15
14,spotify:track:5W7DOVGQLTigu09afW7QMT,Sidhu Moose Wala,295,Sidhu Moose Wala,1,10,31,2036608,2022-09-15
15,spotify:track:6ZYxNjuAU9Vy3VtF6W1dtE,Shubh,We Rollin,SHUBH,10,16,42,2015358,2022-09-15
16,spotify:track:0skYUMpS0AcbpjcGsAbRGj,BLACKPINK,Pink Venom,YG Entertainment/Interscope Records,7,11,4,1921730,2022-09-15
17,spotify:track:2eAvDnpXP5W0cVtiI0PUxV,Ruth B.,Dandelions,Columbia,14,14,42,1919113,2022-09-15
20,spotify:track:02MWAaffLxlfxAUY7c5dvx,Glass Animals,Heat Waves,Polydor Records,3,17,61,1704539,2022-09-15
21,spotify:track:72zHuDxFQTjbL51qJQSA7j,"Jasleen Royal, B Praak, Romy, Anvita Dutt","Ranjha (From ""Shershaah"")",Sony Music Entertainment India Pvt. Ltd.,1,21,58,1677278,2022-09-15
22,spotify:track:2FCXQHugkoHE1K3tiDu8pu,"Alka Yagnik, Arijit Singh","Agar Tum Saath Ho (From ""Tamasha"")",T-Series,4,32,172,1582785,2022-09-15
23,spotify:track:5O2P9iiztwhomNh8xkR9lJ,One Direction,Night Changes,Syco Music,22,23,70,1564966,2022-09-15
24,spotify:track:6yvxu91deFKt3X1QoV6qMv,"Anirudh Ravichander, Jonita Gandhi","Arabic Kuthu - Halamithi Habibo (From ""Beast"")",Sun Pictures,2,19,31,1539875,2022-09-15
25,spotify:track:2eTkxblLeqdTSsb2ivafDX,"Ankit Tiwari, Manoj Muntashir","Galliyan Returns (From ""Ek Villain Returns"")",T-Series,9,45,11,1536855,2022-09-15
26,spotify:track:58HvfVOeJY7lUuCqF0m3ly,Elley Duhé,MIDDLE OF THE NIGHT,Not Fit For Society/RCA Records,12,27,37,1529678,2022-09-15
27,spotify:track:2FZDNh6tm9mkZ9vTphuAh8,"Pritam, Tanishk Bagchi, Neeraj Shridhar",Bhool Bhulaiyaa 2 Title Track,T-Series,7,30,20,1525972,2022-09-15
28,spotify:track:60YICjIPdL7LDBcCMK0tAk,"Sidhu Moose Wala, Sunny Malton, The Kidd",Levels,Sidhu Moose Wala,8,29,16,1516418,2022-09-15
29,spotify:track:5PjdY0CKGZdEuoNab3yDmX,"The Kid LAROI, Justin Bieber",STAY (with Justin Bieber),Columbia,1,26,62,1469572,2022-09-15
30,spotify:track:6VhuP99TE6gYNQRJIlAWFD,Stephen Sanchez,Until I Found You,Republic Records,20,20,20,1464535,2022-09-15
31,spotify:track:7B4uYqxTpTOS1sgxFB9Ann,"Sidhu Moose Wala, Wazir Patar",The Last Ride,Sidhu Moose Wala,3,28,18,1440376,2022-09-15
32,spotify:track:2J2Z1SkXYghSajLibnQHOa,Sia,Unstoppable,Monkey Puzzle Records/RCA Records,16,33,59,1429260,2022-09-15
33,spotify:track:1pean7zvZUqcWZaUucH63f,"Dhanush, Anirudh Ravichander","Thaai Kelavi (From ""Thiruchitrambalam"")",Sun Pictures,18,22,6,1424587,2022-09-15
34,spotify:track:1y1rQTkWmrZdJmjwuK07GC,"Vishal Mishra, Manoj Muntashir","Kaise Hua (From ""Kabir Singh"")",T-Series,5,43,170,1423270,2022-09-15
35,spotify:track:0MHiYjjcHNYM9KURa6NveF,"Dabzee, SA","Manavaalan Thug - From ""Thallumaala""",Muzik247,24,24,5,1409410,2022-09-15
36,spotify:track:043SPVu75TXbs94ZfM9dfn,"Kaushik-Guddu, Raghav Chaitanya, Kunaal Vermaa","Dil (From ""Ek Villain Returns"")",T-Series,20,53,10,1383783,2022-09-15
37,spotify:track:4Dvkj6JhhA12EX05fT7y2e,Harry Styles,As It Was,Columbia,5,31,24,1374525,2022-09-15
38,spotify:track:0DXfJ2iKRDEG7rPgssWFea,"Kanishk Seth, Kavita Seth","Rangisari (From ""Jugjugg Jeeyo"")",T-Series,22,42,14,1366180,2022-09-15
39,spotify:track:3UhmuWcFaLS3AO3kI9ynQ2,"AP Dhillon, Shinda Kahlon, Gurinder Gill, Gminxr",Insane,RUN-UP RECORDS,3,34,74,1363081,2022-09-15
40,spotify:track:0gE8ZP2cTXpRDz53bTkpu6,"Vishal Chandrashekhar, S.P. Charan",Inthandham,Sony Music Entertainment India Pvt. Ltd.,30,59,6,1352510,2022-09-15
41,spotify:track:1smFN2CLqGROu0J0UyvDfL,"Pritam, Arijit Singh",Shayad,Sony Music Entertainment India Pvt. Ltd.,1,48,139,1348668,2022-09-15
42,spotify:track:1ZiReD9pPTttQWwSoYqdyH,Dikshant,Aankhon Se Batana,Sony Music Entertainment India Pvt. Ltd.,38,49,21,1319716,2022-09-15
43,spotify:track:2qxmye6gAegTMjLKEBoR3d,Alec Benjamin,Let Me Down Slowly,2018,34,41,127,1308719,2022-09-15
44,spotify:track:2tMoOS9grHtn4upzb4LwMG,"Dhibu Ninan Thomas, Kapil Kapilan","Adiye - From ""Bachelor""",Think Music,16,37,41,1303121,2022-09-15
45,spotify:track:5iCY0TXNImK4hyKfcplQsg,Anuv Jain,Baarishein,Universal Music India Pvt. Ltd. (on behalf of Anuv Jain),45,54,70,1297887,2022-09-15
46,spotify:track:1rDjwexewf4hrdZT7SRNsH,"Faridkot, Amar Jalal",Nasha (Equals Sessions),Anahad Foundation,39,39,5,1256591,2022-09-15
48,spotify:track:0mBP9X2gPCuapvpZ7TGDk3,"Charlie Puth, Jung Kook, BTS",Left and Right (Feat. Jung Kook of BTS),Atlantic Records,4,35,12,1240951,2022-09-15
49,spotify:track:5WWplXimzIjlJiN2N7T9Q3,"Anirudh Ravichander, Kamal Haasan","Pathala Pathala (From ""Vikram"")",Sony Music Entertainment India Pvt. Ltd.,6,36,18,1222565,2022-09-15
50,spotify:track:5urYiIXu1ZhfMAOsp7WDTc,"Rajat Nagpal, Yasser Desai, Neha Kakkar, Rana Sotal","Dil Ko Karaar Aaya (From ""Sukoon"")",Desi Music Factory,3,58,69,1210159,2022-09-15
51,spotify:track:0stbF4C1ACmIvx0aW81ZXa,"Nakash Aziz, Sunidhi Chauhan","Ra Ra Rakkamma (From ""Vikrant Rona"")",Lahari Music,30,46,10,1205471,2022-09-15
52,spotify:track:3nlAERKIpn3ffgGwYQs0EB,Mitraz,Akhiyaan,Mitraz Records,23,47,20,1173494,2022-09-15
53,spotify:track:3gOXq3FPPesm7VLPKmef6j,"Arijit Singh, Shashaa Tirupati",Rait Zara Si,T-Series,12,66,41,1150579,2022-09-15
54,spotify:track:6A6mDExVoAEJmc5JyVSQeK,Anirudh Ravichander,"Life of Pazham (From ""Thiruchitrambalam"")",Sun Pictures,19,38,5,1147219,2022-09-15
55,spotify:track:58f4twRnbZOOVUhMUpplJ4,"AP Dhillon, Gminxr, Gurinder Gill, Shinda Kahlon",Brown Munde,Run-up Records,1,55,95,1143691,2022-09-15
56,spotify:track:78tblPcz2otRZd1VOeU7zz,"Yuvan Shankar Raja, Sid Sriram","Kanja Poovu Kannala (From ""Viruman"")",Sony Music Entertainment India Pvt. Ltd.,17,40,14,1138833,2022-09-15
58,spotify:track:7MXVkk9YMctZqd1Srtv4MB,"The Weeknd, Daft Punk",Starboy,Universal Republic Records,57,57,59,1128891,2022-09-15
59,spotify:track:5OcGETO7eEKjKme4gm0r7y,"Pritam, Arijit Singh, Amitabh Bhattacharya","Dance Ka Bhoot (From ""Brahmastra"")",Sony Music Entertainment India Pvt. Ltd.,59,109,3,1126583,2022-09-15
60,spotify:track:6KtSNVgCmQEvDgIuHoXAkT,Azaan Sami Khan,Ik Lamha,Freebird Records,36,51,12,1121530,2022-09-15
61,spotify:track:7eNSk0grNnO7MqjLZzs6MM,"Mithoon, Arijit Singh, Neeti Mohan, Karan Malhotra",Fitoor,YRF Music,12,64,10,1119539,2022-09-15
62,spotify:track:3wz2vWhYnnBoFmgMkqtzLy,"Chani Nattan, Inderpal Moga",Daku,Kharku Life Records,62,74,4,1101751,2022-09-15
63,spotify:track:3yV2c3cYhkAwSsxAq6nRiv,Gajendra Verma,Mann Mera,Sony Music / Eros Now Music,42,63,78,1098576,2022-09-15
64,spotify:track:5RrOyaV2xOAnf62uWj24dB,King,OOPS,Warner Music India,64,76,3,1097969,2022-09-15
65,spotify:track:32LKwbmh6yVsWoRRF8DIvf,Pav Dharia,Na Ja,Ishtar Punjabi,50,52,45,1097076,2022-09-15
66,spotify:track:7k6QR9YHyW258yVN6FHO1T,"OAFF, Savera, Lothika, Kausar Munir",Doobey,Sony Music Entertainment India Pvt. Ltd.,2,71,34,1096164,2022-09-15
67,spotify:track:2vkNA9I029dTwX0y6d59Sc,"Anirudh Ravichander, Anthony Daasan","Dippam Dappam (From ""Kaathuvaakula Rendu Kaadhal"")",Sony Music Entertainment India Pvt. Ltd.,13,44,21,1088307,2022-09-15
68,spotify:track:2tjWCe2W7sgvS3C8NHcdtI,"Akhil, Dhvani Bhanushali, Kunaal Vermaa, Abhijit Vaghani","Duniyaa (From ""Luka Chuppi"")",T-Series,1,73,186,1088043,2022-09-15
69,spotify:track:6FQQiTpYnfc5803p84bQp1,Anirudh Ravichander,Vikram - Title Track,Sony Music Entertainment India Pvt. Ltd.,5,56,18,1085900,2022-09-15
70,spotify:track:5pcmtf1lwrMqmAWWm248fY,"AP Dhillon, Gurinder Gill",DESIRES,RUN-UP RECORDS,2,62,43,1084693,2022-09-15
71,spotify:track:5O932cZmzOZGOGZz9RHx20,"Pritam, Arijit Singh",Khairiyat,T-Series,1,75,158,1083281,2022-09-15
72,spotify:track:2Fv2injs4qAm8mJBGaxVKU,"Arijit Singh, Mithoon","Tujhe Kitna Chahne Lage (From ""Kabir Singh"")",T-Series,2,80,172,1066537,2022-09-15
74,spotify:track:3eH3HTKPBmxvbT7OgxjNit,"Vishal Chandrashekhar, Anurag Kulkarni, Sinduri Vishal","Kaanunna Kalyanam (From ""Sita Ramam (Telugu)"")",Sony Music Entertainment India Pvt. Ltd.,59,104,6,1053959,2022-09-15
75,spotify:track:2kOH2QZB7F7I1iVXqwKuBF,"Dhanush, Anirudh Ravichander","Mayakkama Kalakkama (From ""Thiruchitrambalam"")",Sun Pictures,67,67,3,1043292,2022-09-15
76,spotify:track:0ojpEubhy4JNeVftmVuiN7,"Vishal Mishra, Armaan Malik",Pehla Pyaar,T-Series,11,172,68,1033483,2022-09-15
77,spotify:track:5L70RGPJEdooqtrgR7vd6U,"Pritam, Arijit Singh, Tulsi Kumar",Hum Nashe Mein Toh Nahin,T-Series,30,83,18,1026363,2022-09-15
78,spotify:track:7oN0Wo7sCVvXPdpxoio3JM,"Madhur Sharma, Swapnil Tare, Nusrat Fateh Ali Khan",Kali Kali Zulfon Ke (Lo-Fi),T-Series,78,86,2,1018841,2022-09-15
79,spotify:track:2AilvPt1AQ8PixlCKqkjfj,Shubh,Elevated,SHUBH,44,77,37,1016666,2022-09-15
80,spotify:track:7ef4DlsgrMEH11cDZd32M6,"Calvin Harris, Dua Lipa",One Kiss (with Dua Lipa),Sony Music UK,56,65,16,1011818,2022-09-15
81,spotify:track:1uJ2czshFLqimctgvsxfv2,"A.R. Rahman, A. R. Reihana, Bamba Bakya, Ilango Krishnan","Ponni Nadhi (From ""Ponniyin Selvan Part - 1"")",Tips Industries Ltd,81,82,5,1006718,2022-09-15
82,spotify:track:0VjIjW4GlUZAMYd2vXMi3b,The Weeknd,Blinding Lights,Republic Records,4,69,146,998868,2022-09-15
83,spotify:track:0aA3jlllhKSEiXTmGPGSWz,"Jeetu Sharma, Abhilipsa Panda",Har Har Shambhu Shiv Mahadeva,Jeetu Sharma,15,68,12,993164,2022-09-15
84,spotify:track:7eQl3Yqv35ioqUfveKHitE,"Pritam, Mohit Chauhan, Irshad Kamil",Tum Se Hi,T-Series,56,93,130,985664,2022-09-15
87,spotify:track:5uHy68Q7ZWe8Qq9k7EAprS,Karan Aujla,Sheesha,Karan Aujla Music inc,70,70,3,962169,2022-09-15
88,spotify:track:3mZLiEDAHIjZ8ms5Lxq33F,Diljit Dosanjh,Peaches,DILJIT DOSANJH,33,81,9,959525,2022-09-15
89,spotify:track:6zAvNLJkdyRApUHnlJjKfO,Ali Zafar,Jhoom - R&B Mix,Lightingale Records,20,84,18,959490,2022-09-15
90,spotify:track:2NTVtNcpC0i1R7LVGaCZCF,"Badshah, Nikhita Gandhi",Jugnu,Universal Music India Pvt Ltd.,5,87,46,957591,2022-09-15
91,spotify:track:3JkVYvxNoGf2HCWJo61462,"Sidhu Moose Wala, Sunny Malton, SOE",Never Fold,Sidhu Moose Wala,13,92,21,957457,2022-09-15
92,spotify:track:4bD9z9qa4qg9BhryvYWB7c,"Pritam, Tochi Raina, Rekha Bhardwaj",Kabira,T-Series,72,79,157,954593,2022-09-15
93,spotify:track:1iZLpuGMr4tn1F5bZu32Kb,Harrdy Sandhu,Bijlee Bijlee,Universal Music India Pvt Ltd. – Distribution,2,90,46,947907,2022-09-15
94,spotify:track:5G7pZ8G8NFvS1MQ9H4L7dC,"Javed-Mohsin, Arijit Singh, Shreya Ghoshal, Kunaal Vermaa, Prashant Ingole",Pal,Sony Music Entertainment India Pvt. Ltd.,44,111,184,921476,2022-09-15
95,spotify:track:0tgVpDi06FyKpA1z0VMD4v,Ed Sheeran,Perfect,Atlantic Records UK,48,95,126,918547,2022-09-15
96,spotify:track:4OcvkkpF3xmyCGGY5IBlgi,"Akhil Sachdeva, Tulsi Kumar","Tera Ban Jaunga (From ""Kabir Singh"")",T-Series,4,119,161,913044,2022-09-15
97,spotify:track:6eYsOcDdB5b6rTO5ubMxeV,"Anirudh Ravichander, Jonita Gandhi","Private Party (From ""Don"")",Sony Music Entertainment India Pvt. Ltd.,23,78,20,912524,2022-09-15
98,spotify:track:7sVEoPc5ZUUQerRkgTypUZ,"Javed Ali, Devi Sri Prasad","Srivalli (From ""Pushpa The Rise Part - 01"")",T-Series,4,105,34,903391,2022-09-15
99,spotify:track:3fwyItGexa88kR8j76dIqv,Pratsofficial,Aziyat 2.0 - Reprise Version,Prats,85,115,14,895302,2022-09-15
100,spotify:track:6DefzsWqnwrFrmNVnJxWkS,"Asim Azhar, Kunaal Vermaa",Jo Tu Na Mila,Universal Music India Pvt Ltd.,89,89,12,894471,2022-09-15
101,spotify:track:4iEGv5Ne6HuCkFCjzxdWQK,Neeti Mohan,Meri Jaan,Saregama,11,101,29,891552,2022-09-15
102,spotify:track:4381FmKZc1uT2zzhBiknH7,"A.R. Rahman, Vagu Mazan, Thoughtsfornow","Adheeraa (From ""Cobra"")",Sony Music Entertainment India Pvt. Ltd.,61,61,5,890039,2022-09-15
103,spotify:track:0NvGVd87SYZnryTcfQPKUO,Madhur Sharma,Kali Kali Zulfon Ke,Universal Music India Pvt Ltd.,87,131,15,888605,2022-09-15
104,spotify:track:0QzuaeCEEOV40Pn7IvKEny,Dhruv,double take,Little Worry/RCA Records,75,94,23,887264,2022-09-15
105,spotify:track:6TClJ8jXi3OBV7gcrU3jx5,"AP Dhillon, Gurinder Gill",TERE TE,RUN-UP RECORDS,7,122,43,883811,2022-09-15
106,spotify:track:6fhG2KJgwO7CrNflRaRmvp,"Ruth B., sped up + slowed, slater",Dandelions - slowed + reverb,Columbia,75,97,29,881927,2022-09-15
107,spotify:track:0tpwqQhdfJXRcUDSNRjb9O,"Arijit Singh, Neeti Mohan, Rashmi Virag","Mere Yaaraa (From ""Sooryavanshi"")",T-Series,20,130,46,880859,2022-09-15
108,spotify:track:7qiZfU4dY1lWllzX7mPBI3,Ed Sheeran,Shape of You,Atlantic Records UK,63,110,123,863929,2022-09-15
109,spotify:track:4BoFJMLSO3ZoD48KgnslSe,Yashal Shahid,Mere Humsafar (Original Score) [Female Version],ARY DIGITAL,92,96,8,863081,2022-09-15
110,spotify:track:5Z9KJZvQzH6PFmb8SNkxuk,"Lil Nas X, Jack Harlow",INDUSTRY BABY (feat. Jack Harlow),Columbia,6,98,60,861445,2022-09-15
111,spotify:track:7mNZUnDWUDidWBFaUpVtOC,Vilen,Chidiya,Universal Music India Pvt Ltd.,4,85,116,861350,2022-09-15
112,spotify:track:4gC6xOiJLHTpIARRdmYMaQ,"Lipsika Bhashyam, Aditya Iyengar",Ra Ra Reddy I Am Ready,Aditya Music,53,91,8,861269,2022-09-15
113,spotify:track:0pqnGHJpmpxLKifKRmU6WP,Imagine Dragons,Believer,Kid Ina Korner / Interscope,25,108,186,854597,2022-09-15
114,spotify:track:3APdIdF8H0jsxSuGOqXedS,Rashid Ali,Kabhi Kabhi Aditi,T-Series,86,125,48,831648,2022-09-15
115,spotify:track:1J14CdDAvBTE1AJYUOwl6C,Duncan Laurence,Arcade,"Universal Music, a division of Universal International Music BV",7,99,82,828377,2022-09-15
116,spotify:track:3ZGJhN4unVspOqpwGvUL2W,Diljit Dosanjh,Lemonade,DILJIT DOSANJH,93,160,7,826762,2022-09-15
117,spotify:track:3B4etxytImrRKQgV3XHjnR,Katy Perry,Harleys In Hawaii,Capitol Records,32,114,57,822934,2022-09-15
118,spotify:track:6XPmY4hIb1RGRyNuq0UBsl,The PropheC,Kina Chir,PropheC Productions,12,153,47,819811,2022-09-15
119,spotify:track:6v3KW9xbzN5yKLt9YKDYA2,"Shawn Mendes, Camila Cabello",Señorita,Island Records,1,118,169,817462,2022-09-15
122,spotify:track:43YkTTlOD203o9E5ZxhUjF,Arijit Singh,"Main Dhoondne Ko Zamaane Mein (From ""Heartless"")",T-Series,94,132,57,810582,2022-09-15
123,spotify:track:209pScL6fUhISxcLWkB6rf,Anirudh Ravichander,Lokiverse - Background Score,Sony Music Entertainment India Pvt. Ltd.,37,116,10,809251,2022-09-15
124,spotify:track:7cWnks0lsRtpAi87COOiXK,"Salim–Sulaiman, Rahat Fateh Ali Khan, Jaideep Sahni",O Re Piya,YRF Music,124,149,4,808632,2022-09-15
125,spotify:track:1hYaQRlsuEW4kMjjmjyow3,"Vishal Chandrashekhar, S.P. Charan, Ramya Behara","Oh Sita Hey Rama (From ""Sita Ramam (Telugu)"")",Sony Music Entertainment India Pvt. Ltd.,91,152,6,807825,2022-09-15
126,spotify:track:0loZn1c5heXie7OAtvK6nH,"Jubin Nautiyal, Rocky - Shiv",Humnava Mere,T-Series,86,127,80,800843,2022-09-15
127,spotify:track:0u2P5u6lvoDfwTYjAADbn4,"Billie Eilish, Khalid",lovely (with Khalid),Darkroom,23,123,180,799321,2022-09-15
128,spotify:track:7ouBSPZKQpm7zQz2leJXta,Arijit Singh,"Tum Hi Ho (From ""Aashiqui 2"")",T-Series,78,133,85,797814,2022-09-15
129,spotify:track:2PcGqmKToUz0s65q1Acg7d,"AP Dhillon, Shinda Kahlon, Gminxr",SPACESHIP,RUN-UP RECORDS,15,120,43,793976,2022-09-15
131,spotify:track:2PvaburAUlhNHxVhw5lvOq,Arijit Singh,"Humdard (From ""Ek Villain"")",T-Series,93,129,113,790439,2022-09-15
132,spotify:track:4wCy7erulqUfFQNVaZBD9b,Anirudh Ravichander,Once Upon a Time,Sony Music Entertainment India Pvt. Ltd.,12,103,17,788196,2022-09-15
133,spotify:track:7Mi0pugIa9VPQm7ykGWIfa,"Devi Sri Prasad, Silambarasan TR, Haripriya, Shree Mani","Bullet song (From ""The Warriorr"")(Telugu)",Aditya Music,70,112,17,786610,2022-09-15
134,spotify:track:4Te9tTtG4ipT6x6G69DTJd,"Pritam, Sid Sriram","Kumkumala (From ""Brahmastra (Telugu)"")",Sony Music Entertainment India Pvt. Ltd.,134,-1,1,777967,2022-09-15
135,spotify:track:3qrdLVOClRU4yPkcXZ7c5u,"Ayushmann Khurrana, Tanishk-Vayu","Mere Liye Tum Kaafi Ho (From ""Shubh Mangal Zyada Saavdhan"")",T-Series,11,144,135,777757,2022-09-15
136,spotify:track:2VrSkfinwUSNc7uAXiL0FA,"ShaSings, Xtreeemit",Let Me Down Slowly / Mai Dhoondhne Ko Zamaney / Kabhi Jo Badal Barsey (Medley),ShaSings,123,139,6,776914,2022-09-15
137,spotify:track:0dLbrlAVPPjpPqnYfmJsWk,"Atif Aslam, Alisha Chinai, Pritam",Tera Hone Laga Hoon,Tips Industries Ltd,83,146,70,776082,2022-09-15
138,spotify:track:3dPlLOjFnKpGpakkhPEIgF,Prem Dhillon,OG,Prem Dhillon,80,113,5,768813,2022-09-15
139,spotify:track:3Vb8KkT6Ub5fFGPYJCJyLh,Anirudh Ravichander,Rolex Theme - Background Score,Sony Music Entertainment India Pvt. Ltd.,25,124,10,762409,2022-09-15
140,spotify:track:1feANd8EfcDP5UqSvbheM3,"Sachet Tandon, Sachet-Parampara","Bekhayali (From ""Kabir Singh"")",T-Series,1,-1,161,760843,2022-09-15
141,spotify:track:3sqRODOZ1Z6hR4F2tnFAlg,Maninder Buttar,Sakhiyaan,Ishtar Punjabi,20,150,176,760318,2022-09-15
142,spotify:track:1w3exvIgbRFV2ijf6qyWm8,Sidhu Moose Wala,Everybody Hurts,Sidhu Moose Wala,18,135,20,759852,2022-09-15
143,spotify:track:6I3mqTwhRpn34SLVafSH7G,Justin Bieber,Ghost,RBMG/Def Jam,72,117,49,759143,2022-09-15
144,spotify:track:3NpbGCDrcQTERaZb5dHhd3,"Guru Randhawa, Asees Kaur, Vishal Shelke","Nain Ta Heere (From ""Jugjugg Jeeyo"")",T-Series,104,140,11,757235,2022-09-15
145,spotify:track:455lcFHS2MOMKcGquhAf22,"Ankit Tiwari, Tara Sutaria","Shaamat (From ""Ek Villain Returns"")",T-Series,80,-1,7,753201,2022-09-15
146,spotify:track:6FjbAnaPRPwiP3sciEYctO,"Pritam, Arijit Singh",Raabta,T-Series,144,159,16,748142,2022-09-15
147,spotify:track:6udC4b4jOSnHb9ItnXgKLR,"Sachin-Jigar, Shreya Ghoshal, Tochi Raina",Saibo,Sony Music Entertainment India Pvt. Ltd.,65,161,98,746218,2022-09-15
148,spotify:track:6xGruZOHLs39ZbVccQTuPZ,Joji,Glimpse of Us,88rising Music,19,128,13,732554,2022-09-15
149,spotify:track:3C9kY7XZh6GCEmfazGJ2UB,Serena,Safari,"Ultra Records, LLC",82,155,84,727006,2022-09-15
150,spotify:track:57jOEZtoLQK4zF2x55bdkp,"Rochak Kohli, Arijit Singh, Neha Kakkar","Tu Hi Yaar Mera (From ""Pati Patni Aur Woh"")",T-Series,8,167,145,724374,2022-09-15
151,spotify:track:0lYBSQXN6rCTvUZvg9S0lU,"DJ Snake, Justin Bieber",Let Me Love You,DJ Snake Def Jam,90,142,186,722172,2022-09-15
152,spotify:track:48QmG1dfvMuYLxMPt7KSRA,"Sean Paul, Dua Lipa",No Lie,Universal-Island Records Ltd.,19,143,44,719833,2022-09-15
153,spotify:track:5EYZZvmNAH5VZCwuzYJqoA,"Jatin-Lalit, Shaan, Kailash Kher, Prasoon Joshi",Chand Sifarish,YRF Music,98,174,32,711652,2022-09-15
154,spotify:track:70wFZWY6cKFxp3Qcq8uxH4,King,Ektarfa,Warner Music India,51,157,15,710762,2022-09-15
155,spotify:track:6H7fLdt0AeWpuxUKXuXWrx,Hariharan,Shree Hanuman Chalisa,T-Series,155,188,6,710276,2022-09-15
156,spotify:track:1W1dS4VnIrYnllQJ3CAcZy,Sidhu Moose Wala,So High,Humble Music,38,147,16,709600,2022-09-15
157,spotify:track:7BKLCZ1jbUBVqRi2FVlTVw,"The Chainsmokers, Halsey",Closer,Disruptor Records/Columbia,59,171,186,702665,2022-09-15
158,spotify:track:3OK2VUpcjQQZAqGHw95N4G,Prem Dhillon,26 Blvd,Prem Dhillon,54,106,5,701783,2022-09-15
159,spotify:track:3HiobOOpSpMsi95WBKPBYk,"Jeet Gannguli, Arijit Singh",Hamari Adhuri Kahani (Title Track),Sony Music Entertainment India Pvt. Ltd.,159,195,44,695382,2022-09-15
160,spotify:track:4wIWWEhbdgKAxhR68eE0Ye,"Arijit Singh, Chinmayi","Mast Magan (From ""2 States"")",T-Series,75,176,82,691625,2022-09-15
161,spotify:track:1AzNN19lPYC68iacrbWL8X,"Darbuka Siva, Sid Sriram","Mudhal Nee Mudivum Nee Title Track (From ""Mudhal Nee Mudivum Nee"")",Sony Music Entertainment India Pvt. Ltd.,24,156,33,687486,2022-09-15
162,spotify:track:5ZhKD46Q7mhsl0awl7ZMJc,"Sachin-Jigar, Atif Aslam",Jeena Jeena,Eros Now Music,90,191,64,686086,2022-09-15
163,spotify:track:0XwRlvv3KlOu4HWlOH34XG,Diljit Dosanjh,Lover,Diljit Dosanjh,13,180,56,685635,2022-09-15
164,spotify:track:3e7sxremeOE3wTySiOhGiP,"ZAYN, Sia",Dusk Till Dawn (feat. Sia) - Radio Edit,RCA Records Label,51,165,154,684323,2022-09-15
165,spotify:track:1UWacd8x8tPPwmrPB1MoBI,"Pritam, Arijit Singh",Ae Dil Hai Mushkil Title Track,Sony Music Entertainment India Pvt. Ltd.,105,199,137,681618,2022-09-15
166,spotify:track:0H2iJVgorRR0ZFgRqGUjUM,"Pritam, Arijit Singh",Channa Mereya,Sony Music Entertainment India Pvt. Ltd.,58,187,151,681205,2022-09-15
167,spotify:track:1u8c2t2Cy7UBoG4ArRcF5g,Taylor Swift,Blank Space,"Big Machine Records, LLC",69,162,95,676692,2022-09-15
168,spotify:track:4HdzYTQiouB9BVYX7JOrhh,"Anirudh Ravichander, Rokesh","Jalabulajangu (From ""Don"")",Sony Music Entertainment India Pvt. Ltd.,21,148,39,676193,2022-09-15
169,spotify:track:3iH9MTX6mSGgSNlw9Q2T6t,"Hrithik Jayakish, Neha Girish, Eshaan Sanil, Thejas Krishna, Vishnu Vijay, Mu.Ri","Thallumaala Paattu - From ""Thallumaala""",Muzik247,66,121,5,675686,2022-09-15
170,spotify:track:2zZTXtLqCsICzEcztKjn47,"Neeraj Shridhar, Kavita Seth, Pritam",Tum Hi Ho Bandhu,Eros Now Music,170,197,6,675602,2022-09-15
171,spotify:track:7hU3IHwjX150XLoTVmjD0q,LISA,MONEY,YG Entertainment/Interscope Records,6,163,53,671937,2022-09-15
172,spotify:track:4gvrJnKCKIPiacNsWVQwEU,"CKay, Dj Yo!, AX'EL",love nwantiti (feat. Dj Yo! & AX'EL) - Remix,WM South Africa,4,177,52,671475,2022-09-15
173,spotify:track:1SOClUWhOi8vHZYMz3GluK,Jaymes Young,Infinity,Atlantic Records,22,166,41,671251,2022-09-15
174,spotify:track:4L6hCEc9xFf01U4d66JzK0,Armaan Malik,Tu / You,Arista Records,110,181,7,668763,2022-09-15
175,spotify:track:6gwnKOvdBKkTU4CQ7KpIAu,"Shaarib Toshi, Arijit Singh","Bandeya - From ""Dil Juunglee""",Pooja Music,131,170,14,668685,2022-09-15
176,spotify:track:1Hdz67JES35Z4h3Yd4PXvV,"Thaman S, Anirudh Ravichander, Ramya Behara, Sahithi Chaganti, Vivek","Bimbilikki Pilapi (From ""Prince "")(Tamil)",Aditya Music,107,107,2,668307,2022-09-15
177,spotify:track:5D507IC1VOAg7bKkmOblr6,"Anirudh Ravichander, Adithya RK","Bae (From ""Don"")",Sony Music Entertainment India Pvt. Ltd.,50,145,32,666154,2022-09-15
178,spotify:track:4iFPsNzNV7V9KJgcOX7TEO,"Atif Aslam, Pritam",Tu Jaane Na,Tips Industries Ltd,108,186,74,665230,2022-09-15
179,spotify:track:1NX33DecZrq4ZUGDc47AfN,Arijit Singh,"Tera Yaar Hoon Main (From ""Sonu Ke Titu Ki Sweety"")",T-Series,54,196,180,664612,2022-09-15
180,spotify:track:1Ef0TmgS1QrVO6tKHrMMmH,"Vishal-Shekhar, Arijit Singh, Shilpa Rao, Kumaar","Ghungroo (From ""War"")",YRF Music,1,189,149,662716,2022-09-15
181,spotify:track:3RiPr603aXAoi4GHyXx0uy,Coldplay,Hymn for the Weekend,Parlophone UK,118,164,21,661850,2022-09-15
182,spotify:track:1E16f7KcZmuXuhlenRwA2m,"VIBIE, Sachin-Jigar, Shreya Ghoshal, Tochi Raina, Bollywood Lofi",Saibo - Lofi Flip,Sony Music Entertainment India Pvt. Ltd.,175,179,4,660525,2022-09-15
183,spotify:track:2n9ylYiF7urpXo36qBwr3g,Stebin Ben,Mera Dil Bhi Kitna Pagal Hai - Recreated Version,Ishtar Music Pvt. Ltd.,140,-1,14,660168,2022-09-15
185,spotify:track:5cF0dROlMOK5uNZtivgu50,Charlie Puth,Attention,Artist Partner,110,183,119,657622,2022-09-15
186,spotify:track:2RgvvnMwtP0R2OkVZmFvnV,KK,"Ajab Si (From ""Om Shanti Om"")",T-Series,46,200,36,655784,2022-09-15
187,spotify:track:63vWEUXhpgghscp9FgvCMG,"Vishal Chandrashekhar, K. S. Harisankar, Sinduri Vishal","Kannil Kannil (From ""Sita Ramam (Malayalam)"")",Sony Music Entertainment India Pvt. Ltd.,187,-1,1,655440,2022-09-15
189,spotify:track:2ZRo7axmMPeSVUvDbGkJah,XXXTENTACION,Hope,"Bad Vibes Forever, LLC",44,169,68,648761,2022-09-15
190,spotify:track:3Vmo13MxVRKBszmfK61ONH,"Karan Aujla, YG",Gangsta,Rehaan Records,21,173,19,648017,2022-09-15
191,spotify:track:6PO6EnP2QoP4vN27KmKvrj,Prem Dhillon,Nah They Can't,Prem Dhillon,88,158,5,646591,2022-09-15
192,spotify:track:0gPgdRfB4jdGrlyXS0Vx78,"Vishal-Shekhar, KK, Shilpa Rao, Anvita Dutt Guptan",Khuda Jaane,YRF Music,37,-1,15,644194,2022-09-15
193,spotify:track:3T0oPETOdddxJ2xTt2qJe4,"Arjun Kanungo, Momina Mustehsan, Kunaal Vermaa",Aaya Na Tu,Universal Music India Pvt Ltd.,103,-1,18,644082,2022-09-15
194,spotify:track:4wMpv5KCDYSCQ0rWwKON0E,"Haricharan, Benny Dayal, Salim Kumar, Vishnu Vijay, Mu.Ri","Ole Melody - From ""Thallumaala""",Muzik247,121,134,4,643125,2022-09-15
195,spotify:track:3jf5303mzzJ96O8xFTcEn4,"B Praak, Jaani","Mann Bharryaa 2.0 (From ""Shershaah"")",Sony Music Entertainment India Pvt. Ltd.,3,-1,56,642815,2022-09-15
196,spotify:track:2vR23BjIzpLMtzsyKrM6Mb,"Kailash Kher, Paresh Kamath, Naresh Kamath",Saiyyan,Sony Music Entertainment India Pvt. Ltd.,196,-1,1,640210,2022-09-15
197,spotify:track:6qZyM6JV8ohLC4S2EL5sFh,"Sachet Tandon, Nikhita Gandhi, Madhubanti Bagchi, Sachin-Jigar",Barbaadiyan,T-Series,14,193,50,638206,2022-09-15
198,spotify:track:65orA4uL6HAdy9j9VeXxFC,"Jakes Bejoy, Athul Narukara, Sreehari Tharayil, Santhosh Varma","Pala Palli (From ""Kaduva"")",Magic Frames Music,137,137,3,637759,2022-09-15
