rank,uri,artist_names,track_name,source,peak_rank,previous_rank,weeks_on_chart,streams,End Date
1,spotify:track:28veUNu4veN0LOBVa0nFw8,"Yash Narvekar, Parampara Tandon, Tanishk Bagchi","Muqabla (From ""Street Dancer 3D"")",T-Series,1,4,2,1176243,2020-01-02
2,spotify:track:0WdbnNKO0Jt4BZACSDQh44,"Vishal-Shekhar, Arijit Singh, Shilpa Rao, Kumaar","Ghungroo (From ""War"")",YRF Music,1,1,17,963898,2020-01-02
3,spotify:track:4TnjEaWOeW0eKTKIEvJyCa,Trevor Daniel,Falling,Alamo,3,5,6,893191,2020-01-02
4,spotify:track:0TkquWzzuxcrwbCWlTrKYF,"Neha Kakkar, Tanishk Bagchi, Lalit Sen",Yaad Piya Ki Aane Lagi,T-Series,2,3,7,880650,2020-01-02
6,spotify:track:2b8fOow8UzyDFAE27YhOZM,Maroon 5,Memories,Interscope Records*,2,6,15,767788,2020-01-02
7,spotify:track:2Fv2injs4qAm8mJBGaxVKU,"Arijit Singh, Mithoon","Tujhe Kitna Chahne Lage (From ""Kabir Singh"")",T-Series,2,7,31,750712,2020-01-02
8,spotify:track:6q9XTgfWilsnyiFofvYrIF,"Badshah, Neha Kakkar, Varun Dhawan","Garmi (From ""Street Dancer 3D"") (feat. Varun Dhawan)",T-Series,8,-1,1,719526,2020-01-02
9,spotify:track:6v3KW9xbzN5yKLt9YKDYA2,"Shawn Mendes, Camila Cabello",Señorita,Island Records,1,9,28,675117,2020-01-02
10,spotify:track:6E9UwSfT80age2xknoMS7Y,"Payal Dev, Jubin Nautiyal, Kunaal Vermaa","Tum Hi Aana (From ""Marjaavaan"")",T-Series,2,8,14,653544,2020-01-02
11,spotify:track:696DnlkuDOXcMAnKlTgXXK,Arizona Zervas,ROXANNE,Arizona Zervas,10,10,8,613112,2020-01-02
12,spotify:track:5djZm1zFGcJUSUqbBjrAZH,"Neha Kakkar, Tulsi Kumar, B Praak","O Saki Saki (From ""Batla House"")",T-Series,2,12,25,589365,2020-01-02
13,spotify:track:7IAJzec1UxGYmNvbPTHbxx,"Sohail Sen, Vishal Dadlani","Shaitan Ka Saala (From ""Housefull 4"")",T-Series,8,13,13,575229,2020-01-02
14,spotify:track:6E7P1uT2afeor2t6wR2y2r,"B Praak, Akshay Kumar, Nupur Sanon",Filhall,Universal Music India Pvt Ltd. – Distribution,1,11,8,530971,2020-01-02
16,spotify:track:7ofWUKeNCUw1P64ArIwG9b,"Tony Kakkar, Neha Kakkar, Tanishk Bagchi","Dheeme Dheeme (From ""Pati Patni Aur Woh"")",T-Series,16,22,8,492808,2020-01-02
17,spotify:track:0sf12qNH5qcw8qpgymFOqD,The Weeknd,Blinding Lights,Republic Records,11,15,5,481173,2020-01-02
18,spotify:track:1feANd8EfcDP5UqSvbheM3,"Sachet Tandon, Sachet-Parampara","Bekhayali (From ""Kabir Singh"")",T-Series,1,17,32,480804,2020-01-02
19,spotify:track:21jGcNKet2qwijlDFuPiPb,Post Malone,Circles,Republic Records,9,16,18,472246,2020-01-02
20,spotify:track:2tjWCe2W7sgvS3C8NHcdtI,"Akhil, Dhvani Bhanushali, Kunaal Vermaa, Abhijit Vaghani","Duniyaa (From ""Luka Chuppi"")",T-Series,1,18,45,469707,2020-01-02
22,spotify:track:5xWpxI216rbOSiAqjdn6gy,"Meet Bros., Neha Kakkar, Jassie Gill","Lamborghini (From ""Jai Mummy Di"")",T-Series,22,94,2,443003,2020-01-02
23,spotify:track:2IoZMG3RqiTmsy7Li3zGFg,"Sachet Tandon, Parampara Tandon, Sachet-Parampara","Mere Sohneya (From ""Kabir Singh"")",T-Series,4,20,30,441963,2020-01-02
24,spotify:track:4OcvkkpF3xmyCGGY5IBlgi,"Akhil Sachdeva, Tulsi Kumar","Tera Ban Jaunga (From ""Kabir Singh"")",T-Series,4,21,29,439707,2020-01-02
26,spotify:track:57jOEZtoLQK4zF2x55bdkp,"Rochak Kohli, Arijit Singh, Neha Kakkar","Tu Hi Yaar Mera (From ""Pati Patni Aur Woh"")",T-Series,26,28,4,419731,2020-01-02
27,spotify:track:5QVHNa0ppJUOoqSd36ovQS,"Arijit Singh, B Praak, Jaani","Pachtaoge (From ""Jaani Ve"")",T-Series,1,23,19,407731,2020-01-02
28,spotify:track:42ETKyApzUl8hTtytFAjen,"Baani Sandhu, Gur Sidhu",8 Parche,Ishtar Punjabi,27,29,15,402025,2020-01-02
30,spotify:track:0RiRZpuVRbi7oqRdSMwhQY,"Post Malone, Swae Lee",Sunflower - Spider-Man: Into the Spider-Verse,Republic Records,3,26,45,384329,2020-01-02
31,spotify:track:3yOlyBJuViE2YSGn3nVE1K,"Camila Cabello, DaBaby",My Oh My (feat. DaBaby),Syco Music/Epic,31,37,4,383029,2020-01-02
32,spotify:track:1y1rQTkWmrZdJmjwuK07GC,"Vishal Mishra, Manoj Muntashir","Kaise Hua (From ""Kabir Singh"")",T-Series,5,25,29,379306,2020-01-02
33,spotify:track:3sqRODOZ1Z6hR4F2tnFAlg,Maninder Buttar,Sakhiyaan,Ishtar Punjabi,20,30,45,370606,2020-01-02
34,spotify:track:7KhHA3mzt7A3LFlOJEAKpI,"Alan Walker, Sabrina Carpenter, Farruko",On My Way,Kreatell Music,1,27,42,368652,2020-01-02
35,spotify:track:1CM4rFDU9q4EoLy2K44qE6,"B Praak, Harrdy Sandhu, Swasti Mehul, Jaani","Naah Goriye (From ""Bala"")",Sony Music Entertainment India Pvt. Ltd.,27,33,10,365809,2020-01-02
36,spotify:track:39ujbBjTwwqUFySaCYDMMT,"Badshah, Diljit Dosanjh, Aastha Gill",Proper Patola,Sony Music Entertainment India Pvt. Ltd.,18,40,45,364648,2020-01-02
37,spotify:track:6lfSsCL894Qw15xbt7cSUy,"Vishal Dadlani, Benny Dayal","Jai Jai Shivshankar (From ""War"")",YRF Music,9,34,15,362954,2020-01-02
38,spotify:track:2TbCdbFzs2xO2nzasn0Qvw,"Sachin-Jigar, Badshah, Shalmali Kholgade, Gurdeep Mehndi","Don't Be Shy Again (From ""Bala"")",Sony Music Entertainment India Pvt. Ltd.,38,42,11,355585,2020-01-02
39,spotify:track:74qF0JeFMVilMEeFDiQZ48,"Sunanda Sharma, Tanishk Bagchi, Jaani","Mummy Nu Pasand (From ""Jai Mummy Di"")",T-Series,39,53,2,349014,2020-01-02
40,spotify:track:4HBvwhhYo7YiYXkUDrOHzS,"SHAED, ZAYN",Trampoline (with ZAYN),Photo Finish Records,13,31,14,340897,2020-01-02
41,spotify:track:2Fxmhks0bxGSBdJ92vM42m,Billie Eilish,bad guy,Darkroom/Interscope Records,3,39,40,337752,2020-01-02
42,spotify:track:6AooRgSRDzbCYL4NZ4RCjU,DIVINE,Chal Bombay,Universal Music India Pvt Ltd.,23,32,13,335751,2020-01-02
43,spotify:track:36EPfDEkfLYQLt8Fvced8x,"Harrdy Sandhu, Jaani",Dance Like,Sony Music Entertainment India Pvt. Ltd.,41,49,5,334854,2020-01-02
44,spotify:track:57DhVYA7E1CyrE4OKuyLb7,Maninder Buttar,Ik Tera,Ishtar Punjabi,29,43,19,328119,2020-01-02
45,spotify:track:0mJTAdmY8olbGQjopDYff3,"Dhvani Bhanushali, Nikhil D'Souza, Tanishk Bagchi",Vaaste,T-Series,3,41,39,324982,2020-01-02
46,spotify:track:6oDHAjaJJjwwgoAuMIeY9K,"Neha Kakkar, Yash Narvekar, Tanishk Bagchi","Ek Toh Kum Zindagani (From ""Marjaavaan"")",T-Series,29,55,12,324451,2020-01-02
47,spotify:track:3ZCTVFBt2Brf31RLEnCkWJ,Billie Eilish,everything i wanted,Darkroom/Interscope Records,9,38,7,323166,2020-01-02
48,spotify:track:7aiClxsDWFRQ0Kzk5KI5ku,blackbear,hot girl bummer,Alamo,20,36,16,321488,2020-01-02
49,spotify:track:1z0A545pZMaqYRkruladlk,"Garry Sandhu, Neha Kakkar, Mellow D","Hauli Hauli (From ""De De Pyaar De"")",T-Series,15,52,36,317695,2020-01-02
50,spotify:track:57vxBYXtHMk6H1aD29V7PU,The Weeknd,Heartless,Republic Records,7,24,6,315270,2020-01-02
51,spotify:track:0pqnGHJpmpxLKifKRmU6WP,Imagine Dragons,Believer,Kid Ina Korner / Interscope,30,35,45,315125,2020-01-02
53,spotify:track:58wyJLv6yH1La9NIZPl3ne,"Kina, Adriana Proenza",Can We Kiss Forever?,Columbia,44,60,11,289116,2020-01-02
54,spotify:track:1HfMVBKM75vxSfsQ5VefZ5,Selena Gomez,Lose You To Love Me,Interscope Records,2,50,11,284392,2020-01-02
55,spotify:track:7qEHsqek33rTcFNT9PFqLf,Lewis Capaldi,Someone You Loved,Vertigo Berlin,30,48,36,283513,2020-01-02
56,spotify:track:2q0V50aNlI1RQXJyE5HDgD,"Sachin-Jigar, Darshan Raval, Neha Kakkar","Odhani (From ""Made in China"")",Sony Music Entertainment India Pvt. Ltd.,26,62,15,280912,2020-01-02
57,spotify:track:3f0wz6zcA7XkQiGm0qNF5r,"Arijit Singh, Tanishk Bagchi","Thodi Jagah (From ""Marjaavaan"")",T-Series,15,54,11,280446,2020-01-02
58,spotify:track:7GfdU12uRL2xtSQcRXmqNN,"Maninder Buttar, Jaani",Laare,Ishtar Punjabi,58,63,4,277640,2020-01-02
59,spotify:track:3g0mEQx3NTanacLseoP0Gw,"The Chainsmokers, ILLENIUM, Lennon Stella",Takeaway,Disruptor Records/Columbia,20,56,23,274961,2020-01-02
61,spotify:track:3ZjMdVOWxQ53FKrmkgCv95,"Sachet Tandon, Dhvani Bhanushali, Tanishk Bagchi","Psycho Saiyaan (From ""Saaho"")",T-Series,3,59,26,272421,2020-01-02
62,spotify:track:4bKkdGBttnK4SYjT4zPC1U,"Tony Kakkar, Neha Kakkar, Young Desi","Coca Cola (From ""Luka Chuppi"")",T-Series,14,70,45,272379,2020-01-02
64,spotify:track:0bMbDctzMmTyK2j74j3nF3,"Alan Walker, Ava Max","Alone, Pt. II",Kreatell Music,64,-1,1,268464,2020-01-02
65,spotify:track:2P91MQbaiQOfbiz9VqhqKQ,Lauv,I Like Me Better,Lauv,30,46,45,266050,2020-01-02
66,spotify:track:3jjujdWJ72nww5eGnfs2E7,Harry Styles,Adore You,Columbia,41,51,4,260585,2020-01-02
67,spotify:track:2fPPWdQuHY3CxPIOk6qbwH,"Sidhu Moose Wala, Afsana Khan",Dhakka,Sidhu Moose Wala,67,68,4,260535,2020-01-02
68,spotify:track:5p7ujcrUXASCNwRaWNHR1C,Halsey,Without Me,Capitol Records,11,58,45,259654,2020-01-02
69,spotify:track:1q7W78ZYL9iqyYeVONU2hg,"Badshah, Uchana Amit",Kamaal,Saga Music,69,139,3,257841,2020-01-02
70,spotify:track:285pBltuF7vW8TeWk8hdRR,Juice WRLD,Lucid Dreams,Juice WRLD Mixtape / ISR P&D,24,44,8,252840,2020-01-02
71,spotify:track:6ocbgoVGwYJhOv1GgI9NsF,Ariana Grande,7 rings,Republic Records,1,67,45,246388,2020-01-02
72,spotify:track:4gyPGtExOjj1rsByKW33LR,Badshah,Paagal,Sony Music Entertainment India Pvt. Ltd.,12,83,25,245634,2020-01-02
73,spotify:track:0mHU8dcIvGrGDazLMmQpSg,Jubin Nautiyal,Tujhe Kitna Chahein Aur (Film Version),T-Series,12,64,28,241909,2020-01-02
74,spotify:track:7gAyu0od48mkaCw1laPKVC,"Vayu, Aastha Gill, AKASA, Puri",Naagin,Sony Music Entertainment India Pvt. Ltd.,30,80,11,241146,2020-01-02
75,spotify:track:6aPMWbbdhDhiJHlknZb9Yx,"Arijit Singh, Sachet-Parampara","Bekhayali (Arijit Singh Version) [From ""Kabir Singh""]",T-Series,7,65,31,235286,2020-01-02
76,spotify:track:5q6eZbatNFuToQdA7FGhj5,"Sohail Sen, Altamash Faridi, Jyotica Tangri","Ek Chumma (From ""Housefull 4"")",T-Series,61,73,14,233470,2020-01-02
77,spotify:track:2YpeDb67231RjR0MgVLzsG,"Lil Nas X, Billy Ray Cyrus",Old Town Road (feat. Billy Ray Cyrus) - Remix,Columbia,2,78,39,231078,2020-01-02
78,spotify:track:5G7pZ8G8NFvS1MQ9H4L7dC,"Javed-Mohsin, Arijit Singh, Shreya Ghoshal, Kunaal Vermaa, Prashant Ingole",Pal,Sony Music Entertainment India Pvt. Ltd.,44,76,45,229525,2020-01-02
79,spotify:track:39vrbjCMTRXEdiIr2IsBgd,Badshah,She Move It Like,Sony Music Entertainment India Pvt. Ltd.,14,88,45,229027,2020-01-02
80,spotify:track:6vBdBCoOhKHiYDDOcorfNo,"Post Malone, Young Thug",Goodbyes (feat. Young Thug),Republic Records,7,69,26,228405,2020-01-02
81,spotify:track:6UelLqGlWMcVH1E5c4H7lY,Harry Styles,Watermelon Sugar,Columbia,59,74,7,227587,2020-01-02
84,spotify:track:6cARnc9YVlBNigjNSX63pp,"Neha Kakkar, Dhvani Bhanushali, Ikka","Dilbar (From ""Satyameva Jayate"")",T-Series,28,101,45,226001,2020-01-02
85,spotify:track:1VYMsDdZ3toHtlZxAGS95n,DIVINE,Kohinoor,Universal Music India Pvt Ltd.,10,71,16,225590,2020-01-02
86,spotify:track:6wZJsut8fjiWiMPaccRAOX,Ritviz,Udd Gaye,Ritviz,79,91,45,223626,2020-01-02
87,spotify:track:6vuMdb0E8buJeSHArN3dXk,"Amaal Mallik, Armaan Malik, Kunaal Vermaa","Chale Aana (From ""De De Pyaar De"")",T-Series,18,77,35,220006,2020-01-02
88,spotify:track:2GYzXSeNa3Y0BfIfS1VJj3,Sid Sriram,Yaen Ennai Pirindhaai,Aditya Music,50,72,10,217887,2020-01-02
89,spotify:track:698ItKASDavgwZ3WjaWjtz,Alan Walker,Faded,Kreatell Music,47,81,45,217041,2020-01-02
91,spotify:track:45Bfnqhwy4dtqTYmClzEWM,"B Praak, Navi Ferozpurwala, Sachet-Parampara","Dilbara (B Praak Version) [From ""Pati Patni Aur Woh""]",T-Series,70,79,4,211662,2020-01-02
92,spotify:track:04UzZSWfw8hkK832P27QLq,"Nikk, Avneet Kaur",Yaari,BANG Music,18,86,26,208431,2020-01-02
93,spotify:track:7cuYb19oTyv1tLTgzH7qpv,"Bilal Saeed, Momina Mustehsan",Baari,One Two Records,93,102,5,207739,2020-01-02
94,spotify:track:1aIhAX6324JZmhNnGltwkK,Arijit Singh,"Tera Yaar Hoon Main (From ""Sonu Ke Titu Ki Sweety"")",T-Series,61,95,44,207494,2020-01-02
95,spotify:track:6fTEiqvwttauVDmDmDwD2T,"QARAN, Badshah",Tareefan,Zee Music Company,39,108,45,206520,2020-01-02
96,spotify:track:0KMxACWz7WJYy9wj7YVKKr,"Khan Bhaini, Shipra Goyal",Gaddi Pichhe Naa,Single Track Studios,96,106,4,205973,2020-01-02
98,spotify:track:5I3Xih0C2ID3fqngBrBbGv,"Badshah, Neeti Mohan","Bad Boy (From ""Saaho"")",T-Series,8,92,20,204930,2020-01-02
99,spotify:track:01AE1MgL6L86WQzh4KGDUa,"Meet Bros., Jubin Nautiyal, Dhvani Bhanushali","Kinna Sona (From ""Marjaavaan"")",T-Series,31,89,8,204285,2020-01-02
102,spotify:track:0BS99JhjvDbC2lpiMwsaxh,Ammy Virk,Haaye Ve,Jjust Music,75,75,2,201710,2020-01-02
103,spotify:track:65c6VCikt7f5sAS1heoYQC,"Bohemia, Sidhu Moose Wala",Same Beef,Saga Music,53,107,14,201321,2020-01-02
104,spotify:track:5x3K3Ld54TtkYKdQvrFOV3,"Guru Randhawa, Neha Kakkar","Morni Banke (From ""Badhaai Ho"")",T-Series,27,114,45,200686,2020-01-02
105,spotify:track:3YVQHUpNexOqkLI7IclsoT,Darshan Raval,Hawa Banke,Indie Music Label,26,100,24,198640,2020-01-02
106,spotify:track:7BKLCZ1jbUBVqRi2FVlTVw,"The Chainsmokers, Halsey",Closer,Disruptor Records/Columbia,59,98,45,198068,2020-01-02
107,spotify:track:790uNrqzKWCvj8rR1QXNpU,"Neha Kakkar, Mika Singh, Kumar Sanu","Aankh Marey (From ""Simmba"")",T-Series,14,140,45,197849,2020-01-02
108,spotify:track:2dpaYNEQHiRxtZbfNsse99,"Marshmello, Bastille",Happier,Joytime Collective,17,90,45,197739,2020-01-02
109,spotify:track:4yI3HpbSFSgFZtJP2kDe5m,Selena Gomez,Look At Her Now,Interscope Records,9,85,10,197630,2020-01-02
110,spotify:track:0ojpEubhy4JNeVftmVuiN7,"Vishal Mishra, Armaan Malik",Pehla Pyaar,T-Series,11,97,28,196773,2020-01-02
111,spotify:track:6kls8cSlUyHW2BUOkDJIZE,"Ellie Goulding, Juice WRLD",Hate Me (with Juice WRLD),Polydor Records,62,82,14,196356,2020-01-02
112,spotify:track:1rav6gpyMEfZQrMdaVs1sx,"Dino James, Kaprila",Dooriyan (feat. Kaprila),SME India Pvt. Ltd./ Kurian and Company,67,84,4,195671,2020-01-02
115,spotify:track:0e7ipj03S05BNilyu5bRzt,"Post Malone, 21 Savage",rockstar (feat. 21 Savage),Republic Records,43,103,45,191853,2020-01-02
116,spotify:track:5wdlz4N7s1Xyr4y4RXhZJM,"Karan Sehmbi, Tanishk Bagchi, Goldboy","Photo (From ""Luka Chuppi"")",T-Series,15,112,45,191706,2020-01-02
117,spotify:track:7cFuzwgbtHXmSKuCzo0qCW,"The Doorbeen, Ragini",Lamberghini,Times Music,12,126,45,191701,2020-01-02
118,spotify:track:3boJs8tx10SQr2nUUm3FAr,"Sachin-Jigar, Jubin Nautiyal, Asees Kaur","Pyaar Toh Tha (From ""Bala"")",Sony Music Entertainment India Pvt. Ltd.,61,110,9,190726,2020-01-02
119,spotify:track:1zB4vmk8tFRmM9UULNzbLB,Imagine Dragons,Thunder,Kid Ina Korner / Interscope,67,105,45,190684,2020-01-02
120,spotify:track:0dnDTvdUco2UbaBjUtPxNS,"Armaan Malik, Thaman S",Buttabomma - Telugu,Aditya Music,120,-1,1,190386,2020-01-02
121,spotify:track:7h0d2h0fUmzbs7zeFigJPn,"Travis Scott, ROSALÍA, Lil Baby",HIGHEST IN THE ROOM (feat. ROSALÍA & Lil Baby) - REMIX,Cactus Jack/Epic,121,-1,1,190188,2020-01-02
122,spotify:track:3j9DrRebdWK1jkpOw9FZUy,Sid Sriram,Samajavaragamana,Aditya Music,13,122,14,188585,2020-01-02
123,spotify:track:1bvIoSekCZWAgthW01kbo9,"Jasbir Jassi, Badshah, Dhvani Bhanushali","Koka (From ""Khandaani Shafakhana"")",T-Series,13,133,27,188213,2020-01-02
124,spotify:track:6p2o4ep90wpkh0qzUmyFuO,"Arijit Singh, Mithoon, Asees Kaur",Intezaar,Universal Music India Pvt Ltd.,60,104,8,187065,2020-01-02
127,spotify:track:7fa9MBXhVfQ8P8Df9OEbD8,"Maroon 5, Cardi B",Girls Like You (feat. Cardi B) - Cardi B Version,Interscope Records*,39,113,45,184037,2020-01-02
128,spotify:track:2si0ZNx4yRbggTvrIom8A2,"Rochak Kohli, Atif Aslam, Tulsi Kumar",Paniyon Sa,T-Series,68,119,44,182717,2020-01-02
129,spotify:track:5MnAi6ZF7cE8pAz7wYr9Ta,"Vishal-Shekhar, Atif Aslam, Irshad Kamil",Dil Diyan Gallan,YRF Music,83,124,42,180427,2020-01-02
130,spotify:track:6NLzzwFbAD1imLXGBMj9jo,"The Doorbeen, Shreya Sharma",PRADA,Jjust Music,15,127,21,179121,2020-01-02
131,spotify:track:6HGoVbCUr63SgU3TjxEVj6,Imran Khan,Satisfya,Ik Records,100,116,16,178669,2020-01-02
132,spotify:track:3eekarcy7kvN4yt5ZFzltW,Travis Scott,HIGHEST IN THE ROOM,Cactus Jack/Epic,20,93,13,178407,2020-01-02
133,spotify:track:7mUuarQfB0E0Xs80Vzd2gw,"Karan Aujla, Gurlez Akhtar",Chitta Kurta,Rehaan Records,84,158,4,178397,2020-01-02
134,spotify:track:7yEuRloGyxyu1KaWBTPP1Z,"Shreya Ghoshal, Nakash Aziz, Vishal-Shekhar","Slow Motion (From ""Bharat"")",T-Series,23,153,36,177513,2020-01-02
136,spotify:track:22vgEDb5hykfaTwLuskFGD,Jonas Brothers,Sucker,Jonas Brothers Recording,1,120,44,176170,2020-01-02
137,spotify:track:0lYBSQXN6rCTvUZvg9S0lU,"DJ Snake, Justin Bieber",Let Me Love You,DJ Snake Def Jam,109,135,45,176066,2020-01-02
138,spotify:track:2oejEp50ZzPuQTQ6v54Evp,"The Chainsmokers, Bebe Rexha",Call You Mine,Disruptor Records/Columbia,15,121,31,175965,2020-01-02
139,spotify:track:4At0CnQes5Kx1ROSnnP4lK,Tony Kakkar,Dheeme Dheeme,Desi Music Factory,20,154,31,175194,2020-01-02
140,spotify:track:1y4jsQt7MjnZhiD1L6qFBC,Sub Urban,Cradles,NCS,53,128,34,175096,2020-01-02
142,spotify:track:0a6zRnrjmaOcqsEIFkXIhw,Akhil,Khaab,Crown Records,101,137,43,173458,2020-01-02
143,spotify:track:6V9fHiv84WlVTg7CSnIVY2,Halsey,Graveyard,Capitol Records,31,125,16,168699,2020-01-02
144,spotify:track:1ZaeaGLhFSckG8sv1y7AWk,"Harrdy Sandhu, Jaani",Kya Baat Ay,Sony Music Entertainment India Pvt. Ltd.,42,143,45,168286,2020-01-02
145,spotify:track:0rk2X5TAhraBC5aCIXK2Rq,"Jawad Ahmad, Shaarib Toshi, Arijit Singh, Shreya Ghoshal",Samjhawan,Sony Music Entertainment India Pvt. Ltd.,70,146,45,168033,2020-01-02
146,spotify:track:5O932cZmzOZGOGZz9RHx20,"Pritam, Arijit Singh",Khairiyat,T-Series,53,129,17,167924,2020-01-02
147,spotify:track:7AFASza1mXqntmGtbxXprO,XXXTENTACION,changes,"Bad Vibes Forever, LLC",21,123,22,165276,2020-01-02
148,spotify:track:0p83RJy9EZ0hlg82xcXH7f,"Sachet Tandon, Parampara Tandon, Navi Ferozpurwala",Dilbara,T-Series,61,115,5,165081,2020-01-02
149,spotify:track:1fzAokzOONl4XEPUFoammu,"Alka Yagnik, Arijit Singh","Agar Tum Saath Ho (From ""Tamasha"")",T-Series,112,160,31,164591,2020-01-02
150,spotify:track:0Iz4CkptElGHo16r797Jsb,"Atif Aslam, Nusrat Fateh Ali Khan, Rochak Kohli","Dekhte Dekhte (From ""Batti Gul Meter Chalu"")",T-Series,39,145,45,164056,2020-01-02
151,spotify:track:1dLCUfhpiiItPEKSQwqb1B,"Arko, Arijit Singh",Khuda Haafiz,T-Series,103,138,4,163097,2020-01-02
153,spotify:track:66Nmp3ztIMqX1j8yYtWl1X,Ritviz,Liggi,Ritviz,153,-1,1,162680,2020-01-02
154,spotify:track:073ILU1C3APNRGF66VhtyA,Camila Cabello,Liar,Syco Music/Epic,18,130,17,160465,2020-01-02
155,spotify:track:0lks2Kt9veMOFEAPN0fsqN,"Alan Walker, K-391, Emelie Hollow",Lily,Kreatell Music,88,144,41,160419,2020-01-02
156,spotify:track:7FGq80cy8juXBCD2nrqdWU,"benny blanco, Halsey, Khalid",Eastside (with Halsey & Khalid),Friends Keep Secrets/Interscope Records,25,141,45,159479,2020-01-02
157,spotify:track:5X5db3FrBOHbibrFKA02MQ,"Abhijeet Srivastava, Vishal-Shekhar","Chashni (From ""Bharat"")",T-Series,24,165,35,158996,2020-01-02
158,spotify:track:2mwBSO58y92EYmEFpDfmS7,"Guru Randhawa, Arjun",Suit Suit,T-Series,50,166,45,158685,2020-01-02
159,spotify:track:68iBMrMRc1rg4eAxJbvxch,"Tanishk Bagchi, Dhvani Bhanushali, Rashmi Virag",Leja Re,T-Series,60,152,45,158612,2020-01-02
160,spotify:track:6sTbnkzOtPpojgnn50cCHJ,"Ankit Tiwari, Dhvani Bhanushali","Rula Diya (From ""Batla House"")",T-Series,53,142,23,157773,2020-01-02
161,spotify:track:12V0iduYsoXxsQYTSeFB2H,Jass Manak,Viah,GEET MP3,67,155,38,157224,2020-01-02
162,spotify:track:2bT1PH7Cw3J9p3t7nlXCdh,Shawn Mendes,If I Can't Have You,Island Records,1,148,35,156508,2020-01-02
163,spotify:track:5KawlOMHjWeUjQtnuRs22c,"BTS, Halsey",Boy With Luv (feat. Halsey),BIGHIT MUSIC,1,150,33,156424,2020-01-02
164,spotify:track:4ymPEyiXabTe1NO8q8EFxG,"Darshan Raval, Asees Kaur, Lijo George-Dj Chetas","Chogada (From ""Loveyatri"")",T-Series,55,177,45,155699,2020-01-02
165,spotify:track:6qajA2wXvAI4HMey8b1JVK,"Badshah, Tulsi Kumar, Abhijeet, Chandra Dixit","Sheher Ki Ladki (From ""Khandaani Shafakhana"")",T-Series,20,187,26,155356,2020-01-02
166,spotify:track:0H2iJVgorRR0ZFgRqGUjUM,"Pritam, Arijit Singh",Channa Mereya,Sony Music Entertainment India Pvt. Ltd.,58,161,45,155221,2020-01-02
167,spotify:track:2iwS33Jfev1QBiuhWVWZHY,"Lauv, Troye Sivan",i'm so tired...,Lauv,7,149,39,154567,2020-01-02
168,spotify:track:3GRSqlALWISqLeNncZMbpX,"Lauv, LANY",Mean It,Lauv,93,131,7,152442,2020-01-02
169,spotify:track:1mjWhM7GQTTxJxg2F0iCRS,"Armaan Malik, Rochak Kohli, Bappi Lahiri","Dil Mein Ho Tum (From ""Cheat India"")",T-Series,60,156,45,152178,2020-01-02
170,spotify:track:0u2P5u6lvoDfwTYjAADbn4,"Billie Eilish, Khalid",lovely (with Khalid),Darkroom,67,162,39,151522,2020-01-02
171,spotify:track:3QGsuHI8jO1Rx4JWLUh9jd,Shawn Mendes,Treat You Better,Island Records,49,151,45,151512,2020-01-02
172,spotify:track:0JBhoxPKHJc1ZeJrjSt0VO,Gajendra Verma,Tera Ghata,Virtual Planet Production Pvt. Ltd.,172,173,3,150566,2020-01-02
173,spotify:track:6bdpj89aYEBjhpsenXAsmO,"A.R. Rahman, Arijit Singh",Enna Sona,Sony Music Entertainment India Pvt. Ltd.,34,167,45,150191,2020-01-02
174,spotify:track:64RkEV5b7bG697vhIPMlrl,Ritviz,Sage,Ritviz,140,197,13,149423,2020-01-02
175,spotify:track:79XBui7ea1RGjlC57AH0w1,"Inder Chahal, Rajat Nagpal",Gal Karke,Desi Music Factory,175,194,2,148772,2020-01-02
176,spotify:track:4uXJADmybUHUgycBWFHeq6,"Anurag Kulkarni, Mangli, Thaman S",Ramuloo Ramulaa - Duet,Aditya Music,38,164,10,148329,2020-01-02
177,spotify:track:6b2RcmUt1g9N9mQ3CbjX2Y,Sam Smith,How Do You Sleep?,PLG - Capitol,37,169,24,147307,2020-01-02
178,spotify:track:7xQAfvXzm3AkraOtGPWIZg,Post Malone,Wow.,Republic Records,6,159,35,146856,2020-01-02
179,spotify:track:3TKpJrY9q49Mj1JOsM9zGL,"The Chainsmokers, Kygo",Family,Disruptor Records/Columbia,135,163,4,146795,2020-01-02
180,spotify:track:0l6g8Z8mqGbGXFOjigYetD,"Pritam, Arijit Singh",Hawayein,Sony Music Entertainment India Pvt. Ltd.,51,181,45,146472,2020-01-02
181,spotify:track:51Fjme0JiitpyXKuyQiCDo,"Y2K, bbno$",Lalala,Columbia,56,189,26,146174,2020-01-02
182,spotify:track:6Kynli1iHBqJRWUCohcV9h,DIVINE,Kaam 25 - Sacred Games,Netflix India Originals LLC,66,168,40,146080,2020-01-02
183,spotify:track:6rfahvufEQDIVTHJIU2QQB,"MEMBA, EVAN GIIA, Nooran Sisters","For Aisha (Featured in ""The Sky Is Pink"")",ANTNNA,78,188,6,145539,2020-01-02
184,spotify:track:0KoiMHhqKLoL4xM54rcWYY,"DJ Snake, Selena Gomez, Ozuna, Cardi B","Taki Taki (feat. Selena Gomez, Ozuna & Cardi B)",DJ Snake Music Productions Limited,29,182,45,145125,2020-01-02
185,spotify:track:6RUKPb4LETWmmr3iAEQktW,"The Chainsmokers, Coldplay",Something Just Like This,Disruptor Records/Columbia,84,176,44,144632,2020-01-02
186,spotify:track:2nCKF3gkwHCamm3f0jNaJd,"Akhil Sachdeva, Antara Mitra, Arijit Singh, Benny Dayal, Dhvani Bhanushali, Karan Sehmbi, Nikhita Gandhi, Rahat Fateh Ali Khan, Sachet Tandon, Shreya Ghoshal, Tulsi Kumar, Rashmi Virag, DJ Yogii",Love Mashup 2019,T-Series,176,186,8,143143,2020-01-02
187,spotify:track:4f5kLqyOJ5ZPnalEVMQrB2,"Rahat Fateh Ali Khan, Asees Kaur, Tanishk Bagchi","Tere Bin (From ""Simmba"")",T-Series,26,180,45,143001,2020-01-02
188,spotify:track:44O26Gv1wQrlUj14PpTolM,"Sunidhi Chauhan, Divya Kumar, Amit Trivedi","Halka Halka (From ""Fanney Khan"")",T-Series,131,193,25,142859,2020-01-02
189,spotify:track:1UWacd8x8tPPwmrPB1MoBI,"Pritam, Arijit Singh",Ae Dil Hai Mushkil Title Track,Sony Music Entertainment India Pvt. Ltd.,105,190,45,140855,2020-01-02
190,spotify:track:7yy3HgKJEcwArL5k0v5rhF,"Guru Randhawa, Benny Dayal, Sachin-Jigar","Crazy Habibi Vs Decent Munda (From ""Arjun Patiala"")",T-Series,37,-1,21,139453,2020-01-02
192,spotify:track:4hQ6UGyWQIGJmHSo0J88JW,Selena Gomez,Back To You - From 13 Reasons Why – Season 2 Soundtrack,UMGRI Interscope,66,175,45,138503,2020-01-02
193,spotify:track:16NMvEYAus3qS1czInNNZl,"Mika Singh, Tulsi Kumar, Tanishk Bagchi","Ankhiyon Se Goli Mare (From ""Pati Patni Aur Woh"")",T-Series,60,184,6,138481,2020-01-02
194,spotify:track:4Psh3fEnAMftNPOTsAHPgG,Prateek Kuhad,cold/mess,Elektra (NEK),194,-1,1,137971,2020-01-02
195,spotify:track:5icOoE6VgqFKohjWWNp0Ac,"Marshmello, CHVRCHES",Here With Me,Marshmello/Republic,6,174,42,137603,2020-01-02
196,spotify:track:4wopYJ5wpYOM6ogm2Jugnw,"Lauv, Anne-Marie","fuck, i'm lonely",Lauv,24,170,22,136946,2020-01-02
197,spotify:track:7heMX7gyHP0mhTlNgd7Lxd,"A.R. Rahman, Badshah, Tanishk Bagchi, Shashaa Tirupati, Jubin Nautiyal",The Humma Song,Sony Music Entertainment India Pvt. Ltd.,29,-1,43,136363,2020-01-02
198,spotify:track:2TzyJEUfWHGRsk3r6Emvbk,"Param Singh, Kamal Kahlon, Pratik Studio",Daru Badnaam,VIP Records / Param Singh & Kamal Kahlon,149,-1,22,136012,2020-01-02
199,spotify:track:4FcZBCb6dANhvsEnFlgJwG,"Sachet Tandon, Parampara Tandon, Sachet-Parampara","Ghamand Kar (From ""Tanhaji - The Unsung Warrior"")",T-Series,199,-1,1,135964,2020-01-02
200,spotify:track:0F7FA14euOIX8KcbEturGH,Lil Nas X,Old Town Road,Columbia,13,183,39,134751,2020-01-02
