rank,uri,artist_names,track_name,source,peak_rank,previous_rank,weeks_on_chart,streams,End Date
1,spotify:track:1kBbgxAUc4HQv7cgIayIDH,Lil Tecca,Ransom,Republic Records,1,1,11,12432125,2019-08-08
2,spotify:track:0Ryd8975WihbObpp5cPW1t,"Ariana Grande, Social House",boyfriend (with Social House),Republic Records,2,-1,1,11385703,2019-08-08
3,spotify:track:6v3KW9xbzN5yKLt9YKDYA2,"Shawn Mendes, Camila Cabello",Señorita,Island Records,1,2,7,9089472,2019-08-08
4,spotify:track:5qmq61DAAOUaW8AUo8xKhh,Lizzo,Truth Hurts,Nice Life/Atlantic,3,3,16,8531874,2019-08-08
5,spotify:track:6vBdBCoOhKHiYDDOcorfNo,"Post Malone, Young Thug",Goodbyes (feat. Young Thug),Republic Records,1,4,5,8313960,2019-08-08
6,spotify:track:5ry2OE6R2zPQFDO85XkgRb,"Drake, Rick Ross",Money In The Grave (Drake ft. Rick Ross),Republic Records,1,5,8,8222797,2019-08-08
7,spotify:track:6XHVuErjQ4XNm6nDPVCxVX,"Chris Brown, Drake",No Guidance (feat. Drake),Chris Brown Entertainment/RCA Records,5,9,9,7376578,2019-08-08
8,spotify:track:6fTt0CH2t0mdeB2N9XFG5r,Lil Nas X,Panini,Columbia,2,6,7,7091681,2019-08-08
9,spotify:track:3KkXRkHbMCARz0aVfEt68P,"Post Malone, Swae Lee",Sunflower - Spider-Man: Into the Spider-Verse,Universal Records,1,7,42,6115919,2019-08-08
10,spotify:track:70eFcWOvlMObDhURTqT4Fv,"Ed Sheeran, Khalid",Beautiful People (feat. Khalid),Atlantic Records UK,4,8,6,5768094,2019-08-08
11,spotify:track:2gwkD6igEhQbDQegRCcdoB,DaBaby,Suge,South Coast Music Group/Interscope Records,4,11,19,5553431,2019-08-08
12,spotify:track:7DcvwMAiqKJQD1rrdfxSDx,"Young Thug, J. Cole, Travis Scott",The London (feat. J. Cole & Travis Scott),300 Entertainment/Atl,1,14,11,5450709,2019-08-08
13,spotify:track:6b2RcmUt1g9N9mQ3CbjX2Y,Sam Smith,How Do You Sleep?,PLG - Capitol,10,13,3,5434780,2019-08-08
14,spotify:track:51Fjme0JiitpyXKuyQiCDo,"Y2K, bbno$",Lalala,Columbia,12,12,8,5253464,2019-08-08
15,spotify:track:2Fxmhks0bxGSBdJ92vM42m,Billie Eilish,bad guy,Darkroom/Interscope Records,1,15,19,4924290,2019-08-08
16,spotify:track:2YpeDb67231RjR0MgVLzsG,"Lil Nas X, Billy Ray Cyrus",Old Town Road (feat. Billy Ray Cyrus) - Remix,Columbia,1,17,18,4605809,2019-08-08
17,spotify:track:6uFn47ACjqYkc0jADwEdj1,"Polo G, Lil Tjay",Pop Out (feat. Lil Tjay),Columbia,8,16,20,4460911,2019-08-08
18,spotify:track:7qEHsqek33rTcFNT9PFqLf,Lewis Capaldi,Someone You Loved,Vertigo Berlin,18,27,15,4404535,2019-08-08
19,spotify:track:6TqXcAFInzjp0bODyvrWEq,"Khalid, Disclosure",Talk (feat. Disclosure),"Right Hand Music Group, LLC/RCA Records",6,24,26,4188633,2019-08-08
20,spotify:track:67XyC1GdSkKb9sbRRkUDXS,"NLE Choppa, Blueface",Shotta Flow (feat. Blueface) - Remix,Warner Records,20,25,6,4176896,2019-08-08
21,spotify:track:0hVXuCcriWRGvwMV1r5Yn9,"Ed Sheeran, Justin Bieber",I Don't Care (with Justin Bieber),Atlantic Records UK,1,22,13,4147224,2019-08-08
22,spotify:track:4hPpVbbakQNv8YTHYaOJP4,"Marshmello, Kane Brown",One Thing Right,Joytime Collective,15,21,7,3814073,2019-08-08
23,spotify:track:2nKYHpmwjLaEOXS3o7QMiz,"Quality Control, Lil Baby, DaBaby",Baby,Quality Control Music/Motown Records,23,30,3,3804900,2019-08-08
24,spotify:track:00ko9WaS4jOX1kEk3gvHjf,"Chance the Rapper, MadeinTYO, DaBaby",Hot Shower,Chance The Rapper,10,10,2,3781909,2019-08-08
25,spotify:track:2ksOAxtIxY8yElEWw8RhgK,"Anuel AA, Daddy Yankee, KAROL G, J Balvin, Ozuna",China,"2019 Real Hasta La Muerte, LLC.",25,41,3,3772346,2019-08-08
26,spotify:track:6uAm7pG66O1XesXS9bpHSF,"Lizzo, Ariana Grande",Good as Hell (feat. Ariana Grande),Warner Music Group - X5 Music Group,26,31,8,3685127,2019-08-08
27,spotify:track:3yNZ5r3LKfdmjoS3gkhUCT,"Billie Eilish, Justin Bieber",bad guy (with Justin Bieber),Darkroom/Interscope Records,11,26,4,3605683,2019-08-08
28,spotify:track:6moU77g9RQyMzHNuKEaQKq,Ali Gatie,It's You,Warner Records,17,32,8,3541723,2019-08-08
29,spotify:track:5hVghJ4KaYES3BFUATCYn0,"Tyler, The Creator",EARFQUAKE,Columbia,1,33,12,3497379,2019-08-08
30,spotify:track:1DhRbox3xkceP64k3JeYfW,"Ed Sheeran, Travis Scott",Antisocial (with Travis Scott),Atlantic Records UK,7,20,4,3494368,2019-08-08
31,spotify:track:322tcqPhma7F6hfCeLisx0,"Lauv, Anne-Marie","fuck, i'm lonely",Lauv,31,-1,1,3492415,2019-08-08
32,spotify:track:6wo37KVqFJhtuxPTpLCcfe,"The Chainsmokers, ILLENIUM, Lennon Stella",Takeaway,Disruptor Records/Columbia,18,18,2,3491448,2019-08-08
33,spotify:track:2JvzF1RMd7lE3KmFlsyZD8,J. Cole,MIDDLE CHILD,"Dreamville, Inc., Under exclusive license to Roc Nation Records",1,35,29,3486678,2019-08-08
34,spotify:track:2bT1PH7Cw3J9p3t7nlXCdh,Shawn Mendes,If I Can't Have You,Island Records,4,37,14,3478700,2019-08-08
35,spotify:track:6MWtB6iiXyIwun0YzU6DFP,Post Malone,Wow.,Republic Records,2,34,33,3444955,2019-08-08
36,spotify:track:5dW1VZPcFqB4n0P08rGDgm,Blanco Brown,The Git Up,Broken Bow Records,34,40,8,3252539,2019-08-08
37,spotify:track:1kK6DwzyXJSp58u5HYWwuD,"YG, Tyga, Jon Z","Go Loko (feat. Tyga, Jon Z)",Def Jam Recordings,17,39,14,3203928,2019-08-08
38,spotify:track:3XiNC94b4Tq1xwv70sQJGN,Lil Uzi Vert,Sanguine Paradise,Generation Now/Atlantic,6,43,18,3172866,2019-08-08
39,spotify:track:2zjGJ0dChMR0KxBZS15aqo,"Mustard, NAV, Playboi Carti, A Boogie Wit da Hoodie","Baguettes in the Face (feat. NAV, Playboi Carti & A Boogie Wit da Hoodie)",10 Summers Records/Interscope Records,34,44,6,3145231,2019-08-08
40,spotify:track:4ak7xjvBeBOcJGWFDX9w5n,"Lil Nas X, Cardi B",Rodeo,Columbia,9,28,7,3101233,2019-08-08
41,spotify:track:2TH65lNHgvLxCKXM3apjxI,"Bad Bunny, Tainy",Callaita,Rimas Entertainment LLC,41,42,10,3062943,2019-08-08
42,spotify:track:1wJRveJZLSb1rjhnUHQiv6,"A Boogie Wit da Hoodie, 6ix9ine",Swervin (feat. 6ix9ine),Highbridge the Label / Atlantic Records,7,45,33,3059850,2019-08-08
43,spotify:track:29fRTIKsJhLUJoldM89GZS,Taylor Swift,You Need To Calm Down,Taylor Swift,2,38,8,3051873,2019-08-08
44,spotify:track:2IRZnDFmlqMuOrYOLnZZyc,"Meek Mill, Drake",Going Bad (feat. Drake),MMG/Atlantic,2,46,36,3019243,2019-08-08
45,spotify:track:6ocbgoVGwYJhOv1GgI9NsF,Ariana Grande,7 rings,Republic Records,1,50,29,3018687,2019-08-08
46,spotify:track:7Aem1fAapTdGcHwAYyQYU4,Lil Tecca,Love Me,Republic Records,46,-1,1,2917492,2019-08-08
47,spotify:track:1gZFRYcPz3wKevEaNYRwfW,NF,Time - Edit,NF Real Music,47,47,4,2904737,2019-08-08
48,spotify:track:4n4BflhWjCHIxrI4v7Xt9s,Drake,How Bout Now,OVO,48,-1,1,2886420,2019-08-08
49,spotify:track:3t8pnImpBpOwxdtYBpKvA9,Drake,The Motion,Cash Money Records/Young Money Ent./Universal Rec.,49,-1,1,2859063,2019-08-08
50,spotify:track:22vgEDb5hykfaTwLuskFGD,Jonas Brothers,Sucker,Jonas Brothers Recording,1,56,23,2852157,2019-08-08
51,spotify:track:78QR3Wp35dqAhFEc2qAGjE,"Lil Baby, Gunna",Drip Too Hard (Lil Baby & Gunna),"Quality Control Music/Young Stoner Life Records, a 300 Entertainment Label/Motown Records/Capitol Records",1,48,47,2829392,2019-08-08
52,spotify:track:4R9ATNRRl1uth17i5qDCc0,Bazzi,I.F.L.Y.,iamcosmic,52,65,3,2817963,2019-08-08
53,spotify:track:5rU6kDNXZLXIinFezpbWbO,"NAV, Meek Mill",Tap (feat. Meek Mill),"XO Records, LLC and Republic Records",50,60,15,2807813,2019-08-08
54,spotify:track:4Wjhj0WjkyECccfHVIgaTq,Drake,Trust Issues,OVO,54,-1,1,2764434,2019-08-08
55,spotify:track:3j84U36KvLeXNDPv4t5pI8,"Mustard, Migos",Pure Water (with Migos),10 Summers Records/Interscope Records,13,52,29,2721512,2019-08-08
56,spotify:track:43zdsphuZLzwA9k4DJhU0I,Billie Eilish,when the party's over,Darkroom/Interscope Records,5,53,43,2698662,2019-08-08
57,spotify:track:6kls8cSlUyHW2BUOkDJIZE,"Ellie Goulding, Juice WRLD",Hate Me (with Juice WRLD),Polydor Records,51,51,6,2675402,2019-08-08
58,spotify:track:1qyFlfPREPbRcS2BNszdYI,Drake,Dreams Money Can Buy,OVO,58,-1,1,2631321,2019-08-08
59,spotify:track:0u2P5u6lvoDfwTYjAADbn4,"Billie Eilish, Khalid",lovely (with Khalid),Darkroom,24,62,68,2591778,2019-08-08
60,spotify:track:7rvyVWja33WG9R97oeJAjx,Calboy,Envy Me,Polo Grounds Music/RCA Records,22,70,32,2589172,2019-08-08
61,spotify:track:5KBARWIxeMGkvUax9VtVC9,Saweetie,My Type,ICY/Artistry Records/Warner Records,61,72,5,2588544,2019-08-08
62,spotify:track:6zeeWid2sgw4lap2jV61PZ,Khalid,Better,"Right Hand Music Group, LLC/RCA Records",9,64,47,2584666,2019-08-08
63,spotify:track:05CwHjIk71RXVU40boRMnR,"The Chainsmokers, Bebe Rexha",Call You Mine,Disruptor Records/Columbia,23,54,10,2580852,2019-08-08
64,spotify:track:7eBqSVxrzQZtK2mmgRG6lC,YNW Melly,Murder on My Mind,P2018,4,58,46,2567737,2019-08-08
65,spotify:track:285pBltuF7vW8TeWk8hdRR,Juice WRLD,Lucid Dreams,Juice WRLD Mixtape / ISR P&D,1,69,66,2538330,2019-08-08
66,spotify:track:2xLMifQCjDGFmkHkpNLD9h,Travis Scott,SICKO MODE,Cactus Jack / Epic,1,76,53,2518562,2019-08-08
67,spotify:track:7FGq80cy8juXBCD2nrqdWU,"benny blanco, Halsey, Khalid",Eastside (with Halsey & Khalid),Friends Keep Secrets/Interscope Records,10,68,56,2496150,2019-08-08
68,spotify:track:5PYQUBXc7NYeI1obMKSJK0,Katy Perry,Never Really Over,Capitol Records,10,57,10,2481210,2019-08-08
69,spotify:track:3Y7MHz19qCg1Pkxridtu1k,Taylor Swift,The Archer,Taylor Swift,23,23,3,2467808,2019-08-08
70,spotify:track:2dpaYNEQHiRxtZbfNsse99,"Marshmello, Bastille",Happier,Joytime Collective,8,75,51,2442413,2019-08-08
71,spotify:track:7njKgVl3AnLflRad38o7AG,Bazzi,Paradise,iamcosmic,20,78,18,2389006,2019-08-08
72,spotify:track:6CcJMwBtXByIz4zQLzFkKc,Billie Eilish,i love you,Darkroom/Interscope Records,17,71,19,2340019,2019-08-08
73,spotify:track:7dt6x5M1jzdTEt8oCbisTK,Post Malone,Better Now,Republic Records,1,88,67,2300895,2019-08-08
74,spotify:track:6Hj9jySrnFppAI0sEMCZpJ,Juice WRLD,Robbery,Grade A Productions/Interscope Records,3,87,25,2296444,2019-08-08
75,spotify:track:4aPB8rSxGFISs0o6V2LrTy,"Rick Ross, Drake",Gold Roses (feat. Drake),Epic,19,19,2,2264443,2019-08-08
76,spotify:track:5WnfnSpuNEGXyEt78PBA6d,"Dreamville, Bas, JID, Guapdad 4000, Reese LAFLARE, Jace, Mez, Smokepurpp, Buddy, Ski Mask The Slump God","Costa Rica (with Bas & JID feat. Guapdad 4000, Reese LAFLARE, Jace, Mez, Smokepurpp, Buddy & Ski Mask The Slump God)",Dreamville/Interscope Records,31,86,5,2250002,2019-08-08
77,spotify:track:4SSnFejRGlZikf02HLewEF,Billie Eilish,bury a friend,Darkroom/Interscope Records,3,80,28,2249766,2019-08-08
78,spotify:track:2rMAtCaTj16NptyVfEIeAC,"Megan Thee Stallion, DaBaby",Cash Shit (feat. DaBaby),300 Entertainment,78,96,6,2232258,2019-08-08
79,spotify:track:3AEgic4yp82NxMWUjHtxnO,Ambjaay,Uno,Columbia,79,99,5,2214446,2019-08-08
80,spotify:track:0e7ipj03S05BNilyu5bRzt,"Post Malone, 21 Savage",rockstar (feat. 21 Savage),Republic Records,1,89,99,2210395,2019-08-08
81,spotify:track:4wuCQX7JvAZLlrcmH4AeZF,"Ed Sheeran, Chance the Rapper, PnB Rock",Cross Me (feat. Chance the Rapper & PnB Rock),Atlantic Records UK,11,63,11,2205074,2019-08-08
82,spotify:track:6osaMSJh9NguagEDQcZaKx,"DJ Snake, J Balvin, Tyga",Loco Contigo (feat. J. Balvin & Tyga),DJ Snake Music Productions Limited,82,95,8,2176551,2019-08-08
83,spotify:track:7f1zjZG77S891Uv4O68yfk,"DaBaby, Offset",Baby Sitter (feat. Offset),South Coast Music Group/Interscope Records,61,101,13,2176255,2019-08-08
84,spotify:track:3GJ4hzg4lrGwU51Y3VARbF,Dan + Shay,Speechless,Warner Records,84,105,53,2170214,2019-08-08
85,spotify:track:6oJ6le65B3SEqPwMRNXWjY,"Kygo, Whitney Houston",Higher Love,Kygo/RCA Records,28,91,6,2169804,2019-08-08
86,spotify:track:0fea68AdmYNygeTGI4RC18,"J Balvin, Bad Bunny",LA CANCIÓN,Universal Music Latino / Rimas,43,98,6,2147577,2019-08-08
87,spotify:track:3e9HZxeyfWwjeyPAMmWSSQ,Ariana Grande,"thank u, next",Republic Records,1,116,40,2144257,2019-08-08
88,spotify:track:3npzogdOEiVsieXmmhBepL,Maren Morris,The Bones,Columbia Nashville,60,90,13,2142932,2019-08-08
89,spotify:track:5p7ujcrUXASCNwRaWNHR1C,Halsey,Without Me,Capitol Records,5,106,44,2135686,2019-08-08
90,spotify:track:0k664IuFwVP557Gnx7RhIl,Lizzo,Juice,Nice Life/Atlantic,71,97,16,2130145,2019-08-08
91,spotify:track:4kV4N9D1iKVxx1KLvtTpjS,Ariana Grande,"break up with your girlfriend, i'm bored",Republic Records,1,118,26,2113696,2019-08-08
92,spotify:track:4bTZeO72FwMa6wKOiqoynL,"Sech, Ozuna, Anuel AA, Darell, Nicky Jam",Otro Trago - Remix,Rich Music,84,84,2,2088968,2019-08-08
93,spotify:track:40OMBMYRk5IQL6xCzGM0JA,"Martin Garrix, Macklemore, Fall Out Boy",Summer Days (feat. Macklemore & Patrick Stump of Fall Out Boy),Epic Amsterdam,31,94,15,2088944,2019-08-08
94,spotify:track:3Ol2xnObFdKV9pmRD2t9x8,A Boogie Wit da Hoodie,Look Back at It,Highbridge the Label / Atlantic Records,9,107,35,2085468,2019-08-08
95,spotify:track:1c0hsvHLELX6y8qymnpLKL,"Lunay, Daddy Yankee, Bad Bunny",Soltera (Remix),round2media - LaFamilia,60,100,13,2076108,2019-08-08
96,spotify:track:0OsYwz3SCLD98IvWfdLeRQ,NLE Choppa,Shotta Flow 3,Warner Records,96,179,2,2058932,2019-08-08
97,spotify:track:6XkLPzkKzPhpr3hrvl1TUq,"Blueface, Rich The Kid",Daddy (feat. Rich The Kid),Cash Money Records Inc.,97,108,5,2052261,2019-08-08
98,spotify:track:3ee8Jmje8o58CHK66QrVC2,XXXTENTACION,SAD!,"Bad Vibes Forever, LLC",1,110,75,2039402,2019-08-08
99,spotify:track:2rxQMGVafnNaRaXlRMWPde,Luke Combs,Beautiful Crazy,River House Artists/Columbia Nashville,61,111,58,2037603,2019-08-08
100,spotify:track:6foY66mWZN0pSRjZ408c00,Morgan Wallen,Whiskey Glasses,Morgan Wallen,66,112,21,2028941,2019-08-08
101,spotify:track:0rKtyWc8bvkriBthvHKY8d,Joji,SLOW DANCING IN THE DARK,88rising Music,29,120,46,2000746,2019-08-08
102,spotify:track:6C9SwoZ5OrxcvkntgA5t8s,Drake,4pm in Calabasas,OVO,102,-1,1,1996205,2019-08-08
103,spotify:track:6Qs4SXO9dwPj5GKvVOv8Ki,"Sam Smith, Normani",Dancing With A Stranger (with Normani),PLG - Capitol,12,114,30,1980013,2019-08-08
104,spotify:track:7nfmK6oHPDlAd68A11d7AN,Luke Combs,Beer Never Broke My Heart,River House Artists/Columbia Nashville,51,126,13,1976495,2019-08-08
105,spotify:track:0qc4QlcCxVTGyShurEv1UU,"Sam Feldt, RANI",Post Malone (feat. RANI),Spinnin' Records,39,83,7,1971316,2019-08-08
106,spotify:track:4vUmTMuQqjdnvlZmAH61Qk,"Ed Sheeran, Camila Cabello, Cardi B",South of the Border (feat. Camila Cabello & Cardi B),Atlantic Records UK,14,81,4,1964847,2019-08-08
107,spotify:track:2t8yVaLvJ0RenpXUIAC52d,21 Savage,a lot,"Slaughter Gang, LLC/Epic Records",7,109,33,1962176,2019-08-08
108,spotify:track:1dyxS3YzBbL0t8rEVwVQ1K,Blake Shelton,God's Country,Warner Records,69,124,14,1957558,2019-08-08
109,spotify:track:4czcw3NVLY0of5hTD7OufN,Drake,Days in The East,OVO,109,-1,1,1943346,2019-08-08
110,spotify:track:2gTdDMpNxIRFSiu7HutMCg,"mgk, YUNGBLUD, Travis Barker",I Think I'm OKAY (with YUNGBLUD & Travis Barker),Bad Boy/Interscope Records,36,74,9,1942398,2019-08-08
111,spotify:track:0FnxK9FEAQyPJ284QcieNb,Drake,5 Am in Toronto,OVO,111,-1,1,1914868,2019-08-08
112,spotify:track:7ILEWkpfdK6AjH2D7jppWk,"Chris Brown, Justin Bieber, Ink",Don't Check On Me (feat. Justin Bieber & Ink),Chris Brown Entertainment/RCA Records,31,77,6,1908762,2019-08-08
113,spotify:track:7IP0lO9tHfNwBWZ9X6TJ84,Big Sean,Single Again,"Getting Out Our Dreams, Inc./Def Jam Recordings",67,67,2,1907700,2019-08-08
114,spotify:track:75ZvA4QfFiZvzhj2xkaWAh,Post Malone,I Fall Apart,Universal Records,2,127,99,1894507,2019-08-08
115,spotify:track:4MsUsFfWseB9M2plGJyuIw,"Taylor Swift, Brendon Urie, Panic! At The Disco",ME! (feat. Brendon Urie of Panic! At The Disco),Taylor Swift,1,119,15,1891273,2019-08-08
116,spotify:track:0TlLq3lA83rQOYtrqBqSct,Drake,Nonstop,Cash Money/Drake LP6,1,133,58,1889608,2019-08-08
117,spotify:track:1rgnBhdG2JDFTbYkYRZAku,Tones And I,Dance Monkey,Elektra (NEK),117,-1,1,1886752,2019-08-08
118,spotify:track:3WyRgi8CzQnhzO0xw79tTS,DaBaby,Goin Baby,South Coast Music Group/Interscope Records,67,122,16,1885482,2019-08-08
119,spotify:track:3A2yGHWIzmGEIolwonU69h,City Girls,Act Up,Quality Control Music/Motown Records,66,125,23,1882054,2019-08-08
120,spotify:track:6G0FACzGN80Dj2v4ass5rq,"iann dior, Trippie Redd",gone girl (feat. Trippie Redd),"Internet Money Records / TenThousand Projects, LLC",84,115,4,1878474,2019-08-08
121,spotify:track:5kfNriitmkNE8mUbZ7gbq8,Khalid,Saturday Nights,"Right Hand Music Group, LLC/RCA Records",14,136,41,1875492,2019-08-08
122,spotify:track:6MR5IBSNfDmiwnrlQpVw4w,Drake,Club Paradise,OVO,122,-1,1,1867773,2019-08-08
123,spotify:track:1rqqCSm0Qe4I9rUvWncaom,Panic! At The Disco,High Hopes,DCD2 / Fueled By Ramen,13,131,60,1859889,2019-08-08
124,spotify:track:0F7FA14euOIX8KcbEturGH,Lil Nas X,Old Town Road,Columbia,2,-1,22,1838073,2019-08-08
125,spotify:track:6PYnUsNEpYC7A4BS2sjw3L,"Khalid, A Boogie Wit da Hoodie",Right Back (feat. A Boogie Wit Da Hoodie),"Right Hand Music Group, LLC/RCA Records",125,-1,1,1837866,2019-08-08
126,spotify:track:4tNXntkAzQ5A2dfYRYGIIQ,5 Seconds of Summer,Easier,5 Seconds Of Summer/Interscope,22,123,11,1824058,2019-08-08
127,spotify:track:2VxeLyX666F8uXCJ0dZF8B,"Lady Gaga, Bradley Cooper",Shallow,A Star is Born OST,10,135,45,1819230,2019-08-08
128,spotify:track:3W3FVHEDetkiRkkGKDmdir,Drake,Draft Day,OVO,128,-1,1,1818465,2019-08-08
129,spotify:track:3Fj47GNK2kUF0uaEDgXLaD,Billie Eilish,wish you were gay,Darkroom/Interscope Records,3,132,23,1814395,2019-08-08
130,spotify:track:0FZ4Dmg8jJJAPJnvBIzD9z,"Kodak Black, Offset, Travis Scott",ZEZE (feat. Travis Scott & Offset),Atlantic Records,1,134,43,1813818,2019-08-08
131,spotify:track:4u7EnebtmKWzUH433cf5Qv,Queen,Bohemian Rhapsody - Remastered 2011,EMI,42,141,41,1807441,2019-08-08
132,spotify:track:4cEONREpY8NQJMuGQP95Kl,"Bryce Vine, YG",La La Land (feat. YG),Sire,82,128,10,1807353,2019-08-08
133,spotify:track:7m9OqQk4RVRkw9JJdeAw96,XXXTENTACION,Jocelyn Flores,Bad Vibes Forever / EMPIRE,3,146,102,1799190,2019-08-08
134,spotify:track:4XiGKQqbmnMVxDzUj6j3f2,YK Osiris,Worth It,Def Jam Recordings,71,129,23,1786096,2019-08-08
135,spotify:track:2iUXsYOEPhVqEBwsqP70rE,5 Seconds of Summer,Youngblood,Capitol,17,147,69,1784428,2019-08-08
136,spotify:track:0JP9xo3adEtGSdUEISiszL,XXXTENTACION,Moonlight,"Bad Vibes Forever, LLC",3,143,73,1778795,2019-08-08
137,spotify:track:42fw0rxRO2xbesF6mJfd4Y,Dan + Shay,Tequila,Warner Records,60,151,73,1777552,2019-08-08
138,spotify:track:59ywHNwwchG4nZJMLyxSzd,"Offset, Cardi B",Clout (feat. Cardi B),Quality Control Music/Motown Records,46,102,17,1771237,2019-08-08
139,spotify:track:4e4fqjx0Izh4svvTef1z7e,"Bebe Rexha, Florida Georgia Line",Meant to Be (feat. Florida Georgia Line),Warner Records,16,153,100,1767797,2019-08-08
140,spotify:track:56NDFbD0tCUawnqeU2wcvv,"Drake, James Fauntleroy",Girls Love Beyoncé (feat. James Fauntleroy),OVO,140,-1,1,1763435,2019-08-08
141,spotify:track:4R8BJggjosTswLxtkw8V7P,"JHAYCO, J Balvin, Bad Bunny",No Me Conoce - Remix,N&E Entertainment LLC,141,152,8,1753265,2019-08-08
142,spotify:track:22oEJW6r2rMb9z4IntfyEa,Panic! At The Disco,"Hey Look Ma, I Made It",DCD2 / Fueled By Ramen,67,150,17,1745127,2019-08-08
143,spotify:track:3yOs8FffuG6hPbzQG9lIqV,Chris Lane,I Don't Know About You,Big Loud,143,-1,1,1744656,2019-08-08
144,spotify:track:58q2HKrzhC3ozto2nDdN4z,"Cardi B, Bad Bunny, J Balvin",I Like It,Atlantic/KSR,3,148,70,1743792,2019-08-08
145,spotify:track:6vN77lE9LK6HP2DewaN6HZ,"Lil Baby, Drake",Yes Indeed,"Quality Control Music, LLC",2,166,65,1740708,2019-08-08
146,spotify:track:7M2tXmeS15NAzEn7ABFeBg,"Logic, Eminem",Homicide (feat. Eminem),Def Jam Recordings,1,145,14,1740510,2019-08-08
147,spotify:track:4dV3okcjbQwTcg4ObIGr4N,Shordie Shordie,Bitchuary,Warner Records,140,165,6,1731647,2019-08-08
148,spotify:track:4dAMdQ6g4kGmnc1MDHsg77,NLE Choppa,Shotta Flow,Warner Records,46,139,21,1729959,2019-08-08
149,spotify:track:0DiDStADDVh3SvAsoJAFMk,Jonas Brothers,Only Human,Jonas Brothers Recording,12,154,9,1713366,2019-08-08
150,spotify:track:4VXIryQMWpIdGgYR4TrjT1,Juice WRLD,All Girls Are The Same,Juice WRLD Mixtape / ISR P&D,13,162,68,1706801,2019-08-08
151,spotify:track:3swc6WTsr7rl9DqQKQA55C,"Post Malone, Ty Dolla $ign",Psycho (feat. Ty Dolla $ign),Republic Records,2,161,76,1704473,2019-08-08
152,spotify:track:1ThmUihH9dF8EV08ku5AXN,Ski Mask The Slump God,Faucet Failure,Republic Records,27,159,35,1699043,2019-08-08
153,spotify:track:5Z3GHaZ6ec9bsiI5BenrbY,Khalid,Young Dumb & Broke,"Right Hand Music Group, LLC/RCA Records",6,160,121,1693417,2019-08-08
154,spotify:track:2toVe5hfuIi97ytDPDbQFt,"Tyga, Offset",Taste (feat. Offset),Last Kings Music / EMPIRE,4,158,64,1693279,2019-08-08
155,spotify:track:2P91MQbaiQOfbiz9VqhqKQ,Lauv,I Like Me Better,Lauv,30,173,113,1692760,2019-08-08
156,spotify:track:2uIX8YMNjGMD7441kqyyNU,Billie Eilish,ocean eyes,Darkroom,78,164,59,1691376,2019-08-08
157,spotify:track:2Jh3UqxnHJMyzMzku4uOtE,Juice WRLD,Feeling,Grade A Productions/Interscope Records,55,175,19,1679279,2019-08-08
158,spotify:track:25ZAibhr3bdlMCLmubZDVt,"J Balvin, Bad Bunny",QUE PRETENDES,Universal Music Latino / Rimas,27,140,6,1672249,2019-08-08
159,spotify:track:6MF4tRr5lU8qok8IKaFOBE,"Dreamville, J. Cole, Lute, DaBaby",Under The Sun (with J. Cole & Lute feat. DaBaby),Dreamville/Interscope Records,15,142,5,1668040,2019-08-08
160,spotify:track:3a1lNhkSLSkpJE4MSHpDu9,"Post Malone, Quavo",Congratulations,Universal Records,5,170,137,1667982,2019-08-08
161,spotify:track:3sMC6vfTTSa0mMAPTwzDVD,Drake,I Get Lonely,OVO,161,-1,1,1667536,2019-08-08
162,spotify:track:3XF5xLJHOQQRbWya6hBp7d,Billie Eilish,you should see me in a crown,Darkroom/Interscope Records,11,168,41,1666969,2019-08-08
163,spotify:track:3oLe5ZILASG8vU5dxIMfLY,NF,The Search,NF Real Music,56,92,4,1662691,2019-08-08
164,spotify:track:14mHfNsSHN0FbLftyjrV9g,Flipp Dinero,Leave Me Alone,Cinematic/Epic/We The Best,10,176,52,1660136,2019-08-08
165,spotify:track:1faIb3PPSzEifCHUOJ691R,Cordae,Broke As Fuck,Art@War/Atlantic Records,130,130,2,1656514,2019-08-08
166,spotify:track:4ZT9FnbFu1PaBfV3itxiqT,Lil Skies,I,All We Got Ent.,16,174,23,1655936,2019-08-08
167,spotify:track:7zLYKWcXnYeHHWidalz7rj,Lil Mosey,Noticed,Mogul Vision/Interscope Records,20,171,51,1655207,2019-08-08
168,spotify:track:6DCZcSspjsKoFjzjrWoCdn,Drake,God's Plan,Cash Money/Drake LP6,1,191,81,1648876,2019-08-08
169,spotify:track:5lw8Mgb4LyhriPIC86gV6e,"Cordae, Anderson .Paak",RNP (feat. Anderson .Paak),Art@War/Atlantic Records,61,61,2,1634991,2019-08-08
170,spotify:track:7GX5flRQZVHRAGd6B4TmDO,Lil Uzi Vert,XO Tour Llif3,Generation Now/Atlantic,2,178,124,1626575,2019-08-08
171,spotify:track:2xUHiyGeGrWmmfv7NbDTWC,"Drake, J. Cole",Jodeci Freestyle (feat. J. Cole),OVO,171,-1,1,1617566,2019-08-08
172,spotify:track:4e34Qq2lkp92egwgjacVcT,"Trippie Redd, Lil Baby, Lil Duke",Mac 10 (feat. Lil Baby & Lil Duke),"TenThousand Projects, LLC",93,93,2,1616999,2019-08-08
173,spotify:track:7COXchtUOMd6uIT6HvmRaI,"Lauv, Troye Sivan",i'm so tired...,Lauv,23,189,28,1615742,2019-08-08
174,spotify:track:18uwL0vNUanqZH0ro2QcOP,Jeremy Zucker,comethru,Republic Records,165,167,6,1596607,2019-08-08
175,spotify:track:7AQim7LbvFVZJE3O8TYgf2,"XXXTENTACION, Trippie Redd",Fuck Love,Bad Vibes Forever / EMPIRE,8,180,102,1596215,2019-08-08
176,spotify:track:1xzBco0xcoJEDXktl7Jxrr,Sheck Wes,Mo Bamba,Cactus Jack Records/ G.O.O.D. Music/ Interscope Records,1,184,54,1587766,2019-08-08
177,spotify:track:7tbyiwnLhtKYXNMjCZ60BT,"Quality Control, Migos, Lil Yachty, Gucci Mane",Intro,Quality Control Music/Motown Records,177,-1,1,1582608,2019-08-08
178,spotify:track:1xsP6AITcWNigBYBYVnVZw,"Chance the Rapper, Megan Thee Stallion",Handsome,Chance The Rapper,49,49,2,1572829,2019-08-08
179,spotify:track:0EzRnjtN5ER0wu1IudNom8,"Tyga, YG, Blueface",Bop,Last Kings Music / EMPIRE,179,-1,1,1572429,2019-08-08
180,spotify:track:08tq1XcHwVt5PHXUo87i0D,Dan + Shay,All To Myself,Warner Records,155,-1,4,1572392,2019-08-08
181,spotify:track:5icOoE6VgqFKohjWWNp0Ac,"Marshmello, CHVRCHES",Here With Me,Joytime Collective,16,-1,21,1568174,2019-08-08
182,spotify:track:25sgk305KZfyuqVBQIahim,Ava Max,Sweet but Psycho,Atlantic Records,36,182,44,1566212,2019-08-08
183,spotify:track:40T5GIqQ1CegGm2PTEl8Bu,Billie Eilish,idontwannabeyouanymore,Darkroom,48,185,56,1561546,2019-08-08
184,spotify:track:6gBFPUFcJLzWGx4lenP6h2,Travis Scott,goosebumps,Cactus Jack / Epic,16,197,137,1555945,2019-08-08
185,spotify:track:152lZdxL1OR0ZMW6KquMif,Khalid,Location,"Right Hand Music Group, LLC/RCA Records",9,196,134,1553554,2019-08-08
186,spotify:track:6ERR6e7h6wCqGoz1TjiUJb,Luke Bryan,Knockin' Boots,Capitol Records Nashville,159,163,5,1552476,2019-08-08
187,spotify:track:5qrSlOut2rNAWv3ubArkNy,Dean Lewis,Be Alright,Universal Music Australia Pty. Ltd.,31,199,54,1552195,2019-08-08
188,spotify:track:01Qb6dN5suQNu87VJ1mIpf,Lil Tecca,Did It Again,Republic Records,188,-1,1,1546805,2019-08-08
189,spotify:track:2tOOcDDYkh0PSjr6GwPEAJ,"MAX, Quinn XCII",Love Me Less (feat. Quinn XCII),Colour Vision Records/Sony Music Entertainment,68,-1,13,1543931,2019-08-08
190,spotify:track:5wujBwqG7INdStqGd4tRMX,Juice WRLD,Armed And Dangerous,Juice WRLD Mixtape / ISR P&D,9,192,39,1540790,2019-08-08
191,spotify:track:6vWEAOUSxohKxhp0K1BsxL,"YNW Melly, Kanye West",Mixed Personalities (feat. Kanye West),P2019,12,187,29,1534564,2019-08-08
192,spotify:track:7sO5G9EABYOXQKNPNiE9NR,"Offset, Metro Boomin",Ric Flair Drip (with Metro Boomin),"Slaughter Gang, LLC/Epic/Quality Control Music/Motown/Capitol/Boominati Worldwide/Republic",4,195,93,1527775,2019-08-08
193,spotify:track:09IStsImFySgyp0pIQdqAc,"Zedd, Maren Morris, Grey",The Middle,UMGRI Interscope,7,-1,77,1527750,2019-08-08
194,spotify:track:5rLyYxZNzca00ENADO9m54,NF,When I Grow Up,NF Real Music,63,103,5,1526798,2019-08-08
195,spotify:track:2G1tXoGBaEMJ7FKGnkf6ud,"Gucci Mane, Bruno Mars, Kodak Black",Wake Up in the Sky,Guwop Enterprises/Atlantic,6,200,47,1525421,2019-08-08
196,spotify:track:2j9YmQRxtjuVwb4XN95oT8,"Gryffin, Carly Rae Jepsen",OMG (with Carly Rae Jepsen),Darkroom/Geffen Records,196,-1,1,1516025,2019-08-08
197,spotify:track:36J0iaPDGbYGsHvYpaYs3k,"Dreamville, JID, Bas, J. Cole, EARTHGANG, Young Nudy","Down Bad (feat. JID, Bas, J. Cole, EARTHGANG & Young Nudy)",Dreamville/Interscope Records,23,157,8,1512821,2019-08-08
198,spotify:track:3QzAOrNlsabgbMwlZt7TAY,"Mustard, Roddy Ricch",Ballin' (with Roddy Ricch),10 Summers Records/Interscope Records,198,-1,1,1509799,2019-08-08
199,spotify:track:73IE87H0g2MBmdn41lkVto,Drake,Paris Morton Music,OVO,199,-1,1,1507019,2019-08-08
