rank,uri,artist_names,track_name,source,peak_rank,previous_rank,weeks_on_chart,streams,End Date
1,spotify:track:0TK2YIli7K1leLovkQiNik,"Shawn Mendes, Camila Cabello",Señorita,Island Records,1,1,5,10388073,2019-07-25
2,spotify:track:6vBdBCoOhKHiYDDOcorfNo,"Post Malone, Young Thug",Goodbyes (feat. Young Thug),Republic Records,1,2,3,9680155,2019-07-25
3,spotify:track:5qmq61DAAOUaW8AUo8xKhh,Lizzo,Truth Hurts,Nice Life/Atlantic,3,5,14,8936681,2019-07-25
4,spotify:track:1kBbgxAUc4HQv7cgIayIDH,Lil Tecca,Ransom,Republic Records,4,8,9,8862447,2019-07-25
5,spotify:track:5ry2OE6R2zPQFDO85XkgRb,"Drake, Rick Ross",Money In The Grave (Drake ft. Rick Ross),Republic Records,1,3,6,8546369,2019-07-25
6,spotify:track:6fTt0CH2t0mdeB2N9XFG5r,Lil Nas X,Panini,Columbia,2,4,5,8506982,2019-07-25
7,spotify:track:70eFcWOvlMObDhURTqT4Fv,"Ed Sheeran, Khalid",Beautiful People (feat. Khalid),Atlantic Records UK,4,6,4,6850270,2019-07-25
8,spotify:track:3KkXRkHbMCARz0aVfEt68P,"Post Malone, Swae Lee",Sunflower - Spider-Man: Into the Spider-Verse,Universal Records,1,10,40,6824328,2019-07-25
9,spotify:track:2gwkD6igEhQbDQegRCcdoB,DaBaby,Suge,South Coast Music Group/Interscope Records,4,13,17,6286532,2019-07-25
10,spotify:track:6b2RcmUt1g9N9mQ3CbjX2Y,Sam Smith,How Do You Sleep?,PLG - Capitol,10,-1,1,5864636,2019-07-25
11,spotify:track:2Fxmhks0bxGSBdJ92vM42m,Billie Eilish,bad guy,Darkroom/Interscope Records,1,12,17,5606671,2019-07-25
12,spotify:track:7DcvwMAiqKJQD1rrdfxSDx,"Young Thug, J. Cole, Travis Scott",The London (feat. J. Cole & Travis Scott),300 Entertainment/Atl,1,15,9,5528552,2019-07-25
13,spotify:track:1DhRbox3xkceP64k3JeYfW,"Ed Sheeran, Travis Scott",Antisocial (with Travis Scott),Atlantic Records UK,7,7,2,5473927,2019-07-25
14,spotify:track:51Fjme0JiitpyXKuyQiCDo,"Y2K, bbno$",Lalala,Columbia,14,20,6,5455999,2019-07-25
15,spotify:track:4hPpVbbakQNv8YTHYaOJP4,"Marshmello, Kane Brown",One Thing Right,Joytime Collective,15,16,5,5191702,2019-07-25
16,spotify:track:6u7jPi22kF8CTQ3rb9DHE7,"Lil Nas X, Billy Ray Cyrus",Old Town Road (feat. Billy Ray Cyrus) - Remix,Columbia,1,17,16,5004365,2019-07-25
17,spotify:track:0hVXuCcriWRGvwMV1r5Yn9,"Ed Sheeran, Justin Bieber",I Don't Care (with Justin Bieber),Atlantic Records UK,1,9,11,4992296,2019-07-25
18,spotify:track:3yNZ5r3LKfdmjoS3gkhUCT,"Billie Eilish, Justin Bieber",bad guy (with Justin Bieber),Darkroom/Interscope Records,11,11,2,4878780,2019-07-25
19,spotify:track:6uFn47ACjqYkc0jADwEdj1,"Polo G, Lil Tjay",Pop Out (feat. Lil Tjay),Columbia,8,21,18,4819432,2019-07-25
20,spotify:track:6XHVuErjQ4XNm6nDPVCxVX,"Chris Brown, Drake",No Guidance (feat. Drake),Chris Brown Entertainment/RCA Records,5,22,7,4609142,2019-07-25
21,spotify:track:4ak7xjvBeBOcJGWFDX9w5n,"Lil Nas X, Cardi B",Rodeo,Columbia,9,18,5,4538557,2019-07-25
22,spotify:track:6TqXcAFInzjp0bODyvrWEq,"Khalid, Disclosure",Talk (feat. Disclosure),"Right Hand Music Group, LLC/RCA Records",6,24,24,4481526,2019-07-25
23,spotify:track:2nKYHpmwjLaEOXS3o7QMiz,"Quality Control, Lil Baby, DaBaby",Baby,Quality Control Music/Motown Records,23,-1,1,4334205,2019-07-25
24,spotify:track:6moU77g9RQyMzHNuKEaQKq,Ali Gatie,It's You,Warner Records,17,27,6,4290684,2019-07-25
25,spotify:track:1kK6DwzyXJSp58u5HYWwuD,"YG, Tyga, Jon Z","Go Loko (feat. Tyga, Jon Z)",Def Jam Recordings,17,28,12,4140446,2019-07-25
26,spotify:track:29fRTIKsJhLUJoldM89GZS,Taylor Swift,You Need To Calm Down,Taylor Swift,2,29,6,4017500,2019-07-25
27,spotify:track:5hVghJ4KaYES3BFUATCYn0,"Tyler, The Creator",EARFQUAKE,Columbia,1,26,10,3974452,2019-07-25
28,spotify:track:67XyC1GdSkKb9sbRRkUDXS,"NLE Choppa, Blueface",Shotta Flow (feat. Blueface) - Remix,Warner Records,28,41,4,3944699,2019-07-25
29,spotify:track:6MWtB6iiXyIwun0YzU6DFP,Post Malone,Wow.,Republic Records,2,31,31,3857669,2019-07-25
30,spotify:track:2JvzF1RMd7lE3KmFlsyZD8,J. Cole,MIDDLE CHILD,"Dreamville, Inc., Under exclusive license to Roc Nation Records",1,30,27,3847200,2019-07-25
31,spotify:track:7qEHsqek33rTcFNT9PFqLf,Lewis Capaldi,Someone You Loved,Vertigo Berlin,31,34,13,3758596,2019-07-25
32,spotify:track:6uAm7pG66O1XesXS9bpHSF,"Lizzo, Ariana Grande",Good as Hell (feat. Ariana Grande),Warner Music Group - X5 Music Group,32,46,6,3719223,2019-07-25
33,spotify:track:6LsAAHotRLMOHfCsSfYCsz,Shawn Mendes,If I Can't Have You,Island Records,4,32,12,3604505,2019-07-25
34,spotify:track:2zjGJ0dChMR0KxBZS15aqo,"Mustard, NAV, Playboi Carti, A Boogie Wit da Hoodie","Baguettes in the Face (feat. NAV, Playboi Carti & A Boogie Wit da Hoodie)",10 Summers Records/Interscope Records,34,36,4,3456111,2019-07-25
35,spotify:track:5dW1VZPcFqB4n0P08rGDgm,Blanco Brown,The Git Up,Broken Bow Records,34,42,6,3455457,2019-07-25
36,spotify:track:7oqftogUN82Q7VNy2TmTJW,"Beyoncé, JAY-Z, Childish Gambino, Oumou Sangaré",MOOD 4 EVA (feat. Oumou Sangaré),Parkwood Entertainment/Columbia,36,-1,1,3442744,2019-07-25
37,spotify:track:3XiNC94b4Tq1xwv70sQJGN,Lil Uzi Vert,Sanguine Paradise,Generation Now/Atlantic,6,35,16,3403025,2019-07-25
38,spotify:track:4vUmTMuQqjdnvlZmAH61Qk,"Ed Sheeran, Camila Cabello, Cardi B",South of the Border (feat. Camila Cabello & Cardi B),Atlantic Records UK,14,14,2,3340086,2019-07-25
39,spotify:track:1wJRveJZLSb1rjhnUHQiv6,"A Boogie Wit da Hoodie, 6ix9ine",Swervin (feat. 6ix9ine),Highbridge the Label / Atlantic Records,7,43,31,3258196,2019-07-25
40,spotify:track:2IRZnDFmlqMuOrYOLnZZyc,"Meek Mill, Drake",Going Bad (feat. Drake),MMG/Atlantic,2,47,34,3218299,2019-07-25
41,spotify:track:05CwHjIk71RXVU40boRMnR,"The Chainsmokers, Bebe Rexha",Call You Mine,Disruptor Records/Columbia,23,33,8,3211468,2019-07-25
42,spotify:track:22vgEDb5hykfaTwLuskFGD,Jonas Brothers,Sucker,Jonas Brothers Recording,1,38,21,3207739,2019-07-25
43,spotify:track:4wuCQX7JvAZLlrcmH4AeZF,"Ed Sheeran, Chance the Rapper, PnB Rock",Cross Me (feat. Chance the Rapper & PnB Rock),Atlantic Records UK,11,23,9,3165807,2019-07-25
44,spotify:track:2TH65lNHgvLxCKXM3apjxI,"Bad Bunny, Tainy",Callaita,Rimas Entertainment LLC,41,50,8,3151318,2019-07-25
45,spotify:track:3Y7MHz19qCg1Pkxridtu1k,Taylor Swift,The Archer,Taylor Swift,45,-1,1,3149956,2019-07-25
46,spotify:track:6jmZlyf9DxcIoRrjw02YXm,"Lil Nas X, Billy Ray Cyrus, Mason Ramsey, Young Thug",Old Town Road - Remix,Columbia,25,25,2,3134320,2019-07-25
47,spotify:track:43zdsphuZLzwA9k4DJhU0I,Billie Eilish,when the party's over,Darkroom/Interscope Records,5,37,41,3128532,2019-07-25
48,spotify:track:3j84U36KvLeXNDPv4t5pI8,"Mustard, Migos",Pure Water (with Migos),10 Summers Records/Interscope Records,13,49,27,3105862,2019-07-25
49,spotify:track:6ocbgoVGwYJhOv1GgI9NsF,Ariana Grande,7 rings,Republic Records,1,44,27,3008584,2019-07-25
50,spotify:track:5rU6kDNXZLXIinFezpbWbO,"NAV, Meek Mill",Tap (feat. Meek Mill),"XO Records, LLC and Republic Records",50,56,13,2954314,2019-07-25
51,spotify:track:78QR3Wp35dqAhFEc2qAGjE,"Lil Baby, Gunna",Drip Too Hard (Lil Baby & Gunna),"Quality Control Music/Young Stoner Life Records, a 300 Entertainment Label/Motown Records/Capitol Records",1,54,45,2918006,2019-07-25
52,spotify:track:6kls8cSlUyHW2BUOkDJIZE,"Ellie Goulding, Juice WRLD",Hate Me (with Juice WRLD),Polydor Records,52,77,4,2895407,2019-07-25
53,spotify:track:2gTdDMpNxIRFSiu7HutMCg,"mgk, YUNGBLUD, Travis Barker",I Think I'm OKAY (with YUNGBLUD & Travis Barker),Bad Boy/Interscope Records,36,45,7,2876846,2019-07-25
54,spotify:track:4R9ATNRRl1uth17i5qDCc0,Bazzi,I.F.L.Y.,iamcosmic,54,-1,1,2849148,2019-07-25
55,spotify:track:5PYQUBXc7NYeI1obMKSJK0,Katy Perry,Never Really Over,Capitol Records,10,39,8,2836869,2019-07-25
56,spotify:track:0B3FovCVaGKS5w1FTidEUP,"Blue Ivy, SAINt JHN, Beyoncé, Wizkid",BROWN SKIN GIRL,Parkwood Entertainment/Columbia,56,-1,1,2796220,2019-07-25
57,spotify:track:56JyMaElW79S7TDWh1Zw1m,Ashley O,On A Roll,RCA Records Label,32,48,6,2794433,2019-07-25
58,spotify:track:0u2P5u6lvoDfwTYjAADbn4,"Billie Eilish, Khalid",lovely (with Khalid),Darkroom,24,53,66,2782492,2019-07-25
59,spotify:track:7eBqSVxrzQZtK2mmgRG6lC,YNW Melly,Murder on My Mind,P2018,4,58,44,2774527,2019-07-25
60,spotify:track:6CcJMwBtXByIz4zQLzFkKc,Billie Eilish,i love you,Darkroom/Interscope Records,17,68,17,2759795,2019-07-25
61,spotify:track:0qc4QlcCxVTGyShurEv1UU,"Sam Feldt, RANI",Post Malone (feat. RANI),Spinnin' Records,39,40,5,2744304,2019-07-25
62,spotify:track:7ILEWkpfdK6AjH2D7jppWk,"Chris Brown, Justin Bieber, Ink",Don't Check On Me (feat. Justin Bieber & Ink),Chris Brown Entertainment/RCA Records,31,59,4,2699265,2019-07-25
63,spotify:track:5WnfnSpuNEGXyEt78PBA6d,"Dreamville, Bas, JID, Guapdad 4000, Reese LAFLARE, Jace, Mez, Smokepurpp, Buddy, Ski Mask The Slump God","Costa Rica (with Bas & JID feat. Guapdad 4000, Reese LAFLARE, Jace, Mez, Smokepurpp, Buddy & Ski Mask The Slump God)",Dreamville/Interscope Records,31,75,3,2669392,2019-07-25
64,spotify:track:6zeeWid2sgw4lap2jV61PZ,Khalid,Better,"Right Hand Music Group, LLC/RCA Records",9,65,45,2661656,2019-07-25
65,spotify:track:285pBltuF7vW8TeWk8hdRR,Juice WRLD,Lucid Dreams,Juice WRLD Mixtape / ISR P&D,1,72,64,2656398,2019-07-25
66,spotify:track:2ksOAxtIxY8yElEWw8RhgK,"Anuel AA, Daddy Yankee, KAROL G, J Balvin, Ozuna",China,"2019 Real Hasta La Muerte, LLC.",66,-1,1,2614551,2019-07-25
67,spotify:track:7FGq80cy8juXBCD2nrqdWU,"benny blanco, Halsey, Khalid",Eastside (with Halsey & Khalid),Friends Keep Secrets/Interscope Records,10,67,54,2612536,2019-07-25
68,spotify:track:2xLMifQCjDGFmkHkpNLD9h,Travis Scott,SICKO MODE,Cactus Jack / Epic,1,70,51,2611481,2019-07-25
69,spotify:track:7rvyVWja33WG9R97oeJAjx,Calboy,Envy Me,Polo Grounds Music/RCA Records,22,69,30,2603205,2019-07-25
70,spotify:track:2dpaYNEQHiRxtZbfNsse99,"Marshmello, Bastille",Happier,Joytime Collective,8,73,49,2545644,2019-07-25
71,spotify:track:4SSnFejRGlZikf02HLewEF,Billie Eilish,bury a friend,Darkroom/Interscope Records,3,60,26,2527100,2019-07-25
72,spotify:track:7njKgVl3AnLflRad38o7AG,Bazzi,Paradise,iamcosmic,20,71,16,2521151,2019-07-25
73,spotify:track:6oJ6le65B3SEqPwMRNXWjY,"Kygo, Whitney Houston",Higher Love,Kygo/RCA Records,28,61,4,2511856,2019-07-25
74,spotify:track:0AtP8EkGPn6SwxKDaUuXec,"Ed Sheeran, Eminem, 50 Cent",Remember The Name (feat. Eminem & 50 Cent),Atlantic Records UK,19,19,2,2474150,2019-07-25
75,spotify:track:6Hj9jySrnFppAI0sEMCZpJ,Juice WRLD,Robbery,Grade A Productions/Interscope Records,3,78,23,2465159,2019-07-25
76,spotify:track:5KBARWIxeMGkvUax9VtVC9,Saweetie,My Type,ICY/Artistry Records/Warner Records,76,83,3,2452876,2019-07-25
77,spotify:track:7dt6x5M1jzdTEt8oCbisTK,Post Malone,Better Now,Republic Records,1,79,65,2442473,2019-07-25
78,spotify:track:53CJANUxooaqGOtdsBTh7O,Lil Nas X,Old Town Road,Columbia,2,64,21,2431785,2019-07-25
79,spotify:track:0DiDStADDVh3SvAsoJAFMk,Jonas Brothers,Only Human,Jonas Brothers Recording,12,55,7,2418874,2019-07-25
80,spotify:track:40OMBMYRk5IQL6xCzGM0JA,"Martin Garrix, Macklemore, Fall Out Boy",Summer Days (feat. Macklemore & Patrick Stump of Fall Out Boy),Epic Amsterdam,31,66,13,2345243,2019-07-25
81,spotify:track:68Vm2W4oURsPV3121vUZgB,NF,Time - Edit,NF Real Music,80,80,2,2324173,2019-07-25
82,spotify:track:0e7ipj03S05BNilyu5bRzt,"Post Malone, 21 Savage",rockstar (feat. 21 Savage),Republic Records,1,84,97,2314449,2019-07-25
83,spotify:track:3TpBefRZ1vFcOH6z57PQRI,"Bryce Vine, YG",La La Land (feat. YG),Sire,82,92,8,2278236,2019-07-25
84,spotify:track:6G0FACzGN80Dj2v4ass5rq,"iann dior, Trippie Redd",gone girl (feat. Trippie Redd),"Internet Money Records / TenThousand Projects, LLC",84,97,2,2252965,2019-07-25
85,spotify:track:6Qs4SXO9dwPj5GKvVOv8Ki,"Sam Smith, Normani",Dancing With A Stranger (with Normani),PLG - Capitol,12,95,28,2252666,2019-07-25
86,spotify:track:5p7ujcrUXASCNwRaWNHR1C,Halsey,Without Me,Capitol Records,5,87,42,2252589,2019-07-25
87,spotify:track:6MF4tRr5lU8qok8IKaFOBE,"Dreamville, J. Cole, Lute, DaBaby",Under The Sun (with J. Cole & Lute feat. DaBaby),Dreamville/Interscope Records,15,52,3,2221068,2019-07-25
88,spotify:track:4XiGKQqbmnMVxDzUj6j3f2,YK Osiris,Worth It,Def Jam Recordings,71,93,21,2217016,2019-07-25
89,spotify:track:3Ol2xnObFdKV9pmRD2t9x8,A Boogie Wit da Hoodie,Look Back at It,Highbridge the Label / Atlantic Records,9,90,33,2213754,2019-07-25
90,spotify:track:3ee8Jmje8o58CHK66QrVC2,XXXTENTACION,SAD!,"Bad Vibes Forever, LLC",1,94,73,2212490,2019-07-25
91,spotify:track:4MsUsFfWseB9M2plGJyuIw,"Taylor Swift, Brendon Urie, Panic! At The Disco",ME! (feat. Brendon Urie of Panic! At The Disco),Taylor Swift,1,112,13,2188556,2019-07-25
92,spotify:track:3AEgic4yp82NxMWUjHtxnO,Ambjaay,Uno,Columbia,92,179,3,2187984,2019-07-25
93,spotify:track:1c0hsvHLELX6y8qymnpLKL,"Lunay, Daddy Yankee, Bad Bunny",Soltera (Remix),round2media - LaFamilia,60,106,11,2181548,2019-07-25
94,spotify:track:7f1zjZG77S891Uv4O68yfk,"DaBaby, Offset",Baby Sitter (feat. Offset),South Coast Music Group/Interscope Records,61,91,11,2176522,2019-07-25
95,spotify:track:59ywHNwwchG4nZJMLyxSzd,"Offset, Cardi B",Clout (feat. Cardi B),Quality Control Music/Motown Records,46,86,15,2171134,2019-07-25
96,spotify:track:3e9HZxeyfWwjeyPAMmWSSQ,Ariana Grande,"thank u, next",Republic Records,1,88,38,2170559,2019-07-25
97,spotify:track:3WyRgi8CzQnhzO0xw79tTS,DaBaby,Goin Baby,South Coast Music Group/Interscope Records,67,103,14,2158772,2019-07-25
98,spotify:track:3GJ4hzg4lrGwU51Y3VARbF,Dan + Shay,Speechless,Warner Records,85,113,51,2147451,2019-07-25
99,spotify:track:0k664IuFwVP557Gnx7RhIl,Lizzo,Juice,Nice Life/Atlantic,71,96,14,2124427,2019-07-25
100,spotify:track:2rxQMGVafnNaRaXlRMWPde,Luke Combs,Beautiful Crazy,River House Artists/Columbia Nashville,61,110,56,2121385,2019-07-25
101,spotify:track:6foY66mWZN0pSRjZ408c00,Morgan Wallen,Whiskey Glasses,Morgan Wallen,66,109,19,2121346,2019-07-25
102,spotify:track:1Ej96GIBCTvgH7tNX1r3qr,"Sech, Darell",Otro Trago,Rich Music/Ingrooves Records,71,119,10,2114745,2019-07-25
103,spotify:track:36J0iaPDGbYGsHvYpaYs3k,"Dreamville, JID, Bas, J. Cole, EARTHGANG, Young Nudy","Down Bad (feat. JID, Bas, J. Cole, EARTHGANG & Young Nudy)",Dreamville/Interscope Records,23,62,6,2114146,2019-07-25
104,spotify:track:3Fj47GNK2kUF0uaEDgXLaD,Billie Eilish,wish you were gay,Darkroom/Interscope Records,3,81,21,2093291,2019-07-25
105,spotify:track:6XkLPzkKzPhpr3hrvl1TUq,"Blueface, Rich The Kid",Daddy (feat. Rich The Kid),Cash Money Records Inc.,105,129,3,2080180,2019-07-25
106,spotify:track:2t8yVaLvJ0RenpXUIAC52d,21 Savage,a lot,"Slaughter Gang, LLC/Epic Records",7,102,31,2061931,2019-07-25
107,spotify:track:7nfmK6oHPDlAd68A11d7AN,Luke Combs,Beer Never Broke My Heart,River House Artists/Columbia Nashville,51,114,11,2051664,2019-07-25
108,spotify:track:0fea68AdmYNygeTGI4RC18,"J Balvin, Bad Bunny",LA CANCIÓN,Universal Music Latino / Rimas,43,118,4,2046228,2019-07-25
109,spotify:track:0OTBOHjEaoqroFlfut1ZsH,"XXXTENTACION, Ky-Mani Marley, Stefflon Don, Vybz Kartel","Royalty (feat. Ky-Mani Marley, Stefflon Don & Vybz Kartel)",Bad Vibes Forever / EMPIRE,109,-1,1,2031790,2019-07-25
110,spotify:track:4kV4N9D1iKVxx1KLvtTpjS,Ariana Grande,"break up with your girlfriend, i'm bored",Republic Records,1,99,24,2028273,2019-07-25
111,spotify:track:2wZjsbwmWfNVslgV5afl1L,"Lil Baby, Future",Out The Mud,Quality Control/Motown Records,49,105,5,2017514,2019-07-25
112,spotify:track:2rMAtCaTj16NptyVfEIeAC,"Megan Thee Stallion, DaBaby",Cash Shit (feat. DaBaby),300 Entertainment,112,152,4,1999062,2019-07-25
113,spotify:track:1fBXSMOusjaj7GjzErHmUI,"DJ Snake, J Balvin, Tyga",Loco Contigo (feat. J. Balvin & Tyga),DJ Snake Music Productions Limited,92,131,6,1998674,2019-07-25
114,spotify:track:0rKtyWc8bvkriBthvHKY8d,Joji,SLOW DANCING IN THE DARK,88rising Music,29,122,44,1997700,2019-07-25
115,spotify:track:3A2yGHWIzmGEIolwonU69h,City Girls,Act Up,Quality Control Music/Motown Records,66,137,21,1985783,2019-07-25
116,spotify:track:4dAMdQ6g4kGmnc1MDHsg77,NLE Choppa,Shotta Flow,Warner Records,46,115,19,1985344,2019-07-25
117,spotify:track:7M2tXmeS15NAzEn7ABFeBg,"Logic, Eminem",Homicide (feat. Eminem),Def Jam Recordings,1,107,12,1981329,2019-07-25
118,spotify:track:5kfNriitmkNE8mUbZ7gbq8,Khalid,Saturday Nights,"Right Hand Music Group, LLC/RCA Records",14,123,39,1967378,2019-07-25
119,spotify:track:1dyxS3YzBbL0t8rEVwVQ1K,Blake Shelton,God's Country,Warner Records,69,82,12,1965858,2019-07-25
120,spotify:track:75ZvA4QfFiZvzhj2xkaWAh,Post Malone,I Fall Apart,Universal Records,2,127,97,1962912,2019-07-25
121,spotify:track:1rqqCSm0Qe4I9rUvWncaom,Panic! At The Disco,High Hopes,DCD2 / Fueled By Ramen,13,121,58,1955940,2019-07-25
122,spotify:track:4tNXntkAzQ5A2dfYRYGIIQ,5 Seconds of Summer,Easier,5 Seconds Of Summer/Interscope,22,108,9,1955271,2019-07-25
123,spotify:track:0JP9xo3adEtGSdUEISiszL,XXXTENTACION,Moonlight,"Bad Vibes Forever, LLC",3,125,71,1934031,2019-07-25
124,spotify:track:2WyRfGeHo97VC5mP1BBSzr,Miley Cyrus,Mother's Daughter,RCA/Legacy,13,104,8,1919190,2019-07-25
125,spotify:track:0FZ4Dmg8jJJAPJnvBIzD9z,"Kodak Black, Offset, Travis Scott",ZEZE (feat. Travis Scott & Offset),Atlantic Records,1,128,41,1914416,2019-07-25
126,spotify:track:25ZAibhr3bdlMCLmubZDVt,"J Balvin, Bad Bunny",QUE PRETENDES,Universal Music Latino / Rimas,27,85,4,1909406,2019-07-25
127,spotify:track:2VxeLyX666F8uXCJ0dZF8B,"Lady Gaga, Bradley Cooper",Shallow,A Star is Born OST,10,124,43,1905959,2019-07-25
128,spotify:track:0oVxGuRMnawFgA8aduocfc,Tory Lanez,Forever,UME - Global Clearing House,128,-1,1,1898471,2019-07-25
129,spotify:track:2iUXsYOEPhVqEBwsqP70rE,5 Seconds of Summer,Youngblood,Capitol,17,126,67,1897751,2019-07-25
130,spotify:track:4u7EnebtmKWzUH433cf5Qv,Queen,Bohemian Rhapsody - Remastered 2011,EMI,42,136,39,1880253,2019-07-25
131,spotify:track:58q2HKrzhC3ozto2nDdN4z,"Cardi B, Bad Bunny, J Balvin",I Like It,Atlantic/KSR,3,134,68,1871135,2019-07-25
132,spotify:track:7m9OqQk4RVRkw9JJdeAw96,XXXTENTACION,Jocelyn Flores,Bad Vibes Forever / EMPIRE,3,133,100,1867973,2019-07-25
133,spotify:track:0TlLq3lA83rQOYtrqBqSct,Drake,Nonstop,Cash Money/Drake LP6,1,141,56,1840090,2019-07-25
134,spotify:track:4e4fqjx0Izh4svvTef1z7e,"Bebe Rexha, Florida Georgia Line",Meant to Be (feat. Florida Georgia Line),Warner Records,16,138,98,1823369,2019-07-25
135,spotify:track:22oEJW6r2rMb9z4IntfyEa,Panic! At The Disco,"Hey Look Ma, I Made It",DCD2 / Fueled By Ramen,67,132,15,1814458,2019-07-25
136,spotify:track:3XF5xLJHOQQRbWya6hBp7d,Billie Eilish,you should see me in a crown,Darkroom/Interscope Records,11,120,39,1813164,2019-07-25
137,spotify:track:5Uw7Dut2lZfexn3Y09swpf,"Mark Ronson, Camila Cabello",Find U Again (feat. Camila Cabello),Columbia,36,111,8,1811866,2019-07-25
138,spotify:track:5Z3GHaZ6ec9bsiI5BenrbY,Khalid,Young Dumb & Broke,"Right Hand Music Group, LLC/RCA Records",6,147,119,1799678,2019-07-25
139,spotify:track:3swc6WTsr7rl9DqQKQA55C,"Post Malone, Ty Dolla $ign",Psycho (feat. Ty Dolla $ign),Republic Records,2,144,74,1797725,2019-07-25
140,spotify:track:42fw0rxRO2xbesF6mJfd4Y,Dan + Shay,Tequila,Warner Records,60,150,71,1796099,2019-07-25
141,spotify:track:1ThmUihH9dF8EV08ku5AXN,Ski Mask The Slump God,Faucet Failure,Republic Records,27,143,33,1794691,2019-07-25
142,spotify:track:2uIX8YMNjGMD7441kqyyNU,Billie Eilish,ocean eyes,Darkroom,78,135,57,1788638,2019-07-25
143,spotify:track:5w9c2J52mkdntKOmRLeM2m,"Daddy Yankee, Snow",Con Calma,Craft Latino,45,148,24,1769273,2019-07-25
144,spotify:track:4VXIryQMWpIdGgYR4TrjT1,Juice WRLD,All Girls Are The Same,Juice WRLD Mixtape / ISR P&D,13,155,66,1764519,2019-07-25
145,spotify:track:2Jh3UqxnHJMyzMzku4uOtE,Juice WRLD,Feeling,Grade A Productions/Interscope Records,55,139,17,1764293,2019-07-25
146,spotify:track:6vN77lE9LK6HP2DewaN6HZ,"Lil Baby, Drake",Yes Indeed,"Quality Control Music, LLC",2,154,63,1749431,2019-07-25
147,spotify:track:2toVe5hfuIi97ytDPDbQFt,"Tyga, Offset",Taste (feat. Offset),Last Kings Music / EMPIRE,4,149,62,1740753,2019-07-25
148,spotify:track:3a1lNhkSLSkpJE4MSHpDu9,"Post Malone, Quavo",Congratulations,Universal Records,5,156,135,1734208,2019-07-25
149,spotify:track:4qQwGRtGT7l6ckQtdPEFd4,Florida Georgia Line,Talk You Out Of It,BMLG Records,149,171,9,1730842,2019-07-25
150,spotify:track:4R8BJggjosTswLxtkw8V7P,"JHAYCO, J Balvin, Bad Bunny",No Me Conoce - Remix,N&E Entertainment LLC,150,173,6,1730813,2019-07-25
151,spotify:track:2P91MQbaiQOfbiz9VqhqKQ,Lauv,I Like Me Better,Lauv,30,146,111,1726572,2019-07-25
152,spotify:track:4dV3okcjbQwTcg4ObIGr4N,Shordie Shordie,Bitchuary,Warner Records,140,140,4,1722870,2019-07-25
153,spotify:track:14mHfNsSHN0FbLftyjrV9g,Flipp Dinero,Leave Me Alone,Cinematic/Epic/We The Best,10,160,50,1697431,2019-07-25
154,spotify:track:7COXchtUOMd6uIT6HvmRaI,"Lauv, Troye Sivan",i'm so tired...,Lauv,23,142,26,1694827,2019-07-25
155,spotify:track:2j7mcsEz4n5XxMMqqjjB6p,"Future, Doe Boy, Meek Mill",100 Shooters (feat. Meek Mill),Epic/Freebandz,116,116,2,1694013,2019-07-25
156,spotify:track:7AQim7LbvFVZJE3O8TYgf2,"XXXTENTACION, Trippie Redd",Fuck Love,Bad Vibes Forever / EMPIRE,8,162,100,1688619,2019-07-25
157,spotify:track:7GX5flRQZVHRAGd6B4TmDO,Lil Uzi Vert,XO Tour Llif3,Generation Now/Atlantic,2,167,122,1688264,2019-07-25
158,spotify:track:7zLYKWcXnYeHHWidalz7rj,Lil Mosey,Noticed,Mogul Vision/Interscope Records,20,172,49,1684672,2019-07-25
159,spotify:track:4ZT9FnbFu1PaBfV3itxiqT,Lil Skies,I,All We Got Ent.,16,168,21,1681336,2019-07-25
160,spotify:track:40T5GIqQ1CegGm2PTEl8Bu,Billie Eilish,idontwannabeyouanymore,Darkroom,48,145,54,1677792,2019-07-25
161,spotify:track:25sgk305KZfyuqVBQIahim,Ava Max,Sweet but Psycho,Atlantic Records,36,153,42,1670107,2019-07-25
162,spotify:track:6vWEAOUSxohKxhp0K1BsxL,"YNW Melly, Kanye West",Mixed Personalities (feat. Kanye West),P2019,12,157,27,1668696,2019-07-25
163,spotify:track:56eGOeSsqdg3FLxdo83TwV,Lee Brice,Rumor,Curb Records,128,164,10,1665066,2019-07-25
164,spotify:track:1xzBco0xcoJEDXktl7Jxrr,Sheck Wes,Mo Bamba,Cactus Jack Records/ G.O.O.D. Music/ Interscope Records,1,169,52,1657927,2019-07-25
165,spotify:track:18uwL0vNUanqZH0ro2QcOP,Jeremy Zucker,comethru,Republic Records,165,-1,4,1652836,2019-07-25
166,spotify:track:6DCZcSspjsKoFjzjrWoCdn,Drake,God's Plan,Cash Money/Drake LP6,1,165,79,1635530,2019-07-25
167,spotify:track:5wujBwqG7INdStqGd4tRMX,Juice WRLD,Armed And Dangerous,Juice WRLD Mixtape / ISR P&D,9,178,37,1630008,2019-07-25
168,spotify:track:2tOOcDDYkh0PSjr6GwPEAJ,"MAX, Quinn XCII",Love Me Less (feat. Quinn XCII),Colour Vision Records/Sony Music Entertainment,68,170,12,1623208,2019-07-25
169,spotify:track:09IStsImFySgyp0pIQdqAc,"Zedd, Maren Morris, Grey",The Middle,UMGRI Interscope,7,176,76,1605625,2019-07-25
170,spotify:track:2KqJC0koTBUyDlsMt5ok1V,Thomas Rhett,Look What God Gave Her,The Valory Music Co.,70,193,12,1604543,2019-07-25
171,spotify:track:5qrSlOut2rNAWv3ubArkNy,Dean Lewis,Be Alright,Universal Music Australia Pty. Ltd.,31,181,52,1599195,2019-07-25
172,spotify:track:152lZdxL1OR0ZMW6KquMif,Khalid,Location,"Right Hand Music Group, LLC/RCA Records",9,184,132,1593525,2019-07-25
173,spotify:track:2G1tXoGBaEMJ7FKGnkf6ud,"Gucci Mane, Bruno Mars, Kodak Black",Wake Up in the Sky,Guwop Enterprises/Atlantic,6,182,45,1587130,2019-07-25
174,spotify:track:6gBFPUFcJLzWGx4lenP6h2,Travis Scott,goosebumps,Cactus Jack / Epic,16,190,135,1585085,2019-07-25
175,spotify:track:5icOoE6VgqFKohjWWNp0Ac,"Marshmello, CHVRCHES",Here With Me,Joytime Collective,16,163,20,1583371,2019-07-25
176,spotify:track:0yFvWTLs3iIwDbc91noXGT,"Chance the Rapper, TisaKorean, Murda Beatz",GRoCERIES,Chance The Rapper,47,161,10,1581378,2019-07-25
177,spotify:track:7KXjTSCq5nL1LoYtL7XAwS,Kendrick Lamar,HUMBLE.,Aftermath,1,186,120,1572058,2019-07-25
178,spotify:track:7sO5G9EABYOXQKNPNiE9NR,"Offset, Metro Boomin",Ric Flair Drip (with Metro Boomin),"Slaughter Gang, LLC/Epic/Quality Control Music/Motown/Capitol/Boominati Worldwide/Republic",4,192,91,1567491,2019-07-25
179,spotify:track:6ERR6e7h6wCqGoz1TjiUJb,Luke Bryan,Knockin' Boots,Capitol Records Nashville,159,159,3,1566850,2019-07-25
180,spotify:track:4pCEIQ6wBVuaJdER5bALtO,Lil Uzi Vert,That's a Rack,Generation Now/Atlantic,41,187,15,1551772,2019-07-25
181,spotify:track:0mjAU3yKR1QnXnHtjGJqTM,OneRepublic,Rescue Me,Mosley Music/Interscope Records,66,166,10,1537064,2019-07-25
182,spotify:track:3pZO6GoVPeSYDxxsH6vCdj,"Dreamville, J. Cole, Young Nudy",Sunset (with J. Cole feat. Young Nudy),Dreamville/Interscope Records,40,117,3,1526180,2019-07-25
183,spotify:track:08tq1XcHwVt5PHXUo87i0D,Dan + Shay,All To Myself,Warner Records,155,-1,3,1521893,2019-07-25
184,spotify:track:5T8EDUDqKcs6OSOwEsfqG7,Queen,Don't Stop Me Now - Remastered 2011,EMI,102,196,32,1507331,2019-07-25
185,spotify:track:0VsGaRXR5WAzpu51unJTis,"Ed Sheeran, Yebba",Best Part of Me (feat. YEBBA),Atlantic Records UK,51,51,3,1499652,2019-07-25
186,spotify:track:1ZDmxwg7Lywlx68b7SsJjj,Nicki Minaj,MEGATRON,Young Money/Cash Money Records,38,177,5,1496543,2019-07-25
187,spotify:track:4bHsxqR3GMrXTxEPLuK5ue,Journey,Don't Stop Believin' (2022 Remaster),Columbia/Legacy,187,-1,3,1495136,2019-07-25
188,spotify:track:36TO60sxDduIsO3xH8IcUh,"Joyner Lucas, Logic",Isis,Twenty Nine Music Group (Joyner Lucas),14,180,9,1494275,2019-07-25
189,spotify:track:7mldq42yDuxiUNn08nvzHO,Sam Hunt,Body Like A Back Road,MCA Nashville,15,195,85,1490023,2019-07-25
190,spotify:track:340UVheS8z3ncW9TTUhAbc,Halsey,Nightmare,Capitol Records,10,189,10,1485311,2019-07-25
191,spotify:track:2GGMabyHXnJmjY6CXhhB2e,Cardi B,Money,Atlantic/KSR,17,-1,38,1485102,2019-07-25
192,spotify:track:116H0KvKr2Zl4RPuVBruDO,"Bad Bunny, Drake",MIA,Rimas Entertainment LLC,2,198,41,1481366,2019-07-25
193,spotify:track:37AGgp9VP8TVJBfEat74Bj,"mgk, Trippie Redd",Candy (feat. Trippie Redd),Bad Boy/Interscope Records,174,174,2,1481032,2019-07-25
194,spotify:track:4OBZT9EnhYIV17t4pGw7ig,"Daniel Caesar, H.E.R.",Best Part (feat. H.E.R.),MBK Entertainment/RCA Records,68,200,60,1478683,2019-07-25
195,spotify:track:1mMLMZYXkMueg65jRRWG1l,Luke Combs,When It Rains It Pours,River House Artists/Columbia Nashville,123,-1,44,1457589,2019-07-25
196,spotify:track:3CA9pLiwRIGtUBiMjbZmRw,Drake,Nice For What,Cash Money/Drake LP6,1,-1,67,1454747,2019-07-25
