rank,uri,artist_names,track_name,source,peak_rank,previous_rank,weeks_on_chart,streams,End Date
1,spotify:track:4y3OI86AEP6PQoDE6olYhO,Jonas Brothers,Sucker,Jonas Brothers Recording,1,1,2,10521653,2019-03-14
2,spotify:track:2JvzF1RMd7lE3KmFlsyZD8,J. Cole,MIDDLE CHILD,"Dreamville, Inc., Under exclusive license to Roc Nation Records",1,3,8,10093445,2019-03-14
3,spotify:track:6Hj9jySrnFppAI0sEMCZpJ,Juice WRLD,Robbery,Grade A Productions/Interscope Records,3,7,4,10013503,2019-03-14
4,spotify:track:6ocbgoVGwYJhOv1GgI9NsF,Ariana Grande,7 rings,Republic Records,1,2,8,9698592,2019-03-14
5,spotify:track:7eBqSVxrzQZtK2mmgRG6lC,YNW Melly,Murder on My Mind,P2018,4,4,25,9449836,2019-03-14
6,spotify:track:3KkXRkHbMCARz0aVfEt68P,"Post Malone, Swae Lee",Sunflower - Spider-Man: Into the Spider-Verse,Universal Records,1,5,21,9394218,2019-03-14
7,spotify:track:6MWtB6iiXyIwun0YzU6DFP,Post Malone,Wow.,Republic Records,2,8,12,9323710,2019-03-14
8,spotify:track:6MjNilJCVKJq0LfFvo5jWJ,Juice WRLD,Fast,Grade A Productions/Interscope Records,8,-1,1,8932705,2019-03-14
9,spotify:track:4kV4N9D1iKVxx1KLvtTpjS,Ariana Grande,"break up with your girlfriend, i'm bored",Republic Records,1,6,5,8439550,2019-03-14
10,spotify:track:2IRZnDFmlqMuOrYOLnZZyc,"Meek Mill, Drake",Going Bad (feat. Drake),MMG/Atlantic,2,9,15,7593974,2019-03-14
11,spotify:track:4txc3txsIt81diMzGhrVPS,Billie Eilish,wish you were gay,Darkroom/Interscope Records,11,42,2,6145273,2019-03-14
12,spotify:track:2t8yVaLvJ0RenpXUIAC52d,21 Savage,a lot,"Slaughter Gang, LLC/Epic Records",7,11,12,6144150,2019-03-14
13,spotify:track:41MCdlvXOl62B7Kv86Bb1v,Juice WRLD,Empty,Grade A Productions/Interscope Records,13,-1,1,6083850,2019-03-14
14,spotify:track:1wJRveJZLSb1rjhnUHQiv6,"A Boogie Wit da Hoodie, 6ix9ine",Swervin (feat. 6ix9ine),Highbridge the Label / Atlantic Records,14,15,12,6043665,2019-03-14
15,spotify:track:3oh6SCCeLuXhFpEyepla6G,Blueface,Thotiana,Fifth Amendment Entertainment/eOne Music,9,12,10,5993994,2019-03-14
16,spotify:track:13ZyrkCDmRz5xY3seuAWYk,Juice WRLD,Hear Me Calling,Grade A Productions/Interscope Records,16,31,2,5848096,2019-03-14
17,spotify:track:63cd4JkwGgYJrbOizbfmsp,"Mustard, Migos",Pure Water (with Migos),10 Summers Records/Interscope Records,15,18,8,5793819,2019-03-14
18,spotify:track:78QR3Wp35dqAhFEc2qAGjE,"Lil Baby, Gunna",Drip Too Hard (Lil Baby & Gunna),"Quality Control Music/Young Stoner Life Records, a 300 Entertainment Label/Motown Records/Capitol Records",1,14,26,5583215,2019-03-14
19,spotify:track:0rTV5WefWd1J3OwIheTzxM,"Khalid, Disclosure",Talk,"Right Hand Music Group, LLC/RCA Records",13,13,5,5413883,2019-03-14
20,spotify:track:3e9HZxeyfWwjeyPAMmWSSQ,Ariana Grande,"thank u, next",Republic Records,1,17,19,5285199,2019-03-14
21,spotify:track:2xLMifQCjDGFmkHkpNLD9h,Travis Scott,SICKO MODE,Cactus Jack / Epic,1,19,32,5278995,2019-03-14
22,spotify:track:0PG9fbaaHFHfre2gUVo7AN,"Cardi B, Bruno Mars",Please Me,Atlantic/KSR,15,21,4,5243322,2019-03-14
23,spotify:track:6vWEAOUSxohKxhp0K1BsxL,"YNW Melly, Kanye West",Mixed Personalities (feat. Kanye West),P2019,23,28,8,5241333,2019-03-14
24,spotify:track:6eiztdXRkooWsBt2xToMWI,Juice WRLD,Make Believe,Grade A Productions/Interscope Records,24,-1,1,5231331,2019-03-14
25,spotify:track:3Ol2xnObFdKV9pmRD2t9x8,A Boogie Wit da Hoodie,Look Back at It,Highbridge the Label / Atlantic Records,9,20,14,5011095,2019-03-14
26,spotify:track:0FZ4Dmg8jJJAPJnvBIzD9z,"Kodak Black, Offset, Travis Scott",ZEZE (feat. Travis Scott & Offset),Atlantic Records,1,24,22,5004807,2019-03-14
27,spotify:track:5p7ujcrUXASCNwRaWNHR1C,Halsey,Without Me,Capitol Records,5,23,23,4974861,2019-03-14
28,spotify:track:4mUIe9gfsdtsVP2zFIl74x,Juice WRLD,Maze,Grade A Productions/Interscope Records,28,-1,1,4872863,2019-03-14
29,spotify:track:2dpaYNEQHiRxtZbfNsse99,"Marshmello, Bastille",Happier,Joytime Collective,8,25,30,4813038,2019-03-14
30,spotify:track:4NzMOnvSJVNKF7nw5NkXIP,Billie Eilish,bury a friend,Darkroom/Interscope Records,3,22,7,4805378,2019-03-14
31,spotify:track:1DUSuNhF8P5vUGNPpQiZa5,Khalid,My Bad,"Right Hand Music Group, LLC/RCA Records",31,-1,1,4794604,2019-03-14
32,spotify:track:2VxeLyX666F8uXCJ0dZF8B,"Lady Gaga, Bradley Cooper",Shallow,A Star is Born OST,10,10,24,4685036,2019-03-14
33,spotify:track:6Qs4SXO9dwPj5GKvVOv8Ki,"Sam Smith, Normani",Dancing With A Stranger (with Normani),PLG - Capitol,12,26,9,4616039,2019-03-14
34,spotify:track:4ZT9FnbFu1PaBfV3itxiqT,Lil Skies,I,All We Got Ent.,16,16,2,4523437,2019-03-14
35,spotify:track:285pBltuF7vW8TeWk8hdRR,Juice WRLD,Lucid Dreams,Juice WRLD Mixtape / ISR P&D,1,32,45,4369897,2019-03-14
36,spotify:track:1xzBco0xcoJEDXktl7Jxrr,Sheck Wes,Mo Bamba,Cactus Jack Records/ G.O.O.D. Music/ Interscope Records,1,29,33,4331273,2019-03-14
37,spotify:track:5icOoE6VgqFKohjWWNp0Ac,"Marshmello, CHVRCHES",Here With Me,Joytime Collective,37,-1,1,4328344,2019-03-14
38,spotify:track:2pMl9Sx4glsuk5ikZtFBtX,Lil Nas X,Old Town Road,Columbia,38,86,2,4141769,2019-03-14
39,spotify:track:6zeeWid2sgw4lap2jV61PZ,Khalid,Better,"Right Hand Music Group, LLC/RCA Records",9,33,26,4065586,2019-03-14
40,spotify:track:7COXchtUOMd6uIT6HvmRaI,"Lauv, Troye Sivan",i'm so tired...,Lauv,23,30,7,3887467,2019-03-14
41,spotify:track:7dt6x5M1jzdTEt8oCbisTK,Post Malone,Better Now,Republic Records,1,43,46,3843935,2019-03-14
42,spotify:track:4TWflhgevIGo448fWc6mQq,Offset,Red Room,Quality Control Music/Motown Records,22,34,4,3835135,2019-03-14
43,spotify:track:2G1tXoGBaEMJ7FKGnkf6ud,"Gucci Mane, Bruno Mars, Kodak Black",Wake Up in the Sky,Guwop Enterprises/Atlantic,6,38,26,3822114,2019-03-14
44,spotify:track:3ee8Jmje8o58CHK66QrVC2,XXXTENTACION,SAD!,"Bad Vibes Forever, LLC",1,44,54,3818200,2019-03-14
45,spotify:track:7FGq80cy8juXBCD2nrqdWU,"benny blanco, Halsey, Khalid",Eastside (with Halsey & Khalid),Friends Keep Secrets/Interscope Records,10,37,35,3807054,2019-03-14
46,spotify:track:2GGMabyHXnJmjY6CXhhB2e,Cardi B,Money,Atlantic/KSR,17,39,21,3760642,2019-03-14
47,spotify:track:1WSGTYKLEpKfNQYYW5Oymt,"benny blanco, Selena Gomez, J Balvin, Tainy","I Can’t Get Enough (benny blanco, Selena Gomez, J Balvin, Tainy)",NEON16/Friends Keep Secrets/Interscope Records,27,27,2,3723180,2019-03-14
48,spotify:track:5wujBwqG7INdStqGd4tRMX,Juice WRLD,Armed And Dangerous,Juice WRLD Mixtape / ISR P&D,9,35,18,3667872,2019-03-14
49,spotify:track:6phY2gnvf9WwCiXlLMQOY3,Juice WRLD,HeMotions,Grade A Productions/Interscope Records,49,-1,1,3645011,2019-03-14
50,spotify:track:14mHfNsSHN0FbLftyjrV9g,Flipp Dinero,Leave Me Alone,Cinematic/Epic/We The Best,10,47,31,3629195,2019-03-14
51,spotify:track:2BSbCCbaSCzkOEZa6N5901,Juice WRLD,Flaws And Sins,Grade A Productions/Interscope Records,51,-1,1,3604561,2019-03-14
52,spotify:track:05t7JMip6JrLuSrMV5yYjX,Calboy,Envy Me,Polo Grounds Music/RCA Records,49,49,11,3583810,2019-03-14
53,spotify:track:79OEIr4J4FHV0O3KrhaXRb,Rich The Kid,Splashin,Interscope Records,30,51,13,3532458,2019-03-14
54,spotify:track:6ZRuF2n1CQxyxxAAWsKJOy,"Kehlani, Ty Dolla $ign",Nights Like This (feat. Ty Dolla $ign),TSNMI / Atlantic,21,41,9,3507007,2019-03-14
55,spotify:track:2Jh3UqxnHJMyzMzku4uOtE,Juice WRLD,Feeling,Grade A Productions/Interscope Records,55,-1,1,3490507,2019-03-14
56,spotify:track:0JP9xo3adEtGSdUEISiszL,XXXTENTACION,Moonlight,"Bad Vibes Forever, LLC",3,50,52,3351366,2019-03-14
57,spotify:track:5kfNriitmkNE8mUbZ7gbq8,Khalid,Saturday Nights,"Right Hand Music Group, LLC/RCA Records",14,52,20,3307555,2019-03-14
58,spotify:track:1NJcg626wLln4pGHpiV7mf,"Billie Eilish, Khalid",lovely (with Khalid),Darkroom,24,55,47,3232572,2019-03-14
59,spotify:track:4SPu0Ql902hTVXkBoNIYtq,Ariana Grande,NASA,Republic Records,3,36,5,3231419,2019-03-14
60,spotify:track:14JzyD6FlBD5z0wV5P07YI,Billie Eilish,when the party's over,Darkroom/Interscope Records,12,57,22,3152492,2019-03-14
61,spotify:track:4zxpssj8DyrfZcEUSUiNxG,"Juice WRLD, Rvssian, Clever",Ring Ring (with Rvssian feat. Clever),Grade A Productions/Interscope Records,61,-1,1,3146488,2019-03-14
62,spotify:track:1fewSx2d5KIZ04wsooEBOz,"Metro Boomin, Gunna",Space Cadet (feat. Gunna),Republic Records,20,60,19,3140132,2019-03-14
63,spotify:track:1TEL6MlSSVLSdhOSddidlJ,Ariana Grande,needy,Republic Records,4,40,5,3084449,2019-03-14
64,spotify:track:1rqqCSm0Qe4I9rUvWncaom,Panic! At The Disco,High Hopes,DCD2 / Fueled By Ramen,13,61,39,3012036,2019-03-14
65,spotify:track:06LFFPPS7MylCZXps3cO4m,Juice WRLD,Who Shot Cupid?,Grade A Productions/Interscope Records,65,-1,1,2984810,2019-03-14
66,spotify:track:577YBGuskWkVDCxZrLRB4v,Lil Baby,Pure Cocaine,Quality Control Music/Motown Records/Capitol Records,52,67,15,2920387,2019-03-14
67,spotify:track:0e7ipj03S05BNilyu5bRzt,"Post Malone, 21 Savage",rockstar (feat. 21 Savage),Republic Records,1,66,78,2903855,2019-03-14
68,spotify:track:0i0wnv9UoFdZ5MfuFGQzMy,Bebe Rexha,Last Hurrah,Warner Records,63,63,4,2901037,2019-03-14
69,spotify:track:5w9c2J52mkdntKOmRLeM2m,"Daddy Yankee, Snow",Con Calma,Craft Latino,58,74,5,2886639,2019-03-14
70,spotify:track:4rWC4tiO4NCwRHdh6vyu6b,Juice WRLD,Big,Grade A Productions/Interscope Records,70,-1,1,2880798,2019-03-14
71,spotify:track:0jAfdqv18goRTUxm3ilRjb,"A Boogie Wit da Hoodie, Tyga, Offset",Startender (feat. Offset and Tyga),Highbridge the Label / Atlantic Records,17,69,13,2873945,2019-03-14
72,spotify:track:2qxmye6gAegTMjLKEBoR3d,Alec Benjamin,Let Me Down Slowly,2018,49,64,9,2871904,2019-03-14
73,spotify:track:7tFiyTwD0nx5a1eklYtX2J,Queen,Bohemian Rhapsody - Remastered 2011,EMI,42,62,20,2866350,2019-03-14
74,spotify:track:1ThmUihH9dF8EV08ku5AXN,Ski Mask The Slump God,Faucet Failure,Republic Records,68,70,14,2833531,2019-03-14
75,spotify:track:116H0KvKr2Zl4RPuVBruDO,"Bad Bunny, Drake",MIA,Rimas Entertainment LLC,2,71,22,2825249,2019-03-14
76,spotify:track:7m9OqQk4RVRkw9JJdeAw96,XXXTENTACION,Jocelyn Flores,Bad Vibes Forever / EMPIRE,3,68,81,2822066,2019-03-14
77,spotify:track:7pMRoGLEJuFM2wl5pt0R99,"Offset, Travis Scott, 21 Savage",Legacy (feat. Travis Scott & 21 Savage),Quality Control Music/Motown Records,19,45,3,2817628,2019-03-14
78,spotify:track:0TlLq3lA83rQOYtrqBqSct,Drake,Nonstop,Cash Money/Drake LP6,1,77,37,2771045,2019-03-14
79,spotify:track:5IaHrVsrferBYDm0bDyABy,"Tyga, Offset",Taste (feat. Offset),Last Kings Music / EMPIRE,4,76,43,2767469,2019-03-14
80,spotify:track:14SaZBTjxlorHJQxXh01Hu,"Summer Walker, Drake",Girls Need Love (with Drake) - Remix,LVRN/Interscope Records,54,54,2,2735128,2019-03-14
81,spotify:track:4VXIryQMWpIdGgYR4TrjT1,Juice WRLD,All Girls Are The Same,Juice WRLD Mixtape / ISR P&D,13,78,47,2709067,2019-03-14
82,spotify:track:25sgk305KZfyuqVBQIahim,Ava Max,Sweet but Psycho,Atlantic Records,36,72,23,2702908,2019-03-14
83,spotify:track:58q2HKrzhC3ozto2nDdN4z,"Cardi B, Bad Bunny, J Balvin",I Like It,Atlantic/KSR,3,79,49,2670929,2019-03-14
84,spotify:track:11cDEev79fPKi6uJCjUhu8,"The Chainsmokers, 5 Seconds of Summer",Who Do You Love,Disruptor Records/Columbia,33,65,5,2639314,2019-03-14
85,spotify:track:3EPXxR3ImUwfayaurPi3cm,Dean Lewis,Be Alright,Universal Music Australia Pty. Ltd.,31,82,33,2594407,2019-03-14
86,spotify:track:6UTmrvq4nRmx1iQ6iMd1FD,Hozier,Almost (Sweet Music),Universal-Island Records Ltd.,81,81,4,2588841,2019-03-14
87,spotify:track:39LmTF9RgyakzSYX8txrow,Ariana Grande,imagine,Republic Records,7,59,13,2584228,2019-03-14
88,spotify:track:6vN77lE9LK6HP2DewaN6HZ,"Lil Baby, Drake",Yes Indeed,"Quality Control Music, LLC",2,85,44,2566411,2019-03-14
89,spotify:track:75ZvA4QfFiZvzhj2xkaWAh,Post Malone,I Fall Apart,Universal Records,2,83,78,2561112,2019-03-14
90,spotify:track:7sO5G9EABYOXQKNPNiE9NR,"Offset, Metro Boomin",Ric Flair Drip (with Metro Boomin),"Slaughter Gang, LLC/Epic/Quality Control Music/Motown/Capitol/Boominati Worldwide/Republic",4,88,72,2557978,2019-03-14
91,spotify:track:2hloaUoRonYssMuqLCBLTX,Ariana Grande,bloodline,Republic Records,6,56,5,2556428,2019-03-14
92,spotify:track:7EQpvVujgytLVY8vKiDHAg,Ariana Grande,bad idea,Republic Records,5,53,5,2554197,2019-03-14
93,spotify:track:3swc6WTsr7rl9DqQKQA55C,"Post Malone, Ty Dolla $ign",Psycho (feat. Ty Dolla $ign),Republic Records,2,89,55,2546578,2019-03-14
94,spotify:track:2MShy1GSSgbmGUxADNIao5,Kodak Black,Calling My Spirit,Atlantic Records,31,75,15,2539065,2019-03-14
95,spotify:track:6JQvHMSaR8flFsN53ypOfP,Lil Mosey,Noticed,Mogul Vision/Interscope Records,20,84,30,2517028,2019-03-14
96,spotify:track:4dOmgE4ULbySxpeGObN8RL,Juice WRLD,Syphilis,Grade A Productions/Interscope Records,96,-1,1,2509281,2019-03-14
97,spotify:track:40T5GIqQ1CegGm2PTEl8Bu,Billie Eilish,idontwannabeyouanymore,Darkroom,48,90,35,2485750,2019-03-14
98,spotify:track:1JkrD47SDpAbyvqKtolcea,"Blueface, Cardi B, YG",Thotiana (Remix),Fifth Amendment Entertainment/eOne Music,87,87,3,2429111,2019-03-14
99,spotify:track:5ZOEulH7fvK4ZkMLTOyKL0,"Juice WRLD, Brent Faiyaz",Demonz (feat. Brent Faiyaz) - Interlude,Grade A Productions/Interscope Records,99,-1,1,2415214,2019-03-14
100,spotify:track:3npzogdOEiVsieXmmhBepL,Maren Morris,The Bones,Columbia Nashville,100,-1,1,2395394,2019-03-14
101,spotify:track:2iUXsYOEPhVqEBwsqP70rE,5 Seconds of Summer,Youngblood,Capitol,17,96,48,2374734,2019-03-14
102,spotify:track:7AQim7LbvFVZJE3O8TYgf2,"XXXTENTACION, Trippie Redd",Fuck Love,Bad Vibes Forever / EMPIRE,8,93,81,2365565,2019-03-14
103,spotify:track:572BChNcXOIvtfn2TGmTKc,"Juice WRLD, Young Thug",ON GOD (feat. Young Thug),Grade A Productions/Interscope Records,103,-1,1,2364233,2019-03-14
104,spotify:track:4w8niZpiMy6qz1mntFA5uM,"DJ Snake, Selena Gomez, Ozuna, Cardi B","Taki Taki (with Selena Gomez, Ozuna & Cardi B)","DJ Snake Music Productions Limited, under exclusive license to Geffen Records",7,92,24,2355937,2019-03-14
105,spotify:track:0baYVkFX4vIXXmIuHRWXDN,Juice WRLD,Out My Way,Grade A Productions/Interscope Records,105,-1,1,2308340,2019-03-14
106,spotify:track:5WHTFyqSii0lmT9R21abT8,Mabel,Don't Call Me Up,Polydor Records,76,97,5,2301966,2019-03-14
107,spotify:track:5W83ErFkO3aKAIS1WMi6u0,"Anuel AA, KAROL G",Secreto,Anuel AA & Karol G - Secreto,92,100,8,2295490,2019-03-14
108,spotify:track:15LOSQ3z91ZB2wMiMhiCjZ,Juice WRLD,Desire,Grade A Productions/Interscope Records,108,-1,1,2259085,2019-03-14
109,spotify:track:3wFLWP0FcIqHK1wb1CPthQ,Ariana Grande,fake smile,Republic Records,8,73,5,2236822,2019-03-14
110,spotify:track:74lnM5V6ecvoTPV0fvptx9,"Ski Mask The Slump God, Juice WRLD",Nuketown (feat. Juice WRLD),Republic Records,18,95,15,2230813,2019-03-14
111,spotify:track:1KVczjazCcCCgM3gXXUl47,"benny blanco, Juice WRLD, Brendon Urie",Roses (with Juice WRLD feat. Brendon Urie),Friends Keep Secrets/Interscope Records,46,99,14,2217376,2019-03-14
112,spotify:track:5JEx7HbmvHQQswJCsoo9rA,"Ellie Goulding, Diplo, Swae Lee",Close To Me (with Diplo) (feat. Swae Lee),Polydor Records,33,113,20,2211348,2019-03-14
113,spotify:track:6DCZcSspjsKoFjzjrWoCdn,Drake,God's Plan,Cash Money/Drake LP6,1,106,60,2206705,2019-03-14
114,spotify:track:5274I4mUMnYczyeXkGDWZN,"Future, Juice WRLD",Fine China,Epic/Freebandz/Grade A/Interscope,6,110,22,2188982,2019-03-14
115,spotify:track:2P91MQbaiQOfbiz9VqhqKQ,Lauv,I Like Me Better,Lauv,30,116,92,2187161,2019-03-14
116,spotify:track:4qKcDkK6siZ7Jp1Jb4m0aL,"BlocBoy JB, Drake",Look Alive (feat. Drake),Bloc Nation,3,104,57,2180754,2019-03-14
117,spotify:track:6LkawpJyy0TZJ6Z41gMVyy,Juice WRLD,The Bees Knees,Grade A Productions/Interscope Records,117,-1,1,2174715,2019-03-14
118,spotify:track:5T8EDUDqKcs6OSOwEsfqG7,Queen,Don't Stop Me Now - Remastered 2011,EMI,102,102,15,2157333,2019-03-14
119,spotify:track:7AFASza1mXqntmGtbxXprO,XXXTENTACION,changes,"Bad Vibes Forever, LLC",7,111,54,2154898,2019-03-14
120,spotify:track:3oDkdAySo1VQQG0ptV7uwa,Juice WRLD,Lean Wit Me,Juice WRLD Mixtape / ISR P&D,28,114,42,2148901,2019-03-14
121,spotify:track:4OBZT9EnhYIV17t4pGw7ig,"Daniel Caesar, H.E.R.",Best Part (feat. H.E.R.),MBK Entertainment/RCA Records,68,105,41,2145438,2019-03-14
122,spotify:track:51NFxnQvaosfDDutk0tams,Billie Eilish,bellyache,Darkroom,49,119,19,2144101,2019-03-14
123,spotify:track:7GX5flRQZVHRAGd6B4TmDO,Lil Uzi Vert,XO Tour Llif3,Generation Now/Atlantic,2,120,103,2142157,2019-03-14
124,spotify:track:0AluA5RNsa4Cx6XRhf2hWZ,"Metro Boomin, 21 Savage",10 Freaky Girls (with 21 Savage),Republic Records,11,109,19,2137339,2019-03-14
125,spotify:track:25F6MWrnFBCXVnpN4n76EK,Logic,Keanu Reeves,Def Jam Recordings,13,98,8,2136771,2019-03-14
126,spotify:track:2uIX8YMNjGMD7441kqyyNU,Billie Eilish,ocean eyes,Darkroom,78,121,38,2133595,2019-03-14
127,spotify:track:6Z4rmc0uujCpl8yXe3yjgI,"2 Chainz, Travis Scott",Whip (feat. Travis Scott),"Gamebread, LLC / Def Jam Recordings",46,46,2,2131864,2019-03-14
128,spotify:track:0rKtyWc8bvkriBthvHKY8d,Joji,SLOW DANCING IN THE DARK,88rising Music,29,122,25,2131083,2019-03-14
129,spotify:track:7uH27oIt4a6cIFCA8ZPcyG,Ozuna,Baila Baila Baila,Aura Music Corp.,112,117,6,2129227,2019-03-14
130,spotify:track:67fNrBUMc7iWMofdCaoJV9,Blueface,Bleed It,Cash Money Records Inc.,85,107,8,2118119,2019-03-14
131,spotify:track:4eIT2gZ0WZyJpgfmoD6saJ,City Girls,Act Up,Quality Control Music/Motown Records,131,185,2,2104494,2019-03-14
132,spotify:track:3a1lNhkSLSkpJE4MSHpDu9,"Post Malone, Quavo",Congratulations,Universal Records,5,123,116,2082119,2019-03-14
133,spotify:track:4Z9cAwlkruSbWblPBthygg,Juice WRLD,10 Feet,Grade A Productions/Interscope Records,133,-1,1,2064266,2019-03-14
134,spotify:track:2rxQMGVafnNaRaXlRMWPde,Luke Combs,Beautiful Crazy,River House Artists/Columbia Nashville,109,128,37,2063174,2019-03-14
135,spotify:track:4e4fqjx0Izh4svvTef1z7e,"Bebe Rexha, Florida Georgia Line",Meant to Be (feat. Florida Georgia Line),Warner Records,16,133,79,2027166,2019-03-14
136,spotify:track:7lAK3oHbfEnvUQWosrMMpR,Travis Scott,YOSEMITE,Cactus Jack / Epic,7,115,32,2003067,2019-03-14
137,spotify:track:4NBTZtAt1F13VvlSKe6KTl,"The Chainsmokers, Kelsea Ballerini",This Feeling,Disruptor Records/Columbia,25,127,24,1993675,2019-03-14
138,spotify:track:4mGdjNMo0RonTlOEb7cYg4,"YUNGBLUD, Halsey, Travis Barker",11 Minutes (with Halsey feat. Travis Barker),Locomotion Recordings/Geffen Records,46,101,4,1992996,2019-03-14
139,spotify:track:6gBFPUFcJLzWGx4lenP6h2,Travis Scott,goosebumps,Cactus Jack / Epic,16,132,116,1962035,2019-03-14
140,spotify:track:42fw0rxRO2xbesF6mJfd4Y,Dan + Shay,Tequila,Warner Records,60,135,52,1954977,2019-03-14
141,spotify:track:5Z3GHaZ6ec9bsiI5BenrbY,Khalid,Young Dumb & Broke,"Right Hand Music Group, LLC/RCA Records",6,142,100,1951141,2019-03-14
142,spotify:track:4XiGKQqbmnMVxDzUj6j3f2,YK Osiris,Worth It,Def Jam Recordings,142,175,2,1946164,2019-03-14
143,spotify:track:0hCHNYL8ApQCGNwJrYN1FY,"Lil Skies, Gucci Mane",Bad Girls (feat. Gucci Mane),All We Got Ent.,48,48,2,1945803,2019-03-14
144,spotify:track:4lD7gHKF1e8Y9stQuVezZB,Ariana Grande,ghostin,Republic Records,9,91,5,1943959,2019-03-14
145,spotify:track:62vpWI1CHwFy7tMIcSStl8,J. Cole,No Role Modelz,Roc Nation Records LLC,65,130,91,1940603,2019-03-14
146,spotify:track:6PfI6EeLNiNGVAVg11nv7D,Gunna,Speed It Up,300 Entertainment,55,125,4,1937580,2019-03-14
147,spotify:track:4VUwkH455At9kENOfzTqmF,"Bazzi, Camila Cabello",Beautiful (feat. Camila Cabello),iamcosmic,30,129,32,1930987,2019-03-14
148,spotify:track:04MLEeAMuV9IlHEsD8vF6A,"French Montana, Drake",No Stylist (feat. Drake),Epic,21,126,25,1919823,2019-03-14
149,spotify:track:4QIyEq7TcTdAcxjI2AFlAK,"6ix9ine, Nicki Minaj, Murda Beatz",FEFE (feat. Nicki Minaj & Murda Beatz),"ScumGang Records / TenThousand Projects, LLC",2,148,34,1907252,2019-03-14
150,spotify:track:2qT1uLXPVPzGgFOx4jtEuo,Ariana Grande,no tears left to cry,Republic Records,9,136,47,1875139,2019-03-14
151,spotify:track:3GJ4hzg4lrGwU51Y3VARbF,Dan + Shay,Speechless,Warner Records,85,149,32,1872655,2019-03-14
152,spotify:track:7pdF27mSDuPWhppnHAmWHa,XXXTENTACION,whoa (mind in awe),Bad Vibes Forever / EMPIRE,2,134,14,1866824,2019-03-14
153,spotify:track:6GSkLS2y4ZnnZsuRAj975K,"Marshmello, Roddy Ricch",Project Dreams,Joytime Collective,82,153,11,1865879,2019-03-14
154,spotify:track:22An65gG31JLf9n18qjdhZ,XXXTENTACION,BAD!,Bad Vibes Forever / EMPIRE,2,138,18,1865331,2019-03-14
155,spotify:track:6rz0dTA0PdhXImFV5EjM0w,"Juice WRLD, Seezyn",Hide (feat. Seezyn),Universal Records,100,144,13,1849702,2019-03-14
156,spotify:track:7KXjTSCq5nL1LoYtL7XAwS,Kendrick Lamar,HUMBLE.,Aftermath,1,151,101,1845499,2019-03-14
157,spotify:track:7fa9MBXhVfQ8P8Df9OEbD8,"Maroon 5, Cardi B",Girls Like You (feat. Cardi B) - Cardi B Version,Interscope Records*,8,140,41,1833316,2019-03-14
158,spotify:track:152lZdxL1OR0ZMW6KquMif,Khalid,Location,"Right Hand Music Group, LLC/RCA Records",9,160,113,1832323,2019-03-14
159,spotify:track:6Gy7rXB6Ku5vIWC7WGWsl3,"6ix9ine, Tory Lanez",KIKA (feat. Tory Lanez),"ScumGang Records / TenThousand Projects, LLC",9,147,16,1823958,2019-03-14
160,spotify:track:2G7V7zsVDxg1yRsu7Ew9RJ,Drake,In My Feelings,Cash Money/Drake LP6,1,154,37,1810937,2019-03-14
161,spotify:track:51w9Jbat1pLeWINGCpnQUR,"Tory Lanez, Rich The Kid, Lil Wayne",TAlk tO Me (with Rich The Kid feat. Lil Wayne) - Remix,Mad Love/Interscope Records,123,173,9,1808118,2019-03-14
162,spotify:track:5iwz1NiezX7WWjnCgY5TH4,"Pedro Capó, Farruko",Calma - Remix,Sony Music Latin,114,158,11,1794437,2019-03-14
163,spotify:track:3GVkPk8mqxz0itaAriG1L7,XXXTENTACION,Everybody Dies In Their Nightmares,Bad Vibes Forever / EMPIRE,15,150,81,1792567,2019-03-14
164,spotify:track:0ZNrc4kNeQYD9koZ3KvCsy,"YG, 2 Chainz, Big Sean, Nicki Minaj","BIG BANK (feat. 2 Chainz, Big Sean, Nicki Minaj)",Def Jam Recordings,24,163,42,1787910,2019-03-14
165,spotify:track:3CA9pLiwRIGtUBiMjbZmRw,Drake,Nice For What,Cash Money/Drake LP6,1,161,49,1786181,2019-03-14
166,spotify:track:4T652DlATVHe0jdLKaN3Bw,Ariana Grande,in my head,Republic Records,14,108,5,1771273,2019-03-14
167,spotify:track:3WRIaWsws011vHMd9uzPjG,"Future, Travis Scott",First Off (feat. Travis Scott),Epic/Freebandz,17,174,8,1761769,2019-03-14
168,spotify:track:3usM520kfIRpWNaYOwdnYI,Juice WRLD,Rider,Grade A Productions/Interscope Records,168,-1,1,1761257,2019-03-14
169,spotify:track:4jvjzW7Hm0yK4LvvE0Paz9,"Lil Peep, XXXTENTACION",Falling Down - Bonus Track,Columbia,1,155,26,1757567,2019-03-14
170,spotify:track:5vdp5UmvTsnMEMESIF2Ym7,Queen,Another One Bites The Dust - Remastered 2011,EMI,107,146,8,1754609,2019-03-14
171,spotify:track:7uzmGiiJyRfuViKKK3lVmR,Bazzi,Mine,iamcosmic,4,165,61,1749445,2019-03-14
172,spotify:track:79esEXlqqmq0GPz0xQSZTV,Shawn Mendes,Lost In Japan,Island Records,22,166,17,1745732,2019-03-14
173,spotify:track:09IStsImFySgyp0pIQdqAc,"Zedd, Maren Morris, Grey",The Middle,UMGRI Interscope,7,180,57,1729814,2019-03-14
174,spotify:track:1iPBD72u3nAyFEeardYuBV,Lil Mosey,Kamikaze,Mogul Vision/Interscope Records,76,168,20,1724008,2019-03-14
175,spotify:track:4yoQbSPoj8H3O8M3EKvC74,Juice WRLD,Won’t Let Go,Grade A Productions/Interscope Records,175,-1,1,1722433,2019-03-14
176,spotify:track:1ZAyjvIk9YiD76yYy0TEG6,Rich The Kid,Plug Walk,Rich The Kid / (TDE/ISR PS),7,182,57,1721519,2019-03-14
177,spotify:track:7DHApOHsIFo7EyfieArYGE,P!nk,Walk Me Home,RCA Records Label,130,188,3,1719179,2019-03-14
178,spotify:track:1a7WZZZH7LzyvorhpOJFTe,"Juice WRLD, Lil Uzi Vert",Wasted (feat. Lil Uzi Vert),Juice WRLD Mixtape / ISR P&D,20,177,35,1716134,2019-03-14
179,spotify:track:7oJrVhiTPZGBXWPwhxjy9S,Lil Skies,Lust,All We Got Ent.,79,172,59,1700857,2019-03-14
180,spotify:track:32lItqlMi4LBhb4k0BaSaC,Post Malone,Candy Paint,Republic Records,4,183,94,1698121,2019-03-14
181,spotify:track:5aXgz1oKK8Q9z9xvTmSnrO,Trippie Redd,Topanga,"TenThousand Projects, LLC",11,169,21,1692284,2019-03-14
182,spotify:track:45Egmo7icyopuzJN0oMEdk,"Khalid, Normani",Love Lies,RCA Records Label,9,170,56,1683503,2019-03-14
183,spotify:track:2qGfZAgDe1pV2y5xJAhi6R,YoungBoy Never Broke Again,Slime Belief,"Never Broke Again, LLC",181,184,4,1679913,2019-03-14
184,spotify:track:6wWaVoUOzLQJHd3bWAUpdZ,"Lil Baby, Gunna, Drake","Never Recover (Lil Baby & Gunna, Drake)","Quality Control Music/Young Stoner Life Records, a 300 Entertainment Label/Motown Records/Capitol Records",3,162,23,1678876,2019-03-14
185,spotify:track:5SHhPFh68OhUmuRPymKX9d,FLETCHER,Undrunk,Capitol Records,185,-1,1,1671658,2019-03-14
186,spotify:track:2LskIZrCeLxRvCiGP8gxlh,"XXXTENTACION, Lil Pump, Swae Lee, Maluma",Arms Around You (feat. Maluma & Swae Lee),Warner Records,6,164,20,1665913,2019-03-14
187,spotify:track:60SdxE8apGAxMiRrpbmLY0,"Eminem, Joyner Lucas",Lucky You (feat. Joyner Lucas),Eminem Catalog PS,1,186,28,1649953,2019-03-14
188,spotify:track:2FUNBaa5DwItJtYEBgAblU,21 Savage,monster,"Slaughter Gang, LLC/Epic Records",16,176,12,1629565,2019-03-14
189,spotify:track:3L19besdNQzd342qL78xqm,"A Boogie Wit da Hoodie, Juice WRLD",Demons and Angels (feat. Juice WRLD),Highbridge the Label / Atlantic Records,54,167,12,1622015,2019-03-14
190,spotify:track:5nzhL67GpF9szXWg5y509A,Lil Baby,Close Friends (Lil Baby & Gunna),"Quality Control Music/Young Stoner Life Records, a 300 Entertainment Label/Motown Records/Capitol Records",39,189,21,1621932,2019-03-14
191,spotify:track:6CTWathupIiDs7U4InHnDA,Ella Mai,Trip,10 Summers / Interscope PS,39,198,28,1612644,2019-03-14
192,spotify:track:5uCax9HTNlzGybIStD3vDh,James Arthur,Say You Won't Let Go,Columbia,15,195,90,1581201,2019-03-14
193,spotify:track:2u7mxWSeoqTXndK5e08jMp,"Lil Skies, Landon Cube",Nowadays (feat. Landon Cube),All We Got Ent.,30,178,61,1579939,2019-03-14
194,spotify:track:21kOVEG3bDCVphKhXL8XmQ,Comethazine,Walk,Alamo,114,187,18,1576897,2019-03-14
195,spotify:track:1zB4vmk8tFRmM9UULNzbLB,Imagine Dragons,Thunder,Kid Ina Korner / Interscope,21,-1,92,1571543,2019-03-14
196,spotify:track:6eYxmK9fdL4hwLnXG2zY3s,XXXTENTACION,Look At Me!,Bad Vibes Forever / EMPIRE,26,196,93,1571253,2019-03-14
197,spotify:track:1R6VwZ8TuHRzxZUxe88n4I,"2 Chainz, Ariana Grande",Rule The World (feat. Ariana Grande),"Gamebread, LLC / Def Jam Recordings",58,58,2,1565303,2019-03-14
198,spotify:track:2v5JTeM6hSmi5wWy7jiwrI,"Lil Peep, ILOVEMAKONNEN, Fall Out Boy",I've Been Waiting (w/ ILoveMakonnen & Fall Out Boy),Columbia,119,-1,4,1554714,2019-03-14
