rank,uri,artist_names,track_name,source,peak_rank,previous_rank,weeks_on_chart,streams,End Date
189,spotify:track:3XqM8hLCEYlbnFjoWwqtFv,Chris Brown,Angel Numbers / Ten Toes,Chris Brown Entertainment/RCA Records,15,160,86,96836,2025-07-03
190,spotify:track:4J1H4EuucGhhYfcPpYCBRr,"DJ Stokie, Zee_nhle, Omit ST, Sobzeen",Awukhuzeki,Universal Music (Pty) Ltd.,1,-1,82,96741,2025-07-03
191,spotify:track:3T7oE9TuoP5Bi3sYeNtMUI,"Sannere, Trymore, Puleng Phoofolo",Amasosha,The Whole Time Entertainment,97,159,12,96557,2025-07-03
192,spotify:track:0FIDCNYYjNvPVimz5icugS,"The Weeknd, Playboi Carti",Timeless (feat Playboi Carti),XO / Republic Records,15,172,40,96108,2025-07-03
193,spotify:track:0MhOlrfkPfjnmavuqzMp0p,Inkabi Nation,Seloku,Nkabi Records,110,110,3,95751,2025-07-03
194,spotify:track:4LtV1TEpsGkrVTCB4DsG4B,"Sfarzo Rtee, Jinger Stone",Be My Somebody (feat. Jinger Stone),Sfarzo Rtee Music (pty) LTD,104,145,8,95484,2025-07-03
195,spotify:track:4wGW5SJX9hOi6vnc3vLjOp,"Da Mabusa, SoulQue, Sabza Womqulo",Indlela,Major Role Music,78,132,5,95384,2025-07-03
196,spotify:track:1DaZXeHYfJhqPlpWJaWAcI,"MENZI MUSIC, Ntencane",Wayeziphuzela,MENZI MUSIC PRODUCTION,136,-1,7,94942,2025-07-03
197,spotify:track:5fZJQrFKWQLb7FpJXZ1g7K,Shaboozey,A Bar Song (Tipsy),American Dogwood / EMPIRE,7,154,64,94597,2025-07-03
198,spotify:track:7u70HF9iJZnjTOJKewmuez,LIMIT NALA,Kulate Kulate,LIMIT NALA MUSIC,119,-1,13,94501,2025-07-03
199,spotify:track:2pqIaYg12ziqIpVtdVESGt,"Kelvin Momo, Babalwa M, Nia Pearl, Stixx","Amalobolo (feat. Stixx, Nia Pearl)",Kelvin Momo Productions,6,186,82,94261,2025-07-03
200,spotify:track:280F6i6HJwJNPkWQbRVhXu,"Kabza De Small, Spirit Of Praise, Ayanda Ntanzi, DJ Maphorisa, Stakev","Nasempini (feat. Ayanda Ntanzi, DJ Maphorisa & Stakev)",Piano Hub,130,-1,3,93875,2025-07-03
