rank,uri,artist_names,track_name,source,peak_rank,previous_rank,weeks_on_chart,streams,End Date
1,spotify:track:5yyYL1FpimADTIftYQU0cg,"Dlala Thukzin, Zaba, Sykes",iPlan,Dlala Records (PTY) Ltd,1,1,10,598150,2023-11-23
2,spotify:track:6Kijtp0DB6VwcoJIw7PJ9W,"Kabza De Small, Mthunzi, DJ Maphorisa, Young Stunna, Sizwe Alakine, Umthakathi Kush","Imithandazo (feat. Young Stunna, DJ Maphorisa, Sizwe Alakine & Umthakathi Kush)",Piano Hub,2,3,4,477049,2023-11-23
3,spotify:track:1eOOCRtXcPwK8qG8VjtczJ,"Harrycane, Master KG, Eemoh, DJ Latimmy",Dubula (feat. DJ Latimmy) - Remake,Wanitwa Mos Entertainment,3,6,3,461887,2023-11-23
4,spotify:track:5C9h6ZyskUiyAVDmhSfSdP,"Mellow & Sleazy, SjavasDaDeejay, TitoM, Tman Xpress",Imnandi lento (feat. Tman Xpress),Sound African Recordings,1,2,14,406758,2023-11-23
5,spotify:track:7JbLSEDlRdoJaXk5ddZae2,"Mthandeni SK, Lwah Ndlunkulu",Paris,Mthandeni Music Production,4,4,15,400369,2023-11-23
6,spotify:track:3pImmSzeKex5ffzsDoaL3z,"Bassie, Aymos, T-Man SA",Izenzo,Djs Production Pty Ltd,5,7,13,392499,2023-11-23
7,spotify:track:1ng4byy7mejezJ08hs4P7R,"Sam Deep, Njelic, Aymos",Isgubhu,Universal Music (Pty) Ltd.,6,8,12,343960,2023-11-23
8,spotify:track:4URabg9AGHasjFEVdTbWcC,"Kamo Mphela, Tyler ICU, Khalil Harrison, Baby S.O.N",Dalie (feat. Baby S.O.N),KAMO MPHELA ENTERTAINMENT,3,5,5,334275,2023-11-23
9,spotify:track:0UBK6HcgmmWUQzFQTncmDz,"Wanitwa Mos, Nkosazana Daughter, Master KG, Dalom Kids",Keneilwe (feat. Dalom Kids),Wanitwa Mos Entertainment,9,-1,1,295164,2023-11-23
10,spotify:track:4J1H4EuucGhhYfcPpYCBRr,"DJ Stokie, Omit ST, Sobzeen, Zee_nhle",Awukhuzeki,Universal Music (Pty) Ltd.,1,10,23,285469,2023-11-23
11,spotify:track:4xhsWYTOGcal8zt0J161CU,Jack Harlow,Lovin On Me,Generation Now/Atlantic,11,11,2,285434,2023-11-23
12,spotify:track:5aIVCx5tnk0ntmdiinnYvw,Tyla,Water,FAX Records/Epic,4,9,12,267641,2023-11-23
13,spotify:track:4tsVMjM60RNTe9EV5oQ4sQ,"DJ Stokie, Eemoh",Masithokoze,Universal Music (Pty) Ltd.,13,16,5,261367,2023-11-23
14,spotify:track:7Gc7tNSocAypLct0MYYzmk,"Felo Le Tee, LeeMcKrazy, Keynote",Yini Ngathi (Insane),New Money Gang Records,10,14,6,248785,2023-11-23
15,spotify:track:6NC6bUY7tAIgr5xvzzZnBR,"DJ Tshegu, Focalistic, Sims Noreng",Tiya Mfana (Mzokwana) [feat. Sims Noreng],18 Area Holdings,11,13,4,229118,2023-11-23
16,spotify:track:5tpft20jhQvRlG3O7XfwWy,"Tyler ICU, Tumelo_za, DJ Maphorisa, Nandipha808, Ceeka RSA, Tyrondee","Mnike (feat. DJ Maphorisa, Nandipha808, Ceeka RSA & Tyron Dee)",New Money Gang Records,1,12,30,219405,2023-11-23
17,spotify:track:7aqfrAY2p9BUSiupwk3svU,"Drake, J. Cole",First Person Shooter (feat. J. Cole),OVO/Republic,3,28,7,210977,2023-11-23
18,spotify:track:3XqM8hLCEYlbnFjoWwqtFv,Chris Brown,Angel Numbers / Ten Toes,Chris Brown Entertainment/RCA Records,15,15,2,198670,2023-11-23
19,spotify:track:2V2K1hzCtgj9xAnga9WUTy,"DJ Kent, Thakzin, Brenden Praise, Mo-T, MÖRDA","Horns In The Sun (feat. Mo-T, Brenden Praise & Mörda) [Thakzin Remix]",Spinnin' Deep,19,20,9,197915,2023-11-23
20,spotify:track:5l4S6LVL1AQfZC01pypXl6,"Megadrumz, Lady Du",Tjina,Open Mic Productions,9,18,10,186702,2023-11-23
21,spotify:track:5R9zmvswQj0SRJ1XM0yTzU,Killorbeezbeatz,Ngilele E Hotel,Killorbeez Records,6,19,12,186308,2023-11-23
22,spotify:track:5PyDJG7SQRgWXefgexqIge,Doja Cat,Agora Hills,Kemosabe Records/RCA Records,21,22,9,178904,2023-11-23
23,spotify:track:5Se32hEA9raeboZerywxka,Drake,You Broke My Heart,OVO/Republic,23,-1,1,177116,2023-11-23
24,spotify:track:5Jf3hmkf8WKKqxM4vM8rux,Lwah Ndlunkulu,Eyami,Nkabi Records,15,21,16,174606,2023-11-23
25,spotify:track:4i2Dz0USzHqcOTrP0y79V9,"Oscar Mbo, KG Smallz, Mörda, Thakzin, & Mhaw Keys, Dearson","Yes God (feat. Dearson) - Mörda, Thakzin, Mhaw Keys Remix",The Ashmed Hour Records,17,24,16,168433,2023-11-23
26,spotify:track:09zHC0CNGuWQ1ot7WhzwKJ,"Fezeka Dlamini, Nomfundo Moh, Naledi",Uyangijabulisa,Sginci Media,12,27,14,165034,2023-11-23
27,spotify:track:0XSYoJ0MJpMB2tddyRcBEC,"De Mthuda, Da Muziqal Chef, Eemoh",Sgudi Snyc,Universal Music (Pty) Ltd.,2,25,27,159215,2023-11-23
28,spotify:track:2ut4BOQSqxLpcX5MtPjzYa,"Drake, J. Cole",Evil Ways (feat. J. Cole),OVO/Republic,28,-1,1,158292,2023-11-23
29,spotify:track:1NQCinyxiglxekxXVPEhnC,"Uncle Waffles, Ice Beats Slide, Sbuda Maleather",Peacock Revisit (feat. Ice Beats Slide & Sbuda Maleather),Encore Recordings,3,23,15,155181,2023-11-23
30,spotify:track:2YSzYUF3jWqb9YP9VXmpjE,"Drake, Yeat",IDGAF (feat. Yeat),OVO/Republic,5,38,7,148027,2023-11-23
31,spotify:track:4XQNZPkMyo1LxR3NYbVegt,"Maverick Muji, Nonny",Ngimtholile,Muji Records,31,32,6,138616,2023-11-23
32,spotify:track:3rUGC1vUpkDG9CZFHMur1t,Tate McRae,greedy,RCA Records Label,32,33,10,136195,2023-11-23
33,spotify:track:44G2gUVQvNNZ6w3i05tR4n,"Chris Brown, Davido, Lojay",Sensational (feat. Davido & Lojay),Chris Brown Entertainment/RCA Records,26,26,5,133883,2023-11-23
34,spotify:track:62XkMHE1XHcBy2ULz26hXt,Chris Brown,Shooter,Chris Brown Entertainment/RCA Records,17,17,2,132521,2023-11-23
35,spotify:track:1CrwpdodnkXcjPSrg8kw9g,"Mas Musiq, Daliwonga, DJ Maphorisa, Kabza De Small",Gangnam Style (feat. DJ Maphorisa & Kabza De Small),New Money Gang Records,2,37,33,131884,2023-11-23
36,spotify:track:06QKSv9bjUYLEUdRpuaGeQ,"Nandipha808, Ceeka RSA, LeeMcKrazy, Philharmonic","Banike (feat. Philharmonic, LeeMcKrazy)",Stena Academy,36,46,4,129925,2023-11-23
37,spotify:track:480PlMmJsQaL821M8xBNxj,"Pushkin RSA, AMAQHAWE, Philharmonic","ZULU (feat. AMAQHAWE, Philharmonic)",Vatic Space,26,35,6,129198,2023-11-23
38,spotify:track:4iZ4pt7kvcaH6Yo8UoZ4s2,SZA,Snooze,Top Dawg Entertainment/RCA Records,12,29,50,128863,2023-11-23
39,spotify:track:2Mph2Rvl5kVg0MYtfV60wZ,Drake,The Shoe Fits,OVO/Republic,39,-1,1,128261,2023-11-23
40,spotify:track:5Mc8XDfGQCMkOEZm9rS1cE,Drake,Red Button,OVO/Republic,40,-1,1,126498,2023-11-23
41,spotify:track:6lrKA1DMAihPI490Oj0twC,"MaWhoo, Deep Sen, KingTalkzin, Mthunzi","Ngilimele (feat. Deep Sen, KingTalkzin, Mthunzi)",MaWhoo Entertainment,34,40,10,124672,2023-11-23
42,spotify:track:2Oe52Ggx8lxxI55azZbr5h,"Kabza De Small, Mthunzi, MaWhoo",Amazwe (feat. Mawhoo),Piano Hub,42,48,4,123922,2023-11-23
43,spotify:track:7ko9EAsZ2N1ZpEBlMUkR3J,"Kabza De Small, DJ Maphorisa, Njelic, Young Stunna, Nkosazana Daughter, Xolani Guitar","Nana Thula (feat. Njelic, Young Stunna, Nkosazana Daughter & Xolani Guitar)",Piano Hub,6,31,27,122828,2023-11-23
44,spotify:track:4nFrcGM7MY1mpoQCC7Kefj,Tems,Me & U,RCA Records/Since 93',42,42,7,122116,2023-11-23
45,spotify:track:0JXXNGljqupsJaZsgSbMZV,Miguel,Sure Thing,Jive,13,39,151,121844,2023-11-23
46,spotify:track:56y1jOTK0XSvJzVv9vHQBK,Doja Cat,Paint The Town Red,Kemosabe Records/RCA Records,10,30,16,121481,2023-11-23
47,spotify:track:3eP13S8D5m2cweMEg3ZDed,Drake,Virginia Beach,OVO/Republic,4,87,7,119692,2023-11-23
48,spotify:track:0ZB5pdrM1leH58IgokDPZM,Drake,Stories About My Brother,OVO/Republic,48,-1,1,119153,2023-11-23
49,spotify:track:1djewwWkOaJGFtPaQc2MU6,"Sam Deep, Eemoh, Da Muziqal Chef",iMpumelelo,Universal Music (Pty) Ltd.,8,50,37,118531,2023-11-23
50,spotify:track:5O677N09WkpiDFluKb1fXh,"Jimmy Maradona, QuayR Musiq, Mellow & Sleazy, Ch'cco, LeeMcKrazy",Wena Wa Pallwa (feat. Ch'cco & LeeMcKrazy),Sound African Recordings,8,34,19,117578,2023-11-23
51,spotify:track:2FDTHlrBguDzQkp7PVj16Q,"Dave, Central Cee",Sprinter,Neighbourhood / Live Yours,4,41,25,114816,2023-11-23
52,spotify:track:4rXLjWdF2ZZpXCVTfWcshS,Gunna,fukumean,300 Entertainment,5,43,23,112061,2023-11-23
53,spotify:track:0lSR2SUKY0N8ft5MYIzyVa,"Harrycane, Master KG, DJ Latimmy",Dubula,Wanitwa Mos Entertainment,19,36,16,109078,2023-11-23
54,spotify:track:5mjYQaktjmjcMKcUIcqz4s,Kenya Grace,Strangers,Warner Records/Major Recordings,29,44,12,107777,2023-11-23
55,spotify:track:5Yx3xbh3ob1TzcSkTZRYjT,"Tebza De DJ, DJ Nomza The King",Ka Valungu,Music Band Production / EMPIRE,5,45,18,105187,2023-11-23
56,spotify:track:3Pv1NcASIE987vF8t1VWVu,Lwah Ndlunkulu,Ngiyeza,Nkabi Records,8,49,44,105112,2023-11-23
57,spotify:track:6bFD28m0wxDX6CpzTKKCnT,"Dj Jaivane, LeeMcKrazy, Skandisoul",Ulala Kanjani (feat. LeeMckrazy & Skandisoul),Ziiki Media,17,47,18,104665,2023-11-23
58,spotify:track:0JtoyusgiISK10cXzX79uH,"Sizwe Nineteen, R-Bee, De’vine 07, Drumonade, Tumi Sdomane",Habibi (Quantum Sound),Sizwe Nineteen,9,51,15,103802,2023-11-23
59,spotify:track:1udwFobQ1JoOdWPQrp2b6u,"JID, 21 Savage, Baby Tate",Surround Sound (feat. 21 Savage & Baby Tate),Dreamville/Interscope,55,55,3,102743,2023-11-23
60,spotify:track:5L8SXJHxQBLCt4i6ohuPee,"Deejaykgosi, Baby Momo, Lington, Phemelo Saxer, Zee_nhle, iam.psalm","Ngizwile (feat. Lington, Zee_nhle, iam.psalm, Phemelo Saxer)",Wanitwa Mos Entertainment,23,56,18,102564,2023-11-23
61,spotify:track:68Dni7IE4VyPkTOH9mRWHr,J. Cole,No Role Modelz,Roc Nation Records LLC,39,53,162,100046,2023-11-23
62,spotify:track:4PkzeTYPMBXdjhEW6RsbPt,"Mr Thela, Njelic",Kwandonga Ziyaduma,Tronics Land,62,-1,1,99827,2023-11-23
63,spotify:track:4ASBfwBwwo7DTT2zq9YSLP,Drake,Wick Man,OVO/Republic,63,-1,1,99553,2023-11-23
64,spotify:track:4iuNZTcvT9diFySSzVsnVS,Fantasia,When I See U,J Records,39,52,185,98416,2023-11-23
65,spotify:track:3BraTCQg9APnWRC7HQZyOJ,"Wanitwa Mos, Nkosazana Daughter, Master KG, Casswell P",Makhelwane (feat. Casswell P),Wanitwa Mos Entertainment,65,-1,1,98323,2023-11-23
66,spotify:track:2jm0UrP5A9ccJ3twMI8cVq,Myles Smith,Solo,RCA Records Label,66,-1,1,98298,2023-11-23
67,spotify:track:0AYt6NMyyLd0rLuvr0UkMH,"Drake, SZA",Slime You Out (feat. SZA),OVO/Republic,4,80,10,93609,2023-11-23
68,spotify:track:4pxH1dqKimocSU5kaA4GYp,"De Mthuda, Da Muziqal Chef, Kwiish SA, Eemoh",iThuba,Universal Music (Pty) Ltd.,38,62,21,91472,2023-11-23
69,spotify:track:2DTnuVhrGnLcmgutAW4vb1,"Lwah Ndlunkulu, Siya Ntuli",Ithuba,Nkabi Records,33,58,66,90220,2023-11-23
70,spotify:track:3xKsf9qdS1CyvXSMEid6g8,Frank Ocean,Pink + White,Boys Don't Cry,64,64,53,90173,2023-11-23
71,spotify:track:4EI8VuxUuIHKfafU72emqz,Mariah Carey,We Belong Together,Def Jam Recordings,51,57,90,89347,2023-11-23
72,spotify:track:6wf7Yu7cxBSPrRlWeSeK0Q,Billie Eilish,"What Was I Made For? [From The Motion Picture ""Barbie""]",Darkroom/Interscope Records,17,54,19,87843,2023-11-23
73,spotify:track:4CljUDO1I5hpKjwSNK6RWY,"Tyla, Travis Scott",Water - Remix,FAX Records/Epic,73,-1,1,87179,2023-11-23
74,spotify:track:5B3JWkzaEumPyWXGyDcuGQ,"Lindough, DJ Active, Freddie Gwala, Kingshort",Ok'salayo,Lindough,66,73,7,86373,2023-11-23
75,spotify:track:1BxfuPKGuaTgP7aM0Bbdwr,Taylor Swift,Cruel Summer,Taylor Swift,26,65,24,86212,2023-11-23
76,spotify:track:3vkCueOmm7xQDoJ17W1Pm3,Mitski,My Love Mine All Mine,Dead Oceans,76,77,7,84276,2023-11-23
77,spotify:track:1xs8bOvm3IzEYmcLJVOc34,Ayra Starr,Rush,Mavin Records,7,75,60,84187,2023-11-23
78,spotify:track:5IgjP7X4th6nMNDh4akUHb,Chris Brown,Under The Influence,Chris Brown Entertainment/RCA Records,2,68,88,83735,2023-11-23
79,spotify:track:0u2P5u6lvoDfwTYjAADbn4,"Billie Eilish, Khalid",lovely (with Khalid),Darkroom,22,59,291,83471,2023-11-23
80,spotify:track:7wcjeveluiW5djtxLCxNSx,"Spirit Of Praise, Mpumi Mtsweni",Thath'Indawo (Live),Spirit Music,23,67,39,83307,2023-11-23
81,spotify:track:0JNVN7NMFTTTs7TZ9zHL1r,"Nomcebo Zikode, Exclusive Drumz",iNkanyezi (feat. Exclusive Drumz),Emazulwini Productions,81,82,2,82601,2023-11-23
82,spotify:track:1y5eHXBYiLgNv00KoHXm4o,"Soa Mattrix, Mashudu, Happy Jazzman, Emotionz DJ",Mina Nawe,Soa Music Group,1,74,58,82587,2023-11-23
83,spotify:track:43PuMrRfbyyuz4QpZ3oAwN,Bryson Tiller,Exchange,TrapSoul/RCA Records,58,61,94,82485,2023-11-23
84,spotify:track:5hJFhO9dvhJoDvUZZ9iWSw,Miguel,Adorn,ByStorm Entertainment/RCA Records,59,63,62,82127,2023-11-23
85,spotify:track:1s7oOCT8vauUh01PbJD6ps,"Rema, Selena Gomez",Calm Down,Mavin Records/Jonzing World,7,76,65,81979,2023-11-23
86,spotify:track:3pXF1nA74528Edde4of9CC,Bryson Tiller,Don't,TrapSoul/RCA Records,55,66,99,81782,2023-11-23
87,spotify:track:7GaFYUqP2WdR4KTPk7cXoP,Mario,Let Me Love You,J Records,64,72,259,81505,2023-11-23
88,spotify:track:59nOXPmaKlBfGMDeOVGrIK,"Future, Drake, Tems",WAIT FOR U (feat. Drake & Tems),Epic/Freebandz,1,69,82,81488,2023-11-23
89,spotify:track:5U6zQqXCVZokE7UH4kdAB1,"MÖRDA, Oscar Mbo, Murumba Pitch",Mohigan Sun,Asante Music,36,94,41,80577,2023-11-23
90,spotify:track:1bmZLmDu9jkzwHInzPsYLD,"Inkabi Zezwe, Sjava, Big Zulu",Umbayimbayi,Warner Music Africa,1,71,35,79260,2023-11-23
91,spotify:track:1odExI7RdWc4BT515LTAwj,David Kushner,Daylight,"Miserable Music Group, LLC",18,81,32,79116,2023-11-23
92,spotify:track:6fAQNPY3jkRAKs75NqvdLS,"Kabza De Small, Mthunzi, Young Stunna",Impumelelo (feat. Young Stunna),Piano Hub,66,79,4,78741,2023-11-23
93,spotify:track:7662sEny6elrNILSP7OzQB,"Soa Mattrix, Sir Trill, B33Kay SA, Cnethemba Gonelo, Frank Mabeat, Tribal Soul",Athandwe,Soa Music Group,29,96,12,78680,2023-11-23
94,spotify:track:4k5FlWz3dfhyQzmRpVPZsW,"Lady Amar, JL SA, Cici, Murumba Pitch",Hamba Juba,Lea Records,1,70,40,77947,2023-11-23
95,spotify:track:5jPckUbvd78IYYd1bEJSwJ,"Khuthuza, MAFIKIZOLO",NGIJOLA NEBHINCA,5932550 Records DK,95,141,3,76794,2023-11-23
96,spotify:track:5fEB6ZmVkg63GZg9qO86jh,PARTYNEXTDOOR,Break from Toronto,OVO Sound,88,111,48,76384,2023-11-23
97,spotify:track:6T7FXSuXykeGktMLGp8WgE,"Lil Durk, J. Cole",All My Life (feat. J. Cole),Alamo,2,86,28,76260,2023-11-23
98,spotify:track:26b3oVLrRUaaybJulow9kz,Libianca,People,5K Records Limited,5,93,49,76144,2023-11-23
99,spotify:track:7qEHsqek33rTcFNT9PFqLf,Lewis Capaldi,Someone You Loved,Vertigo Berlin,7,88,254,75027,2023-11-23
100,spotify:track:4W6MsZnV6zeqtaNeDvrgLD,"DJ Maphorisa, Tman Xpress, Mellow & Sleazy, Madumane, Uncool MC","Imali iKhona (feat. Mellow & Sleazy, Madumane & Uncool MC)",New Money Gang Records,71,95,9,74287,2023-11-23
101,spotify:track:1rtMuIY76v879DN8kW1fhf,"Kelvin Momo, Babalwa M, Sfarzo Rtee",Sukakude (feat. Sfarzo Rtee),Kelvin Momo Productions,7,103,50,74256,2023-11-23
102,spotify:track:3cM44rvXAA35FwNYj1mKmH,"INNOVATIVE DJz, Wade Yarrow",Makukhanye,famifellaz Entertainment Group,97,106,9,73614,2023-11-23
103,spotify:track:0HD8mbiPjp3o94X3EaZp0o,Tate McRae,exes,RCA Records Label,103,-1,1,73278,2023-11-23
104,spotify:track:3zSm2FYUjpc9egsTA0bJ16,Die Piesangskille,Inge 2,Universal Music (Pty) Ltd.,55,92,14,72889,2023-11-23
105,spotify:track:4uUG5RXrOk84mYEfFvj3cK,"David Guetta, Bebe Rexha",I'm Good (Blue),Parlophone UK,8,102,65,72826,2023-11-23
106,spotify:track:4RoKNqyZ9622tcAeNPNv5k,Burna Boy,City Boys,Spaceship Entertainment Ltd.,64,107,12,72821,2023-11-23
107,spotify:track:3eRE1KwnUma75nu1HhoNY4,Tevin Campbell,Can We Talk,Rhino/Warner Records,103,110,45,71784,2023-11-23
108,spotify:track:3hRV0jL3vUpRrcy398teAU,Lord Huron,The Night We Met,Play It Again Sam,86,108,31,71398,2023-11-23
109,spotify:track:3HCs7v1ac2ReqcUlTs7YVm,"Mellow & Sleazy, Tman Xpress, Keynote",Kwelinye (feat. Keynote),Sound African Recordings,12,104,38,71294,2023-11-23
110,spotify:track:65UliXqF4kM3qJbt0YsYvL,"Mr JazziQ, Pcee, Justin99, Ma'Ten, Jandas","Hamba naye (feat. Pcee, Justin99, MaTen & Jandas)",Sound African Recordings,54,78,5,71108,2023-11-23
111,spotify:track:5YbPxJwPfrj7uswNwoF1pJ,Burna Boy,Last Last,Spaceship Entertainment Ltd.,1,105,80,70670,2023-11-23
112,spotify:track:4GuiGH1qje9eYA4trD0hti,"Mthandeni SK, Sminofu",Mubi kamnandi,Mthandeni Music Production,112,146,3,70655,2023-11-23
113,spotify:track:1Qrg8KqiBpW07V7PNxwwwL,SZA,Kill Bill,Top Dawg Entertainment/RCA Records,5,114,50,70653,2023-11-23
114,spotify:track:5c6ZeX7Kh4Uu1NDbd7HOnm,"Kabza De Small, Mthunzi",Isibusiso,Piano Hub,60,85,5,70357,2023-11-23
115,spotify:track:1yeB8MUNeLo9Ek1UEpsyz6,"Drake, Sexyy Red, SZA",Rich Baby Daddy (feat. Sexyy Red & SZA),OVO/Republic,34,186,7,70078,2023-11-23
116,spotify:track:2nibvvDdAQkVraYP00z2RS,"Drake, 21 Savage",Calling For You (feat. 21 Savage),OVO/Republic,8,-1,4,69901,2023-11-23
117,spotify:track:3js04Z5R4L1ZvtLPopSG8l,"Myztro, Daliwonga, Xduppy, ShaunMusiq & Ftears",Kunkra (feat. Xduppy & ShaunMusiq & Ftears),New Money Gang Records,4,117,23,69760,2023-11-23
118,spotify:track:6wsqVwoiVH2kde4k4KKAFU,Travis Scott,I KNOW ?,Cactus Jack/Epic,11,118,17,69714,2023-11-23
119,spotify:track:46zJrgparMvp3N5j4iHODt,"Tebza De DJ, Tanaka",Trust the Process,Tebza De DJ / EMPIRE,71,91,7,69675,2023-11-23
120,spotify:track:4Dvkj6JhhA12EX05fT7y2e,Harry Styles,As It Was,Columbia,1,115,86,69352,2023-11-23
121,spotify:track:3CbmyeFC71dnrv4DjlEohj,"Tskay, Omaan, Ocean Biller, Bepa, Double D, Jazzy Avenue","Bhebha 2.0 (feat. Bepa, Double D, Jazzy Avenue)",Open Mic Productions,51,119,5,69224,2023-11-23
122,spotify:track:3PdO57q0KLWkfWXsXQJlV6,"Mas Musiq, Aymos, Young Stunna",Sengizwile (feat. Aymos & Young Stunna),New Money Gang Records,3,123,81,69186,2023-11-23
123,spotify:track:0w3Mfe4PIVjuFjJbe3OlYv,Drake,8am in Charlotte,OVO/Republic,13,-1,6,68923,2023-11-23
124,spotify:track:05A1KzxTLvShctiD0Bsydd,"Inkabi Zezwe, Sjava, Big Zulu",Sayona,Warner Music Africa,51,99,27,68920,2023-11-23
125,spotify:track:5hrEIx4k6mAMErcsMwKQwQ,"Nkosazana Daughter, Master KG, Lowsheen, Murumba Pitch",Amaphutha (feat. Murumba Pitch),Nkosazana Daughter,49,-1,8,68341,2023-11-23
126,spotify:track:14SaZBTjxlorHJQxXh01Hu,"Summer Walker, Drake",Girls Need Love (with Drake) - Remix,LVRN/Interscope Records,43,101,189,67516,2023-11-23
127,spotify:track:0Mrnt1YqVuW2bqmwu4VxDt,"Drake, Teezo Touchdown",Amen (feat. Teezo Touchdown),OVO/Republic,9,-1,4,67442,2023-11-23
128,spotify:track:3F5CgOj3wFlRv51JsHbxhe,"Drake, 21 Savage",Jimmy Cooks (feat. 21 Savage),OVO,1,124,75,67362,2023-11-23
129,spotify:track:0Yx0dpXq9K6vIkRWxPvKWI,"Dr Dope, Pro Tee, Qveen-rsa, Mzwilili, Kitso Nave",Hamba Wena,3174598 Records DK,40,136,21,67321,2023-11-23
130,spotify:track:1QI3YsyMxfD2j3xoJDHvTi,"Dlala Thukzin, Sykes, Zaba",Imoto,Dlala Records (PTY) Ltd,59,160,10,67194,2023-11-23
131,spotify:track:2HbKqm4o0w5wEeEFXm2sD4,"Kendrick Lamar, Jay Rock",Money Trees,Aftermath,49,116,83,66693,2023-11-23
132,spotify:track:33PDDaCzc8AM8J5EKjO7v2,"Young Stunna, Kabza De Small, Deeper Phil, Mfundo Da DJ",uNonkosi (feat. Deeper Phil & Mfundo Da DJ),Piano Hub,13,129,14,66028,2023-11-23
133,spotify:track:3c6afiysmB7OnxQzzSqRfD,Tamia,So Into You,Rhino/Warner Records,119,133,25,65850,2023-11-23
134,spotify:track:2J6OF7CkpdQGSfm1wdclqn,Brent Faiyaz,Clouded,Lost Kids,63,127,45,65690,2023-11-23
135,spotify:track:1zHdh2Muk7jyPYXc8h1zPs,"Big Zulu, Mduduzi Ncube, Siya Ntuli, Lwah Ndlunkulu, Xowla",Voicemail,Nkabi Records,11,109,59,65651,2023-11-23
136,spotify:track:66PVdnWWemyJbvScVS6vJ0,"Ciara, Chris Brown",How We Roll,"Beauty Marks Entertainment, Inc.",37,84,16,65262,2023-11-23
137,spotify:track:5UqFcsRHW5It2HD3f2yoJD,Riaan Benadé,Boksemdais,Warner Music Africa,113,125,6,65178,2023-11-23
138,spotify:track:1SB1UdyYs3DMyzHVxZg0QE,"ShaunMusiq & Ftears, Xduppy, Myztro, Mellow & Sleazy, QuayR Musiq, Matute Boy","Bhebha (feat. Myztro, Mellow & Sleazy, QuayR Musiq & Matuteboy)",Sound African Recordings,3,97,37,65169,2023-11-23
139,spotify:track:7jtQIBanIiJOMS6RyCx6jZ,Tom Odell,Another Love,ITNO/Columbia,45,126,88,65067,2023-11-23
140,spotify:track:4fYte8ZvTK14NEhAOZocBi,OneRepublic,I Ain't Worried,Interscope Records,11,148,76,64412,2023-11-23
141,spotify:track:58u8z6ia8GTm9yZlkmtCtV,"Aymos, Ami Faku",Fatela,Lyf Styl Entertainment,3,153,53,64368,2023-11-23
142,spotify:track:1zi7xx7UVEFkmKfv06H8x0,"Drake, Wizkid, Kyla",One Dance,Cash Money Records/Young Money Ent./Universal Rec.,78,144,132,64076,2023-11-23
143,spotify:track:2LBqCSwhJGcFQeTHMVGwy3,The Weeknd,Die For You,Universal Republic Records,35,132,80,63817,2023-11-23
144,spotify:track:2eAvDnpXP5W0cVtiI0PUxV,Ruth B.,Dandelions,Columbia,56,131,96,63705,2023-11-23
145,spotify:track:2mzM4Y0Rnx2BDZqRnhQ5Q6,Tems,Free Mind,Leading Vibe Ltd,68,134,84,63481,2023-11-23
146,spotify:track:1RMJOxR6GRPsBHL8qeC2ux,"Daniel Caesar, H.E.R.",Best Part (feat. H.E.R.),Golden Child Recordings,83,120,217,63447,2023-11-23
147,spotify:track:7DSAEUvxU8FajXtRloy8M0,Miley Cyrus,Flowers,Columbia,1,149,45,63336,2023-11-23
148,spotify:track:7rZbFj5T5GzbIrVMrkw5AU,Chris Brown,Press Me,Chris Brown Entertainment/RCA Records,60,60,2,63306,2023-11-23
149,spotify:track:4tqcoej1zPvwePZCzuAjJd,J. Cole,Wet Dreamz,Roc Nation Records LLC,91,145,86,63046,2023-11-23
150,spotify:track:0z2QglVOqge7D0Mo7Pqvow,"Musical Jazz, Soul Revolver, Kgocee, Tumelo_za",Gojasi,Musical Jazz Entertainment,27,121,17,62669,2023-11-23
151,spotify:track:2e3Ea0o24lReQFR4FA7yXH,J. Cole,Love Yourz,Roc Nation Records LLC,93,130,41,62423,2023-11-23
152,spotify:track:2uIX8YMNjGMD7441kqyyNU,Billie Eilish,ocean eyes,Darkroom,92,137,86,62216,2023-11-23
153,spotify:track:60Z2UUVW3R0oeWCLi4Y3aK,"Shebeshxt, Naqua SA, Buddy Sax, Bayor 97, Zoli White Smoke, Smeazy",Ambulance,The Royal Media House Group,153,-1,1,62161,2023-11-23
154,spotify:track:2qxgejJTaZIHNSHDD22Uhl,"Kabza De Small, DJ Maphorisa, Ami Faku",Abalele,Piano Hub,1,175,111,62052,2023-11-23
155,spotify:track:6n3HGiq4v35D6eFOSwqYuo,Drake,Teenage Fever,Cash Money Records/Young Money Ent./Universal Rec.,70,139,88,61959,2023-11-23
156,spotify:track:7CyPwkp0oE8Ro9Dd5CUDjW,"The Weeknd, JENNIE, Lily-Rose Depp","One Of The Girls (with JENNIE, Lily Rose Depp)",XO / Republic Records,156,171,2,61930,2023-11-23
157,spotify:track:741UUVE2kuITl0c6zuqqbO,"Nicki Minaj, Ice Spice, Aqua",Barbie World (with Aqua) [From Barbie The Album],Atlantic Records,9,135,22,61788,2023-11-23
158,spotify:track:7MXVkk9YMctZqd1Srtv4MB,"The Weeknd, Daft Punk",Starboy,Universal Republic Records,80,152,84,61292,2023-11-23
159,spotify:track:2xyx0o4xNOLLjBSbOOdcbA,"Summer Walker, Bryson Tiller",Playing Games (with Bryson Tiller) - Extended Version,LVRN/Interscope Records,37,112,81,61289,2023-11-23
160,spotify:track:1KDT0dCJbLdJGFb47430tk,"Kabza De Small, Mthunzi, MaWhoo",Bonga (feat. Mawhoo),Piano Hub,140,157,4,61210,2023-11-23
161,spotify:track:4g1GEUBY0wt7iQrPHhhB5S,"Nandipha808, Ceeka RSA, Djy Fresh, Dot Mega, Mellow & Sleazy","Ivale Mfana (feat. Djy Fresh, Dot Mega, Mellow & Sleazy)",Stena Academy,150,150,4,61201,2023-11-23
162,spotify:track:2dHHgzDwk4BJdRwy9uXhTO,"Metro Boomin, The Weeknd, 21 Savage",Creepin' (with The Weeknd & 21 Savage),Republic Records,2,142,51,60318,2023-11-23
163,spotify:track:7zFXmv6vqI4qOt4yGf3jYZ,"Daniel Caesar, Kali Uchis",Get You (feat. Kali Uchis),Golden Child Recordings,119,154,46,60134,2023-11-23
164,spotify:track:0mflMxspEfB0VbI1kyLiAv,Noah Kahan,Stick Season,Mercury Records/Republic Records,164,194,2,60039,2023-11-23
165,spotify:track:35I3Q5Ue33pO2g1amfyTbO,Mr Thela,Crossnight,Tronics Land,165,-1,1,59859,2023-11-23
166,spotify:track:65NAMIdsZkxYIM5ui8SJSw,"K.O, Young Stunna, Blxckie",SETE (feat. Young Stunna & Blxckie),Sound African Recordings,1,-1,63,59576,2023-11-23
167,spotify:track:0yAyBZ0S4Pnaz2cH4K1w1b,"Spirit Of Praise, Ayanda Ntanzi",Moy’ Oyingcwele (Live),Spirit Music,29,98,13,59561,2023-11-23
168,spotify:track:4KW1lqgSr8TKrvBII0Brf8,Kanye West,Father Stretch My Hands Pt. 1,Rock The World/IDJ/Kanye LP7,168,-1,2,59156,2023-11-23
169,spotify:track:6PGoSes0D9eUDeeAafB2As,"Kendrick Lamar, Zacari",LOVE. FEAT. ZACARI.,Aftermath,74,138,62,59113,2023-11-23
170,spotify:track:561jH07mF1jHuk7KlaeF0s,Eminem,Mockingbird,Aftermath,52,167,58,58913,2023-11-23
171,spotify:track:65ssk0NCbNtYDYgF86Tc65,Nathi,Imimoya,Gallo Record Company,143,143,13,58728,2023-11-23
172,spotify:track:1ULFJZX54HXXjSTMx63dk0,"Kabza De Small, Msaki",Khusela (feat. Msaki),Piano Hub,5,184,72,58703,2023-11-23
173,spotify:track:2KslE17cAJNHTsI2MI0jb2,Jung Kook,Standing Next to You,BIGHIT MUSIC,55,122,3,58188,2023-11-23
174,spotify:track:4hDjmMljGvNZuYUXw1HWw3,"Murumba Pitch, Omit ST, Dinky Kunene, Soa Mattrix, Buhle Sax",Wena Dali,Murumba Pitch,19,165,36,57843,2023-11-23
175,spotify:track:6oEVnWKgPqIEPc53OYDNqG,"H.E.R., Bryson Tiller",Could've Been (feat. Bryson Tiller),MBK Entertainment/RCA Records,77,170,63,57677,2023-11-23
176,spotify:track:2OaiWMFJMnUSFLpdsYWgup,Madlala,uHerodi,4713726 Records DK,147,-1,10,57651,2023-11-23
177,spotify:track:3JyEmaZmPsuIvFivnwN22k,Glenn Jones,All for You,Jive,123,177,36,57550,2023-11-23
178,spotify:track:0AY3sNqV7qAdAZ8j6TRVBd,"2Point1, Ntate Stunna, Nthabi Sings",Stimela,Penya Play Productions,1,196,48,57347,2023-11-23
179,spotify:track:2HRgqmZQC0MC7GeNuDIXHN,"Jung Kook, Latto",Seven (feat. Latto) (Explicit Ver.),BIGHIT MUSIC,11,172,19,57290,2023-11-23
180,spotify:track:2QjOHCTQ1Jl3zawyYOpxh6,The Neighbourhood,Sweater Weather,Columbia,57,179,137,57256,2023-11-23
181,spotify:track:2IlT65thKQQw248mhk2PjQ,Brent Faiyaz,JACKIE BROWN,"Lost Kids LLC., Marketed by Venice / Stem",52,159,39,57104,2023-11-23
182,spotify:track:4CsLsh2t5Piv2PY6tiSb0G,"Makhadzi Entertainment, Ntate Stunna, Fortunator, DJ Gun Do SA",Movie,Makhadzi Entertainment,58,158,15,57072,2023-11-23
183,spotify:track:2JvzF1RMd7lE3KmFlsyZD8,J. Cole,MIDDLE CHILD,"Dreamville, Inc., Under exclusive license to Roc Nation Records",2,168,138,57023,2023-11-23
184,spotify:track:0RiRZpuVRbi7oqRdSMwhQY,"Post Malone, Swae Lee",Sunflower - Spider-Man: Into the Spider-Verse,Republic Records,1,181,216,56979,2023-11-23
185,spotify:track:0IJJ5q4ZkmC4kJvkF1HNIe,Appel,Foute,Warner Music Africa,102,198,25,56931,2023-11-23
186,spotify:track:7yq4Qj7cqayVTp3FF9CWbm,Vance Joy,Riptide,F-Stop Records/Atlantic,135,188,42,56873,2023-11-23
187,spotify:track:5Ms6phtE3zdTYgNo5hlqzQ,Sushi.b,Shakespeare,Sushi Way,109,183,10,56627,2023-11-23
188,spotify:track:78QR3Wp35dqAhFEc2qAGjE,"Lil Baby, Gunna",Drip Too Hard (Lil Baby & Gunna),"Quality Control Music/Young Stoner Life Records, a 300 Entertainment Label/Motown Records/Capitol Records",41,166,108,56525,2023-11-23
189,spotify:track:0MtfUEHee9p6RsqAwW8gyF,Myles Smith,My Home,RCA Records Label,67,192,4,56512,2023-11-23
190,spotify:track:1Jm1I3APcmVz3MqPr5vfTx,"Fabolous, Tamia",Into You (feat. Tamia) - Main Mix,Rhino/Elektra,97,163,124,56339,2023-11-23
191,spotify:track:4SHBNhM1S8QZgsx8pCdthw,"Aymos, Jessica LM",Amandla,Lyf Styl Entertainment,103,-1,15,56312,2023-11-23
192,spotify:track:4ZT0wGKwlJRjpMUuwZVy3p,Drake,Daylight,OVO/Republic,11,-1,4,56192,2023-11-23
