rank,uri,artist_names,track_name,source,peak_rank,previous_rank,weeks_on_chart,streams,End Date
1,spotify:track:4XTgFBxBHN6var1BzAgE1m,"Maanu, Annural Khalid",Jhol,Giraffe Music,1,1,20,9203336,2025-05-01
2,spotify:track:5ThyDv6aRVU8AH4vXQNldF,"Kushagra, Bharath, Saaheal",Finding Her,EYP Creations,2,2,8,8952212,2025-05-01
3,spotify:track:4vHRQnzGcKEtqsLH70tAms,"Sachet-Parampara, Parampara Tandon, Kausar Munir","Raanjhan (From ""Do Patti"")",T-Series,1,3,28,7107532,2025-05-01
4,spotify:track:4LMlVCXHJtCE9abhmn0mYo,"Afusic, AliSoomroMusic",Pal Pal,Universal Music MENA (Pakistan),4,4,5,6265395,2025-05-01
5,spotify:track:2ZzZ2qwZBWlDKs420hhloc,"Bayaan, Hasan Raheem, Rovalio",Maand,Sony Music Entertainment,4,5,9,5218371,2025-05-01
6,spotify:track:0eCajpR75pDW0r64U6hP2x,Anuv Jain,Jo Tum Mere Ho,Universal Music India Pvt. Ltd. (on behalf of Anuv Jain),1,6,38,4771869,2025-05-01
7,spotify:track:1hlbywc8Jhl1FFqJxAMabE,"Faheem Abdullah, Rauhan Malik, Amir Ameer",Ishq,Artiste First,2,9,57,4627799,2025-05-01
8,spotify:track:5UGrftqh9U3zKQUt3vs7Ob,Shubh,Supreme,Shubh,8,116,2,4527663,2025-05-01
9,spotify:track:6nRGPf5tpeJtKpXZO5cgIT,"Aditya Rikhari, UNPLG'd",Paro,Universal Music India Pvt Ltd.,7,7,8,4384311,2025-05-01
10,spotify:track:3vCzLB6kS2lGcIpm1OOUsy,"Anurag Saikia, Raj Shekhar, Romy, Amarabha Banerjee, Varun Jain, Madhubanti Bagchi, Mismatched - Cast",Ishq Hai,Netflix Music,1,8,20,4203051,2025-05-01
11,spotify:track:2Fv2injs4qAm8mJBGaxVKU,"Arijit Singh, Mithoon","Tujhe Kitna Chahne Lage (From ""Kabir Singh"")",T-Series,2,10,309,3756121,2025-05-01
12,spotify:track:1hA697u7e1jX2XM8sWA6Uy,"Sachin-Jigar, Arijit Singh, Amitabh Bhattacharya",Apna Bana Le,Zee Music Company,1,12,97,3475561,2025-05-01
13,spotify:track:2cPUB8EOT6AfJ8oxhyoNXL,"Pritam, Javed Bashir",Ye Tune Kya Kiya,T-Series,12,13,63,3459775,2025-05-01
14,spotify:track:4Qm7r3ImER8S2Ori1gLMAf,"Anuv Jain, AP Dhillon",Afsos,"Universal Music India Pvt. Ltd. (on behalf of Anuv Jain, AP DHILLON INC/Republic Records)",6,11,13,3328829,2025-05-01
15,spotify:track:5zCnGtCl5Ac5zlFHXaZmhy,"Ram Sampath, Arijit Singh, Prashant Pandey","Sajni (From ""Laapataa Ladies"")",T-Series,1,15,52,3164637,2025-05-01
16,spotify:track:4ulroyDK6rN73nVkCkWhur,"Jasleen Royal, Stebin Ben, Vijay Deverakonda, Radhikka Madan, Priya Saraiya, Aditya Sharma",Sahiba,Warner Music India,1,14,23,3089794,2025-05-01
17,spotify:track:22ZIAjVRJTjYj5EwD0MjEJ,Masoom Sharma,2 Khatole (Lofi Mix),Tuffan Music,17,17,5,2991512,2025-05-01
18,spotify:track:4d2jV5fmX6hbRwaRbY39dt,Karan Aujla,Wavy,Karan Aujla Music,4,18,24,2991070,2025-05-01
19,spotify:track:7so0lgd0zP2Sbgs2d7a1SZ,"Lady Gaga, Bruno Mars",Die With A Smile,Interscope Records,4,19,31,2970245,2025-05-01
20,spotify:track:7eQl3Yqv35ioqUfveKHitE,"Pritam, Mohit Chauhan, Irshad Kamil",Tum Se Hi,T-Series,12,16,267,2934942,2025-05-01
21,spotify:track:3PWfXDaGLxwN9UJDHMEyKi,"Masoom Sharma, Sheenam Katholic, Kay D, Aarohi Raghav",Teri Ramjhol Bole Gi (feat. Kay D & Aarohi Raghav),Empire Media,18,21,7,2774429,2025-05-01
22,spotify:track:5J9L7IbadCt0ivs9xmNrr0,Zain Zohaib,Ranjheya Ve,Zain Zohaib,20,20,10,2768317,2025-05-01
23,spotify:track:2Ul0NiluAcBWG6BJBl40sT,"Himesh Reshammiya, Arijit Singh, Shabbir Ahmed",Tera Chehra,Sony Music / Eros Now Music,3,22,13,2718818,2025-05-01
24,spotify:track:3yHyiUDJdz02FZ6jfUbsmY,"Arijit Singh, Shreyas Puranik, Siddharth - Garima","Satranga (From ""ANIMAL"")",T-Series,2,24,79,2689841,2025-05-01
25,spotify:track:2618Fg2I7K5leCzDUhOjbr,"Ali & Shjr, Haider Ali, Ali Raza",Heer,Giraffe Music,23,25,6,2622508,2025-05-01
26,spotify:track:75OSVIdR2KPpEmViMt8MX2,"Afusic, Talwiinder, AliSoomroMusic",Pal Pal (with Talwiinder),Universal Music MENA (Pakistan),26,69,2,2607959,2025-05-01
27,spotify:track:5AnWrUzsrFgBvhn6dUElnr,"Sachin-Jigar, Amitabh Bhattacharya, Madhubanti Bagchi, Divya Kumar","Aaj Ki Raat (From ""Stree 2"")",Saregama India Ltd,1,26,40,2606248,2025-05-01
28,spotify:track:2PvaburAUlhNHxVhw5lvOq,Arijit Singh,"Humdard (From ""Ek Villain"")",T-Series,20,27,250,2594023,2025-05-01
29,spotify:track:2ceeTJAzKy295Fm0VsaXtE,"Sachin-Jigar, Raghav Chaitanya, Varun Jain, Indraneel","Tum Se (From ""Teri Baaton Mein Aisa Uljha Jiya"")",T-Series,10,23,64,2553602,2025-05-01
30,spotify:track:5pPyvA03RKSJrAnnDcq0nh,"Sachin-Jigar, Shreya Ghoshal, Tochi Raina",Saibo,Sony Music Entertainment India Pvt. Ltd.,30,42,235,2543527,2025-05-01
31,spotify:track:56zZ48jdyY2oDXHVnwg5Di,"Mithoon, Arijit Singh",Tum Hi Ho,T-Series,31,37,222,2522084,2025-05-01
32,spotify:track:2IoZMG3RqiTmsy7Li3zGFg,"Sachet Tandon, Parampara Tandon, Sachet-Parampara","Mere Sohneya (From ""Kabir Singh"")",T-Series,4,40,263,2479156,2025-05-01
33,spotify:track:5ZLkihi6DVsHwDL3B8ym1t,Shubh,One Love,SHUBH,3,36,89,2473339,2025-05-01
34,spotify:track:5a0Z7Dz4e5Z81IM0iccFVY,"Himesh Reshammiya, Ankit Tiwari, Palak Muchhal, Sameer Anjaan",Sanam Teri Kasam,Sony Music / Eros Now Music,1,28,13,2456443,2025-05-01
35,spotify:track:45PA9lW7U5LYnlpGrdTyHY,"Jasleen Royal, Ujjwal Kashyap",Sang Rahiyo,Warner Music India,21,34,60,2426385,2025-05-01
36,spotify:track:0TL0LFcwIBF5eX7arDIKxY,Anuv Jain,Husn,Universal Music India Pvt. Ltd. (on behalf of Anuv Jain),1,32,74,2421088,2025-05-01
37,spotify:track:5FXMRdJjKq1BIX4e8Eg9mK,"Vishal-Shekhar, KK",Ajab Si,T-Series,19,30,173,2418629,2025-05-01
38,spotify:track:5npFBWhVs3VVlc0nY5xQMA,"Sachin-Jigar, Arijit Singh","Tainu Khabar Nahi - From ""Munjya""",Zee Music Company,17,31,46,2393802,2025-05-01
39,spotify:track:2GXXZFUxYg2LvG8SR0byOE,"Sachin-Jigar, Atif Aslam",Jeena Jeena,Eros Now Music,29,29,190,2388536,2025-05-01
40,spotify:track:3t3wsY5IdLVzB9WidegJSU,"Atif Aslam, Shreya Ghoshal, Sachin-Jigar",Jeene Laga Hoon,Tips Industries Ltd,40,51,34,2377745,2025-05-01
41,spotify:track:6kYoY0PhBelP64UMnhsEZx,"Alka Yagnik, Arijit Singh","Agar Tum Saath Ho (From ""Tamasha"")",T-Series,4,49,309,2349700,2025-05-01
42,spotify:track:5VvkNZesG4T86mUULEG5Wp,"Sachet-Parampara, Sachet Tandon, Parampara Tandon, Kausar Munir",Maiyya,T-Series,19,33,21,2324930,2025-05-01
43,spotify:track:3yV2c3cYhkAwSsxAq6nRiv,Gajendra Verma,Mann Mera,Sony Music / Eros Now Music,26,58,211,2318438,2025-05-01
44,spotify:track:2JlzHPGIVaLNAppX1viq7f,"Santhosh Narayanan, The Indian Choral Ensemble, Vivek","Kanimaa (From ""Retro"")",T-Series,44,52,5,2289254,2025-05-01
45,spotify:track:3F3difXqjmx6tfA4JmaKAj,"Maanu, Annural Khalid, Abdullah Siddiqui",Jhol - Acoustic,Giraffe Music,45,60,10,2223239,2025-05-01
46,spotify:track:4FeczSomVWVyU4FW7xDeAI,"A.R. Rahman, Chinmayi, Murtuza Khan, Qadir Khan",Tere Bina,Sony Music Entertainment India Pvt. Ltd.,46,59,37,2212762,2025-05-01
47,spotify:track:0XRb6eZE4dBIJdqwf1Mixu,"Juss, MixSingh",Suniyan Suniyan,Mix It Up Studio,3,55,50,2210338,2025-05-01
48,spotify:track:4y2sSEDG8aP4nDyXWnmPjw,"Masoom Sharma, Swara Verma, Dev Chouhan, Pooja Saxena",Blender,GSC Music,19,41,17,2210257,2025-05-01
49,spotify:track:72zHuDxFQTjbL51qJQSA7j,"Jasleen Royal, B Praak, Romy","Ranjha (From ""Shershaah"")",Sony Music Entertainment India Pvt. Ltd.,1,65,195,2206322,2025-05-01
50,spotify:track:0YQJoDL6f46J0n1rOVkpxJ,"Karan Aujla, Ikky",Softly,WM Canada,4,45,89,2191761,2025-05-01
51,spotify:track:0hFkx6EoIRvNmEVXQIIJtk,Aditya Rikhari,Paaro,Universal Music India Pvt Ltd.,46,46,7,2175315,2025-05-01
52,spotify:track:0SAZ4IHYMtjW4Lxrjm7NnG,"Altamash Faridi, Sohail Sen, Mudassar Aziz",Aashiq Tera,Eros Now Music,35,38,8,2175010,2025-05-01
53,spotify:track:7yDHHVKLbvDmVw1XXhDDIO,"Vishal Mishra, Raj Shekhar",Pehle Bhi Main,T-Series,1,61,74,2170556,2025-05-01
54,spotify:track:02Ck2nLoW3TpgGV6uwvK5Z,"Anurag Kulkarni, Sameera Bharadwaj, Vijai Bulganin, Purnachary","Premalo (From ""Court"")",Saregama India Ltd,20,48,7,2166524,2025-05-01
55,spotify:track:0FBQ4NrrHUbR9kus7rzrOj,Atif Aslam,Dil Diyan Gallan,YRF Music,53,75,272,2165373,2025-05-01
56,spotify:track:6fScgF2Y63ScU73nYju0ny,"Atif Aslam, Arko",O Saathi,T-Series,28,35,144,2145069,2025-05-01
57,spotify:track:4tJz5wXpwIvG2KMKPbYWwz,"Santhosh Narayanan, Vivek","Kannadi Poove (From ""Retro"")",T-Series,57,78,8,2137130,2025-05-01
58,spotify:track:2nP1wLRh85mo5Wdj4RQldp,"Amit Trivedi, Madhubanti Bagchi, Amitabh Bhattacharya","Uyi Amma - From ""Azaad""",Zee Music Company,24,47,15,2137020,2025-05-01
59,spotify:track:4wIWWEhbdgKAxhR68eE0Ye,"Arijit Singh, Chinmayi","Mast Magan (From ""2 States"")",T-Series,45,91,219,2133899,2025-05-01
60,spotify:track:4MtsPGGUTIs4qFD8gOSJ3D,"Masoom Sharma, Rahul Muana, Swara Verma, Ruba Khan",Chambal K Dakku,Bajewala Records,26,44,7,2121865,2025-05-01
61,spotify:track:0gPgdRfB4jdGrlyXS0Vx78,"Vishal-Shekhar, KK, Shilpa Rao, Anvita Dutt Guptan",Khuda Jaane,YRF Music,35,71,134,2120126,2025-05-01
62,spotify:track:1dFrZr9eMUsFqeag04ClqD,Dhanda Nyoliwala,Russian Bandana,Universal Music India Pvt Ltd.,6,43,31,2115945,2025-05-01
63,spotify:track:1y1rQTkWmrZdJmjwuK07GC,"Vishal Mishra, Manoj Muntashir","Kaise Hua (From ""Kabir Singh"")",T-Series,5,93,307,2068405,2025-05-01
64,spotify:track:6bmmHeCvZI92pRiTHxEdTC,"Pritam, Arijit Singh, Irshad Kamil",O Maahi,T-Series,4,62,72,2059279,2025-05-01
65,spotify:track:4Lo6I7kkHWgAVRmdILLhig,"Arijit Singh, Afsana Khan, Tanishk Bagchi, Irshad Kamil","Tu Hain Toh Main Hoon (From ""Sky Force"")",Saregama India Ltd,7,39,14,2047013,2025-05-01
66,spotify:track:6H7fLdt0AeWpuxUKXuXWrx,Hariharan,Shree Hanuman Chalisa,T-Series,31,56,142,2040842,2025-05-01
67,spotify:track:1bxzr3JK05fMTcweGAZUHp,"Shilpa Rao, Anirudh Ravichander, Ramajogayya Sastry","Chuttamalle (From ""Devara Part 1"")",T-Series,4,67,39,2033529,2025-05-01
68,spotify:track:78BWCd70D1X6LMkDZm1UoF,Yo Yo Honey Singh,Millionaire,T-Series,3,53,35,2020711,2025-05-01
69,spotify:track:48Ix6ReYdJf2H4mKb3TIpj,"Atif Aslam, Alisha Chinai, Pritam",Tera Hone Laga Hoon,Tips Industries Ltd,30,68,207,2019991,2025-05-01
70,spotify:track:25jtUwCQfXwnxENh8Bvoj4,"Diljit Dosanjh, MixSingh, Raj Ranjodh",Water,Famous Studios,37,57,10,2005819,2025-05-01
71,spotify:track:3zSSCPpLZ5Oc8nelhhGjKz,AUR,Tu hai kahan,Sony Music Entertainment,1,64,81,2003643,2025-05-01
72,spotify:track:0GQngE2rOYvlKwEQjTAsP8,"Pritam, Sreeram, Shilpa Rao",Subhanallah,T-Series,34,63,108,1999331,2025-05-01
73,spotify:track:3WLJ7D5kh44K5eJ1NqZQ6W,Anuv Jain,Baarishein,Universal Music India Pvt. Ltd. (on behalf of Anuv Jain),16,54,207,1982818,2025-05-01
74,spotify:track:1d5lpW3gUyq537iuyrb9Lf,Aditya Rikhari,Samjho Na,CollabX Productions,23,74,106,1981988,2025-05-01
75,spotify:track:4eBvRhTJ2AcxCsbfTUjoRp,Shubh,Cheques,SHUBH,1,84,101,1980473,2025-05-01
76,spotify:track:4Tkb7zsDmsawB7S5TpKQV1,"Atif Aslam, Shiraz Uppal",Pehli Dafa,T-Series,50,50,78,1978273,2025-05-01
77,spotify:track:5Ggb9pKiKcr5vNV9v1e1vs,"Varun Jain, Shilpa Rao, Sachin-Jigar, Amitabh Bhattacharya",Tumhare Hi Rahenge Hum,Saregama India Ltd,8,89,37,1971657,2025-05-01
78,spotify:track:7eQoMQdE4JqngwYDOqLBU0,"dox, JASKARAN, Rita Kim",Superstar,5.5 Records Under Exclusive License to AWAL,70,70,3,1953394,2025-05-01
79,spotify:track:3FqtduiaqnFYvBgKuc6QWQ,"Karan Aujla, Seshnolan",Winning Speech,Karan Aujla,8,72,50,1901886,2025-05-01
80,spotify:track:0M0ANKNzmM4Odd7FNKghzW,Mitraz,"Akhiyaan Gulaab (From ""Teri Baaton Mein Aisa Uljha Jiya"")",T-Series,2,80,66,1885439,2025-05-01
81,spotify:track:1r6GbBLdtUK1Vl1IHT14wP,"Mohammad Faiz, Jaani","Dekhha Tenu (From ""Mr. And Mrs. Mahi"")",Sony Music Entertainment India Pvt. Ltd.,2,83,50,1874905,2025-05-01
82,spotify:track:3ygfdwvBJ2Y5XhJiiHFFZE,Sachet Tandon,Maiyya Mainu,Zee Music Company,5,77,130,1862688,2025-05-01
83,spotify:track:4MU4Kfkd9EnkArK2ocQyqK,"Arijit Singh, Harshdeep Kaur",Zaalima,Zee Music Company,78,90,97,1860943,2025-05-01
84,spotify:track:5JCDVLwteSXuwVqjCa7SwH,"Shankar-Ehsaan-Loy, Shreya Ghoshal, Javed Bashir, Yusuf Mohammed, Vajid Ali",O Rangrez,Sony Music Entertainment India Pvt. Ltd.,48,73,26,1854322,2025-05-01
85,spotify:track:5vGiuYFSGekGLgbxhV1rD5,"Atif Aslam, Pritam",Tu Jaane Na,Tips Industries Ltd,66,105,187,1848703,2025-05-01
86,spotify:track:4UMIv5jd9gK98a39BQRD9X,"Pritam, Arijit Singh, Amitabh Bhattacharya",Kesariya,Sony Music Entertainment India Pvt. Ltd.,1,112,146,1828621,2025-05-01
87,spotify:track:5PUXKVVVQ74C3gl5vKy9Li,"Jasleen Royal, Arijit Singh, Dulquer Salmaan",Heeriye (feat. Arijit Singh),Warner Music India,1,98,92,1826878,2025-05-01
88,spotify:track:0l6g8Z8mqGbGXFOjigYetD,"Pritam, Arijit Singh",Hawayein,Sony Music Entertainment India Pvt. Ltd.,51,111,186,1806499,2025-05-01
89,spotify:track:7aE1lfskJLMHQnzCCP1zsV,"Akhil Sachdeva, Mansheel Gujral","Humsafar (From ""Badrinath Ki Dulhania"")",T-Series,44,86,67,1804582,2025-05-01
90,spotify:track:0645eBDehHcqfiF15hscQV,"Vishal Mishra, Rashmeet Kaur","Janiye (from the Netflix Film ""Chor Nikal Ke Bhaga"")",Netflix Music,5,103,95,1803148,2025-05-01
91,spotify:track:0KSOLEBixnBYIKNHF1VbzF,"Atif Aslam, Hadiqa Kiani",Hona Tha Pyar,Tips Industries Ltd,54,66,9,1799965,2025-05-01
92,spotify:track:1PALLCSlHwAI4upY3sMg8u,"Aditya Rikhari, Tulsi Kumar, Lijo George-Dj Chetas","Jaana Samjho Na (From ""Bhool Bhulaiyaa 3"")",T-Series,9,76,26,1793615,2025-05-01
93,spotify:track:73K33p4Vyz9koXGqmL5eFs,"Sachet Tandon, Parampara Tandon, Kumaar, Sachet-Parampara",Malang Sajna,T-Series,4,152,119,1786756,2025-05-01
94,spotify:track:5zcfnScTSFGCHGY1yeXWke,"Vishal-Shekhar, Kamal Khan",Ishq Sufiyana (Male),T-Series,46,100,23,1782488,2025-05-01
95,spotify:track:3be9ACTxtcL6Zm4vJRUiPG,yung kai,blue,BMG Rights Management (US) LLC,16,92,21,1781866,2025-05-01
96,spotify:track:1mQUEvGR7Sbt2OCz2gFrdx,"Amitabh Bhattacharya, Sachin-Jigar, Pawan Singh, Simran Choudhary","Aayi Nai (From ""Stree 2"")",Saregama India Ltd,2,85,38,1779660,2025-05-01
97,spotify:track:79hQvdTHNBkq2fp2ZrM8b2,"Javed-Mohsin, Arijit Singh, Shreya Ghoshal, Kunaal Vermaa, Prashant Ingole",Pal,Sony Music Entertainment India Pvt. Ltd.,34,131,314,1751232,2025-05-01
98,spotify:track:2L5fXA2pNlTXJvQTeMZn4z,"Masoom Sharma, Swara Verma",Lofar,Shikaari Music,25,88,7,1748876,2025-05-01
99,spotify:track:1fkjRQA8wXPPyxqYLbxuqy,"Vishal-Shekhar, Sanam Puri, Shipra Goyal",Ishq Bulaava,Sony Music Entertainment India Pvt. Ltd.,94,94,5,1746616,2025-05-01
100,spotify:track:3tgdOveYac7YMEAQD9sGLf,"Vishal-Shekhar, Papon, Irshad Kamil",Bulleya,YRF Music,30,96,16,1740559,2025-05-01
101,spotify:track:4VsP4Dm8gsibRxB5I2hEkw,Kaifi Khalil,Kahani Suno 2.0,1944121 Records DK,1,109,124,1733015,2025-05-01
102,spotify:track:52itZ0w0CydihB2JCZEIft,"Pritam, Mohit Chauhan, Irshad Kamil",Pee Loon,T-Series,37,108,64,1728350,2025-05-01
103,spotify:track:6y5SuF4NxGkvwpAdqcAkD3,"Pritam, Arijit Singh, Shreya Ghoshal, Shadab Faridi, Altamash Faridi, Amitabh Bhattacharya",Ve Kamleya,Saregama India Ltd,15,118,90,1710382,2025-05-01
104,spotify:track:2iNqdCchlUZEgjJbQyZf8T,"Kailash Kher, Paresh Kamath, Naresh Kamath",Teri Deewani,Sony Music Entertainment India Pvt. Ltd.,62,95,39,1701122,2025-05-01
105,spotify:track:1o8YPl0hyGbpRcHplXNvsm,"Vishal Mishra, Sachin-Jigar, Amitabh Bhattacharya","Khoobsurat (From ""Stree 2"")",Saregama India Ltd,5,104,37,1694297,2025-05-01
106,spotify:track:4XxfOvudrnBRdlgzEaq1sd,Diljit Dosanjh,Born to Shine,FAMOUS STUDIOS INC,14,97,96,1682249,2025-05-01
107,spotify:track:2aH78X2rspZ3RibbAFXdjh,"Masoom Sharma, Pinna Music, Amar Karnawal",Mard,Masoom Sharma,81,81,4,1674237,2025-05-01
108,spotify:track:6mTvwBzWTGDOVeCNQEqtOE,"Amaal Mallik, Arijit Singh, Tulsi Kumar",Soch Na Sake,T-Series,46,113,122,1662419,2025-05-01
109,spotify:track:4bD9z9qa4qg9BhryvYWB7c,"Pritam, Tochi Raina, Rekha Bhardwaj",Kabira,T-Series,31,107,294,1661988,2025-05-01
110,spotify:track:6457ZKiycyQm6qrNcu5y15,"Komal Chaudhary, Masoom Sharma",Mere Mittar,Komal Chaudhary,55,79,6,1661058,2025-05-01
111,spotify:track:3bZPdEskcnMdepwCaDSJRl,"Vishal-Shekhar, Shafqat Amanat Ali, Sunidhi Chauhan",Bin Tere,Sony Music Entertainment India Pvt. Ltd.,109,119,12,1659655,2025-05-01
112,spotify:track:1smFN2CLqGROu0J0UyvDfL,"Pritam, Arijit Singh",Shayad,Sony Music Entertainment India Pvt. Ltd.,1,110,276,1656118,2025-05-01
113,spotify:track:1eZefeDb8uOsjvcbl1fJrG,"Diljit Dosanjh, Badshah, Raj Ranjodh","Naina (From ""Crew"")",Tips Industries Ltd,3,87,60,1642274,2025-05-01
114,spotify:track:0cUdmruT6kjxa5KpteSdwc,Bayaan,Nahin Milta,rearts records,75,82,6,1639539,2025-05-01
115,spotify:track:18YHbIhrleUkKKj2DvEp79,"Pritam, KK",Zara Sa,Sony Music Entertainment India Pvt. Ltd.,33,102,113,1633564,2025-05-01
116,spotify:track:5FDVyL6VahLO3B4T7xRYD9,"Guru Randhawa, Sanjoy, Gill Machhrai",Qatal,Warner Music India,116,-1,1,1630519,2025-05-01
117,spotify:track:67u2VDnIGjc9wYxSaUaUvt,"Jasmine Sandlas, Sachet Tandon, Jaani, White Noise Collectives, Divya Kumar, Sumonto Mukherjee","Nasha (From ""Raid 2"")",T-Series,117,-1,1,1626964,2025-05-01
118,spotify:track:5a11x5PUFvJEadMRqtNtTr,"Atif Aslam, Shreya Ghoshal, Sachin-Jigar",Piya O Re Piya,Tips Industries Ltd,114,141,14,1624571,2025-05-01
119,spotify:track:0NXnuTqFQHDsbEIoKIAVCN,"Josh Brar, Kinza Hashmi",Tere Bina Na Guzara E,Times Music – Speed Records,19,99,29,1624518,2025-05-01
120,spotify:track:5XeFesFbtLpXzIVDNQP22n,Arctic Monkeys,I Wanna Be Yours,Domino Recording Co,48,122,129,1619826,2025-05-01
121,spotify:track:25Nxyrng0Z3jC5Q0hAibpw,Karan Aujla,"Tauba Tauba (From ""Bad Newz"")",Saregama India Ltd,1,117,43,1611190,2025-05-01
122,spotify:track:76ZWOhRRQzmb4xMoZzTjJ9,"Yo Yo Honey Singh, Paradox",Payal,T-Series,14,101,23,1595207,2025-05-01
123,spotify:track:3xMHXmedL5Rvfxmiar9Ryv,"Anirudh Ravichander, Arijit Singh, Shilpa Rao, Kumaar",Chaleya,T-Series,1,174,89,1589533,2025-05-01
124,spotify:track:0MTdYgTZ25sLCO6kVnDoje,"Sai Abhyankkar, Sai Smriti","Aasa Kooda - From ""Think Indie""",Think Music,3,130,45,1580009,2025-05-01
125,spotify:track:0OdztoASgKBBNcAgtErk0X,"Abdul Hannan, Rovalio",Bikhra,2636621 Records DK,125,136,4,1561777,2025-05-01
126,spotify:track:4BTPzhEsyW3blWcxcuhLM0,"Shankar-Ehsaan-Loy, Shankar Mahadevan, Caralisa Monteiro, Shafqat Amanat Ali",Mitwa,Sony Music Entertainment India Pvt. Ltd.,81,114,37,1559487,2025-05-01
127,spotify:track:1YMLgvsQdE27r30q0fsLeV,Arijit Singh,Tera Fitoor,Tips Industries Ltd,61,120,92,1543178,2025-05-01
128,spotify:track:4OcvkkpF3xmyCGGY5IBlgi,"Akhil Sachdeva, Tulsi Kumar","Tera Ban Jaunga (From ""Kabir Singh"")",T-Series,4,128,294,1542246,2025-05-01
129,spotify:track:0rk2X5TAhraBC5aCIXK2Rq,"Jawad Ahmad, Shaarib Toshi, Arijit Singh, Shreya Ghoshal",Samjhawan,Sony Music Entertainment India Pvt. Ltd.,70,192,193,1542014,2025-05-01
130,spotify:track:6FjbAnaPRPwiP3sciEYctO,"Pritam, Arijit Singh",Raabta,T-Series,41,123,133,1537995,2025-05-01
131,spotify:track:6ygiy70ujkNOYXM1tQuMNe,"Karan Aujla, Ikky, Preston Pablo",Admirin' You (feat. Preston Pablo),WM Canada,24,132,91,1534704,2025-05-01
132,spotify:track:1UWacd8x8tPPwmrPB1MoBI,"Pritam, Arijit Singh",Ae Dil Hai Mushkil Title Track,Sony Music Entertainment India Pvt. Ltd.,79,133,274,1532745,2025-05-01
133,spotify:track:2wG1mwTiuvqll9YYLMjSaY,ATLXS,PASSO BEM SOLTO - Slowed,broke,133,138,4,1527635,2025-05-01
134,spotify:track:7Imk0IG6S5GA5iYWkjmMW5,"Palak Muchhal, Arijit Singh","Chahun Main Ya Naa (From ""Aashiqui 2"")",T-Series,103,155,81,1511930,2025-05-01
135,spotify:track:23UKXgXmLkT0XyPBeKx2gP,"Tanishk Bagchi, Gifty, Harnoor, Shreya Ghoshal","Koi Naa (From ""Bhool Chuk Maaf"")",Sony Music Entertainment India Pvt. Ltd.,135,-1,1,1510679,2025-05-01
136,spotify:track:6rFckZb1cuJYzsZiGHgqks,"Karan Aujla, Ikky",52 Bars,Rehaan Records,12,164,35,1510065,2025-05-01
137,spotify:track:29m79w9xPMH4YCD6r8JSmV,"AP Dhillon, Gurinder Gill, Intense",Excuses,RUN-UP RECORDS,1,134,184,1508283,2025-05-01
138,spotify:track:4DrDsY7ExVwT371fdjcjgA,"Cheema Y, Gur Sidhu, Jasmeen Akhtar",Police,Brown Town Music,52,129,10,1508015,2025-05-01
139,spotify:track:0tgVpDi06FyKpA1z0VMD4v,Ed Sheeran,Perfect,Atlantic Records UK,29,157,263,1501568,2025-05-01
140,spotify:track:1kDZSmw3mKQeAjcmPTLS3M,"Pritam, Arijit Singh, Shreya Ghoshal, Amitabh Bhattacharya","Tum Kya Mile, Pt. 2",Saregama India Ltd,9,139,96,1493676,2025-05-01
141,spotify:track:5thVzD79BxlDTYy0LfHzvu,"Aparshakti Khurana, Savi Kahlon",Zaroor,Sony Music Entertainment India Pvt. Ltd.,13,125,39,1481436,2025-05-01
142,spotify:track:6xHPBEvcG0RQDfyTq7jc8P,"Cheema Y, Gur Sidhu",Young G.O.A.T,Brown Town Music,72,153,10,1477472,2025-05-01
143,spotify:track:1tCduDqB3J8r90FAxprLzO,Arko,Nazm Nazm,Zee Music Company,106,149,48,1477223,2025-05-01
144,spotify:track:7qiZfU4dY1lWllzX7mPBI3,Ed Sheeran,Shape of You,Atlantic Records UK,63,171,242,1465086,2025-05-01
145,spotify:track:2C6CJGFLbisteRuY6Plb7b,"Danny, Avvy Sra, Sagar",Ve Haaniyaan,Dreamiyata Music,10,126,65,1456742,2025-05-01
146,spotify:track:2HNG9q8rXbnijbPTwCMgsb,"Atif Aslam, Roop Kumar Rathod, Mithoon, Naresh Sharma","Woh Lamhe Woh Baatein - From ""Zeher""",UME - Global Clearing House,146,167,4,1456032,2025-05-01
147,spotify:track:0fAPcsD7qrEAfO2EH0ce4V,Shubh,Aura,SHUBH,58,-1,12,1435640,2025-05-01
148,spotify:track:5GJ3WaxTSlxDY3csctX20H,"Himesh Reshammiya, Sameer Anjaan",Bewajah,Eros Now Music,12,127,12,1434601,2025-05-01
149,spotify:track:3bTnREOf1CyY4Gz5jfHUiI,"Leon James, Sid Sriram, Sanjana Kalmanje","Vazhithunaiye - From ""Dragon""",Think Music,76,143,10,1431418,2025-05-01
150,spotify:track:7MXVkk9YMctZqd1Srtv4MB,"The Weeknd, Daft Punk",Starboy,Universal Republic Records,12,162,196,1425295,2025-05-01
151,spotify:track:4Jv2S12lwUBOEve08icgj5,"Masoom Sharma, Harsh Sandhu",Gentleman 2,AVN Music Series,76,106,6,1422068,2025-05-01
152,spotify:track:1uQU9b93tlMlMoZ0h2bRgf,"Sai Abhyankkar, Vivek","Sithira Puthiri - From ""Think Indie""",Think Music,101,135,11,1420107,2025-05-01
153,spotify:track:5QWuignQQWDlbtQsjKX0Kq,"G. V. Prakash, Vivek, Dhanush, Jonita Gandhi","Yedi (From ""Nilavuku En Mel Ennadi Kobam"")",Wunderbar Films,111,147,6,1418955,2025-05-01
154,spotify:track:7KQdgW7QzNd9oPoCzjCU76,Shubh,Bandana,Shubh,8,158,57,1413921,2025-05-01
155,spotify:track:1fcCPXmH4vUzG6UQTTjZp5,"Mithoon, Arijit Singh, Shashaa Tirupati",Phir Bhi Tumko Chaahunga,Zee Music Company,117,165,36,1403815,2025-05-01
156,spotify:track:7AAap8D4C4pTyNoMkM9vjG,"Shankar-Ehsaan-Loy, Diljit Dosanjh",Ishq Di Baajiyaan,Sony Music Entertainment India Pvt. Ltd.,100,140,36,1399388,2025-05-01
157,spotify:track:0fK7ie6XwGxQTIkpFoWkd1,JENNIE,like JENNIE,OA Entertainment/Columbia,131,142,7,1395877,2025-05-01
158,spotify:track:5cgKosPPj5Cs9a2JQufUc1,"Pritam, Arijit Singh",Ilahi,T-Series,86,124,18,1393715,2025-05-01
159,spotify:track:1syH0Fc7nsprIjKwlTRBEx,"Masoom Sharma, Amar Karnawal, Pinna Music",Ek Khatola Jail Ke Bhitar,Masoom Sharma,61,115,6,1388941,2025-05-01
160,spotify:track:4OEBP1iwGmLtcM8UKRLm80,"Arijit Singh, Antara Mitra","Itni Si Baat Hain (From ""Azhar"")",T-Series,138,172,29,1383343,2025-05-01
161,spotify:track:1wnozUBSe7OMpmZiTPJC5j,"A.R. Rahman, Javed Ali, KIRTI SAGATHIA, Pooja AV","Tum Tak (From ""Raanjhanaa"")",Sony Music Entertainment India Pvt. Ltd.,113,183,28,1380042,2025-05-01
162,spotify:track:6egfWbtFFhMToV2DvmEzmo,"Bunny, Hunny, Sagar","Tu Hain Toh (From ""Mr. And Mrs. Mahi"")",Sony Music Entertainment India Pvt. Ltd.,8,156,45,1378395,2025-05-01
163,spotify:track:7CyPwkp0oE8Ro9Dd5CUDjW,"The Weeknd, JENNIE, Lily-Rose Depp","One Of The Girls (with JENNIE, Lily Rose Depp)",XO / Republic Records,98,151,69,1377097,2025-05-01
164,spotify:track:37AGZMVr5V8mEMcCmGHroZ,"Kailash Kher, Paresh Kamath, Naresh Kamath",Saiyyan,Sony Music Entertainment India Pvt. Ltd.,71,144,70,1376868,2025-05-01
165,spotify:track:2MvCNH9ua0CeOgUQfZf56z,Javed Ali,Guzarish,T-Series,109,137,29,1375716,2025-05-01
166,spotify:track:5UprhHX9Zdm0DeZzbPHbEN,"Atif Aslam, Manoj Muntashir",Tere Sang Yaara,Zee Music Company,101,145,41,1368749,2025-05-01
167,spotify:track:7G5wpuR61ABrT7R1snos7C,"Pritam, Arijit Singh",Kalank - Title Track,Zee Music Company,5,148,273,1368405,2025-05-01
168,spotify:track:3nKQrVVlwbAQSnFbgZWdN0,"Avvy Sra, Karan Aujla, Jaani",White Brown Black,Universal Music India Pvt Ltd. – Distribution,29,181,123,1358129,2025-05-01
169,spotify:track:2S6N9pbnkhQRyAx80HmF79,Mohammed Irfan,"Banjaara (From ""Ek Villain"")",T-Series,128,169,51,1357373,2025-05-01
170,spotify:track:4Qu8LlchmRCaPBKBArcNsA,"Shankar-Ehsaan-Loy, Shafqat Amanat Ali",Tere Naina,Sony Music Entertainment India Pvt. Ltd.,113,150,16,1352773,2025-05-01
171,spotify:track:2iZeKe5avjtKVmjfSFkpxd,"Pritam, Rahat Fateh Ali Khan, Tulsi Kumar, Irshad Kamil",Tum Jo Aaye,T-Series,171,-1,6,1351236,2025-05-01
172,spotify:track:2PxZSFOv7RebkeSEwQTjr7,Mustafa Zahid,Tera Mera Rishta,Vishesh Films Pvt Ltd.,152,178,8,1340885,2025-05-01
173,spotify:track:7m4CgL81VVIHaaiSxyH922,Yo Yo Honey Singh,Desi Kalakaar,T-Series,13,173,67,1337172,2025-05-01
174,spotify:track:69Qzz3yyQSsA0T95jLDoPL,"Gurnazar, Chet Singh",Dil Tu Jaan Tu,Mars Films / Jhankar Music,14,154,40,1330581,2025-05-01
175,spotify:track:32765xcLM1fd6wQIpkN9A0,"Ami Mishra, Kunaal Vermaa",Hasi - Male Version,Sony Music Entertainment India Pvt. Ltd.,77,176,96,1327524,2025-05-01
176,spotify:track:6vuMdb0E8buJeSHArN3dXk,"Amaal Mallik, Armaan Malik, Kunaal Vermaa","Chale Aana (From ""De De Pyaar De"")",T-Series,18,160,135,1326074,2025-05-01
177,spotify:track:0s76ExpXyMGVBlKLUr683e,Aditya Rikhari,Faasle,CollabX Productions,123,146,35,1320734,2025-05-01
178,spotify:track:5vUumh0QzTwWlla9hK1XJd,"Deepthi Suresh, Anirudh Ravichander, Vignesh Shivan","Paththavaikkum (From ""Devara Part 1"")",T-Series,27,170,11,1314244,2025-05-01
179,spotify:track:2tva3nN2kQhBjHMC7Zlty6,Javed Ali,Deewana Kar Raha Hai,T-Series,119,179,16,1310573,2025-05-01
180,spotify:track:3bRAgqTWL1fHb8k8X56KLu,"Swarnalatha, Pushpavanam Kuppusamy","Thottu Thottu (Form ""Ethirum Puthirum"")",Music Masters Audio Video LLP,121,121,3,1309286,2025-05-01
181,spotify:track:7AsG1F1eMWd17RYan8M3Wm,"AP Dhillon, Shinda Kahlon",Dil Nu,RUN-UP RECORDS,33,-1,68,1307732,2025-05-01
182,spotify:track:1upGq2z1JcGm2en01psP8y,"Baggh-e SMG, Farmaan SMG, BIG KAY SMG",C.R.E.A.M POSSE,SMG STUDIO'S,148,161,3,1306668,2025-05-01
183,spotify:track:0loZn1c5heXie7OAtvK6nH,"Jubin Nautiyal, Manoj Muntashir",Humnava Mere,T-Series,66,182,152,1306092,2025-05-01
