rank,uri,artist_names,track_name,source,peak_rank,previous_rank,weeks_on_chart,streams,End Date
1,spotify:track:6E7P1uT2afeor2t6wR2y2r,"B Praak, Akshay Kumar, Nupur Sanon",Filhall,Universal Music India Pvt Ltd. – Distribution,1,1,4,888353,2019-12-05
2,spotify:track:0WdbnNKO0Jt4BZACSDQh44,"Vishal-Shekhar, Arijit Singh, Shilpa Rao, Kumaar","Ghungroo (From ""War"")",YRF Music,1,3,13,853233,2019-12-05
3,spotify:track:6E9UwSfT80age2xknoMS7Y,"Payal Dev, Jubin Nautiyal, Kunaal Vermaa","Tum Hi Aana (From ""Marjaavaan"")",T-Series,2,2,10,835032,2019-12-05
4,spotify:track:2b8fOow8UzyDFAE27YhOZM,Maroon 5,Memories,Interscope Records*,2,4,11,744695,2019-12-05
6,spotify:track:2Fv2injs4qAm8mJBGaxVKU,"Arijit Singh, Mithoon","Tujhe Kitna Chahne Lage (From ""Kabir Singh"")",T-Series,2,6,27,686378,2019-12-05
7,spotify:track:57vxBYXtHMk6H1aD29V7PU,The Weeknd,Heartless,Republic Records,7,69,2,599841,2019-12-05
8,spotify:track:6v3KW9xbzN5yKLt9YKDYA2,"Shawn Mendes, Camila Cabello",Señorita,Island Records,1,7,24,589826,2019-12-05
9,spotify:track:0TkquWzzuxcrwbCWlTrKYF,"Neha Kakkar, Tanishk Bagchi, Lalit Sen",Yaad Piya Ki Aane Lagi,T-Series,9,10,3,573904,2019-12-05
11,spotify:track:0sf12qNH5qcw8qpgymFOqD,The Weeknd,Blinding Lights,Republic Records,11,-1,1,532408,2019-12-05
12,spotify:track:3ZCTVFBt2Brf31RLEnCkWJ,Billie Eilish,everything i wanted,Darkroom/Interscope Records,9,12,3,472154,2019-12-05
13,spotify:track:1feANd8EfcDP5UqSvbheM3,"Sachet Tandon, Sachet-Parampara","Bekhayali (From ""Kabir Singh"")",T-Series,1,13,28,456612,2019-12-05
14,spotify:track:21jGcNKet2qwijlDFuPiPb,Post Malone,Circles,Republic Records,9,17,14,455469,2019-12-05
15,spotify:track:7IAJzec1UxGYmNvbPTHbxx,"Sohail Sen, Vishal Dadlani","Shaitan Ka Saala (From ""Housefull 4"")",T-Series,8,9,9,443272,2019-12-05
16,spotify:track:5QVHNa0ppJUOoqSd36ovQS,"Arijit Singh, B Praak, Jaani","Pachtaoge (From ""Jaani Ve"")",T-Series,1,11,15,439872,2019-12-05
17,spotify:track:5djZm1zFGcJUSUqbBjrAZH,"Neha Kakkar, Tulsi Kumar, B Praak","O Saki Saki (From ""Batla House"")",T-Series,2,16,21,429355,2019-12-05
18,spotify:track:4OcvkkpF3xmyCGGY5IBlgi,"Akhil Sachdeva, Tulsi Kumar","Tera Ban Jaunga (From ""Kabir Singh"")",T-Series,4,15,25,427457,2019-12-05
19,spotify:track:2tjWCe2W7sgvS3C8NHcdtI,"Akhil, Dhvani Bhanushali, Kunaal Vermaa, Abhijit Vaghani","Duniyaa (From ""Luka Chuppi"")",T-Series,1,20,41,420430,2019-12-05
21,spotify:track:1HfMVBKM75vxSfsQ5VefZ5,Selena Gomez,Lose You To Love Me,Interscope Records,2,14,7,407547,2019-12-05
22,spotify:track:696DnlkuDOXcMAnKlTgXXK,Arizona Zervas,ROXANNE,Arizona Zervas,22,26,4,402281,2019-12-05
23,spotify:track:2IoZMG3RqiTmsy7Li3zGFg,"Sachet Tandon, Parampara Tandon, Sachet-Parampara","Mere Sohneya (From ""Kabir Singh"")",T-Series,4,22,26,395551,2019-12-05
24,spotify:track:3f0wz6zcA7XkQiGm0qNF5r,"Arijit Singh, Tanishk Bagchi","Thodi Jagah (From ""Marjaavaan"")",T-Series,15,19,7,378403,2019-12-05
25,spotify:track:6AooRgSRDzbCYL4NZ4RCjU,DIVINE,Chal Bombay,Universal Music India Pvt Ltd.,23,23,9,375435,2019-12-05
26,spotify:track:1iQDltZqI7BXnHrFy4Qo1k,"SHAED, ZAYN",Trampoline (with ZAYN),Photo Finish Records,13,21,10,365638,2019-12-05
27,spotify:track:7aiClxsDWFRQ0Kzk5KI5ku,blackbear,hot girl bummer,Alamo,20,24,12,363659,2019-12-05
28,spotify:track:1y1rQTkWmrZdJmjwuK07GC,"Vishal Mishra, Manoj Muntashir","Kaise Hua (From ""Kabir Singh"")",T-Series,5,25,25,359095,2019-12-05
29,spotify:track:42ETKyApzUl8hTtytFAjen,"Baani Sandhu, Gur Sidhu",8 Parche,Ishtar Punjabi,27,28,11,330068,2019-12-05
30,spotify:track:6lfSsCL894Qw15xbt7cSUy,"Vishal Dadlani, Benny Dayal","Jai Jai Shivshankar (From ""War"")",YRF Music,9,30,11,329680,2019-12-05
31,spotify:track:57DhVYA7E1CyrE4OKuyLb7,Maninder Buttar,Ik Tera,Ishtar Punjabi,29,29,15,328085,2019-12-05
33,spotify:track:3sqRODOZ1Z6hR4F2tnFAlg,Maninder Buttar,Sakhiyaan,Ishtar Punjabi,20,32,41,313845,2019-12-05
34,spotify:track:7ofWUKeNCUw1P64ArIwG9b,"Tony Kakkar, Neha Kakkar, Tanishk Bagchi","Dheeme Dheeme (From ""Pati Patni Aur Woh"")",T-Series,34,48,4,311327,2019-12-05
36,spotify:track:7qEHsqek33rTcFNT9PFqLf,Lewis Capaldi,Someone You Loved,Vertigo Berlin,30,38,32,287453,2019-12-05
37,spotify:track:6oDHAjaJJjwwgoAuMIeY9K,"Neha Kakkar, Yash Narvekar, Tanishk Bagchi","Ek Toh Kum Zindagani (From ""Marjaavaan"")",T-Series,29,33,8,284365,2019-12-05
39,spotify:track:1CM4rFDU9q4EoLy2K44qE6,"B Praak, Harrdy Sandhu, Swasti Mehul, Jaani","Naah Goriye (From ""Bala"")",Sony Music Entertainment India Pvt. Ltd.,27,35,6,280552,2019-12-05
40,spotify:track:4TnjEaWOeW0eKTKIEvJyCa,Trevor Daniel,Falling,Alamo,40,92,2,278603,2019-12-05
41,spotify:track:01AE1MgL6L86WQzh4KGDUa,"Meet Bros., Jubin Nautiyal, Dhvani Bhanushali","Kinna Sona (From ""Marjaavaan"")",T-Series,31,31,4,276372,2019-12-05
42,spotify:track:1VYMsDdZ3toHtlZxAGS95n,DIVINE,Kohinoor,Universal Music India Pvt Ltd.,10,34,12,273224,2019-12-05
43,spotify:track:0RiRZpuVRbi7oqRdSMwhQY,"Post Malone, Swae Lee",Sunflower - Spider-Man: Into the Spider-Verse,Republic Records,3,46,41,272797,2019-12-05
44,spotify:track:0mJTAdmY8olbGQjopDYff3,"Dhvani Bhanushali, Nikhil D'Souza, Tanishk Bagchi",Vaaste,T-Series,3,41,35,269529,2019-12-05
45,spotify:track:3ZjMdVOWxQ53FKrmkgCv95,"Sachet Tandon, Dhvani Bhanushali, Tanishk Bagchi","Psycho Saiyaan (From ""Saaho"")",T-Series,3,39,22,266506,2019-12-05
46,spotify:track:7gAyu0od48mkaCw1laPKVC,"Vayu, Aastha Gill, AKASA, Puri",Naagin,Sony Music Entertainment India Pvt. Ltd.,30,37,7,263021,2019-12-05
47,spotify:track:2q0V50aNlI1RQXJyE5HDgD,"Sachin-Jigar, Darshan Raval, Neha Kakkar","Odhani (From ""Made in China"")",Sony Music Entertainment India Pvt. Ltd.,26,42,11,260864,2019-12-05
48,spotify:track:39ujbBjTwwqUFySaCYDMMT,"Badshah, Diljit Dosanjh, Aastha Gill",Proper Patola,Sony Music Entertainment India Pvt. Ltd.,18,43,41,260836,2019-12-05
49,spotify:track:58wyJLv6yH1La9NIZPl3ne,"Kina, Adriana Proenza",Can We Kiss Forever?,Columbia,44,44,7,260432,2019-12-05
50,spotify:track:4yI3HpbSFSgFZtJP2kDe5m,Selena Gomez,Look At Her Now,Interscope Records,9,40,6,251828,2019-12-05
51,spotify:track:2GYzXSeNa3Y0BfIfS1VJj3,Sid Sriram,Yaen Ennai Pirindhaai,Aditya Music,50,50,6,246797,2019-12-05
52,spotify:track:1NDKkQsf7XlNYLzmGIAO6e,Jass Manak,Lehanga,GEET MP3,52,77,3,245730,2019-12-05
53,spotify:track:3eekarcy7kvN4yt5ZFzltW,Travis Scott,HIGHEST IN THE ROOM,Cactus Jack/Epic,20,47,9,242969,2019-12-05
54,spotify:track:0mHU8dcIvGrGDazLMmQpSg,Jubin Nautiyal,Tujhe Kitna Chahein Aur (Film Version),T-Series,12,45,24,242415,2019-12-05
55,spotify:track:0pqnGHJpmpxLKifKRmU6WP,Imagine Dragons,Believer,Kid Ina Korner / Interscope,52,66,41,235053,2019-12-05
56,spotify:track:7KhHA3mzt7A3LFlOJEAKpI,"Alan Walker, Sabrina Carpenter, Farruko",On My Way,Kreatell Music,1,54,38,234813,2019-12-05
57,spotify:track:1z0A545pZMaqYRkruladlk,"Garry Sandhu, Neha Kakkar, Mellow D","Hauli Hauli (From ""De De Pyaar De"")",T-Series,15,49,32,232134,2019-12-05
58,spotify:track:2Fxmhks0bxGSBdJ92vM42m,Billie Eilish,bad guy,Darkroom/Interscope Records,3,55,36,230435,2019-12-05
59,spotify:track:6vuMdb0E8buJeSHArN3dXk,"Amaal Mallik, Armaan Malik, Kunaal Vermaa","Chale Aana (From ""De De Pyaar De"")",T-Series,18,53,31,224667,2019-12-05
60,spotify:track:6aPMWbbdhDhiJHlknZb9Yx,"Arijit Singh, Sachet-Parampara","Bekhayali (Arijit Singh Version) [From ""Kabir Singh""]",T-Series,7,51,27,222589,2019-12-05
61,spotify:track:0p83RJy9EZ0hlg82xcXH7f,"Sachet Tandon, Parampara Tandon, Navi Ferozpurwala",Dilbara,T-Series,61,-1,1,217525,2019-12-05
62,spotify:track:3boJs8tx10SQr2nUUm3FAr,"Sachin-Jigar, Jubin Nautiyal, Asees Kaur","Pyaar Toh Tha (From ""Bala"")",Sony Music Entertainment India Pvt. Ltd.,61,110,5,217305,2019-12-05
64,spotify:track:63VyEdzMM3w4ZQ1WtARa2S,"The Chainsmokers, ILLENIUM, Lennon Stella",Takeaway,Disruptor Records/Columbia,20,56,19,213137,2019-12-05
65,spotify:track:7LzouaWGFCy4tkXDOOnEyM,Camila Cabello,Liar,Syco Music/Epic,18,52,13,207701,2019-12-05
66,spotify:track:5G7pZ8G8NFvS1MQ9H4L7dC,"Javed-Mohsin, Arijit Singh, Shreya Ghoshal, Kunaal Vermaa, Prashant Ingole",Pal,Sony Music Entertainment India Pvt. Ltd.,44,61,41,206280,2019-12-05
67,spotify:track:6vBdBCoOhKHiYDDOcorfNo,"Post Malone, Young Thug",Goodbyes (feat. Young Thug),Republic Records,7,64,22,206200,2019-12-05
68,spotify:track:04UzZSWfw8hkK832P27QLq,"Nikk, Avneet Kaur",Yaari,BANG Music,18,59,22,205522,2019-12-05
70,spotify:track:5p7ujcrUXASCNwRaWNHR1C,Halsey,Without Me,Capitol Records,11,72,41,198414,2019-12-05
71,spotify:track:65c6VCikt7f5sAS1heoYQC,"Bohemia, Sidhu Moose Wala",Same Beef,Saga Music,53,67,10,196511,2019-12-05
72,spotify:track:0ojpEubhy4JNeVftmVuiN7,"Vishal Mishra, Armaan Malik",Pehla Pyaar,T-Series,11,62,24,194148,2019-12-05
73,spotify:track:5O932cZmzOZGOGZz9RHx20,"Pritam, Arijit Singh",Khairiyat,T-Series,53,78,13,191937,2019-12-05
75,spotify:track:2P91MQbaiQOfbiz9VqhqKQ,Lauv,I Like Me Better,Lauv,30,79,41,189468,2019-12-05
76,spotify:track:6PLgUw6dE0Bp3lGVBKnn94,"Guru Randhawa, Bunty Bains, Davvy Singh",Black,T-Series,76,-1,1,189377,2019-12-05
77,spotify:track:3j9DrRebdWK1jkpOw9FZUy,Sid Sriram,Samajavaragamana,Aditya Music,13,63,10,189108,2019-12-05
78,spotify:track:1aIhAX6324JZmhNnGltwkK,Arijit Singh,"Tera Yaar Hoon Main (From ""Sonu Ke Titu Ki Sweety"")",T-Series,61,81,40,188020,2019-12-05
79,spotify:track:6sTbnkzOtPpojgnn50cCHJ,"Ankit Tiwari, Dhvani Bhanushali","Rula Diya (From ""Batla House"")",T-Series,53,65,19,184043,2019-12-05
80,spotify:track:5I3Xih0C2ID3fqngBrBbGv,"Badshah, Neeti Mohan","Bad Boy (From ""Saaho"")",T-Series,8,74,16,183749,2019-12-05
81,spotify:track:4bKkdGBttnK4SYjT4zPC1U,"Tony Kakkar, Neha Kakkar, Young Desi","Coca Cola (From ""Luka Chuppi"")",T-Series,14,82,41,182196,2019-12-05
82,spotify:track:6NLzzwFbAD1imLXGBMj9jo,"The Doorbeen, Shreya Sharma",PRADA,Jjust Music,15,80,17,181868,2019-12-05
83,spotify:track:6p2o4ep90wpkh0qzUmyFuO,"Arijit Singh, Mithoon, Asees Kaur",Intezaar,Universal Music India Pvt Ltd.,60,75,4,181108,2019-12-05
85,spotify:track:36EPfDEkfLYQLt8Fvced8x,"Harrdy Sandhu, Jaani",Dance Like,Sony Music Entertainment India Pvt. Ltd.,85,-1,1,178991,2019-12-05
86,spotify:track:6wZJsut8fjiWiMPaccRAOX,Ritviz,Udd Gaye,Ritviz,79,86,41,178836,2019-12-05
87,spotify:track:1e9oZCCiX42nJl0AcqriVo,Harry Styles,Watermelon Sugar,Columbia,73,73,3,177339,2019-12-05
88,spotify:track:39vrbjCMTRXEdiIr2IsBgd,Badshah,She Move It Like,Sony Music Entertainment India Pvt. Ltd.,14,85,41,176917,2019-12-05
89,spotify:track:7nSTuuVgzhJuQjZhgDlzKl,"Himesh Reshammiya, Tanishk Bagchi","Jhalak Dikhla Jaa Reloaded (From ""The Body"")",T-Series,89,-1,1,175934,2019-12-05
90,spotify:track:5MnAi6ZF7cE8pAz7wYr9Ta,"Vishal-Shekhar, Atif Aslam, Irshad Kamil",Dil Diyan Gallan,YRF Music,83,88,38,174953,2019-12-05
91,spotify:track:2TbCdbFzs2xO2nzasn0Qvw,"Sachin-Jigar, Badshah, Shalmali Kholgade, Gurdeep Mehndi","Don't Be Shy Again (From ""Bala"")",Sony Music Entertainment India Pvt. Ltd.,57,71,7,174379,2019-12-05
92,spotify:track:6V9fHiv84WlVTg7CSnIVY2,Halsey,Graveyard,Capitol Records,31,83,12,173362,2019-12-05
93,spotify:track:4gyPGtExOjj1rsByKW33LR,Badshah,Paagal,Sony Music Entertainment India Pvt. Ltd.,12,87,21,172423,2019-12-05
96,spotify:track:0Iz4CkptElGHo16r797Jsb,"Atif Aslam, Nusrat Fateh Ali Khan, Rochak Kohli","Dekhte Dekhte (From ""Batti Gul Meter Chalu"")",T-Series,39,91,41,169492,2019-12-05
97,spotify:track:4uXJADmybUHUgycBWFHeq6,"Anurag Kulkarni, Mangli, Thaman S",Ramuloo Ramulaa - Duet,Aditya Music,38,70,6,169365,2019-12-05
98,spotify:track:5wdlz4N7s1Xyr4y4RXhZJM,"Karan Sehmbi, Tanishk Bagchi, Goldboy","Photo (From ""Luka Chuppi"")",T-Series,15,95,41,169159,2019-12-05
99,spotify:track:698ItKASDavgwZ3WjaWjtz,Alan Walker,Faded,Kreatell Music,47,96,41,167705,2019-12-05
101,spotify:track:2si0ZNx4yRbggTvrIom8A2,"Rochak Kohli, Atif Aslam, Tulsi Kumar",Paniyon Sa,T-Series,68,102,40,165085,2019-12-05
102,spotify:track:2gMXnyrvIjhVBUZwvLZDMP,Lewis Capaldi,Before You Go,Vertigo Berlin,102,106,2,163270,2019-12-05
103,spotify:track:68iBMrMRc1rg4eAxJbvxch,"Tanishk Bagchi, Dhvani Bhanushali, Rashmi Virag",Leja Re,T-Series,60,99,41,163259,2019-12-05
104,spotify:track:6cARnc9YVlBNigjNSX63pp,"Neha Kakkar, Dhvani Bhanushali, Ikka","Dilbar (From ""Satyameva Jayate"")",T-Series,28,90,41,162698,2019-12-05
106,spotify:track:7BKLCZ1jbUBVqRi2FVlTVw,"The Chainsmokers, Halsey",Closer,Disruptor Records/Columbia,59,98,41,161123,2019-12-05
107,spotify:track:1zB4vmk8tFRmM9UULNzbLB,Imagine Dragons,Thunder,Kid Ina Korner / Interscope,67,108,41,157128,2019-12-05
109,spotify:track:1mjWhM7GQTTxJxg2F0iCRS,"Armaan Malik, Rochak Kohli, Bappi Lahiri","Dil Mein Ho Tum (From ""Cheat India"")",T-Series,60,114,41,155283,2019-12-05
110,spotify:track:4At0CnQes5Kx1ROSnnP4lK,Tony Kakkar,Dheeme Dheeme,Desi Music Factory,20,111,27,154941,2019-12-05
111,spotify:track:0a6zRnrjmaOcqsEIFkXIhw,Akhil,Khaab,Crown Records,101,101,39,154739,2019-12-05
112,spotify:track:1fzAokzOONl4XEPUFoammu,"Alka Yagnik, Arijit Singh","Agar Tum Saath Ho (From ""Tamasha"")",T-Series,112,130,27,153517,2019-12-05
113,spotify:track:6HGoVbCUr63SgU3TjxEVj6,Imran Khan,Satisfya,Ik Records,100,100,12,153030,2019-12-05
114,spotify:track:2dpaYNEQHiRxtZbfNsse99,"Marshmello, Bastille",Happier,Joytime Collective,17,122,41,151794,2019-12-05
115,spotify:track:7fa9MBXhVfQ8P8Df9OEbD8,"Maroon 5, Cardi B",Girls Like You (feat. Cardi B) - Cardi B Version,Interscope Records*,39,121,41,151468,2019-12-05
116,spotify:track:7cuYb19oTyv1tLTgzH7qpv,"Bilal Saeed, Momina Mustehsan",Baari,One Two Records,116,-1,1,151314,2019-12-05
117,spotify:track:5X5db3FrBOHbibrFKA02MQ,"Abhijeet Srivastava, Vishal-Shekhar","Chashni (From ""Bharat"")",T-Series,24,113,31,150723,2019-12-05
118,spotify:track:0rk2X5TAhraBC5aCIXK2Rq,"Jawad Ahmad, Shaarib Toshi, Arijit Singh, Shreya Ghoshal",Samjhawan,Sony Music Entertainment India Pvt. Ltd.,70,109,41,149950,2019-12-05
119,spotify:track:40GHpTNbgMbydOKVDd2Ehb,"Ranjit Bawa, Bunty Bains, Desi Crew",Impress,T-Series,117,117,3,149892,2019-12-05
120,spotify:track:1ZaeaGLhFSckG8sv1y7AWk,"Harrdy Sandhu, Jaani",Kya Baat Ay,Sony Music Entertainment India Pvt. Ltd.,42,116,41,149436,2019-12-05
121,spotify:track:16NMvEYAus3qS1czInNNZl,"Mika Singh, Tulsi Kumar, Tanishk Bagchi","Ankhiyon Se Goli Mare (From ""Pati Patni Aur Woh"")",T-Series,60,60,2,149264,2019-12-05
122,spotify:track:5x3K3Ld54TtkYKdQvrFOV3,"Guru Randhawa, Neha Kakkar","Morni Banke (From ""Badhaai Ho"")",T-Series,27,119,41,148414,2019-12-05
123,spotify:track:6IJTc8xo6XasOU8fpxMU57,"The Chainsmokers, Bebe Rexha",Call You Mine,Disruptor Records/Columbia,15,126,27,148366,2019-12-05
124,spotify:track:6Kynli1iHBqJRWUCohcV9h,DIVINE,Kaam 25 - Sacred Games,Netflix India Originals LLC,66,118,36,148292,2019-12-05
125,spotify:track:4JxguFZxVeGu9lINBIA7DU,"Hitesh Modak, Armaan Malik","Hawaa Banke (From ""Yeh Saali Aashiqui"")",Sony Music Entertainment India Pvt. Ltd.,103,103,4,148236,2019-12-05
126,spotify:track:1bvIoSekCZWAgthW01kbo9,"Jasbir Jassi, Badshah, Dhvani Bhanushali","Koka (From ""Khandaani Shafakhana"")",T-Series,13,112,23,147962,2019-12-05
127,spotify:track:5aJEh9Oqdz7PRLKTpH25pB,Harry Styles,Lights Up,Columbia,23,76,8,147939,2019-12-05
129,spotify:track:12V0iduYsoXxsQYTSeFB2H,Jass Manak,Viah,GEET MP3,67,123,34,146012,2019-12-05
130,spotify:track:0e7ipj03S05BNilyu5bRzt,"Post Malone, 21 Savage",rockstar (feat. 21 Savage),Republic Records,43,134,41,144546,2019-12-05
131,spotify:track:0H2iJVgorRR0ZFgRqGUjUM,"Pritam, Arijit Singh",Channa Mereya,Sony Music Entertainment India Pvt. Ltd.,58,124,41,143937,2019-12-05
132,spotify:track:3YVQHUpNexOqkLI7IclsoT,Darshan Raval,Hawa Banke,Indie Music Label,26,145,20,143927,2019-12-05
133,spotify:track:6kls8cSlUyHW2BUOkDJIZE,"Ellie Goulding, Juice WRLD",Hate Me (with Juice WRLD),Polydor Records,70,129,10,143812,2019-12-05
134,spotify:track:1mpD5Q8IM32I4bF6eCpU74,Khalid,Up All Night,"Right Hand Music Group, LLC/RCA Records",131,131,3,143713,2019-12-05
135,spotify:track:6b2RcmUt1g9N9mQ3CbjX2Y,Sam Smith,How Do You Sleep?,PLG - Capitol,37,127,20,143454,2019-12-05
136,spotify:track:51Fjme0JiitpyXKuyQiCDo,"Y2K, bbno$",Lalala,Columbia,56,137,22,142069,2019-12-05
137,spotify:track:0cWLJcdvM6QlOQ7UJdB4jb,"Ash King, Sachin-Jigar","Nazar Na Lag Jaaye (From ""Stree"")",T-Series,77,135,40,140733,2019-12-05
138,spotify:track:2YpeDb67231RjR0MgVLzsG,"Lil Nas X, Billy Ray Cyrus",Old Town Road (feat. Billy Ray Cyrus) - Remix,Columbia,2,141,35,140285,2019-12-05
139,spotify:track:6ocbgoVGwYJhOv1GgI9NsF,Ariana Grande,7 rings,Republic Records,1,152,41,140199,2019-12-05
140,spotify:track:7AFASza1mXqntmGtbxXprO,XXXTENTACION,changes,"Bad Vibes Forever, LLC",21,128,18,140178,2019-12-05
141,spotify:track:1UWacd8x8tPPwmrPB1MoBI,"Pritam, Arijit Singh",Ae Dil Hai Mushkil Title Track,Sony Music Entertainment India Pvt. Ltd.,105,139,41,140127,2019-12-05
142,spotify:track:29g0X56b7scJVZfbuUHNE8,"Jassie Gill, Sunny Vik, Raj Fatehpur",Allah Ve,T-Series,142,-1,1,139340,2019-12-05
143,spotify:track:7cFuzwgbtHXmSKuCzo0qCW,"The Doorbeen, Ragini",Lamberghini,Times Music,12,143,41,138595,2019-12-05
144,spotify:track:0qiRXUSuGlbdBasXJ8AInc,"Amrit Maan, Dr Zeus",Combination,HUMBLE MUSIC,97,97,2,138266,2019-12-05
145,spotify:track:0lYBSQXN6rCTvUZvg9S0lU,"DJ Snake, Justin Bieber",Let Me Love You,DJ Snake Def Jam,109,149,41,136620,2019-12-05
146,spotify:track:7E4sdzJDrVMu8qcwyxz3vP,"Tanishk Bagchi, Jubin Nautiyal",Sawarne Lage,Sony Music Entertainment India Pvt. Ltd.,133,133,23,136562,2019-12-05
147,spotify:track:44O26Gv1wQrlUj14PpTolM,"Sunidhi Chauhan, Divya Kumar, Amit Trivedi","Halka Halka (From ""Fanney Khan"")",T-Series,131,146,21,136179,2019-12-05
149,spotify:track:790uNrqzKWCvj8rR1QXNpU,"Neha Kakkar, Mika Singh, Kumar Sanu","Aankh Marey (From ""Simmba"")",T-Series,14,132,41,134967,2019-12-05
150,spotify:track:4ymPEyiXabTe1NO8q8EFxG,"Darshan Raval, Asees Kaur, Lijo George-Dj Chetas","Chogada (From ""Loveyatri"")",T-Series,55,150,41,134889,2019-12-05
151,spotify:track:7yEuRloGyxyu1KaWBTPP1Z,"Shreya Ghoshal, Nakash Aziz, Vishal-Shekhar","Slow Motion (From ""Bharat"")",T-Series,23,154,32,134604,2019-12-05
152,spotify:track:3QGsuHI8jO1Rx4JWLUh9jd,Shawn Mendes,Treat You Better,Island Records,49,148,41,134359,2019-12-05
153,spotify:track:4Kwajm44l1SNP6fJT93WDq,"Jassie Gill, Karan Aujla",Aukaat,Times Music,57,138,7,134222,2019-12-05
154,spotify:track:7MXVkk9YMctZqd1Srtv4MB,"The Weeknd, Daft Punk",Starboy,Universal Republic Records,84,-1,22,133807,2019-12-05
155,spotify:track:4f5kLqyOJ5ZPnalEVMQrB2,"Rahat Fateh Ali Khan, Asees Kaur, Tanishk Bagchi","Tere Bin (From ""Simmba"")",T-Series,26,153,41,132786,2019-12-05
156,spotify:track:0l6g8Z8mqGbGXFOjigYetD,"Pritam, Arijit Singh",Hawayein,Sony Music Entertainment India Pvt. Ltd.,51,144,41,132538,2019-12-05
157,spotify:track:3GRSqlALWISqLeNncZMbpX,"Lauv, LANY",Mean It,Lauv,93,115,3,132190,2019-12-05
158,spotify:track:1y4jsQt7MjnZhiD1L6qFBC,Sub Urban,Cradles,NCS,53,142,30,131955,2019-12-05
159,spotify:track:4wopYJ5wpYOM6ogm2Jugnw,"Lauv, Anne-Marie","fuck, i'm lonely",Lauv,24,147,18,131453,2019-12-05
160,spotify:track:3w6SuEVkg0jFo8FG0YBELz,Karan Aujla,Hint,Rehaan Records,53,107,4,130433,2019-12-05
161,spotify:track:5q6eZbatNFuToQdA7FGhj5,"Sohail Sen, Altamash Faridi, Jyotica Tangri","Ek Chumma (From ""Housefull 4"")",T-Series,61,104,10,130079,2019-12-05
162,spotify:track:6bdpj89aYEBjhpsenXAsmO,"A.R. Rahman, Arijit Singh",Enna Sona,Sony Music Entertainment India Pvt. Ltd.,34,155,41,129752,2019-12-05
163,spotify:track:0lks2Kt9veMOFEAPN0fsqN,"Alan Walker, K-391, Emelie Hollow",Lily,Kreatell Music,88,165,37,128648,2019-12-05
164,spotify:track:4e9dIemIXO8Tzg0k4aWujk,"Pritam, Arijit Singh, Nikhita Gandhi","Raabta (Title Track) [From ""Raabta""]",T-Series,140,159,14,127904,2019-12-05
165,spotify:track:1LMwOxNStAp24Py3mWoRkb,"Shweta Mohan, Shankar Mahadevan, Shankar-Ehsaan-Loy","Baby Won't You Tell Me (From ""Saaho"")",T-Series,16,136,15,127841,2019-12-05
166,spotify:track:6fScgF2Y63ScU73nYju0ny,"Atif Aslam, Arko",O Saathi,T-Series,58,163,41,126655,2019-12-05
167,spotify:track:4hQ6UGyWQIGJmHSo0J88JW,Selena Gomez,Back To You - From 13 Reasons Why – Season 2 Soundtrack,UMGRI Interscope,66,162,41,125782,2019-12-05
168,spotify:track:2mwBSO58y92EYmEFpDfmS7,"Guru Randhawa, Arjun",Suit Suit,T-Series,50,164,41,125684,2019-12-05
169,spotify:track:7FGq80cy8juXBCD2nrqdWU,"benny blanco, Halsey, Khalid",Eastside (with Halsey & Khalid),Friends Keep Secrets/Interscope Records,25,167,41,124671,2019-12-05
170,spotify:track:2iwS33Jfev1QBiuhWVWZHY,"Lauv, Troye Sivan",i'm so tired...,Lauv,7,-1,35,124540,2019-12-05
171,spotify:track:22vgEDb5hykfaTwLuskFGD,Jonas Brothers,Sucker,Jonas Brothers Recording,1,170,40,124251,2019-12-05
172,spotify:track:2bT1PH7Cw3J9p3t7nlXCdh,Shawn Mendes,If I Can't Have You,Island Records,1,169,31,123994,2019-12-05
173,spotify:track:0tBbt8CrmxbjRP0pueQkyU,"Selena Gomez, Marshmello",Wolves,Selena Gomez PS,57,168,41,123913,2019-12-05
175,spotify:track:7hADNKBDHS8MblpUzLebLf,"Anirudh Ravichander, Inno Genga","Hoyna Hoyna (From ""Gang Leader"")",Sony Music Entertainment India Pvt. Ltd.,30,158,16,123121,2019-12-05
176,spotify:track:0u2P5u6lvoDfwTYjAADbn4,"Billie Eilish, Khalid",lovely (with Khalid),Darkroom,67,192,35,122089,2019-12-05
177,spotify:track:6qajA2wXvAI4HMey8b1JVK,"Badshah, Tulsi Kumar, Abhijeet, Chandra Dixit","Sheher Ki Ladki (From ""Khandaani Shafakhana"")",T-Series,20,161,22,122017,2019-12-05
178,spotify:track:1aUfggX5E0nKDikNuiDQ3D,Guru Randhawa,Ishq Tera,T-Series,155,190,12,121463,2019-12-05
179,spotify:track:6RUKPb4LETWmmr3iAEQktW,"The Chainsmokers, Coldplay",Something Just Like This,Disruptor Records/Columbia,84,178,40,120976,2019-12-05
180,spotify:track:3DXP7pJNl1AmAUl90CAGe0,DIVINE,Gandhi Money,Universal Music India Pvt Ltd.,44,156,9,120944,2019-12-05
181,spotify:track:6cy3ki60hLwimwIje7tALf,"Black Eyed Peas, J Balvin",RITMO (Bad Boys For Life),Epic/We The Best,181,-1,2,120939,2019-12-05
182,spotify:track:42WGQxg2lPIFBt8ZRHQ4Q4,"Mithoon, Atif Aslam, Armaan Malik, Arijit Singh, Amaal Mallik, Salman Khan, Mohit Chauhan, Yo Yo Honey Singh, Ankit Tiwari, Sonu Nigam, Neeti Mohan, Sabri Brothers, Tulsi Kumar, Rashmi Virag, Dj Chetas",Romantic Mashup 2,T-Series,107,166,15,120708,2019-12-05
183,spotify:track:5icOoE6VgqFKohjWWNp0Ac,"Marshmello, CHVRCHES",Here With Me,Marshmello/Republic,6,186,38,120677,2019-12-05
184,spotify:track:3i9UVldZOE0aD0JnyfAZZ0,"Taylor Swift, Shawn Mendes",Lover (Remix) [feat. Shawn Mendes],Taylor Swift,49,125,3,120496,2019-12-05
185,spotify:track:0KoiMHhqKLoL4xM54rcWYY,"DJ Snake, Selena Gomez, Ozuna, Cardi B","Taki Taki (feat. Selena Gomez, Ozuna & Cardi B)",DJ Snake Music Productions Limited,29,173,41,120111,2019-12-05
186,spotify:track:7heMX7gyHP0mhTlNgd7Lxd,"A.R. Rahman, Badshah, Tanishk Bagchi, Shashaa Tirupati, Jubin Nautiyal",The Humma Song,Sony Music Entertainment India Pvt. Ltd.,29,174,41,119398,2019-12-05
187,spotify:track:62RXe5I6L7n32fUMd8Puvo,Shreya Ghoshal,Yeh Aaina,T-Series,10,157,24,118516,2019-12-05
188,spotify:track:2nCKF3gkwHCamm3f0jNaJd,"Akhil Sachdeva, Antara Mitra, Arijit Singh, Benny Dayal, Dhvani Bhanushali, Karan Sehmbi, Nikhita Gandhi, Rahat Fateh Ali Khan, Sachet Tandon, Shreya Ghoshal, Tulsi Kumar, Rashmi Virag, DJ Yogii",Love Mashup 2019,T-Series,176,183,4,117916,2019-12-05
189,spotify:track:64RkEV5b7bG697vhIPMlrl,Ritviz,Sage,Ritviz,140,-1,10,117361,2019-12-05
190,spotify:track:5sul5AkWmzi2fE70oS7mK9,Arijit Singh,"Ik Vaari Aa (From ""Raabta"")",T-Series,70,195,37,116948,2019-12-05
191,spotify:track:4bD9z9qa4qg9BhryvYWB7c,"Pritam, Tochi Raina, Rekha Bhardwaj",Kabira,T-Series,117,181,30,116844,2019-12-05
192,spotify:track:0oukMLKedsqQ3ltnI2daRO,"QARAN, Ash King",Haaye Oye (feat. Ash King),Sony Music Entertainment India Pvt. Ltd.,74,187,32,116685,2019-12-05
193,spotify:track:7F8RNvTQlvbeBLeenycvN6,"A.R. Rahman, Javed Ali, Mohit Chauhan",Kun Faya Kun,T-Series,171,171,3,116123,2019-12-05
195,spotify:track:5r7k55M31Q22AEJkF1GTyw,"Ammy Virk, Sonam Bajwa",Wang Da Naap,Ishtar Punjabi,54,191,27,114561,2019-12-05
196,spotify:track:1MhHomaXgrPMBroXkpWSSa,"Amrita Singh, Ankit Tiwari, Asees Kaur, Ash King, Atif Aslam, Badshah, Dhvani Bhanushali, Guru Randhawa, Himesh Reshammiya, Jubin Nautiyal, Karan Sehmbi, Neha Kakkar, Palak Muchhal, Sachin-Jigar, Shruti Pathak, Sunidhi Chauhan, Tony Kakkar, Rashmi Virag, Kedrock, Sd Style",Valentine's Mashup 2019,T-Series,66,176,22,114542,2019-12-05
197,spotify:track:0F7FA14euOIX8KcbEturGH,Lil Nas X,Old Town Road,Columbia,13,-1,35,114414,2019-12-05
198,spotify:track:1rfofaqEpACxVEHIZBJe6W,"Camila Cabello, Young Thug",Havana (feat. Young Thug),Syco Music/Epic,86,197,40,114342,2019-12-05
199,spotify:track:7CZyCXKG6d5ALeq41sLzbw,"Post Malone, Ozzy Osbourne, Travis Scott",Take What You Want (feat. Ozzy Osbourne & Travis Scott),Republic Records,71,198,13,113541,2019-12-05
200,spotify:track:5SVpD60u9vjoQ2OeoKsTkb,"Badshah, Asees Kaur, Jubin Nautiyal",Akh Lad Jaave,T-Series,44,-1,39,112769,2019-12-05
