rank,uri,artist_names,track_name,source,peak_rank,previous_rank,weeks_on_chart,streams,End Date
185,spotify:track:3AWDeHLc88XogCaCnZQLVI,The Weeknd,Cry For Me,XO / Republic Records,185,-1,1,1334137,2025-02-06
186,spotify:track:5BQePe9rcCJozHK3oPayYk,Shubh,MVP,Shubh,24,-1,21,1332497,2025-02-06
187,spotify:track:2iZeKe5avjtKVmjfSFkpxd,"Pritam, Rahat Fateh Ali Khan, Tulsi Kumar, Irshad Kamil",Tum Jo Aaye,T-Series,179,-1,2,1327797,2025-02-06
188,spotify:track:2HRqTpkrJO5ggZyyK6NPWz,Sabrina Carpenter,Espresso,Island Records,26,185,41,1327752,2025-02-06
189,spotify:track:0UZLaEOSIc5kg0cc7eszqC,Vishal Mishra,Manjha,Desi Music Factory,16,163,141,1327649,2025-02-06
190,spotify:track:7BCp5hEiiDSmXsxsXkvYff,"Amit Trivedi, Arijit Singh, Nikhita Gandhi",Qaafirana,Zee Music Company,40,184,183,1324578,2025-02-06
191,spotify:track:6FjbAnaPRPwiP3sciEYctO,"Pritam, Arijit Singh",Raabta,T-Series,41,178,122,1320968,2025-02-06
192,spotify:track:2Z6HgNji9cNlFLNORw6wDQ,"Mansheel Gujral, Akhil Sachdeva","Channa Ve - From ""Bhoot - Part One: The Haunted Ship""",Zee Music Company,33,182,62,1313709,2025-02-06
193,spotify:track:7F8RNvTQlvbeBLeenycvN6,"A.R. Rahman, Javed Ali, Mohit Chauhan",Kun Faya Kun,T-Series,60,174,147,1309240,2025-02-06
194,spotify:track:54PRUdMOYzglMGnsg9kIta,"Raghav Chaitanya, Manoj Muntashir, Pritam","Hua Main (From ""ANIMAL"")",T-Series,6,172,69,1306662,2025-02-06
195,spotify:track:1a1xLj9W8libnO9PvJf6ao,"Sushin Shyam, Dabzee, Vinayak Sasikumar",Illuminati,Think Music,3,180,44,1299320,2025-02-06
196,spotify:track:7AsG1F1eMWd17RYan8M3Wm,"AP Dhillon, Shinda Kahlon",Dil Nu,RUN-UP RECORDS,33,-1,57,1296786,2025-02-06
197,spotify:track:0u8wprNfOdcWpUlWnfMcpP,"Shankar-Ehsaan-Loy, Rahat Fateh Ali Khan, Mahalakshmi Iyer, Gulzar",Bol Na Halke Halke,YRF Music,196,196,2,1296757,2025-02-06
198,spotify:track:5O2P9iiztwhomNh8xkR9lJ,One Direction,Night Changes,Syco Music,22,-1,194,1295896,2025-02-06
199,spotify:track:3HFjh7QljnUCBLsoTwMuTj,"Pritam, KK, Neelesh Misra",Kya Mujhe Pyar Hai,T-Series,42,-1,100,1291916,2025-02-06
200,spotify:track:2hPMMkjM0eSDgsNFfIVSwf,"Vishal Mishra, Tanishk Bagchi, Irshad Kamil","Kya Meri Yaad Aati Hai (From ""Sky Force"")",Saregama India Ltd,200,-1,1,1291659,2025-02-06
