rank,uri,artist_names,track_name,source,peak_rank,previous_rank,weeks_on_chart,streams,End Date
187,spotify:track:43YkTTlOD203o9E5ZxhUjF,Arijit Singh,"Main Dhoondne Ko Zamaane Mein (From ""Heartless"")",T-Series,62,177,117,993141,2024-01-04
188,spotify:track:6STXfHpOuGjOespYlpeuI4,"Dhibu Ninan Thomas, Pradeep Kumar, Karthika Vaidyanathan, Yugabharathi","Kangal Edho - From ""Chithha""",Think Music,81,165,5,991411,2024-01-04
189,spotify:track:4kaLkst9lT3sQ5Crgxs3ic,"Ayushmann Khurrana, Rochak Kohli",Pani Da Rang - Male Vocals,Eros Now Music,68,173,19,990691,2024-01-04
190,spotify:track:1sZFDDmmBVkcHOpV6AB0Nx,"Yo Yo Honey Singh, Rony Ajnali, Gill Machhrai","Kalaastar (From ""Honey 3.0"")",Zee Music Company,39,179,10,987694,2024-01-04
191,spotify:track:7fW9J3EpVWVN1ouv0slAs0,KK,"Kya Mujhe Pyar Hai (From ""Woh Lamhe"")",T-Series,42,176,51,985203,2024-01-04
192,spotify:track:3JkVYvxNoGf2HCWJo61462,"Sidhu Moose Wala, Sunny Malton, SOE",Never Fold,Sidhu Moose Wala,13,183,89,977400,2024-01-04
193,spotify:track:0TdWXMXyfTQ2qp5vvU9LID,"Diljit Dosanjh, Intense",Case,DILJIT DOSANJH,44,180,13,974607,2024-01-04
194,spotify:track:6V4N3h4HYD1Ask9cUTxjjg,"Taimour Baig, Raffey Anwar, AUR",Long time no see,Universal Music MENA,66,162,11,969723,2024-01-04
195,spotify:track:2NmBCDkjvJVvEZkH5QDOeb,"Varinder Brar, Rav Dhaliwal, Ultra Beats",Thaa,Varinder Brar Music,10,-1,37,968128,2024-01-04
196,spotify:track:0s76ExpXyMGVBlKLUr683e,Aditya Rikhari,Faasle,CollabX Productions,123,175,29,965205,2024-01-04
197,spotify:track:1NX33DecZrq4ZUGDc47AfN,Arijit Singh,"Tera Yaar Hoon Main (From ""Sonu Ke Titu Ki Sweety"")",T-Series,54,-1,191,959829,2024-01-04
198,spotify:track:0Bz7dfqPY4JOGZO3O1j8Wh,"Pritam, Amit Mishra, Shilpa Rao",Bulleya,Sony Music Entertainment India Pvt. Ltd.,124,-1,21,958240,2024-01-04
199,spotify:track:3GEiVoaUXq468gfYs2EPfh,"DIVINE, Sidhu Moose Wala",Chorni,DIVINE,8,187,25,955719,2024-01-04
200,spotify:track:5PyDJG7SQRgWXefgexqIge,Doja Cat,Agora Hills,Kemosabe Records/RCA Records,153,192,8,955226,2024-01-04
