rank,uri,artist_names,track_name,source,peak_rank,previous_rank,weeks_on_chart,streams,End Date
1,spotify:track:7yDHHVKLbvDmVw1XXhDDIO,"Vishal Mishra, Raj Shekhar",Pehle Bhi Main,T-Series,1,1,5,10841368,2024-01-04
2,spotify:track:0TL0LFcwIBF5eX7arDIKxY,Anuv Jain,Husn,Universal Music India Pvt. Ltd. (on behalf of Anuv Jain),2,5,5,8458805,2024-01-04
3,spotify:track:3yHyiUDJdz02FZ6jfUbsmY,"Arijit Singh, Shreyas Puranik, Siddharth - Garima","Satranga (From ""ANIMAL"")",T-Series,2,2,10,8216589,2024-01-04
4,spotify:track:3zSSCPpLZ5Oc8nelhhGjKz,AUR,Tu hai kahan,Sony Music Entertainment,1,3,12,6700978,2024-01-04
5,spotify:track:4ApCig0GTR4IEp7Ijsyo3r,"Manan Bhardwaj, Bhupinder Babbal",Arjan Vailly,T-Series,1,4,7,5877988,2024-01-04
6,spotify:track:3xMHXmedL5Rvfxmiar9Ryv,"Anirudh Ravichander, Arijit Singh, Shilpa Rao, Kumaar",Chaleya,T-Series,1,6,21,5636026,2024-01-04
7,spotify:track:6bmmHeCvZI92pRiTHxEdTC,"Pritam, Arijit Singh, Irshad Kamil",O Maahi,T-Series,7,12,3,5240716,2024-01-04
8,spotify:track:0YxKKO272sacGBJKjf6FnB,"Jaani, B Praak",Saari Duniya Jalaa Denge,T-Series,3,7,6,4633545,2024-01-04
9,spotify:track:5ZLkihi6DVsHwDL3B8ym1t,Shubh,One Love,SHUBH,3,8,20,4543752,2024-01-04
10,spotify:track:5PUXKVVVQ74C3gl5vKy9Li,"Jasleen Royal, Arijit Singh, Dulquer Salmaan",Heeriye (feat. Arijit Singh),Warner Music India,1,10,23,4114810,2024-01-04
11,spotify:track:54PRUdMOYzglMGnsg9kIta,"Raghav Chaitanya, Manoj Muntashir, Pritam","Hua Main (From ""ANIMAL"")",T-Series,6,9,12,4108261,2024-01-04
12,spotify:track:35FFqjqaPv1Fr9B1GtJdZO,"Harshavardhan Rameshwar, Choir","Abrar’s Entry | Jamal Kudu (From ""ANIMAL"")",T-Series,8,11,4,3682366,2024-01-04
13,spotify:track:0Jiaz0O4AqnJICa9PxHhaR,Darshan Raval,Mahiye Jinna Sohna,Warner Music India,2,15,28,2981313,2024-01-04
14,spotify:track:0YQJoDL6f46J0n1rOVkpxJ,"Karan Aujla, Ikky",Softly,WM Canada,4,13,20,2914367,2024-01-04
15,spotify:track:1hA697u7e1jX2XM8sWA6Uy,"Sachin-Jigar, Arijit Singh, Amitabh Bhattacharya",Apna Bana Le,Zee Music Company,1,17,28,2895385,2024-01-04
16,spotify:track:6c4Po8zyQjB4cR5XgLhcGb,"Prabh Singh, Jay Trak, Rooh Sandhu",9:45,Prabh Singh Official,9,18,26,2880703,2024-01-04
17,spotify:track:4eBvRhTJ2AcxCsbfTUjoRp,Shubh,Cheques,SHUBH,1,16,32,2874353,2024-01-04
18,spotify:track:72vuBPMhwFNlSYpTSf6fVD,"Diljit Dosanjh, Sia, Greg Kurstin",Hass Hass,Warner Music India,5,14,10,2778280,2024-01-04
19,spotify:track:0645eBDehHcqfiF15hscQV,"Vishal Mishra, Rashmeet Kaur","Janiye (from the Netflix Film ""Chor Nikal Ke Bhaga"")",Netflix Music,5,19,26,2707904,2024-01-04
20,spotify:track:4UMIv5jd9gK98a39BQRD9X,"Pritam, Arijit Singh, Amitabh Bhattacharya",Kesariya,Sony Music Entertainment India Pvt. Ltd.,1,20,77,2673437,2024-01-04
21,spotify:track:26elzgFl8tvajnDfeoY1YF,"Darshan Raval, Prakriti Kakar",Mannat,Warner Music India,21,23,4,2646468,2024-01-04
22,spotify:track:73K33p4Vyz9koXGqmL5eFs,"Sachet Tandon, Parampara Tandon, Kumaar, Sachet-Parampara",Malang Sajna,T-Series,4,28,50,2585699,2024-01-04
23,spotify:track:7iekl4P95GuphG8x8a3cNT,"Pritam, Arijit Singh, Jonita Gandhi, Ranveer Singh, Amitabh Bhattacharya",What Jhumka ?,Saregama India Ltd,6,24,25,2584657,2024-01-04
24,spotify:track:38h4tmH1AWBVuemWAy4R4y,"Pritam, Arijit Singh, Shreya Ghoshal, Amitabh Bhattacharya","Tum Kya Mile, Pt. 2",Saregama India Ltd,9,25,27,2521415,2024-01-04
25,spotify:track:1y1rQTkWmrZdJmjwuK07GC,"Vishal Mishra, Manoj Muntashir","Kaise Hua (From ""Kabir Singh"")",T-Series,5,21,238,2496180,2024-01-04
26,spotify:track:23YpzkTDtU78GK6vpgRbkM,"Vishal-Shekhar, Vishal Dadlani, Shekhar Ravjiani, Shilpa Rao, Mellow D, Kumaar","Ishq Jaisa Kuch (From ""Fighter"")",T-Series,26,86,2,2441987,2024-01-04
27,spotify:track:1418IuVKQPTYqt7QNJ9RXN,King,Maan Meri Jaan,Warner Music India,1,26,64,2396224,2024-01-04
28,spotify:track:4H1FLy4H7nS9wy9gg9JeFQ,"Santhosh Narayanan, Dhvani Kailas, Vivek","Unakku Thaan - From ""Chithha""",Think Music,11,22,4,2364821,2024-01-04
29,spotify:track:2pIoyDWZV5OSW0xd6n41xV,"Pritam, Arijit Singh, Swanand Kirkire, IP Singh",Lutt Putt Gaya,T-Series,29,33,6,2364239,2024-01-04
30,spotify:track:4u0D2jZ20wQaEMHBSqsDnZ,King,Tu Jaana Na Piya,Warner Music India,15,30,10,2319557,2024-01-04
31,spotify:track:3bQsp4Vr9Rg4fNCx6HPOgX,Anuv Jain,Alag Aasmaan,Universal Music India Pvt. Ltd. (on behalf of Anuv Jain),31,39,16,2319433,2024-01-04
32,spotify:track:0UZLaEOSIc5kg0cc7eszqC,Vishal Mishra,Manjha,Desi Music Factory,27,35,84,2295144,2024-01-04
33,spotify:track:5Tkf5CbtVYHA1SiKo1NrJE,"Sachin-Jigar, Arijit Singh, Amitabha Bhattacharya","Phir Aur Kya Chahiye (From ""Zara Hatke Zara Bachke"")",Saregama,1,27,32,2233478,2024-01-04
34,spotify:track:2ZD4aIEepqZsdxPxLSuUhm,"Pritam, Arijit Singh, Amitabh Bhattacharya, Nikhita Gandhi",Tere Pyaar Mein,T-Series,5,32,48,2141803,2024-01-04
35,spotify:track:0rMeOAvbQZ2RTG4B6L1M4p,Darshan Raval,Asal Mein,Indie Music Label,21,40,136,2130830,2024-01-04
36,spotify:track:3F3ZuXYFXGM1V6pk3b3zmi,"Diljit Dosanjh, thiarajxtt",Kinni Kinni,DILJIT DOSANJH,25,29,8,2112007,2024-01-04
37,spotify:track:3WLJ7D5kh44K5eJ1NqZQ6W,Anuv Jain,Baarishein,Universal Music India Pvt. Ltd. (on behalf of Anuv Jain),18,36,138,2087640,2024-01-04
38,spotify:track:2FCXQHugkoHE1K3tiDu8pu,"Alka Yagnik, Arijit Singh","Agar Tum Saath Ho (From ""Tamasha"")",T-Series,4,31,240,2060999,2024-01-04
39,spotify:track:4VsP4Dm8gsibRxB5I2hEkw,Kaifi Khalil,Kahani Suno 2.0,1944121 Records DK,1,34,55,2031732,2024-01-04
40,spotify:track:0xIuPDzJSnJywALez8dwKR,AP Dhillon,With You,Mass Appeal India,2,37,21,1961406,2024-01-04
41,spotify:track:6GZIAVSu0YXF7FYzyRl1MP,"Sachin-Jigar, Varun Jain, Shadab Faridi, Altamash Faridi, Amitabh Bhattacharya","Tere Vaaste (From ""Zara Hatke Zara Bachke"")",Saregama,1,38,32,1882769,2024-01-04
42,spotify:track:2q9lPN7CT92W1Ry77j2acn,"Pritam, Arijit Singh, Shreya Ghoshal, Shadab Faridi, Altamash Faridi, Amitabh Bhattacharya",Ve Kamleya,Saregama India Ltd,32,44,21,1866749,2024-01-04
43,spotify:track:7CVw4gVPpH1TPQttQGVmhZ,"Karun, Lambo Drive, Arpit Bala, ReVo LEKHAK",Maharani,TEESRI DUNIYA,43,69,4,1864169,2024-01-04
44,spotify:track:4blqlsA1uf2d2I40E90EUC,"Pritam, Arijit Singh, Shilpa Rao","Tere Hawaale (From ""Laal Singh Chaddha"")",T-Series,11,42,45,1847858,2024-01-04
45,spotify:track:1smFN2CLqGROu0J0UyvDfL,"Pritam, Arijit Singh",Shayad,Sony Music Entertainment India Pvt. Ltd.,1,55,207,1828737,2024-01-04
46,spotify:track:4wIWWEhbdgKAxhR68eE0Ye,"Arijit Singh, Chinmayi","Mast Magan (From ""2 States"")",T-Series,45,47,150,1796930,2024-01-04
47,spotify:track:6oz1L5jcqZWYuId7nxvIan,Shubh,Still Rollin,SHUBH,4,43,33,1795956,2024-01-04
48,spotify:track:3dpM3ijJz0vGzbkh5DcMXz,"Payal Dev, Vishal Mishra, A.M. Turaz","Naseeb Se (From ""Satyaprem Ki Katha"")",T-Series,44,46,31,1789353,2024-01-04
49,spotify:track:3nKQrVVlwbAQSnFbgZWdN0,"Avvy Sra, Karan Aujla, Jaani",White Brown Black,Universal Music India Pvt Ltd. – Distribution,29,45,55,1783827,2024-01-04
50,spotify:track:6H7fLdt0AeWpuxUKXuXWrx,Hariharan,Shree Hanuman Chalisa,T-Series,39,74,73,1769535,2024-01-04
51,spotify:track:4i6z4CQXt1HTGSjCJEquG6,"Guru Randhawa, Shehnaaz Gill, Sanjoy",Sunrise,T-Series,51,108,3,1731890,2024-01-04
52,spotify:track:4uK0M8AI6gyFmyzUneQpbi,"A.R. Rahman, Arijit Singh, Shashaa Tirupati","Rait Zara Si (From ""Atrangi Re"")",T-Series,12,68,100,1714411,2024-01-04
53,spotify:track:2PvaburAUlhNHxVhw5lvOq,Arijit Singh,"Humdard (From ""Ek Villain"")",T-Series,28,50,181,1712750,2024-01-04
54,spotify:track:5G7pZ8G8NFvS1MQ9H4L7dC,"Javed-Mohsin, Arijit Singh, Shreya Ghoshal, Kunaal Vermaa, Prashant Ingole",Pal,Sony Music Entertainment India Pvt. Ltd.,34,61,252,1710897,2024-01-04
55,spotify:track:5BKKKNwrebowaMoUdBaNby,King,Tu Aake Dekhle,Warner Music India,3,57,153,1695852,2024-01-04
56,spotify:track:0snQrp1VaY5Pj1YIHRJpRJ,Aditya A,Chaand Baaliyan,Sony Music Entertainment India Pvt. Ltd.,2,48,98,1691292,2024-01-04
57,spotify:track:2vPrBucKCfKmafHhSfJ2pt,"Pritam, Arijit Singh, Amitabh Bhattacharya, Charan","Pyaar Hota Kayi Baar Hai (From ""Tu Jhoothi Main Makkaar"")",T-Series,9,70,47,1682511,2024-01-04
58,spotify:track:610keNiNVTIkYD0CqeSerg,"Cheema Y, Gur Sidhu",California Love,Brown Town Music,27,53,32,1663330,2024-01-04
59,spotify:track:23y8MwhdvbSalGitHeokpk,Anirudh Ravichander,Badass,Sony Music Entertainment India Pvt. Ltd.,4,41,14,1652382,2024-01-04
60,spotify:track:1ejy8AVI7k1SAlWeeKaZ60,Shubh,No Love,SHUBH,2,54,95,1646198,2024-01-04
61,spotify:track:7eQl3Yqv35ioqUfveKHitE,"Pritam, Mohit Chauhan, Irshad Kamil",Tum Se Hi,T-Series,27,66,198,1637021,2024-01-04
62,spotify:track:2oenSXLDbWVaaL7QjSGYj5,"Diljit Dosanjh, Intense, Sultaan",Lalkara,DILJIT DOSANJH,22,62,13,1630485,2024-01-04
63,spotify:track:2rOnSn2piaqLAlYjtfUBlY,"Tanishk Bagchi, Jubin Nautiyal, Asees Kaur","Raataan Lambiyan (From ""Shershaah"")",Sony Music Entertainment India Pvt. Ltd.,1,56,127,1623266,2024-01-04
64,spotify:track:2Fv2injs4qAm8mJBGaxVKU,"Arijit Singh, Mithoon","Tujhe Kitna Chahne Lage (From ""Kabir Singh"")",T-Series,2,52,240,1614664,2024-01-04
65,spotify:track:3yV2c3cYhkAwSsxAq6nRiv,Gajendra Verma,Mann Mera,Sony Music / Eros Now Music,26,51,144,1612247,2024-01-04
66,spotify:track:24MMjyA3NLqCsDJfsn51eg,"Sharn, The Paul",Mi Amor,Desi Avenue,7,63,51,1607138,2024-01-04
67,spotify:track:5XeFesFbtLpXzIVDNQP22n,Arctic Monkeys,I Wanna Be Yours,Domino Recording Co,48,58,60,1601397,2024-01-04
68,spotify:track:13ZISM2bmrMBCRlMzl669x,"Anirudh Ravichander, Vijay, Asal Kolaar",Naa Ready,Sony Music Entertainment India Pvt. Ltd.,4,49,28,1600049,2024-01-04
69,spotify:track:0l6g8Z8mqGbGXFOjigYetD,"Pritam, Arijit Singh",Hawayein,Sony Music Entertainment India Pvt. Ltd.,51,84,117,1591317,2024-01-04
70,spotify:track:5W7DOVGQLTigu09afW7QMT,Sidhu Moose Wala,295,Sidhu Moose Wala,1,72,99,1587718,2024-01-04
71,spotify:track:51DEaelXeJJ6cFFYbX8Hal,"Javed-Mohsin, Vishal Mishra, Shreya Ghoshal",Zihaal e Miskin,Universal Music India Pvt Ltd.,7,59,32,1581544,2024-01-04
72,spotify:track:6ygiy70ujkNOYXM1tQuMNe,"Karan Aujla, Ikky, Preston Pablo",Admirin' You (feat. Preston Pablo),WM Canada,24,64,22,1578069,2024-01-04
73,spotify:track:0CtZpaOhtzvLV3FfcsVpQo,"Vishal-Shekhar, Shilpa Rao, Caralisa Monteiro, Vishal Dadlani, Shekhar Ravjiani, Kumaar","Besharam Rang (From ""Pathaan"")",YRF Music,4,82,56,1565584,2024-01-04
74,spotify:track:5rpCUsEfBLIumvrxrahnKF,"Hasan Raheem, Umair, Talwiinder",Wishes,1698613 Records DK2,74,90,4,1556066,2024-01-04
75,spotify:track:3HiobOOpSpMsi95WBKPBYk,"Jeet Gannguli, Arijit Singh",Hamari Adhuri Kahani (Title Track),Sony Music Entertainment India Pvt. Ltd.,56,65,112,1553720,2024-01-04
76,spotify:track:2IoZMG3RqiTmsy7Li3zGFg,"Sachet Tandon, Parampara Tandon, Sachet-Parampara","Mere Sohneya (From ""Kabir Singh"")",T-Series,4,78,194,1543412,2024-01-04
77,spotify:track:6udC4b4jOSnHb9ItnXgKLR,"Sachin-Jigar, Shreya Ghoshal, Tochi Raina",Saibo,Sony Music Entertainment India Pvt. Ltd.,31,80,166,1537975,2024-01-04
78,spotify:track:0ojpEubhy4JNeVftmVuiN7,"Vishal Mishra, Armaan Malik",Pehla Pyaar,T-Series,11,75,136,1535970,2024-01-04
79,spotify:track:4OcvkkpF3xmyCGGY5IBlgi,"Akhil Sachdeva, Tulsi Kumar","Tera Ban Jaunga (From ""Kabir Singh"")",T-Series,4,71,225,1532913,2024-01-04
80,spotify:track:7e2dvR0ySx1bBJRDxVJiG1,AUR,Shikayat,Sony Music Entertainment,80,-1,1,1529598,2024-01-04
81,spotify:track:7ouBSPZKQpm7zQz2leJXta,Arijit Singh,"Tum Hi Ho (From ""Aashiqui 2"")",T-Series,44,67,153,1528958,2024-01-04
82,spotify:track:2A4lcqTJZgUs1XrW6TSvt0,"Rajat Nagpal, Yasser Desai, Rana Sotal",Hum Toh Deewane,PlayDMF,50,81,14,1510771,2024-01-04
83,spotify:track:5DgY6Ab0vpyUMKnY9ubFOF,"Anirudh Ravichander, Super Subu",Hukum - Thalaivar Alappara,Sun Pictures,1,60,25,1505884,2024-01-04
84,spotify:track:7MXVkk9YMctZqd1Srtv4MB,"The Weeknd, Daft Punk",Starboy,Universal Republic Records,12,88,127,1498142,2024-01-04
85,spotify:track:0gPgdRfB4jdGrlyXS0Vx78,"Vishal-Shekhar, KK, Shilpa Rao, Anvita Dutt Guptan",Khuda Jaane,YRF Music,37,87,65,1497231,2024-01-04
86,spotify:track:0tgVpDi06FyKpA1z0VMD4v,Ed Sheeran,Perfect,Atlantic Records UK,29,76,194,1492864,2024-01-04
87,spotify:track:0FBQ4NrrHUbR9kus7rzrOj,Atif Aslam,Dil Diyan Gallan,YRF Music,74,79,203,1478213,2024-01-04
88,spotify:track:0n2LpEAixGBWK8mwUSGtGb,Sunanda Sharma,Chandigarh Ka Chokra,Warner Music / Sky Digital JV,88,117,3,1463911,2024-01-04
89,spotify:track:0czcoKJbJt08NqKrvSbbz7,"Pritam, Arijit Singh, Amitabh Bhattacharya","O Bedardeya (From ""Tu Jhoothi Main Makkaar"")",T-Series,1,73,43,1460904,2024-01-04
90,spotify:track:1UWacd8x8tPPwmrPB1MoBI,"Pritam, Arijit Singh",Ae Dil Hai Mushkil Title Track,Sony Music Entertainment India Pvt. Ltd.,79,85,205,1455431,2024-01-04
91,spotify:track:72zHuDxFQTjbL51qJQSA7j,"Jasleen Royal, B Praak, Romy, Anvita Dutt","Ranjha (From ""Shershaah"")",Sony Music Entertainment India Pvt. Ltd.,1,83,126,1452878,2024-01-04
92,spotify:track:0rlLBWFFTQiOWi963SH9bb,The Local Train,Choo Lo,The Local Train,78,114,28,1422868,2024-01-04
93,spotify:track:3wz2vWhYnnBoFmgMkqtzLy,"Chani Nattan, Inderpal Moga",Daku,Kharku Life Records,5,95,72,1419089,2024-01-04
94,spotify:track:6mTvwBzWTGDOVeCNQEqtOE,"Amaal Mallik, Arijit Singh, Tulsi Kumar",Soch Na Sake,T-Series,64,98,53,1411276,2024-01-04
95,spotify:track:42TMa2hgBNjte4uV7jNCnQ,"Shubh, Ikky",Baller,SHUBH,2,91,69,1407265,2024-01-04
96,spotify:track:6FAYpZ4jve8vpvTwUvjK6H,"Vishal-Shekhar, Arijit Singh, Sukriti Kakar, Vishal Dadlani, Shekhar Ravjiani, Kumaar",Jhoome Jo Pathaan,YRF Music,3,93,54,1399054,2024-01-04
97,spotify:track:48Ix6ReYdJf2H4mKb3TIpj,"Atif Aslam, Alisha Chinai, Pritam",Tera Hone Laga Hoon,Tips Industries Ltd,59,101,138,1397605,2024-01-04
98,spotify:track:5BBB2PDgDWi6NBECj0wJiA,"Savi Kahlon, The Masterz",Apa Fer Milaangey,Single Track Studios,98,-1,1,1393512,2024-01-04
99,spotify:track:29m79w9xPMH4YCD6r8JSmV,"AP Dhillon, Gurinder Gill, Intense",Excuses,RUN-UP RECORDS,1,97,115,1378941,2024-01-04
100,spotify:track:6FahmzZYKH0zb2f9hrVsvw,"Anirudh Ravichander, Nikhita Gandhi","Ordinary Person (From ""Leo"")",Sony Music Entertainment India Pvt. Ltd.,5,77,11,1371924,2024-01-04
101,spotify:track:3mUkVsovIuscQlSoMhmAZt,"Madhur Sharma, Swapnil Tare, Nusrat Fateh Ali Khan",Kali Kali Zulfon Ke (Lo-Fi),T-Series,6,110,69,1367662,2024-01-04
102,spotify:track:5DezAsjtSLUxW9j00eh0Ia,"Santhosh Narayanan, Dhee, Vivek","Maamadura - From ""Jigarthanda DoubleX""",Think Music,39,96,8,1362875,2024-01-04
103,spotify:track:32765xcLM1fd6wQIpkN9A0,"Ami Mishra, Kunaal Vermaa",Hasi - Male Version,Sony Music Entertainment India Pvt. Ltd.,97,100,27,1361326,2024-01-04
104,spotify:track:0tpwqQhdfJXRcUDSNRjb9O,"Arijit Singh, Neeti Mohan, Rashmi Virag","Mere Yaaraa (From ""Sooryavanshi"")",T-Series,20,129,86,1358296,2024-01-04
105,spotify:track:0EH7sgeiFqDa3eS7ieW2zs,"Akon, Hamsika Iyer",Chammak Challo,T-Series,105,119,38,1341492,2024-01-04
106,spotify:track:7G5wpuR61ABrT7R1snos7C,"Pritam, Arijit Singh",Kalank - Title Track,Zee Music Company,5,145,210,1336096,2024-01-04
107,spotify:track:3ZGJhN4unVspOqpwGvUL2W,Diljit Dosanjh,Lemonade,DILJIT DOSANJH,26,89,75,1334431,2024-01-04
108,spotify:track:3eSm4iAkLsn3BeggfiQOH9,"Gaurav Chatterji, Aasa Singh, Hansika Pareek, Hrishi Giridhar, Pratik Gangavane","Kaise Ab Kahein - From ""Gutar Gu""",Sikhya Entertainment Records,78,116,22,1328820,2024-01-04
109,spotify:track:7m4CgL81VVIHaaiSxyH922,Yo Yo Honey Singh,Desi Kalakaar,T-Series,13,99,15,1323587,2024-01-04
110,spotify:track:66ezsSqTUU35e0ZSeyZ5CP,"lusttqwe, bexter",Jeena Jeena,Finest Music Entertainment,37,94,128,1311137,2024-01-04
111,spotify:track:53QrRlALFJfZgdcGLKwy5s,Shubh,Dior,SHUBH,76,106,26,1300480,2024-01-04
112,spotify:track:6ivemTXTn27PwVjtd0oqDs,Anuv Jain,Gul,Universal Music India Pvt. Ltd. (on behalf of Anuv Jain),76,112,36,1300241,2024-01-04
113,spotify:track:4zmdSbVzs06VyVRlmc5QTl,"Sachet Tandon, Parampara Tandon, Sachet-Parampara",Blur,T-Series,113,-1,1,1298276,2024-01-04
114,spotify:track:5aMLADD1Ho6Ogq8s8mIzB9,"Sachet-Parampara, Sachet Tandon, Parampara Tandon, Manoj Muntashir","Ram Siya Ram (From ""Adipurush"")",T-Series,11,140,31,1297648,2024-01-04
115,spotify:track:4bD9z9qa4qg9BhryvYWB7c,"Pritam, Tochi Raina, Rekha Bhardwaj",Kabira,T-Series,31,109,225,1291417,2024-01-04
116,spotify:track:2RgvvnMwtP0R2OkVZmFvnV,KK,"Ajab Si (From ""Om Shanti Om"")",T-Series,34,102,104,1286550,2024-01-04
117,spotify:track:4VosVUajzm6nzGlSb6nP3L,"Parmish Verma, Paradox",Check It Out,SDA Studios,19,107,25,1281402,2024-01-04
118,spotify:track:6WzRpISELf3YglGAh7TXcG,"The Weeknd, Playboi Carti, Madonna",Popular (with Playboi Carti & Madonna) - From The Idol Vol. 1 (Music from the HBO Original Series),XO / Republic Records,118,163,12,1279675,2024-01-04
119,spotify:track:0rk2X5TAhraBC5aCIXK2Rq,"Jawad Ahmad, Shaarib Toshi, Arijit Singh, Shreya Ghoshal",Samjhawan,Sony Music Entertainment India Pvt. Ltd.,70,113,140,1279103,2024-01-04
120,spotify:track:1d5lpW3gUyq537iuyrb9Lf,Aditya Rikhari,Samjho Na,CollabX Productions,73,105,37,1270777,2024-01-04
121,spotify:track:6MZyrnqwsLnrWY5Gk0AyXg,Suzonn,Farq hai,Suzonn,60,103,17,1258037,2024-01-04
122,spotify:track:2tjWCe2W7sgvS3C8NHcdtI,"Akhil, Dhvani Bhanushali, Kunaal Vermaa, Abhijit Vaghani","Duniyaa (From ""Luka Chuppi"")",T-Series,1,115,254,1255278,2024-01-04
123,spotify:track:04ChFQZCKl2yRcvc0VR7qN,"Denny, Rahul Mishra, Kunaal Vermaa",Chale Jaana Phir (Humko Tere Bina),For The Record Music,14,104,26,1246356,2024-01-04
124,spotify:track:6Z4rRhYZVQsYKmrxD40tru,"Riar Saab, Abhijay Sharma",Obsessed,"Mass Appeal India, LLC",2,125,35,1228314,2024-01-04
125,spotify:track:32VAw8DL9ixX5XSW2VLcZ4,"Parmish Verma, PARDHAAN, Desi Crew",Aam Jahe Munde,Parmish Verma Films,29,121,26,1223999,2024-01-04
126,spotify:track:3wwLWFRLiReDf5AqgmAJwT,"Rito Riba, Rajat Nagpal, Rana Sotal",Heer Ranjha,PlayDMF,11,118,62,1218483,2024-01-04
127,spotify:track:6bdpj89aYEBjhpsenXAsmO,"A.R. Rahman, Arijit Singh",Enna Sona,Sony Music Entertainment India Pvt. Ltd.,34,135,139,1204684,2024-01-04
128,spotify:track:7mSzDKajY2wUtstQSLdzMK,"Mohit Chauhan, Rochak Kohli",Rang Lageya,Saregama,35,124,49,1199783,2024-01-04
129,spotify:track:3qrdLVOClRU4yPkcXZ7c5u,"Ayushmann Khurrana, Tanishk-Vayu","Mere Liye Tum Kaafi Ho (From ""Shubh Mangal Zyada Saavdhan"")",T-Series,11,128,202,1185783,2024-01-04
130,spotify:track:7v0t3o17J796y9OG2n3ebl,"B Praak, Jaani",Kya Loge Tum,Universal Music India Pvt Ltd. – Distribution,10,126,33,1169331,2024-01-04
131,spotify:track:0DXfJ2iKRDEG7rPgssWFea,"Kanishk Seth, Kavita Seth","Rangisari (From ""Jugjugg Jeeyo"")",T-Series,22,120,60,1163553,2024-01-04
132,spotify:track:5nQA7m7xypeL7dFaGRwJO5,Shallum Lama,Timro Pratiksa,Sony Music Entertainment India Pvt. Ltd.,132,134,4,1159044,2024-01-04
133,spotify:track:0biCSADTAblvLTLtJz4pXO,"Vishal-Shekhar, Arijit Singh, Caralisa Monteiro, Jaideep Sahni",Nashe Si Chadh Gayi,YRF Music,133,164,22,1157540,2024-01-04
134,spotify:track:6FjbAnaPRPwiP3sciEYctO,"Pritam, Arijit Singh",Raabta,T-Series,41,143,84,1151613,2024-01-04
135,spotify:track:5WXQbgwGwyauXOqswlEeQY,"Tanishk Bagchi, Arijit Singh, Asees Kaur","Bolna (From ""Kapoor & Sons (Since 1921)"")",Sony Music Entertainment India Pvt. Ltd.,101,132,45,1151159,2024-01-04
136,spotify:track:4m2af7wCfOyYLBQZ3l7xLs,"Sonu Nigam, Harshavardhan Rameshwar, Raj Shekhar","Papa Meri Jaan (From ""ANIMAL"")",T-Series,23,92,5,1146046,2024-01-04
137,spotify:track:2sT0eosuhBEkw8dz6qFxUo,"Anurag Saikia, Raghav Chaitanya, Raj Shekhar, Nikhita Gandhi",Aise Kyun,Netflix Music,137,156,2,1145149,2024-01-04
138,spotify:track:57LA3fJhESaZtMcxMzR4RT,"Ikka, Sanjoy",Laadla,T-Series,138,-1,1,1143800,2024-01-04
139,spotify:track:1feANd8EfcDP5UqSvbheM3,"Sachet Tandon, Sachet-Parampara","Bekhayali (From ""Kabir Singh"")",T-Series,1,111,208,1143245,2024-01-04
140,spotify:track:6V7UVqe8XnAS4WPdpaw5TK,"Asees Kaur, Stebin Ben",Tu Mile Dil Khile,Saregama,20,139,47,1120264,2024-01-04
141,spotify:track:5O2P9iiztwhomNh8xkR9lJ,One Direction,Night Changes,Syco Music,22,144,138,1120011,2024-01-04
142,spotify:track:6fScgF2Y63ScU73nYju0ny,"Atif Aslam, Arko",O Saathi,T-Series,58,136,75,1118915,2024-01-04
143,spotify:track:0H2iJVgorRR0ZFgRqGUjUM,"Pritam, Arijit Singh",Channa Mereya,Sony Music Entertainment India Pvt. Ltd.,58,148,206,1118394,2024-01-04
144,spotify:track:4OEBP1iwGmLtcM8UKRLm80,"Arijit Singh, Antara Mitra","Itni Si Baat Hain (From ""Azhar"")",T-Series,144,-1,4,1112640,2024-01-04
145,spotify:track:1AMD2AkfGrKoKhwkvYLbza,"Sunny Yaduvanshi, AK Rok, Nitesh Ujoli, Elvish Yadav",Yadav Brand 2 (feat. Elvish Yadav),Flame Music,9,142,43,1112013,2024-01-04
146,spotify:track:6wkHR8cU4INbp145hngbQO,"Sukha, Chani Nattan, Prodgk, Gurlez Akhtar",8 ASLE,SODHI MUSIC INC.,146,196,2,1111141,2024-01-04
147,spotify:track:4iEGv5Ne6HuCkFCjzxdWQK,Neeti Mohan,Meri Jaan,Saregama,11,123,63,1110492,2024-01-04
148,spotify:track:4vrpvlcDM3uze5PoOgZpoV,Arijit Singh,Dil Haareya,Saregama,122,122,3,1108013,2024-01-04
149,spotify:track:28lvraTNIN8qiTpoIK7m8Z,"AP Dhillon, Shinda Kahlon",True Stories,Mass Appeal India,15,149,29,1099753,2024-01-04
150,spotify:track:2eAvDnpXP5W0cVtiI0PUxV,Ruth B.,Dandelions,Columbia,14,141,110,1095206,2024-01-04
151,spotify:track:5Gy67YHzPZTk9Q0D73LAGH,"Jeet Gannguli, Arijit Singh","Khamoshiyan (From ""Khamoshiyan"")",Sony Music Entertainment India Pvt. Ltd.,90,147,36,1091760,2024-01-04
152,spotify:track:2AilvPt1AQ8PixlCKqkjfj,Shubh,Elevated,SHUBH,27,146,105,1091458,2024-01-04
153,spotify:track:6cUOiOY5qh2FpIQWIYAd2h,"Pritam, Darshan Raval, Antara Mitra",Mehrama,Sony Music Entertainment India Pvt. Ltd.,10,137,162,1090649,2024-01-04
154,spotify:track:6aQIGqAo9PxRKjUkhYtR6R,"Anirudh Ravichander, Priya Mali","Hayyoda (From ""Jawan"")",T-Series,14,130,19,1089278,2024-01-04
155,spotify:track:5O932cZmzOZGOGZz9RHx20,"Pritam, Arijit Singh",Khairiyat,T-Series,1,133,226,1087905,2024-01-04
156,spotify:track:03yKEFruN3BS2coglBtt2N,"Laddi Chahal, Parmish Verma, Gurlez Akhtar",Rubicon Drill,Parmish Verma Films,12,154,55,1087773,2024-01-04
157,spotify:track:6ZYxNjuAU9Vy3VtF6W1dtE,Shubh,We Rollin,SHUBH,10,151,110,1083371,2024-01-04
158,spotify:track:7H3mfOvtPNA8YDF3EdKy0L,"Neeraj Shridhar, Kavita Seth, Pritam",Tum Hi Ho Bandhu,Eros Now Music,144,-1,11,1073219,2024-01-04
159,spotify:track:66v97IvccVkHt40FIOq1LH,"Pritam, Arijit Singh, Nikhita Gandhi, Amitabh Bhattacharya","Leke Prabhu Ka Naam (From ""Tiger 3"")",YRF Music,30,127,10,1070169,2024-01-04
160,spotify:track:6O1RAYwmOqkcoJQr7J9SFJ,"Manan Bhardwaj, Arijit Singh",Oonchi Oonchi Deewarein,T-Series,52,150,12,1069335,2024-01-04
161,spotify:track:7Imk0IG6S5GA5iYWkjmMW5,"Palak Muchhal, Arijit Singh","Chahun Main Ya Naa (From ""Aashiqui 2"")",T-Series,152,152,12,1065386,2024-01-04
162,spotify:track:1RdrAqXa2fUj2XytsKaUwl,Irshad Khan,Haryana Hood,Bajewala Records Haryanvi,40,159,37,1063517,2024-01-04
163,spotify:track:0GQngE2rOYvlKwEQjTAsP8,"Pritam, Sreeram, Shilpa Rao",Subhanallah,T-Series,107,-1,43,1058287,2024-01-04
164,spotify:track:0NuWRfZRWzn1oc9piFhK9n,"MC SQUARE, Hiten",Laado,Sony Music Entertainment India Pvt. Ltd.,11,138,17,1053343,2024-01-04
165,spotify:track:2qxmye6gAegTMjLKEBoR3d,Alec Benjamin,Let Me Down Slowly,2018,34,131,195,1052795,2024-01-04
166,spotify:track:3rUGC1vUpkDG9CZFHMur1t,Tate McRae,greedy,RCA Records Label,119,168,10,1051415,2024-01-04
167,spotify:track:6gwnKOvdBKkTU4CQ7KpIAu,"Shaarib Toshi, Arijit Singh","Bandeya - From ""Dil Juunglee""",Pooja Music,70,160,68,1043048,2024-01-04
168,spotify:track:7aE1lfskJLMHQnzCCP1zsV,"Akhil Sachdeva, Mansheel Gujral","Humsafar (From ""Badrinath Ki Dulhania"")",T-Series,158,158,11,1040236,2024-01-04
169,spotify:track:2uWZ7EGddFlA1DJ3Rzzvs2,"Karan Aujla, Ikky, Yarah",Bachke Bachke (feat. Yarah),WM Canada,57,155,18,1033118,2024-01-04
170,spotify:track:7lNbI1xd39QRdf6Mj8tvTv,Javed Ali,"Saudebazi (Encore) [From ""Aakrosh""]",T-Series,108,166,19,1031327,2024-01-04
171,spotify:track:56y1jOTK0XSvJzVv9vHQBK,Doja Cat,Paint The Town Red,Kemosabe Records/RCA Records,45,174,18,1027108,2024-01-04
172,spotify:track:3jyqXdAjwqO3gFtjnYrbq9,"Darshan Raval, Rochak Kohli","Ek Ladki Ko Dekha Toh Aisa Laga (From ""Ek Ladki Ko Dekha Toh Aisa Laga"")",Saregama,59,167,59,1020404,2024-01-04
173,spotify:track:60lWIMv8FTxZnFasZxddW2,Inder Arya,Gulabi Sharara- Young Uttarakhand Group,Young Uttarakhand Group,173,-1,3,1017572,2024-01-04
174,spotify:track:1knnSlcBlhlcNsQkGyVl9X,"Shiva Choudhary, Sapna Choudhary",Jale 2,Desi Geet,174,-1,1,1014793,2024-01-04
175,spotify:track:1Ef0TmgS1QrVO6tKHrMMmH,"Vishal-Shekhar, Arijit Singh, Shilpa Rao, Kumaar","Ghungroo (From ""War"")",YRF Music,1,190,170,1011585,2024-01-04
176,spotify:track:39ujbBjTwwqUFySaCYDMMT,"Badshah, Diljit Dosanjh, Aastha Gill",Proper Patola,Sony Music Entertainment India Pvt. Ltd.,18,-1,105,1011294,2024-01-04
177,spotify:track:0MbOLfDcGk8ROHJYXJHu5c,"Badshah, Karan Aujla, Devika Badyal",Players,Universal Music India Pvt Ltd.,7,182,53,1010549,2024-01-04
178,spotify:track:7o1SDLghDwMc4OW3rKakVt,"Bir, Dhanju, thiarajxtt",Afterhours,Sky Digital,87,169,29,1010408,2024-01-04
179,spotify:track:1YMLgvsQdE27r30q0fsLeV,Arijit Singh,Tera Fitoor,Tips Industries Ltd,87,171,27,1008014,2024-01-04
180,spotify:track:3ygfdwvBJ2Y5XhJiiHFFZE,Sachet Tandon,Maiyya Mainu,Zee Music Company,5,-1,66,1003502,2024-01-04
181,spotify:track:6f3ANRNQ8nCiPZ6VqXqq93,"Amaal Mallik, Armaan Malik, Rashmi Virag",Main Rahoon Ya Na Rahoon,T-Series,164,184,4,1002239,2024-01-04
182,spotify:track:6R9DVbFDwO8pwwkd515vyr,Neelkamal Singh,Heroine,Saregama,156,-1,5,1002175,2024-01-04
183,spotify:track:1q6pMQBRILzkz0g4rKEXdM,Palak Muchhal,"Kaun Tujhe (From ""M.S.Dhoni - The Untold Story"")",T-Series,57,161,25,1001108,2024-01-04
184,spotify:track:1ExaQYPap38faw3FEqKcGY,"Mankirt Aulakh, Simar Kaur, Flamme Music",Koka,Sky Digital,184,185,3,998375,2024-01-04
185,spotify:track:567e29TDzLwZwfDuEpGTwo,"The Kid LAROI, Justin Bieber",STAY (with Justin Bieber),Columbia,1,188,130,994816,2024-01-04
186,spotify:track:7qiZfU4dY1lWllzX7mPBI3,Ed Sheeran,Shape of You,Atlantic Records UK,63,181,191,993768,2024-01-04
