rank,uri,artist_names,track_name,source,peak_rank,previous_rank,weeks_on_chart,streams,End Date
184,spotify:track:36N5awamOX6XX5pQn3aFXZ,"Darshan Raval, Jonita Gandhi, Rochak Kohli, Gurpreet Saini","Soni Soni (From ""Ishq Vishk Rebound"")",Tips Industries Ltd,4,175,48,1303402,2025-05-01
185,spotify:track:3HiobOOpSpMsi95WBKPBYk,"Jeet Gannguli, Arijit Singh, Rashmi Virag",Hamari Adhuri Kahani (Title Track),Sony Music Entertainment India Pvt. Ltd.,56,168,181,1299930,2025-05-01
186,spotify:track:7wGgYAOMhhRObOGdWlJ9Hi,"Talha Anjum, Umair",Departure Lane,Mass Appeal,68,-1,8,1292225,2025-05-01
187,spotify:track:7wW9scVNLYFLsmBb1yAUmS,Yo Yo Honey Singh,Blue Eyes,T-Series,38,200,46,1291494,2025-05-01
188,spotify:track:5OMUXgfXsSukZ0zxelpC3b,"A.R. Rahman, Jaswinder Singh, Shiraz Uppal","Raanjhanaa (From ""Raanjhanaa"")",Sony Music Entertainment India Pvt. Ltd.,110,-1,37,1289035,2025-05-01
189,spotify:track:1418IuVKQPTYqt7QNJ9RXN,King,Maan Meri Jaan,Warner Music India,1,-1,122,1277941,2025-05-01
190,spotify:track:5fBghXeYCGIEVuExKytoJ9,Shubh,Fell For You,SHUBH,19,194,14,1276932,2025-05-01
191,spotify:track:610keNiNVTIkYD0CqeSerg,"Cheema Y, Gur Sidhu",California Love,Brown Town Music,27,186,83,1274901,2025-05-01
192,spotify:track:1WxzZoWBTmB68AtyA6ejBB,"Sohail Sen, Monali Thakur, Kausar Munir",Haan Ke Haan,YRF Music,9,163,39,1268192,2025-05-01
193,spotify:track:1q6pMQBRILzkz0g4rKEXdM,Palak Muchhal,"Kaun Tujhe (From ""M.S.Dhoni - The Untold Story"")",T-Series,57,-1,44,1264659,2025-05-01
194,spotify:track:0dJacN6K3mSGLE9p7QE0lO,KK,"Beete Lamhein (From ""The Train"")",T-Series,75,177,51,1261094,2025-05-01
195,spotify:track:4kaLkst9lT3sQ5Crgxs3ic,"Ayushmann Khurrana, Rochak Kohli",Pani Da Rang - Male Vocals,Eros Now Music,68,199,48,1244491,2025-05-01
196,spotify:track:0FIDCNYYjNvPVimz5icugS,"The Weeknd, Playboi Carti",Timeless (feat Playboi Carti),XO / Republic Records,78,185,20,1240246,2025-05-01
197,spotify:track:3Kl8p2PxVf8eAayLwTxOIm,"Pritam, KK",Dil Ibaadat,Sony Music Entertainment India Pvt. Ltd.,54,-1,19,1239164,2025-05-01
198,spotify:track:5PvwPy5eRO8BPwpRzCHK3D,Ankit Tiwari,Sunn Raha Hai (Male Version),T-Series,140,189,17,1235369,2025-05-01
199,spotify:track:6GQK4G5o60E8YA18DGpAzv,Harshit Saxena,Hale Dil,T-Series,98,184,26,1234372,2025-05-01
200,spotify:track:5GENwU66wYztXVqEOLubyF,"G. V. Prakash, Arivu, Dhanush, Sublahshini","Golden Sparrow (From ""Nilavuku En Mel Ennadi Kobam"")",Wunderbar Films,75,-1,21,1231117,2025-05-01
