rank,uri,artist_names,track_name,source,peak_rank,previous_rank,weeks_on_chart,streams,End Date
193,spotify:track:0AQfRLzd7pQZcLtfh9Onb8,"Mellow & Sleazy, Scotts Maphuma, Mr Pilato, Seemah, Yanda Woods",Shayi'Moto (feat. Seemah & Yanda Woods),Mellow and Sleazy (Pty) Ltd,4,185,29,95752,2025-05-29
194,spotify:track:7129iqBafaphfc3WPCGC0L,Lukas Graham,7 Years,Warner Records,190,190,2,95642,2025-05-29
195,spotify:track:7ne4VBA60CxGM75vw0EYad,Gracie Abrams,That’s So True,"Gracie Abrams, under exclusive license to Interscope Records",34,173,31,95126,2025-05-29
196,spotify:track:1ULFJZX54HXXjSTMx63dk0,"Kabza De Small, Msaki",Khusela (feat. Msaki),Piano Hub,5,133,92,95125,2025-05-29
197,spotify:track:7CyPwkp0oE8Ro9Dd5CUDjW,"The Weeknd, JENNIE, Lily-Rose Depp","One Of The Girls (with JENNIE, Lily Rose Depp)",XO / Republic Records,31,181,80,94765,2025-05-29
198,spotify:track:0FwBYg7Ci059wnjpQJeC6c,Sneziey,Izulu,Gallo Record Company,97,130,19,94588,2025-05-29
199,spotify:track:1Q7EgiMOuwDcB0PJC6AzON,"Daniel Caesar, H.E.R.",Best Part (feat. H.E.R.),HV Recordings,75,191,277,94295,2025-05-29
200,spotify:track:7nvgkC241e8HViZvP12x9H,"UNjoko, UMzukulu",Umamemeza,3490297 Records DK,105,147,9,94282,2025-05-29
